,comentario,liguagem
0,This melody plays in my head every time I hear a beat at a party.,en
1,His energy is infectious! You can't help but smile watching him jam it out.,en
2,It's amazing to see how the 90's style both in music and outfits are coming back.,en
3,Amo esse som ,pt
4,Love this beat the first time I heard it! So good!,en
5,I remember growing up with stuff like this in the very early 2000's. It's been a good 23 years since then and we're FINALLY GETTING THAT SOUND BACCCCKKKK!!! ,en
6,I'm addicted to this song. Can't get enough listening to this while working out on the elliptical machine.,en
7,Que batida é essa? Ficou maravilhosa! Arrasou! ,pt
8,The original version by Cherish is a 2000s R&B classic!! Everyone go watch the music video as well,en
9,Arrasou to amando essa musica pelo o instagram,pt
10,"I need more music like this!!!!
It gives me lifeeeeee, high vibrations and vibes!",en
11,"Que ótimo, essa música toca em tudo, não paro de escutar NÃO SAI DA MINHA CABEÇAAA",pt
12,Love it! Makes me wanna dance anywhere I here this,en
13,This song is addictive. I heard it last weekend on a bike rally and couldn't get it out of my mind,en
14,Literally the most played tech house song of 2021  This reminds me of 2018-2019's Losing It era :D,en
15,"So many people have played this I’m so hyped it’s out. Martin Garrix played it at Creamfields, but I also knew it from Carnage playing it in clubs. Such a banger track.",en
16,Demais essa musica!!!,pt
17,Boa música e viciante! ️,pt
18,TO DAJE MI TYLE ENERGII I TAKI DOBRY NASTRÓJ!!!!!! DZIĘKUJĘ!!!!!!!!!!!!!!!,en
19,Beat goes hard - great workout mix!,en
20,Muito top ,en
21,Love it! ,en
22,Love the energy!,en
23,This beat is sooooo impressive.,en
24,BOOM!  My Ear buds are on fire!  Love it! ,en
25,"Minha primeira música na play list , todos os dias ouço no carro dando Aula , pois sou instrutor de Auto escola , e ouço o dia todo , os aluno gosta e curte muito .",pt
26,This song might be perfect for a dance party!,en
27,I love this song! I'm a new fan! ,en
28,Those vibrations vibrate my good vibes!,en
29,GROWING UP WITH CHERISH WAS JUST LIFE THEY'RE TRULY UNDERRATED AND WAS A BOP IN THE 2000S,en
30,Saw ACRAZE perform this Live at EDC. Everyone went crazy. ,en
31,Eu amo essa música !,pt
32,"Rock wit it for life, Dpe, Solid, Authentic and Raw Track, Love it! More Music Brother ",en
33,"Listened to it once while I was driving a car at night, it made the ride more atmospheric for some reason.",en
34,"So far, this is the only song on the ""Dance-Pop Bangers"" playlist that legitimately sounds like dance music to me. I'm probably just old.",en
35,"This on repeat will be why I go deaf early. And that’s okay. 
And just like that you created something that will resonate forever.",en
36,"Nothing short of musical genuis. Got into my car in Limerick city, Ireland and turn on the radio. Wow! Turn that up and roll down the windows. Brilliant tune!",en
37,I'm glad I stumbled on this song... It's fire! ,en
38,Goood track!!!,en
39,Banger I'm addicted can't stop listening  to it ,en
40,"Every party or club I've been to in the last couple of months this song is played so much, and I like that ",en
41,Love this song!,en
42,Amazing music ,en
43,The best dance tune this year love it. On my repeat playlist,en
44,Na academia essa música fica top para malhar! ,pt
45,This tune is addictive,en
46,Love it!,en
47,"Best Track ever, Love the vibe",en
48,Arrasou!!!,pt
49,muito bom,pt
50,"if I was still in my 20s, I'd likely play this every day while I walking around the city imagining that everyone is bobbing to the same beat as I am. nice mix!",en
51,Track top ,en
52,Great track and it's a great song to shuffle 2...️,en
53,So glad this is finally released ,en
54,The Soundtrack is simple yet it make you wanna dance right now.Not gonna lie.,en
55,"this gives me 2000’s club vibes  and I’m not saying because of the sample used, but because of the Dance vibe.",en
56,"We are finally getting back musics like 90s, 80s, and 00s, they finally realised whats the best....",en
57,This bounce is so sick bro. Lov it,en
58,"Everytime if i hear the song even in the car, i would dance so wildly",en
59,Adoro essa musica!!,pt
60,I keep rewinding it  dude this is a TUNE!!,en
61, love It!!!,en
62,Música show,en
63,You really broke electronic music! ,en
64,What a banger!  We need an extended version!,en
65,Here's our happy lives getting back to normal what a feel good tune,en
66,"This song and ""Lukaz - Did You Call Me” are the two songs keeping me sane through these tough times. I just want to send love to everyone and I want everyone to know things will get better. We are in this together. I love you ",en
67,"Bounce with it

Drop with it ",en
68,"This remix was ranked # 1 in The Netherlands charts and, knowing the musical background of that part of northern Europe, it would have been almost a ""great classic"" if it had come from that country instead of the States.",en
69,Love it   ,en
70,What an amazing Beat ,en
71,The lyrics are amazing,en
72,Nice to hear it!,en
73,I love this song ️,en
74,Amazing! Highly addictive.,en
75,Love    this  song    so  so  much ,en
76,"50, and as Acraze describes his music: sexy, fun & groovy. Just like me ",en
77,"Today I learned I just need bass, a voiceline and a mv and I can create a hit",en
78,adorei mesmo,pt
79,If a 50 year old dude like me says it's good... it is ,en
80,J'adore! ,pt
81,Music fire.  Thanks for the listening pleasure,en
82,Que recriação....️️️️️,pt
83,This track has bin going round  on repeat all the time in my brain and all from tik tock and instagram reels wondering what and where it is from and now I've finally found  it  ,en
84,This song and “Did You Call Me” by Lukaz are some of the only things getting me through tough times. I hope everyone is doing well. I love you ,en
85,That drop is   ,en
86,The sounds of this song make me think of a fantastical (fantasy type) of factory like Willie Wonka's chocolate factory / minions working in sync with each other towards a common goal. I can't be the only one noticing this. ,en
87,I love this awesome music,en
88,Not really into bassy tracks but this is really good.,en
89,Glad I found this finally. Heard this shit on the radio in the car on Fortnite and just rode around til it was over.,en
90,Hearing this song at beyond wonderland was amazing and the mix they did after this,en
91,Love this song,en
92,I love this song so much,en
93,True masterpiece right here...,en
94,Such a great song I always have to dance to the song,en
95,Love it,en
96,That’s beat slaps fire ,en
97,We need an extended version with more mixing,en
98,This song is addictive!,en
99,Dang...catchy....been a loooonnng time a track dont stick in my head like this,en
100,Eu amo essa música  ,pt
101,My bus driver is addicted to it. I have to listen to this everyday-,en
102,"Hope this guy may nominated tp billboard, and grammy music awards.",en
103,"Finally found this song!

Love it! ;)",en
104,Hits pretty hard,en
105,the reinvention of a classic! I hope the Cherish girls (now women) have heard this,en
106,"Sem condições velho, ",pt
107,I hope everyone knows the original song!! It's nice to bring it back. I hope they had $$$,en
108,I lovve  this beat and i do the dance everytime it comes on the radio,en
109,"J'adore, J'adore cette chanson",pt
110,love the song,en
111,This is great my fav song,en
112,But I swear your beats are really good,en
113,"Imagine Cherish just sitting at home minding their business, then the checks start rolling in ",en
114,ZEDD NO EDC FOI COISA DE LOUCO!! Que track,en
115,"""Bounce wit it drop wit it
Lean wit it rock wit it
Snap wit it
All my ladies pop yo backs wit it",en
116,They actually weren't a bad group glad they get some search time,en
117,Im only here to see if it's good enough to go into my playlist,en
118,this song is soooo nice!!,en
119,These are the legend songs. Only few can find them,en
120,I know this track since Monday and love it ...,en
121,Mais uma música antiga fazendo sucesso nos tempos de hj ksksks,pt
122,Muito foda,pt
123,Best song to hear in all situations. PARTY,en
124,this song has been on my mind for so long,en
125,My 2 year old loves this beat. She shakes her booty lol️she got me hooked on this song!!! Love from Cape Breton Nova Scotia Canada ️,en
126,"Watching really beautiful women dance to this is just amazing, especially when Molly is with you, its an incredible experience",en
127,Musica boa....,pt
128,Thank for this energy,en
129,I really love the beats of this song it really awesome,en
130,adorei,pt
131,"Heard two seconds of it on Insta, what a tune",en
132,So Dope ,en
133,ALL MY LADIES POP YOUR BACKS WIT IT best line ever,en
134,"It’s a go, people. We got the beat.",en
135,1 minuto de silêncio para os BR que ainda não acharam essa pedrada,pt
136,I love this ,en
137,"There are just 5 lines of lyrics in this but man, does the music slap!!",en
138,This shit is a hit   pls bring me back to 90s To Cafe del Mar,en
139,"I feel it bruh. I always watch new artists i discover, and i know these years have been harder for em. For real, I like the unexpected mixes. Wish I knew artists actually saw these comments, but oh well. Profit, thats the ol boy i been watching. I think he gonna blow it up. Id love to take the credit for getting him to mix with you. Watch his single, that sht fiya https://youtu.be/zKWS8IhM4ow",en
140,Love it! ,en
141,Adoro essa musica!!,pt
142,"We are finally getting back musics like 90s, 80s, and 00s, they finally realised whats the best....",en
143,I absolutely love every millisecond of this,en
144,All my ladies pop your backs with it ,en
145,Reminds me back to the early 1990's,en
146,Killed it,en
147,Damn this was our when I was 21 yrs old going to the club and this remix Is FIRE!!!,en
148,One of the few 90 mix tracks where i hit MUTE button. Looping crescendo for 3min?? Imaging like  frigide s3+ on that black couch ,en
149,His sooo  coool omg his energy iyd so infectus,en
150,It’s so easy and soooooo addictive,en
151,Some of y’all are just NOW realizing how dope house music is ...welcome to the club ,en
152,"i found out this song on MTV worldwide hits
its amaz",en
153,I love Just music,en
154,Acraze is so cool I love his song,en
155,Damn cherish!   Hope y’all getting some of that attention and popularity boost because it looks like this version will overtake your own work.,en
156,This is  I heard the original.  This one works for me,en
157,The song is ,en
158,Caught this on a weight watchers commercial and I actually think I lost some weight dancing to it!,en
159,"Everything repeats itself here, so I know it by heart",en
160,A great song. Dance is also nice,en
161,This remix was genius,en
162,L O V E I T  He'll yeah ,en
163,This is a Banger!,en
164,The one and the only banger,en
165,Beginning of new generation rave music,en
166,Benny Benassi played this 3 days ago at Charlotte in World Nightclub. Was so pumped when he played it!,en
167,Song of the summer   ,en
168,Omg I’m in love  oh yeah rock it wit it,en
169,Obsesionada quedeeee  love from 🇲🇽,pt
170,"""And ye shall know the truth, and the truth shall make you free.""",en
171,I mean it’s in every dj set but it’s an amazing song,en
172,Jeeez that drop ,en
173,Omg this is amazing!!!,en
174,"Bounce wit' it, drop wit' it
Lean wit' it, rock wit' it
Snap wit' it
All my ladies pop yo' backs wit' it",en
175,"Omg, I love this YT Playlist. I hope some day my song will be here also. ️",en
176,This is literally a workout song,en
177,This beat is going to be remiksed by many djs. Najssss,en
178,Nice beat.,en
179,"What an AWSOME CLUB Master Number << handclap >>  first heard my shazam didn't knew back then, super happy to find it <3 congrats !",en
180,When I first heard the song it was my favorite song,en
181,Até q enfim achei essa música ,pt
182,Great video as well ️,en
183,damn. I'm inlove with this 2step-garage-house. lit ,en
184,The beat beat to dance!!!,en
185,Really really into this track but I'd hoped the video would've been a bit surreal to go with it,en
186,"I knew this shit sounded familiar too me, it's a song by Cherish and thank you for giving them they credit for it",en
187,"Once a friend of mine suggested this song,everytime i hear this Song Its reminds me her ",en
188,Great Work!,en
189,Dance with it. ️,en
190,"ooooah, unique style I love this sound",en
191,The best part is the haunting addicting background beats and lady that goes auhhahh I think a lot of time the backgrounds carry the songs and nobody realizes it,en
192,Unappreciated is one of my favorite Cherish Songs! No idea what this is though!!,en
193,Thanks for reminding us about cherish ,en
194,I'm so glad Cherish is getting credit for this sample.,en
195,Dropped by Martin Garrix at Creamfields. Banger!,en
196,This is very dope Lol ,en
197,"No naked skin, no women humiliating, and only cool vibes",en
198,Damn this is fire,en
199,"All my ladies,pop yo’ backs with it! ",en
200,Great video ,en
201,"I love it but it my head goes to
“Lean with it, rock with it
When we gonna stop with it?
Lyrics that mean nothing, we were gifted with thought",en
202,I really like your sound Charlie Duncker a belgian fan ,en
203,DE LUJO.,pt
204,"As long as Cherish gets the recognition for the sample, d'wytes can have fun with this.",en
205,One of the things that made the song so popular was the vocals of the song as well. This version doesn't pay much homage to the vocals so it's hard to enjoy as much ,en
206,Why does this go so HARD,en
207,It took me 2 days to find this song and I had to search through more than 100 songs to do so,en
208,Music very very good ,en
209,This is LEGENDARY,en
210,I like how he keeps going knocking on the camera and all the filters,en
211,The wait is over ,en
212,How has this got 101 . Melts ,en
213,Foda de mais,pt
214,"Pra quem assistiu round 6, essa msc lembra demaisss",pt
215,"The remix is bomb.   
But why does it remind me of Squid Game? ",en
216,Its so clean,en
217,Its so clean,en
218,Adoro,pt
219,Dope ass Banger   Need more clicks ,en
220,This is the new “Deep Down Low”,en
221,"I remember the actual 2006 version like yesterday
.",en
222,This is LEGENDARY,en
223,Shit bops too hard no ,en
224,holy hell the most greatess song i ever heard.,en
225,DAMSCO IN DA HOUSE WE GOT THEM PILLES FOR YA      NOW ROCK WITH IT!!!,en
226,You think dj’s practice listening to beats or does it just come naturally,en
227,This song by cherish is,en
228,This made me re listen to Oh by Ciara. Oh the memories!,en
229,When I’m turnt I can’t stop dancing to this shit,en
230,TIRO !!!! NFT! Crypto! ,en
231,You and SICKICK album pleeeeeaaaasseeeee. These dam eargasmic beats,en
232,Great !,en
233,So surprised to see how this track didn't end up getting signed to SPINNIN or STMPD,en
234,TikTok hits never failed me ,en
235,I just shazammed this song from some guy bumping it on ventura Blvd while we were at a red light.,en
236,Do a remix with Ciaras Oh .. Would go Hard af,en
237,"Sounds like 90s modeling music.
Something you would listen to at a Victoria Secret show. O.o?!?!",en
238,I found this song from nadine breaty like weeks ago and I can't stop listening to it!,en
239,Yes! Great composition,en
240,This is better than the original,en
241,"Why didn’t they put the track with the rest of lyrics??? They could of at least included the “do it, to it” part considering that’s the name of the track",en
242,that beat track has been used about a billion times.,en
243,My man Dom Dolla played this on his set in Electric Zoo ,en
244,I never never never  heard  this  song  but is cool,en
245,Original is still fire,en
246,This the greatest master mind producer wow the level of ingenuity here is off the charts! Someone tell destiny child to hire this guy,en
247,The beginning reminds me of Pink Soldiers theme music in Squid Games.,en
248,Genuinely thought this was a Claptone song when I first heard it,en
249,This remix is 100% better than the original version which I find unlistenable.,en
250,Idk what this is but it hits hard as FUCKKKKKK,en
251,"Emptiness is the word for all this stuff. Empty roof, empty room, empty dance floor and finally --- EMPTY music.",en
252,"God is very pleased when someone comes forward with the help of indigent, endangered and needy people. Therefore, it is essential to show sincere love and empathy for the poor and helpless. The moral and fundamental demands of the brotherhood are to help and cooperate with each other and to stand by them in times of danger. Extend a hand of support and sympathy",en
253,"The melody is like squid game ""pink soldier"" backsound",en
254,My gym plays this song all the time. Just Shazam’d it. I can’t stand this song ,en
255,Just another mainstream song with some mainstream 0815 beats.,en
256,Let's pray for people who try to find this song ,en
257,It reminds me of F for you  by  disclosure feat. Mary j Blige ️,en
258,This music like a squid game Intro deep music,en
259,"So somebody looped a chorus from a 20 years old kinda meh RNB song, faded it in an out of some random effects and layered an uninspired beat over it. This 'song' took 30minutes to make tops. Jeez, I could have done this in roughly a day and only because someone would have had to explain the studio software to me. How is this called art?
Seriously this is minimum effort to become rich. Well done!",en
260,"Imagine, if you died right now, where would your soul go for eternity? Was everything you ever did without purpose, and never really mattered, or will you just stop existing, after you draw your last breath? Think about this, it is the most important question of your life. There is only one chance to get it right, and it is in this lifetime. Do not be deceived, God is not mocked; for whatever a man sows, that he will also reap. Heaven is real, place of eternal bliss and perfection. Hell is real, place of eternal suffering and torment. You’re going to spend your eternity in one of those places. God's will is, that nobody would perish. One day, each and every one of us must appear before the Judgement Seat of the Holy Righteous God, and to give an account, how we have lived our life. The only way to get to Heaven is, if you’ve never broken any part of God’s Law, in other words, if you’re without sin, and every single one of us have sinned. Not one person, who’s not born again from above, of the Holy Spirit, and is still in their sins, can inherit the Kingdom of God, for the wages of sin is death, and eternal damnation. Our sins separates us from God. That is why God in His love and mercy sent His only begotten Son, Jesus Christ, to atone for our sins. He left Heaven’s Throne, was God in flesh, conceived by the Holy Spirit, born of a virgin, lived a holy perfect life while being in same temptations as we are, yet without sin, was condemned unjustly to death, although being innocent, was beaten, mocked, flogged, and crucified on the cross, and gave up His life and Blood willingly on our behalf, for there is no forgiveness of sins without the shedding of blood, but Christ, the spotless and unblemished Lamb of God, the Perfect Sacrifice once and for all, took the punishment of our sins on the cross, sacrificed Himself for us and paid the sin debt in full, past, present, and future, so we can be forgiven of all our sins, and be redeemed back to God, after the fall in Paradise by satan's tempting, through the Holy Precious Blood, which Jesus shed on the middle cross at Calvary, in His everlasting love towards every single one of us.",en
261,Song of the 2021 autumn :P,en
262,I’m here because the martial arts artist Chloe Bruce used this music for her kicking demonstration.The sample come from Ciara Oh feat Ludacris.FABULOUS!,en
263,Power music ,en
264,This beat can relate to lady gaga. Creepy beat.,en
265,music great!,en
266,"Zedd's ""Squid Game"" intro at EDC Las Vegas brought me here",en
267,alguém traduz? adoro esse som mas não entendo mt bem,pt
268,"Good copy Remixed of Cherish ft Sean Paul, 15 years ago it was already bursting. Excuse me Millennials, this is already a Boom from before.

Buena copia Remixada de Cherish ft Sean Paul, 15 años atrás ya reventaba.  Disculpen Millennials, esto ya es un boom de antes.",en
269,Sounds like the squid game music,en
270,Remember of Ciara - Oh,en
271,Gruß is the best music,en
272,The best song in 2022🇮🇩🇮🇩,en
273,Best song in January,en
274,Wat a drop,en
275,Crazy  beats from Australia Melbourne,en
276,Something tells me this didn't need a lyrics video.,en
277,The BEST,en
278,Finally i been watch this for 50 days and is finally here,en
279,"TikTokers brought me here. 
YouTube shorts brought me here. 
So amazing music it is. 
Reminds of my 2000s",en
280,Pepsi sent me here This mash up is Salute to Cherish,en
281,I always wanted to be a DJ ,en
282,"I heard this on the radio and I swore it said ""ladies drop your pants to it"" not ""pop your backs to it"" and I'm so disappointed it's not",en
283,Beginning sounds like a level off streets of rage haha,en
284,Wasn't this a hit in the 2000s??? or it sounds like something really similar,en
285,WITH HEADPHONES IT THE BEST THE BEATS,en
286,This reminds of  Carol of the bells  the Ukrainian version,en
287,"he looks like a mix between steve aoki and khal drogo

no wonder this drops so hard",en
288,Cool...,en
289,"Great !! It reminds me ""Ciara - Oh""",en
290,"Life, liberty, pursuit of happyness",en
291,Bounce wit it...,en
292,Mashup up of This and losing it ...is in the making,en
293,Move it!!!!!,en
294,The Best of the Best Deep House 2021,en
295,"Do It To It
ACRAZE, Cherish",en
296,Love  Australia  Melbourne,en
297,LoveFrom Japan🇯🇵,en
298,"Earphone + Full Bass + High Volume 
#BaliNightLife brought me here... 
Greetings from Bali with ",en
299,Top,en
300,sooooooo COOL!!!!!! 2 work out tooooooo!!!!  and dance too!! thanx!!,en
301,nice bro fresh,pt
302,If squid game season 2 came out this should be the intro music,en
303,Good song,en
304,All the fellas doff your hats to it.,en
305,GooD Music From HUNGARY 🇭🇺 BUDAPEST  2022.04.04.Hétfő 22:10,en
306,top track,en
307,Personal I think is very good when it’s loud,en
308,Every time I hear this song I picture the daughter from Bob's Burger twerkin lol,en
309,Oh shit it’s out!!!,en
310,I don't understand the meaning of the song. Please tell me !! I like it!,en
311,this music kinda gives me squid game vibes,en
312,cool ,en
313,What genre would this falls under Electronic/House Music??,en
314,The music giving squid game wibes ,en
315,I don't now if you guys can hear it but the melody kind of sounds like squid games at the beginning,en
316,Why is this top 50 on spotify?,en
317,drop with it,en
318,Hollywood undead vibes,en
319,"Help ! I can't even focus on my studies because of this song 
️         ️
       
       ",en
320,This remind me “Pocket full of Hawthorns” in Community. Don’t know why ,en
321,I thought is an sample from Ciara „Oh“ well i thougt wrong. Anyway this sht is on fire ,en
322,Acraze do it to it is best songs,en
323,Brasil 🇧🇷,pt
324,Tickles my whistle,en
325,0:25 Kinda sounds like Squid Game's theme,en
326,This one guy ,en
327,"Só lembro de batatinha frita 1,2,3",pt
328,"On the build up to the drop, was that the song “do it to it” the squid game remix? It sounded like it lol",en
329,"I love how you put ""wit"" instead of ""with""",en
330,Das ist voll cool,en
331,where does this endling female vocals came from? remembering it from an older song?!,en
332,This song somehow reminds me of Squid Game ,en
333,its got the squid game pink soilders mixed into it,en
334,The crowd is too far away!!!,en
335,Sounds like Holloween music,en
336,a perfect horse riding song,en
337,"maybe stuoid question, but can anybody please tell me how this music style is called?",en
338,Cool ,en
339,Hard to imagine that someone so much lack of talent actually has youtube channels dedicated to to them..,en
340,This guy isn't that bad,en
341,Nice sound from tiktok ,en
342,No one gonna talk about this is the Squid Game Theme Song,en
343,All my ladies backs with it,en
344,Anyone have an idea what the lyrics implies? What is “it”?,en
345,"That way, drop way, freeway, drop way, snap they, all my lady clap your hands way.",en
346,Fun classic twist,en
347,AMSTERDAM 4-LIFE!!! ,en
348,AMSTERDAM 4-LIFE!!! ,en
349,"The bit is made on Squid game's soundtrack, as I hear",en
350,i keep thinking of squid game while listening to this song.,en
351,"After the parents of the child I babysit leave.


3secs l8tr: Do it to it plays",en
352,Why does this sound like the guards song from squid game ,en
353,In case someone is interested to find out the original song... http://www.youtube.com/watch?v=dPCS68n0s2I,en
354,i hâte this song,en
355,Rock is relays. That way I am a lady’s gonna have Baby wrap.,en
356,Is this song copyrighted because i would like to use it if it's not?,en
357,Ethereum. Classic.,en
358,Acraze Ft. Cherish - Do It To It (Zedd Edit) (Official Music Video),en
359,Why its not on  S P O T I F Y,en
360,The simplest beat with a ciera loop.. and people are going crazy over it... Wtf.. crazy. But fuck it if you can get they money do it,en
361,"obviously inspired by ""Ciara - Oh"" from back in the day",en
362,Reminds me of Oh by Ciara. Dope though.,en
363,Why this remix sounds like if this song  released in 2010?,en
364,What happened to the girls from the original video? The should be dancing in the new one.,en
365,I came here from Zedd Squid Game ,en
366,Squid Games Vibes!? There is a similarity :D,en
367,Sooooo we gonna act like this not Cherish song?,en
368,What the.... go away... find me on that dancefloor,en
369,What do you mean ft Cherish???? This is a remix of the song do it to it by Cherish plus the Oh sample is from Ciara's song oh ft Ludacris..,en
370,Addictive video,en
