,comentario,liguagem
371,TY CHERISH AND ACRAZE OMG,en
372,It was awkward to hum this to the google search app,en
373,I dancet in school whith this song,en
374,"Yay my generation of music is coming back. See ya later Ariana and Bieber, you weren't even born yet ",en
375,I am in the car an I am dancing,en
376,Cherish Featuring Sean Paul Of YoungBloodZ - Do It To It is tha real one.,en
377,"is it me or does this sound like
Ciara - Oh (Official Video) ft. Ludacris",en
378,Cadê os brasileiro de plantão,pt
379,Squid game type beat,en
380,I found this through a Pepsi commercial,en
381,2x speed is just funny,en
382,Esto es house ?,pt
383,cant he wear his headphones right?,en
384,Flow,en
385,That hairstyle should be illegal.. but at least he has hair...  so I'll just shut up ,en
386,Chiropractor’s anthem,en
387,Cool,en
388,I'm looking for the riot ten remix or trap version.,en
389,O autor da música é a`,pt
390,It's 2022 sounds like squid game,en
391,B.B. King - The Thrill Is Gone [Crossroads 2010] (Official Live Video),en
392,found it,en
393,They say that drying with a Mexican ,en
394,Song literally said ,en
395,does anyone know the location of this shoot?   i know its nyc but where exactly?,en
396,Me when i hear this : Is ThAt PiNk SoLdIErS ?!,en
397,And he's cute ♡,en
398,0:10 The Moscow...,en
399,see you at countdown!!!!,en
400,Why is the Dj the only one dancing?,en
401,"I watch this, where electro cables on the ROOF? Aaaaaaaaaaa?",en
402,I love misic amesing,en
403,I am bouncin my 53 year old bootay. And im a dude!,en
404,I always thought it was just play with drop play with play with all my ladies pop your bags with step which,en
405,It sounds like oh by Ciara,en
406,The starting tho sounds like squid gamr,en
407,0:13    he looks like npc from the sims tbh,en
408,Wait....its familiar to..,en
409,Make me think of ciara’s song Oh,en
410,My friend helped with this song.,en
411,Squid game theme but dj music instead,en
412,It’s a solid tune but oh boy did they go cheap on the video,en
413,This song was originally by cherish,en
414,Wild Cherry Pepsi BROUGHT ME HERE!,en
415,Where this video is recorded?,en
416,Fortnite Players might know this song,en
417,squid games type beat,en
418,And I thought this was Queen B,en
419,Vim do Fred bbb23,pt
420,this lowk sounds like squid game lol,en
421,He’s very cute,en
422,"It gives me jack the 
Vides",en
423,House baby,en
424,"This is a great song to take a major shit discharge to, no??",en
425,THIS MUSIC IS SCARY AND HORROR,en
426,İt was hard to sing this song,en
427,Omg it's the Squid Game song!!!11!!1!!!!!!1111!1!1111!!11!1!one,en
428,"Ciara's ""One Two Step"" 2.0 and ""Oh""",en
429,Sounds similar to Ciara ft. Ludacris Oh.,en
430,No mes de dezembro 2021 ja n esta mas funcionando esse link desse video,pt
431,I prefer the original version,en
432,Ciara bought me here from her Instagram...,en
433,Do lt to lt remix,en
434,Is this song inspired by Squid game?,en
435,Train music,en
436,Lets goooo to show,en
437,2022 1st number one,en
438,Squid Game     Red Light Green light ,en
439,Coverd from Cherish and Sean P,en
440,"I could've done this, not H8N but he's usin digital gurl beat by foxx, like how hard is that to do and he gettin praise for it, c'mon now opie.. aka Blaze",en
441,horrible title... i ve searched for this song for weeks!,en
442,"Welcome to you fellow fellas from Fortnite, All dedicated to the same cause its seems like. ",en
443,Qual é o id ?,pt
444,who's here in 2022? ,en
445,Sounds like Ciara Oh remix...,en
446,Remix of the squid game guard song,en
447,Y'all need to leave early 2000s songs alone,en
448,Isn't this Zedds music?,en
449,Hardstyle is way better!!!,en
450,Pocketful of Hawthornes,en
451,"is it me but I hear 0 beats and nothing, just the talking T_T",en
452,Thanks…SNL sketch that brought me here,en
453,i used to think this was beyoncé,en
454,"Patrick, Patrick, Patrick.... ohhh ...",en
455,Dunno this sounds like squid game,en
456,"0:04-0:05 ""cascada-miracle"" ?",pt
457,Alguém em 2022 ,pt
458,You sound like screen game,en
459,Why the song like squid game,en
460,Weight watchers brought me,en
461,Im shocked that uninspired shit like this is getting into the charts now XD,en
462,Is this tune from squid game?,en
463,love the song......but he barely touches the mixer.....:P,en
464,I love EDM but this is very repetative. It lacks that extra factor that makes an EDM song special outside of a club. One that stands up on the radio. Like the Cold heart song does cause its a proper song not just some loop of the same nagging repetition. Plus this backing track is so tinny & tired. Tinny beats.,en
465,What the hell is this song supposed to be about?,en
466,This like squid game,en
467,DO what?,en
468,What are you doing now I am in a hurry I am,en
469,Pepsi brought me here,en
470,BRO NO ONE ELSE THINK THIS SQuid game????,en
471,"AUDIO TECHNICIANS AND AUDIOPHILES LISTEN TO MUSIC GRAPHICALLY THEY LISTEN TO WHAT THE SOUND IS SPEAKING TO THEM AT THAT TIME SEAMING TO SAY TO THEM FOR WHAT AS A PHYCOLOGICAL TEAM WOULD SAY AS SUBLYMONOL BUT ONE WOULD SUGGEST THAT THE ONLY THING IN SPYCHOLOGY IS A TEAM IM SUGGESTING THAT THE ONLY THING COULD ONE DESCUSS OF ETHICAL LAW IS ONLY WITHIN THE DESCUSSION IS BOUNDING A TEAM WITHIN THIS UNIVERSE GOD INVENTED NOW OH AND FREE THE BLIND AND MAKE GAS CHAMBER REALITY SCEES AFRICAN , ENGLISHMAN , ",en
472,"this song is atrocious, makes me feel like I'm in a tub while smugglers remove my organs",en
473,This is squit game song,en
474,Remake from Ciara-oh,en
475,Hi from morocco,en
476,Even though we don't like squid game anymore I'm the biggest hater of squid game but the song is very good,en
477,0:36 Seegson Synthetics Nostromo Alien Isolation Working Joe Amanda Ripley,en
478,Who was here before squid game,en
479,Weight watchers commercial,en
480,ozzy man reviews brought me here,en
481,Missy Elliott - 4 My People PLUGIAT,en
482,Podre! Fiquei esperando o refrão e nada ,pt
483,"i dont understand the hype about it,  its only mediocre in comparison to many songs from this music genre, and the drop is ultra boring actually. no hate just i tried to listen to it 5 times and i cant find any part that i could rate at least 6/10, its 5/10 at max",en
484,4 months ago ,en
485,Man I really wish there was no squid  game remix of this because I hate squid game,en
486,More proof that TikTok popularizes garbage music.,en
487,"Relative to the original, this is hot garbage. The original was a dope house party/club song. This version makes me want to put out a cigarette on my ear drums.",en
488,Wobble,en
489,It’s not sounds like a sq game,en
490,This song is getting really annoying at every club,en
491,Creepy,en
492,"Thanks,",en
493,"Colocaram o nome das Cherish,  porém as mesmas não cantam. Estragou a música. A versão original é infinitamente melhor!",pt
494,This stuff is not house music oi! Been listening to house music for ever this is like drop like it's hot not house music get over yerself,en
495,Zedd composed this song not you,en
496,Squid gsme is this you?,en
497,I was gonna dislike but thays negative,en
498,This tune is as dry as Moses' heels...,en
499,You mean Cherish featuring you? Sir this is NOT your song and you need to credit the original artists properly. I hope they sue you. The damn audacity.,en
500,Download link - http://usheethe.com/HqGz,en
501,with what,en
502,Why they copied Squid Games ?,en
503,Dear user camera name I,en
504,What,en
505,On,en
506,"Shameless rip off of ""Battle"" by Wookie.",en
507,Sounds Like a shitty Netflix series,en
508,"Butchered a good song, everyone go listen to the original instead of this pelt",en
509,What a rip off of squid game music,en
510,Cringe gringo music,en
511,Annoying as hell,en
512,I hate it so much,en
513,I hate it,en
514,Use me as the Disslike Button,en
515,I hate this song… this is terrible music my ears omg.,en
