,comentario,liguagem
283,"Gosh, Summer feeling all over it! So pleased to hear a hit from Calvin Harris once more. Have been worried he wouldn't never do a smash hit again. Thank you",en
284,I can't resist saying that Calvin Harris is far better at making summer songs than DJ Khaled,en
285,This song is lit,en
286,this song is so good,en
287,Her voice is so soothing and mixed with the beat of Calvin Harris makes this the best summer song by far! ️ ️ ️ ,en
288,SHe really has his own cool style. A very cute and stylish style at the same time and she is very beautiful. sHe has his own different and unique style. I love her so much.,en
289,"imagine this song, on your phone while you're on the couch, on a Friday night in winter.",en
290,the melody ,en
291,"Very classy and chill chorus. Enjoyable Song for sure. 
You guys make a great combination",en
292,So we ain’t gon talk abt how thugga just kilt his verse ,en
293,This guitar's reminds me a bit of spandau ballet's true. It's a masterpiece ,en
294,Duvido existir mulher mais linda que Dua Lipa.,pt
295,Look what we’ve had up to this from ‘Acceptable in the 80’s’  well done uncle ,en
296,This song and “Clover Cage - This Is What The World Needs” are the only two things keeping me sane through these tough times. I just want to send love to everyone and I want everyone to know things will get better...We are in this together...I love you...️,en
297,"They've put a lot of effort in this vid, it's stunning.
Soothing & relaxing.",en
298,"5 years ago, Calvin Harris bring Pharrell
Williams, Katy Perry, Big Sean to enjoy the summer vibes with Feels. Now, with Dualipa and Thug. Never failed ",en
299,Mestre eu preciso de um milagre....,pt
300,I hope her next album has 70s influences,en
301,My heart ️ goes ,en
302,"After ""Feels"", it feels like it is the second part of ""Feels"". Calvin Harris is never disappointed",en
303,I love this song so much but I expect there will be more beat break,en
304,Dua’s voice is perfect for this song,en
305,in my side (gostei dessa parte) ,pt
306,Thug never disappoints he a true  free ,en
307,Cool beats!,en
308,Calvin's music production+Dua and Thugs vocals is pure talent ,en
309,Dua lipa is the star of the show,en
310,A shout out to Young Thugs smooth flow..,en
311,The beginning,en
312,Calvin Harris and his baselines will never ever disappoint,en
313,Thug's fit into this format is so Underrated,en
314,At first heard this song I feels like wow I want to hear again n again.,en
315,such a beautiful song yet so very underrated mahn,en
316,I’ve had 2 dreams where Dua Lipa is my best friend. They felt so real!!! ,en
317,"Her songs always grow organically, that’s what makes her one of the best pop stars this decade.",en
318,"É impressão minha ou as pessoas não perceberam que a música também tem o  Young Thug cantando?. Eu em.  li muito sobre Dua Lipa e o Calvin... mas não vi menção ao Young Thug. Alías ele é um cantor excêntrico, apesar do que está passando ( não sou Juiz para julgar ) ele canta muito bem.",pt
319,"Tbh, Music videos and the outfits worn in those videos INSPIRE me.",en
320,great song,en
321,My performance in the gym soars when this jam comes up.,en
322,Best song from the album,en
323,"Loved the lyrics of this song specially,",en
324,I would like the song more if dua lipa dance like levitating️btw it's great as always,en
325,"Imagine this song with a sunset at the beach people just vibing, grooving, drinking cocktails ",en
326,Young thug vocals just amazing,en
327,DUA IS THE STAR OF THE GALAXY,en
328,This is fucking good song! My favourite ,en
329,"Just another summer hit by Calvin Harris 
i can bet Calvin never bought views from AUTHENTIC views",en
330,Calvin Harris always appears in his videos at some point. Normally just randomly standing somewhere. Just casually. Looking cool ,en
331,Dua Lipa is SOO Beauty,en
332,"Calvin Harris e Dua Lipa não tem erro, hit na certa, SALVE BRASIL !",pt
333,"It's the best summer hit, it puts me in a tropical and relaxing mood 
i can bet Young Thug never bought views from AUTHENTIC viewS",en
334,She should play Poison ivy's role in Battinson's Bat-verse,en
335,This has the 90s vibe and sexiness,en
336,Calvin Harris always delivers summer hit and this track is one of them. Massive Collab,en
337,"how I said it before, 3 years as 4 have passed since he collaborated with Calvin Harris and he did it again on this new song .",en
338,Happy birthday dua may god bless you  from India,en
339,Soo good it scares me!,en
340,ahah the song ,en
341,"Love this, Calvin Harris done well with this one, a bit of 80's and 70's mixed with contemporary. ️",en
342,Hi guys I love this song with all my heart it gives me another vibe,en
343,"This sounds like a sequel to ""FEELS""!",en
344,Young thug eu te amo ,en
345,when you have the guts to listen this infront of your parents with no earphones.,en
346,this song is amazing for stay underating yet!,en
347,"Talk about music - Calvin Harris
Talk about sex appeal - Dua 
Talk about rap - Little thug!
Perfect combo for a lively evening",en
348,Nice song,en
349,It's gonna be a masterpiece ️,en
350,I'm so glad he's back,en
351,1980’s ,en
352,"I bloody love this song  Really thought it would be performing better as a single, come on guys, keep streaming on here and spotify!!",en
353,These two are so sick,en
354,Bringing back the 70’s 80’s vibes ,en
355,Young thug gives really another level off vibe ,en
356,Dua Lipa could make me do anything… literally anything,en
357,the best ,en
358,Dua Lipa is literally the epitome of hotness -every man in the world ,en
359,Bassline is deadly,en
360,"Quem é a cantora mais linda do mundo? Não digo, porque ficas muito vaidosa",pt
361,dua and thug killed it,en
362,I could be wrong but this could be the best looking Dua Lipa looked in any of her videos.. Pretty Impressive tone stomach for sure.,en
363,So beautiful,en
364,Love it! By the way I'm Albanian 🇦🇱 just like you,en
365,I'm glad 70s and 80s funk/disco is making a come back in 2020s as a trend.,en
366,"this song got me the same vibe as the feels song, i did mistaken dua lipa's voice as katy perry's",en
367,Cavin  Harris ,en
368,"AAAAAAAAAAAAAAAAAAAAAAAAAAA I LISTENED TO THIS LIKE 1,0000,0000000000 TIMES OMGGGGGG ITS SUCH A GOOOD FREKING SONG",en
369,"Potion - This is my best 3:34 seconds of my life in my entire day!!!



Dual Lipa - I have never seen such a Beautiful and Charismatic Artist before",en
370,"Ths video is really pretty, Fits the song very well.",en
371,"The resurrection of the G-funk era. ""The rhythm is the bass and the bass is the treble."" Ya'll know what I mean. ;)",en
372,OMG THE MUSIC IS TOP,en
373,She's solo fkn Beauty,en
374,"man it reminds me so much of the vibe ""feels"" gave, really love it!",en
375,I love this song ...,en
376,When she went from lazy dance to full on sexy dance.,en
377,The chill vibes to the track are perfect for the intro to Dua's verse where we get nice and funky. Dope track!,en
378,"Dua Lipa inspired me to go all in with my music. She was just like me, an artist without many listeners. Now she’s on top. I believe it will happen for me one day ",en
379,I love Kelvin Harissa's collaboration with Dua Lipa,en
380,"The tone of Dua Lipa's voice is pure and innocent, like a warm feeling that descends from my lips to my heart. I feel that emotion in every song he sings. ",en
381,"Lovely clip,good harmony,very pleasant moment",en
382,Old school Vibe,en
383,"Eu amo toda essa delicadeza nos sons do Calvin, é muito gostoso de ouvir",pt
384,I've been catching love off the backboard!,en
385,oh it´s the best song in the world,en
386,Dua Lipa is the best singer in the world and beautiful,en
387,Heard more than 20 time in the last 2 days! Outstanding vocals music video and everything!,en
388,"They keep trying to recapture the lightening in a bottle of ""feels"".",en
389,I love this song,en
390,What is this? Perfect!,en
391,Calvin Harris e Dua Lipa já é a segunda música que fazem juntos,pt
392,Wonderful very beautiful video Excellent story,en
393,it is a bop,en
394,Calvin is acc a legend,en
395,Sucesso garantido!,pt
396,"Contains samples from Stanley Clarke - Heaven Sent You . Nice, very nice Mr.Harris ",en
397,Oh gosh I heard this song riding along I said this is the shit. I had to come home and play this over again and again.,en
398,Musica que toca na C&A,pt
399,Dua Lipa is the best among all singers️,en
400,Dua Lipa must get an entire album with Daft Punk. It could be something epic like RAM.,en
401,thugger has crazy vibes,en
402,Dua is the anatomy of a Blue Lotus flower 🪷️,en
403,This love song ️️,en
404,"Thug is so versatile, be free we need your talent.",en
405,"Nostalgia
I listen this song at sea ",en
406,"Calvin Harris = Perfect
Dua Lipa= Perfect
Young Thug= Perfect 
Potion= Perfect ",en
407,didnt realize how much i miss thugger,en
408,Reading all these comments no one giving thugger credit for blessing another song.... may be one of his last for a while,en
409,Need more similar versus from Young Thug,en
410,Fantastic song,en
411,I love this song,en
412,Calvin e rainha Dua mais um sucesso na certa,pt
413,i love this song is my favoriteeeee!!!!!!!!!!!,en
414,I can't think of anything better than a great song and Dua in satin........... nope still can't lol.,en
415,Nice combo.  #23 combo with that magic spice.  Come on.  Fantastic.,en
416, DUA LIPA ,pt
417,Nothing More To Say Calvin Harris,en
418,"DAMN GO HARD AF ON THIS ONE! Go? viral today with authentic views , get tons of views and exposure to ANY video!",en
419,nice music and video,en
420,"Wowwwwww! Dua Lipa never disappoints, every song sounds rlly good! Keep up the hard work, dua! Let’s try to get the views to 30 mil!",en
421,"i was imagining thug don't match this kinda beat ,but actually it's not bad",en
422,We need dua lipa songs to be in life,en
423,Thug killed this one ️,en
424,Thug goes tooo crazy ,en
425,Yo amo a dualipa,pt
426,"The song is amazing. Loved that Dua and Young Thug sound great together in a song, it's gonna be a summer hit!!!!!!!",en
427,Very Good bass sound,en
428,She's wow,en
429,"I love you miss you are amazing yada thank you so much, love your beautiful voice",en
430,"Tem cara de hit inesperado do verão, que música vibezeira!",pt
431,Thugger part is crazy,en
432,"The female landscape is a beautiful thing.  And I'm grateful for every time I'm allowed to visit.  Thank you ladies,  you're beautiful.",en
433,Dua Lipa it's the better Singer of the universe,en
434,I hope soon dua lipa will be first best singer in the Britain,en
435,Nice to see some understated pop-music that doesn't try to engorge my synapses with gratuitous shaking asses. Love the rock-steady classy feel of this track.,en
436,no one is talking about young thug  his voice surprisingly goes with this like it was a move to rap on this song,en
437,"POT FARMER DANCE SONG **

I got out my pipe stuffed it with pot

You better believe it held a whole lot.

I whipped out a lighter thumbed up a flame",en
438,I LOVE THESE SONG DUA ,en
439,The best song,en
440,calvin harris is the summer goat,en
441,I don’t know these genius’ come up with this music. It’s crazy genius good,en
442,She really deserves the success she's having ...  :-),en
443,"Your songs would be great with symbolic 
Images that goes with the songs  by your ability as a female ISTP .",en
444,"I notice the real facts of life, what is sadness and absolutely real? You must get to know about. That's my fact. Thank you for your conversation Young Thug, Calvin Harris and Dua Lipa!",en
445,I wouldn't be surprised if there just so happened to be a baby boom 9 months for this song's release.,en
446,Everyone giving Calvin and dua love but what about thugger ,en
447,They did their thing on this I love this ,en
448,But I still think it would be better to change its name to Late Night Conversations,en
449,I’ve lost a lot of seed to this song…,en
450,I actually don't think this song is that bad actually.,en
451,"Calvin Harris is a genius 

Dua Lipa is a goddess",en
452,WE NEED A REMIX CALVIN ,en
453,Dua Lipa is awesome and Wooow,en
454,"I literally see them in action and they are really amazing, because joining the sound with their voices brings something special to me or other people, thank you very much ️",en
455,can we appreciate Thug's verses please?,en
456,"ROFL Calvin just re-made his song ""Feels"" with a different female singer and different rapper and slowed it down a bit ...even got Dua to sing as much like Katy Perry as possible..",en
457,Heart  from India for dua lipa ️,en
458,"Essa nova canção é muito gostoso de dançar,, Dua lipa é top demais 🇧🇷🇧🇷🇧🇷🇧🇷🇧🇷",pt
459,My mom loves this song,en
460,Bruno Sousa is on fire with this music,en
461,Wish Calvin Harris and Dua would end up together ️,en
462,"Thug high class ,good work ",en
463,Essa tem chances de ser um dos hits do Verão ou ser o próprio ,pt
464,"This song is just perfect, the vibe is so cool... And every part of the video is very aesthetic, beautiful.",en
465,Dua lipa is the best ,en
466,"Dar aquela vontade de estar a beira do mar, com uma boa capirinha, uma boa compania e a música deles de fondo, como os amamos!!! ️‍",pt
467,"When young thug said ""break somebody HHHhhuuughhhHhhh""
 I felt that.",en
468,As usual those two deliver! Never dissapoint! Big hit is coming!,en
469,"Her songs always grow organically, that’s what makes her one of the best pop stars this decade.",en
470,"love it. dua is one of the most talented artists of this era besides the weeknd and others. she has it all, great looks, sexy body, incredible voice and sensual dance moves.",en
471,"I’m a fan of 80s, I love this song and Dua Lipa voice is amazing. Great collaboration between differents artists",en
472,"Summer song?? 

Why not, she never disappoint us",en
473,"🇧🇷 Adoro essa vibe vintage dos vídeos dela
Vídeo maravilhoso. Relaxante e profundo, cheio de cores e muita natureza",pt
474,"This song reminds me of my youth, roller skating with my friends….Love the beat! ",en
475,"Is fantastic back to see Calvin Harris and Dua Lipa having a new collaboration in a song and results a new great song, these are the artists we love and we admire",en
476,"The beauty and posture of this woman takes me away from me, she sings her songs as if she is whispering in my ear. Dua Lipa ",en
477,"Imagine this song with a sunset at the beach people just vibing, grooving, drinking cocktails ",en
478,"It's a phenomenal song, I love it and I'm enjoying it right now alone",en
479,"I passed by the house playing this song and I went home to find it, but it's better than I imagined, it's great. I love it ️",en
480,Bringing back the 70’s 80’s vibes,en
481,This gave me Huge 80th vibe... Gonna be on repeat all summer,en
482,Typical sound and video from Calvin. Love it!!!,en
483,"Brilliant, BRILLIANT song. I saw Dua in Milan on May 26th live, it was the HIGHLIGHT OF MY ENTIRE LIFE! ",en
484,"She's the pop queen of today's world, hard to surpass her.",en
485,it’s a summer hit! love it ,en
486,You’ll probably never read this but you have inspired so many people to follow there heart and have got me and so many others through hard times. I hope you know that. And I’m so excited for this! I know it will be an amazing hit just like all your other songs. ,en
487,"I'm getting ""Feels"" vibes from this",en
488, at the begining juste ,en
489,Very beautiful,en
490,Congratulations from Brazil ! Parabéns.. mais uma track boa do Calvin Harris. Respirou muito da vibe de RAM do Daft Punk. Logo vai ter vários remixes !,pt
491,Underrated,en
492,Dua lipa the best ,en
493,Que mulher lindaaaaaa socorro! Dua Lipa perfeita ,pt
494,That voice is good,en
495,Dua Lipa always adapts old style songs very well to the present,en
496,Love it song,en
497,Summer hit of the year is coming y'all!!!,en
498,You are the best ,en
499,"The '80s are back, see Bruno Mars, The Weeknd, now Dua.",en
500,That guitar in the beginning is fuckin DIRTY,en
501,Song is  perfect to have some fun with your partner on,en
502,Young thug verse carries,en
503,The music video reminds Dua on the Last dance and hotter than hell ,en
504,Listenin this just for Young Thug it go crazzyy,en
505,Calvin Harris is the best at bringing back music from the swing/jazz era - he does an incredible job modernizing this music - best DJ ever,en
506,"I'm 100% sure that this song is going to be a hit song for 2022's Summer!!!
Thanks for sharing good music Calvin Harris!
You're the best man!!!",en
507,Already listened to this song on repeat!,en
508,"32,095,112 views, 422k likes, 11k comments, 18.6M subscribers. Nice!!",en
509,Free the GOAT Young Thug ,en
510,Nice song     ️,en
511,It's awesome,en
512,Dua oh Dua she is the showstopper,en
513,A SUMMER HIT IS COMING,en
514,Woman Of The Year Calvin Harris,en
515,Dua excelente cantante  excelente música ,pt
516,song of the summer,en
517,Dua the best,en
518,Thug is that guy ,en
519,Dua’s Black long hair and dance moves here reminds me so much of Last Dance Era. No matter how many times I listen to it I never get bored! ,en
520,Those who edit this video need a raise. ,en
521,Top top,en
522,A Dua é toda retrô né? Eu amo!!!,pt
523,"Love this song. But there is a remix I hear on XM that has a great BPM feel, but i cant find it.",en
524,Why does she look like Olivia Rodrigo when she’s in the upside car OMG,en
525,Sounds good . and calming!!! ,en
526,"Dua Lipa and Calvin Harris never disappoint!! it's a summer hit!!! and Wow that dance dua did on the big leaf...

Seriously, when Calvin and Dua Lipa colabs, you can always expect a big hit. ",en
527,"yasssssss summer smash hit , love Dua's new pitch , we've seen her mostly use her low , raw vocals that smoky voice ( THE perfect voice ) but this is just perfection ,  a bit slow , that pitch omfg WOW I don't have words to describe Dua's voice it's just PERFECT . I really catch Thug's voice on this track ( it takes time and a few listens to realize this )  he went in with the flow like Dua's and then his own flow and THE PRODUCTION SLAYYYYYYY . OVERALL 100 out of 10 and can we just talk about the MV  . BIG BIG BIG PROPS TO THE TEAM BEHIND THE MV , THEY FUCKING SHOT ALL THIS IN 24 hrs , THE MV IS JUST THE CHERRY ON THE TOP , THE PERFECT MV FOR THIS TRACK AND OBV DUA'S DANCE SKILLZ ARE ",en
528,I never was interested in Dua but lately she's been on fire ,en
529,I LOVE YOU DUA  UR MY CELEB CRUSH,en
530,"what a video omggg
hi from russia ️",en
531,"Ya of course dua lipa ,  my emotion is real on you, not a electric type.  hope you understand ",en
532,"Wait, this is good.",en
533,Dua lipa seems like she spawned from Kali Uchis’s sweat puddles on stage even her artist name sounds like a fancy bit off version of her name,en
534,"Young Thug, always kill's these Pop songs! 

Calvin I've been waiting 5yrs for Funk Wave Bounce Vol 2! Thank you brother! ",en
535,Dua lipa is star of world,en
536,"FEELS for when the sun's out, POTION for partying all night!",en
537,It's the best intro to vídeoclip. #Soloofguitar.,en
538,One Kiss was AMAZING and Now Potion!These two are such icons and Im sure people are ready for more songs by yall.,en
539,Who else came here for the thugger verse? Both carried ! ,en
540,Maravilhosos .,pt
541,Sonhando com o dia da versão solo somente com a Dua,pt
542,"I'm sure you're older than these late night talks
You are a hi star",en
543,That voice ngg,en
544,Calvin one of my favourite producers I like his EDM more but this is class too,en
545,Bom dia joinha garantido,pt
546,Nice song,en
547,Dua lipa million dollar baby so good queen priccess is the moments,en
548,The purple waters make me think of Grape Fanta lol,en
549,BRASIL AKI !! CALVIN DUA E YOUNG MDS EU AMO ISSO,en
550,Lovely song,en
551,She's so gorgeous...,en
552,O início tem um clima meio Santana. Música muito gostosa. A voz da Dua Lipa é um espetáculo.,pt
553,dua lipa ready for love million dollar baby beautiful queens princess is the moments so good,en
554,THIS GREATER SONG BUT IM STILL WAIT NEW SONG YOU EVERYTHING YOU RELEASE SO GREAT YOU PERFECT PREFORMANCE,en
555,doesn't sound like a little bit of sex when you say it over a hundred times,en
556,this women is so pretty its unreal,en
557,"Calvin Harris = Perfect
Dua Lipa= Perfect
Young Thug= Perfect
Potion= Perfect",en
558,it was supposed to have at least 50M,en
559,"When I started college in 2018, Dua Lipa and Calvin Harris did a collab. It was the first time I heard about Dua. Now, I just graduated a few weeks ago. Another great bop to close out this perfect circle",en
560,He tried but it was to late he couldn’t escape into pop,en
561,very good song with dua lipa and young thug,en
562,"Goddess, my Muse!",en
563,thug a legend,en
564,"Calvin, for the love of God.. wtf were you thinking of when you included the lyrics from Young Thug!?!?!!? It's a HIT there's no doubt, but bloody heck man, Young Thug's lyrics could have been toned done a bit.... no????",en
565,Young Thug’s voice is everything,en
566,Dua Lipa & Calvin Harris best couple,en
567,Muito forte!!!,pt
568,Best of the best ,en
569,storytelling: oh you girl trapped me in my madness and now i am in ten senses come on darling hahahahhahah,en
570,J cold said young thugs talent to hit notes is genius. 🫡,en
571,definitely the song of the summer ,en
572,"Obsessed Calvin Harris,Charlie Puth & Sheaseea",en
573,"that intro music, I think I've heard it before. Does anyone know the intro music",en
574,"I think this generation is going through an 80s revival and I love it. Dua, Doja, Ariana, Weekend. I’m a millennial and mainstream music has seen a huge leap in quality since the 2010s in my opinion. You Gen Z kids are getting some sick beats! You’ll turn out awesome.",en
575,What a state mainstream music had turned into ,en
576,Stay With Me Calvin Harris,en
577,This should have been the Hallucinate Music Video,en
578,This song I feel so good,en
579,"I already know this lineup finna be a summer hit Calvin, Dua, and young thug NEVER DISAPPOINT!!
Edit- okay so after the first listen... ehh ionk I'm not messing with it somethings off ",en
580,Where's the closed captioning for the Deaf and Hard of Hearing fans? Please add it on this music video and thank you #CAPTIONTHIS,en
581,Can I have a sip of that potion I'm very lonely.,en
582,"People saying that they miss his old music and deny the current music during his change in music every year, they are not true real of Calvin Harris, it's believed that he was a great festival EDM producer to have had catchy songs in the world, in reality he is music producer evolving to the sound and I recommend that you they listen to his old songs and not make a mess, this is actually masterpiece ",en
583,Chill ,en
584,"I love Dua's sultry voice in this song, when you think she couldn't possible get any sexier. God damn, you've got me in love again",en
585,"Miracle Calvin Harris
Woman In The Year Calvin Harris",en
586,"Obsessed Calvin Harris
Stay With Me Calvin Harris
By Your Side Calvin Harris
Potion Calvin Harris",en
587,"The day this woman learned to dance/move on the stage we gained another True DIVA who is winning on every front.
Love from PL Dua ",en
588,FREE YOUNG THUG ,en
589,Sick whip,en
590,Flow do young thug é demais meu,en
591,Free Thugga ️,en
592,Riff song like the king of dangdut from Indonesia rhoma irama,en
593,"Lyrics: Potion
In the whip on a Tuesday night, got the music high
And you by my side, side
Top down and the moon is high and the mood is right",en
594,Good song,en
595,Ready OR Not Calvin Harris,en
596,Dua Lipa is the moment,en
597,New For You Calvin Harris,en
598,"Hi Dua can go to the Nostalgia tour in Asia, Turkey, which expresses Iranian fans, and like a place with fans who take pictures.",en
599,"Lyrics: 

Pre-Chorus: Dua Lipa
In the whip on a Tuesday night with the music high",en
600,"Potion Calvin Harris,Dua Lipa & Young Thug",en
601,"Before I’d heard a Calvin Harris song, I was homeless, drug addicted, and depressed. Thanks to hearing his genre-busting and boundary-pushing music, I have found true purpose and meaning in life. I am now a multibillionaire, and I wake up with a smile on my face. Thanks Calvin.",en
602,Cold Heart Dua Lipa,en
603,"In the whip on a Tuesday night, got the music high
And you by my side, side
Top down and the moon is high and the mood is right
And you're by my side, side, yeah",en
604,Dua lipa is so amazingly beautiful and sexy. ️,en
605,ma mommyy's so fuckin' HH00TTT ,en
606,She’s got talent the rest don’t I’ll say it ti ya face when I surface,en
607,"0:43 me trajo vibes de New Rules, TREMENDO ARTEEEEEE:,)",en
608,"E do caralho essa música,,, um salve do Brasil",pt
609,I’m tryin to marry dua lipa but she hasn’t answered my DMs :(,en
610,Young Thug always snaps on pop songs - free that man,en
611,I'm here for young thug,en
612,so basically this is levitating,en
613,"In the whip on a Tuesday night, got the music high
And you by my si-i-ide, si-i-ide
Top down and the moon is high and the mood is right
And you're by my si-i-ide, si-i-ide, yeah",en
614,unironically fitting badabing badabom in a song,en
615,"Lyrics
In the whip on a Tuesday night, got the music high
And you by my si-i-ide, si-i-ide
Top down and the Moon is high and the mood is right",en
616,Free thugga ,en
617,Bro Thug Went Crazy,en
618,"Lyrics:

In the whip on a Tuesday night got the music high
And you by my side side",en
619,calvin happyyyy new yearrrrrrr,en
620,"I don't f***kin know...why this song is not appreciated as her other billion view songs...
This song make me high like I don't need anything else....
Other than a 50 inch 4k TV....lol",en
621,This song is actually my poison and ima need a potion after listening,en
622,dua lipa and billie elish are most bold person in world,en
