,comentario,liguagem
623,"I'll still be a Young Thug fan until he gets out. His voice, and flow is a musical instrument in itself.",en
624,Is it just me or does this song sounds like:'Feels'?,en
625,comfort song,en
626,"In the whip on a Tuesday night, got the music high
And you by my si-i-ide, si-i-ide
Top down and the moon is high and the mood is right
And you're by my si-i-ide, si-i-ide, yeah",en
627,"Young Thug is such a breath of fresh air!! Its Like Christmas day you just never know what you're going to get 
#FreeYoungThug",en
628,After hearing thugs verse on a commercial song. I’m not surprised Rico charges were put on him lmao,en
629,Sounds like the music when u walk into a clothing store,en
630,she only better and better,en
631,"In the whip on a Tuesday night, got the music high
And you by my si-i-ide, si-i-ide
Top down and the Moon is high and the mood is right
And you're by my si-i-ide, si-i-ide, yeah",en
632,I Lowe You Music !!!,en
633,why are people sleeping on this? do we need tiktok to make this famous?,en
634,"I came here for Young Thug , the only rapper to hop on pop, latin like it's his comfort zone. He really did his thing . FREE YOUNG THUG ️",en
635,We need a new songs dua,en
636,The red head to her left at 2:50 steals that scene.,en
637,These fresh Young Thug Lyrics are RICO!,en
638,This is the recipe for a power puff girl,en
639,Dua i love u from libya we in war and still listn to you,en
640,Ready Or Not Calvin Harris,en
641,the beginning is so mysterious,en
642,Dua's outfits thooo,en
643,Dua lipa you rock you make want to dance my ass offi was at you concert  xoxoxoxox in the Sauer I sing you songs love always,en
644,dua lipa and calvin harris never disappoint!! it’s a summer hit!!! and WOW that dance dua did on the big leaf,en
645,"I hold high respect for your work mate
because you're pointing people in the right direction. If there's one thing I've learnt
recently is to remain calm especially when it comes to investment in cryptocurrency. Let's not panic and sell when when everything goes down and do not buy in euphoria when everything goes up. I advise everyone to forget predictions and start making profits now because future valuations are all speculations and guesses. The trade market is unstable and you can't easily tell if it's going bullish or bearish.",en
646,Potion By Calvin Harris / Dua Lipa / Young Thug,en
647,Dua Lipa is my best friend,en
648,Thug carrying,en
649,Young Thug is the spicy element in this music and i love it,en
650,Latest song by Dua lipa,en
651,"Stay With Me Calvin Harris, Justin Timberlake, Pharrell Williams, Halsey",en
652,Free Young Thug,en
653,Free thugger,en
654,I’ve never unsubscribed any channel this fast!,en
655,"The FED has lost it and the sad fact is, it's pretty obvious we are headed for hyperinflation. I think stores better have tight security because when people can't afford to feed their families, things might get ugly",en
656,"New Money Calvin Harris
Promises Calvin Harris
One Kiss Calvin Harris",en
657,Free Young Thug,en
658,1:03 look it’s the guy from jail,en
659,Reminds me of feels from Katy Perry (oh wait calvin Harris),en
660,By Your Side Calvin Harris,en
661,Free Thugger,en
662,storytelling: its a pure boyfriend of god hahahahah,en
663,Calvin Harris and Dua Lipa would be a great couple 🥹,en
664,We're Good Dua Lipa,en
665,Did anyone else struggle so desperately to get Yung thug,en
666,"Every single masterpiece song of these 41 songs by Dua Lipa from official original songs release by Dua Lipa of this list created completely by Dian Rubianti - owned by Dian Rubianti.
every single song of these 41 songs by Dua Lipa produced by released every single of Dian Rubianti's masterpiece song originally by Dua Lipa by  lyrics written by the song team writer.",en
667,Hello new subscriber here have A Great Day ,en
668,I don’t know who there noobs .. Thuggas back must be hurting carrying them towards that W,en
669,Why is nobody talking about young thugs part?,en
670,where is the 50M??,en
671,boy she's gorgeous,en
672,Potion Dua Lipa And Calvin Harris,en
673,"Came here after watching ""Potion but Bee Gees"" cover",en
674,Veronica fan art thanks guys thanka,en
675,here it is,en
676,Free young thug ,en
677,VIVA DUA LIPA PURO MEXICO PURA LUMBRE ???? JIMI HURTADO GARCIA 27/11/2022,pt
678,The Intro Music Sound Like Dangdut ( IndoNesian Music ),en
679,"1 potion
2 feel so close
3 how deep is your love",en
680,Dua Lipa is the hottest women on earth in this video.,en
681,FREE YOUNG THUG,en
682,New Money Calvin Harris,en
683,"This song is exactly what I needed right now, except Young Thug adds nothing lmaooooooo",en
684,City pop,en
685,"Every single song of these 41 songs release officially by Dua Lipa are copying perfectly and completely every single song composed by Dian Rubianti, Dian Rubianti's songs in new lyrics by Dua Lipa.
41 songs release officially by Dua Lipa copyright to Dian Rubianti, owned by Dian Rubianti.
1. Future Nostalgia",en
686,Potion By Calvin Harris,en
687,Y’all only talking about Calvin And Dua Lipa Like lets all appreciate how good is Young Thug is too! They are all good at the song,en
688,"Hello dear Dua Lipa.  We wrote to you on Instagram, please read, Thank you very much.",en
689,free thugga!!!,en
690,"Yo free young thug, them charges are bullshiii frfr ",en
691,Just switched From 144p to 240p,en
692,New subscriber from India,en
693,Young Thug totally ill fitting. Swearing just ill fitting.,en
694,Num ISSO apanho é sinto saudade ISSO é falta infeiticada e agora,pt
695,You should find a seller that sells weaker potions.,en
696,"Cool content, Nice to meet you, friends.. don't forget to stop by, friends.. greetings",en
697,Anthem,en
698,When young thug got out my dude,en
699,"Hey, get that fire extinguisher, there’s a fire, where ?, right there !………… nah, that’s DL, you ain’t puttin her out !!!!!

ANOTHER, groovin tune !",en
700,Can dua lipa make one bad song? I mean is that even possible?,en
701,You are the most beautifull girl in the world ;***,en
702,Young Thug has been used in the worst way possible!,en
703,I like this song  But l think song 's name . My friend 's name is Porsha (Porsha Crystal the wolf from sing 2),en
704,FREE THUG!,en
705,Dualipacalvinharris,pt
706,"Yo ma man thugger can also sing
On such a unique texture and tone .
But why it's funny ️️ .
When he says binga  bada boon ",en
707,Free Young Thugger,en
708,Calvin Harris,en
709,Calvin Harris thing with parrots and lizards,en
710,"Listen to ""Calvin Harris - Obsessed"" after this :)",en
711,Free Thugger,en
712,I hate myself for liking this in the past  now I can't smash like again.  YOUTUBE NEEDS A LOVE BUTTON,en
713,intro de TRIANA,pt
714,.....and it's a potion! - Who feels it every time she says that?,en
715,Calvin lost hes golden touch,en
716,Free Thug,en
717,Free thugger!,en
718,"#Free THUGGA
Ysl",en
719,This song is realised on you birthday,en
720,keep support #asbouncer,en
721,Calvin Harris Songs,en
722,I'm back when can we go to the disco whip il just dream about it one day 4 real xxluallways xxluallways xxluallways,en
723,"Dear stranger whoever reads this:

.

.",en
724,Dua Lipa is her,en
725,TyPearson loves this,en
726,JAKC HARLOW IS THE RIZZLER!,en
727,This is like speed 2.1 time is too much weak saucel lol.,en
728,If only the random currently popular mumble rapper didn't ruin his part completely I fucking love this song,en
729,"Young Thug added precisely ""FUCK ALL"" to this track.",en
730,Woohoo,en
731,"YouTube
How to sing Break My Heart by Dua Lipa in harmony? 
Lower harmony:
https://youtu.be/urTbHCBm2NI",en
732,DUA LIPAAAAAA,pt
733,Come hit,en
734,You very beautiful woman kisses and hugs,en
735,Thugger with another W,en
736,And WHY JUST WHY IS SHE PUTTING A CHERRY ON HER BELLY BUTTON,en
737,"After Angelina jolie, Mila Kunis, selena gomez   and you.. no no not you, The Dua lipa    the hypnotiser i love you... Everyone else svcks",en
738,thank you ure reply is my gift,en
739,Não sou de ameaça e ainda fico drenando e vamos só o pai ajuda ou si mata vamos Yes não tem pista e agora bonitao,pt
740,Yall paid this song dust. It is such a grower!,en
741,Free thug,en
742,Calvin Harris is.God,en
743,"Is thi an ol track?
She's got her old style",en
744,someone tell travis scott to hop on this,en
745,this is seriously to do with a princess isn't it...️ please can someone send her my way,en
746,subscribed done,en
747,Young thug is finally out of jail?,en
748,Wish i could see dua lipa,en
749,Only here for my slime young thug,en
750,"The loser is Calvin, Dua in solo is a queen",en
751,I came to about dua lipa from Top G,en
752,"Great voice she has, beautiful woman, don't like the male vocals, but isn't she lovely, cool.",en
753,Fairy tail dress just flowing with your every move a right little bell of the ball is that a glitter ball above your head or is it a thousand stars come out to play in your perfect tears  were is my dashing Prince he's doing a spot of spring cleaning funny right smile and make my day il be there cinders to fly out of the ashes once again mmmm debatable I'm sure I might just be to hot for you like one of my hot cookies divine but you have to let them linger around your finger befor you can truly taste the heaven sent I'm digging OK sorry not my best il quite while I'm ahead OK crazy me loves all of you take it easy suger boo whst ever you do xxlu2 xxluallways xxsweetest you bla bla  amoura amoura  amoura amoura xx,en
754,2022 yenice trip,en
755,Why tf is she inside of a car that is on its' back?,en
756,storytelling: mfs change your world's don't worry hahahahhahah,en
757,Dua lipa hit diff.,en
758,Thats calvins gal,en
759,Free young thug,en
760,Potion seller please,en
761,"What is the point of having an artist featured on your song if they can't even sing?  It's pointless.  Why is Young Thugs in this song at all when he apparently can't sing one line without auto-tune?  It could be literally anyone doing his part, better yet, it could be someone who actually has the talent to sing with a real voice.  Auto-tune is the cancer of modern music.",en
762,Dua Lipa is match to Calvin Harris song.,en
763,This song sounds like it could have gone to Katy Perry.,en
764,"Ball like Lebron james in the finals?, good percentage to strike out LOL",en
765,Good everithing litle bit high local.to the end that can be much more great ;),en
766,How about song with shakira and sammy hagar. Drakes main prodocer is also lebanese.,en
767,"There's pretty women and then there's Dua Lipa.  This woman is just a pure, true Goddess from Heaven. If you don't find her extremely attractive, you need to check your T levels (if you're a guy) or your estrogen levels (for a woman) LOL!",en
768,"It is actually a very good song and Dua Lipa did a good job, but the producer just ruined it with his lazy production. The production was too simple, and is not enough to recall a summer aesthetic and/or sexy vibe. Calvin Harris could do better.",en
769,Young thug is not young anymore,en
770,"Umm I think the director is doing it wrong, that's not what she meant by top down in the whip....",en
771,im speechless imagine the best comment and its urs,en
772,Music by Nice video,en
773,storytelling: sometimes i got angry abouts gods but its okays afterwards sex darlings hahahahah,en
774,Forever contine,en
775,is there a version out there without the rapper afterthought ?,en
776,If I were your professor and you turned this in you would pass my class for sure... Though what is the reason that previously my vision was obscured regarding the subject matter (this film)...,en
777,The music intro sounds like from the CAMEL band,en
778,"When serbs go west-nikola tesla,when albanians go west-dua lipa",en
779,Free THUGGER ,en
780,"No way is the best singers, Calvin Harris and Dua Lipa ",en
781,"Wow. Whole video done in pink, baby blue, and white colors. Hmmm. Dua what are you trying to tell us??? Many of us already know........",en
782,Two collaboration with Rihanna and Dua lipa,en
783,Beauty and the beast,en
784,I thought young thug be in jail?,en
785,Where is Calvin Harris in this,en
786,Free Thug,en
787,"FREE THUG
FREE THUG 
FREE THUG 
FREE THUG",en
788,Bruh free thug,en
789,storytelling: darlings coming afterwards 3 day's what can i do god is god and can't regret her because its a god kill me blessings me its my pleasure hahahahhahah,en
790,Save the Lovebugs ending theme version wonder pets Save the Acting Donkey Hungarian low tone ending Minimentok,en
791,Give Philip honey,en
792,oreo,en
793,"The surname Synott was first found in County Wexford (Irish: Loch Garman), founded by Vikings as Waesfjord, and located in Southeastern Ireland, in the province of Leinster. ""Descended from an honourable stock, of Norman extraction..",en
794,Hottest woman on the planet.,en
795,Somebody Else Calvin Harris,en
796,Somebody Else Calvin Harris,en
797,Can You please talk spanish?,en
798,Free young thug,en
799,Go to calvin harris concert. No dua. No ythug. Just a macbook pro.,en
800,Da baby is funny,en
801,"i thought it was dangdut at first 
lol",en
802,The presence of black elements in her videos feels forced by some lobby …,en
803,O+,pt
804,Dua i love yoU look my profile photo you and TINI TINI TINI!,en
805,When you stop on 49 there is a chicken,en
806,"It's a SHAME that the Funk Wav Vol 2 project has FLOPPED. This song flopped, Stay With Me with Justin, Halsey, and Pharrell flopped. Now the whole album has completely disappeared from the Billboard 200 album charts. A chart that has 200 albums! And the album's only been out for a month or so. Sad. What do you guys think is the reason this project did so poorly?",en
807,My cat vomiting at 3 am be like 1:49,en
808,They took cheap to a whole new level muy barato,en
809,Dua was no match for Thuggers charm,en
810,"Dua lipa an Calvin Harris nice tone music 
But the third one ehhh no comment  ",en
811,Her music is feeling dry now.,en
812,Coleslaw as a side,en
813,Hey beauty Queen  please Pin on my comment ,en
814,IMNO PRODUCER OFFICIAL CHANNEL,en
815,"I eternally love and am grateful for saving ALl The Zul...

-ER Commander Miele",en
816,Dua Lipa Greeks want to know yout location for the fake map..,en
817,"Young Thug is redundant in this music, no talent found",en
818,"Great song, but unfortunately it's not mixed well.",en
819,"For whosoever shall call upon the name of the Lord shall be saved. (Romans 10:13) 
The fool hath said in his heart, There is no God. They are corrupt, they have done abominable works, there is none that doeth good. The LORD looked down from heaven upon the children of men, to see if there were any that did understand, and seek God. They are all gone aside, they are all together become filthy: there is none that doeth good, no, not one. Have all the workers of iniquity no knowledge? who eat up my people as they eat bread, and call not upon the LORD. (Psalms 14:1-4)",en
820,Hello dualipa My name is hetero,en
821,"Young Thug?  Just lost a listener, fan, purchaser and sub.",en
822,"""blahblu  beh gucci flipflop hugh yeah"" it because of ""musicians""\""artist""\""rappers"" like Young Thug todays music unbearably awful",en
823,I’d rather listen to limp bizket.,en
824,Where are you from?,en
825,Joel Karr to be fair I learnt loads,en
826,"I recommend joining a political party as a registered member even donating to be a candidate in an election. Benefits example Australia if someone where to attack me that is five years imprisonment in a correctional facility. With conflict around the world it is wise.
My view is there needs to be legislation change that military police replace all soldiers and instead of a soldier that murders millitary police arrest charge take to court imprison terrorist.",en
827,"bad editing and horrendous direction

dua did post a few teasers and behind ",en
828,Friday 5 August 2022,en
829,Free that nigga Young Thugger,en
830,"I like this song but young thug ruins it for me tbh, i wish it was just dua lipa singing it",en
831,What's with that upside down Honda Civic? That shouldn't be treated that way. -From a car enthusiast who hates mistreating nice old school cars.,en
832,#FreeThug,en
833,The next africa cup of nations will be held in the african country with the highest population of lebanese in africa.,en
834,Never thought she’d make a song I don’t like but this is one I don’t like lol …. The engineers in the studio should’ve said nope,en
835,Please ,en
836,Young Thug honestly ruins it,en
837,Dua Lipa should have done this song without these sissy rappers.,en
838,Thirsty,en
839,Please,en
840,The song would be better without young thug.,en
841,Witchcraft,en
842,"I’m gonna cop some flak but will we move on from smooth female vocalists paired with rappers whinging about stuff?

I notice most of the positive comments below are about Dua Lipa and almost nothing about Young Thug.",en
843,"I think Dua Lipa is a good singer, but she is definitely not pretty",en
844,"sorry but this aint good, it feels recycled from other of Calvin's production",en
845,"Pink, white, and blue=trans",en
846,atrocious nonsensical lyrics and boring instrumental (people objectifying dua in the comments too is just chef's kiss),en
847,Ppl actually listen this rap x pop BS,en
848,Been sitting on it since release. I think it's just boring.,en
849,Stop with the auto tune!!,en
850,i just hate young thugs verse :(,en
851,"Sorry, no.",en
852,How are you gonna ruin a song with a terrible auto tuned rapper,en
853,Ngl.This flopped,en
854,"She sounds the same in all her songs, same notes going flat.  Its boring now.  not even for the car radio. fall asleep.",en
855,wish people would stop ruining songs with horrible trash rap verses,en
856,What the fuck is this song,en
857,This guy fkd up this song,en
858,This flopped badly,en
859,No not good sorry,en
860,Flop,en
861,Young Thug is ruining this song,en
