,comentario,liguagem
292,"I'm 13 and this gives me nostalgia of when I was 7 in the car, coming home from school just hearing this song everyday.",en
293,Calvin Harris is a brilliant DJ. I wish his success.,en
294,Remember my late sister used to like this song it brings back so many memories of her,en
295,What a time to be alive,en
296,"I love the drills
Ellie is wonderful ",en
297,"I remember back in 2018-2019, I used to watch so many star vs the forces of evil and gravity falls comics on youtube and  almost always hearing this song. It was always a vibe reading and listening to this",en
298,This song still slaps on 2s in rocket league 8 years later,en
299,Mi adolescencia ,pt
300,I Finally found the Song now i can die in Peace,en
301,I'll play this with big speakers outside my house after this quarantine is over,en
302,I swear these old music videos never made sense. It’s just vibes. ,en
303,This song hits harder than my dad,en
304,I love it so much it’s my fav song even the sped up,en
305,Everything in the Ellie Goulding's voice is perfect,en
306,6 year's after listening this Masterpiece ,en
307,Calvin Harris is a great musician.,en
308,Can't believe I was only in the fourth grade when this came out now I'm about to be 19 so crazy these were the good days,en
309,"Look at what you've done
Stand still, fallin' away from me
When it takes so long
Fire's out, what do you want to be?",en
310,i remember when i listened this track in a radio to the first time. i fckg loved this song immediately and i was sure that i loved electronic music. im listening today and thinking bout how a simple track changed all my life and my chooses. i really dont think i would be the same without this track,en
311,I remember listening to this song Little Falls time on my old radio in my room when I was grounded for my phone nostalgic,en
312,"i’m in love with this song and the zyzz version. 

this song is just too good.",en
313,"Ellie ""The Hit Machine"" Goulding.
What a Masterpiece!, this song never gets old.",en
314,This song used to play every day at work and it was just good vibes back then.,en
315,omg I love this song so much,en
316,wtf didint know Calvin Harriss made this i always wondered who made it it’s actually a masterpiece,en
317,"nostalgia do tvz, amava o casal na época também aaaa",pt
318,This reminds me of all my depressing summer breaks as a kid,en
319,This is why  old is gold ,en
320,2014 is the best year ever,en
321,2023 still slaps the same,en
322,"Im more of a rock, oldschool hiphop or DnB guy, But Ellie Goulding realy gets me going.

Her voice is just fantastic!",en
323,The Nostalgia ,en
324,I just want those days back!!!,en
325,The memories ,en
326,Is it me but always the old songs are one of the most catchiest songs? Not all but yeah!,en
327,I really didn't thoght this is already 7 years old  Something in this is still fresh to me,en
328,Back when times were good ,en
329,Love the inside source of love.,en
330,Bro the nostalgia is killing me,en
331,"Me in 2014:Vibing to this song

Me in 2021:Crying to this song",en
332,banger still to this day,en
333,The day this video was released was the day my daughter was born. I’ll never forget it. Now we sing to it! This song and “Clover Cage - Learning To Love Myself” are the two songs that helped get rid of my depression. I just want to send love to everyone and I want everyone to know things will get better. We are in this together..I love you ,en
334,🇧🇷CH,en
335,I love this song it really reminds me of my childhood. Btw 8 years and I still don't know why she became blonde in this one frame. 3:32 ,en
336,I love the song,en
337,"the fact that it’s been 5 years is mind blowing

rip 2010s",en
338,i literally hummed this into song search on google after a car passed by playing this  i feel so powerful,en
339,I remember listening to this so much wow yesss,en
340,"Look at what you've done
Stand still, falling away from me
When it takes so long
Fire's out, what do you want to be?",en
341,SO FUCKING GOOD STILL UGH I FORGOT HOW MUCH I LOVE THIS SONG,en
342,Only Magic ,en
343,"Look at what you've done
Stand still, falling away from me
When it takes so long
Fire's out, what do you want to be?",en
344,"Ouça  : SARA AS MINHAS FERIDAS MIRO LIMA, minha música. ",pt
345,The first i heard this song was in the game called LoveBeat.. It's my favorite to play with it... I missed that game️️and this song hit me too..,en
346,This song and “Clover Cage - Make a Difference” are the two songs keeping me sane through these tough times. I just want to send love to everyone and I want everyone to know things will get better. We are in this together..I love you ,en
347,take me back to 2020,en
348,Always the best,en
349,Got tickets to see Calvin tonight here in Argentina 🇦🇷,en
350,The only ones on the outside are my neighbors throwing bricks at my window for how loud I play this song!,en
351,"Is it just me or this song hits different now than before when it just first released?
Fkin gives me goosebumps everytime i hear this song:)",en
352,"I miss this song 

It been a while since i listen to this song",en
353,"Look at what you’ve done
Stand still, fallin’ away from me
When it takes so long
Fire’s out, what do you want to be?",en
354,How much nostalgia for those years ,en
355,NOSTALGIAAAAAA AAAAA I LOVE 2020 SO MUCH ::::( and i really miss my friend passed away :’(,en
356,This is the best song! She is Beautiful,en
357,mi adolescencia ,pt
358,What an Awesome Video from a GREAT AWESOME PRODUCER AND GOT 2 OF THE BEST FEMALE ARTISTS  STARTED RHIANNA AND ELLIE GOULDING 2 OF THE MOST BEAUTIFUL VOICES IN THE INDUSTRY.  !!!!!,en
359,Ellie is so beauty at this video,en
360,"Elli and Calvin, this song means a lot to me.. I cry every time hear it because I listened to this song like over 100 times going to visit my brother in the military in North Carolina and he has a daughter and a wife. This was last year in spring 2015, well yeah he died going to fight in a war and this was me and his favourite song at the time so was love me like you do Elli and Calvin thank you for letting my Brothers memory alive. Thank You",en
361,This song makes me lift 15% more at the gym,en
362,The upbeat and the nostlangia,en
363,Omfg there’s no waaaay this is 7 years old. Bro shit is so nostalgic,en
364,Its 4am and this song just randomly popped in my head,en
365,"good times when standards were high, this song sounded pretty good to me few years back, now it souns better because of the detoriation of music industry... tiktok is one of the reasons",en
366,My soul just returned ,en
367,"amazing song, i remember the first time hearing it as a kid listening to an Ali-A opening song lol",en
368,I can't stop listening this song,en
369,2000s music... It was fun while it lasted.... Goodbye forever now.,en
370,"in 2022 , god i really really love this song",en
371,"8 Years later, If you'r still listening to this song, Your legend",en
372,Wow  it’s been 8 years!!! dang I remember when this came out in elementary for me,en
373,I fell in love with Ellie goulding after watching her in this song ️ later got to know she is with Calvin uncle  ,en
374,nostalgia♡,pt
375,This deserve more views,en
376,Jesus Christ THE NOSTALGIA HIT ME IN THE FACE LIKE A COLD FISH,en
377,I remember hearing this a lot in nearby malls. ,en
378,"Bro, this is my child song, i need to NOSTALGIA",en
379,miss these types of songs,en
380,This song hits me different everytime,en
381,"2023 , but this still hot and very hot , oh god dam i'm addicted to this song",en
382,2023 anyone. Nostalgia really just hits hard,en
383,I can't imagine how nostalgic this will be in 10 years...,en
384,Still my shit ,en
385,Every time this song would hit in Diceys Garden in Dublin everyone would go crazy,en
386,Times flies so fast,en
387,Here because they are soon to release their third collab!!,en
388,Came back cause I had a crush on Ellie Goulding for 3 years,en
389,When I first heard the song it was like heaven ,en
390,When I think or listen to to this song it makes me think of my crush that moved away🥹,en
391,This was my first hearing this man what a banger and no I’m not really young lol,en
392,She is fantastic,en
393,Oh the memories,en
394,Lembrando da época que essa música tava em quase todo mem da SAM,pt
395,Calvin Harris on top!,en
396,I want to thank tiktok for reminding me that this song exists,en
397,"Ellie is lowkey, stillllll, an underrated mother",en
398,I never heard this song before. Pop crave announced a new collaboration and someone in the comments said this and I need your love were their faves. So I came to see what all the fuss was about,en
399,"Ooooh my god 
I listened it with friend 4 years ago)))
Nostalgia",en
400,Duvido Não Ter Um BR Aqui ? É Nós!! 🇧🇷,pt
401,"Look at what you've done

Stand still, fallin' away from me

When it takes so long

Fire's out, what do you want to be?",en
402,I miss the old Calvin Harris ,en
403,I miss every afternoon when we got home from school my brothers and I put on mtv brasil we listened to this hit and others miss this time,en
404,Do songs that remind you of an Ex-Girlfriend ever get easier?,en
405,THE BEST SONG EVER IM HERE 6 YEARS LATER SINCE THE WHOLE PRIMARY CLASS WAS OBSESSED AND ALL TIME FAVOURITE OMG,en
406,Does anyone know when Ellie’s album is out? Calvin is helping production,en
407,"Never ignore a person who loves you, cares for you, misses you. Because one day, you might wake up from your sleep and realize that you lost the moon while counting the stars",en
408,Maybe life back then wasn't so bad,en
409,Tá vindo mais umaaaaa,pt
410,"Still listening to this, bring those summer days back <3",en
411,One of the best. Up there with zedd clarity and david guetta titanium,en
412,"i've search this song for 10 minutes, and im tired and just type ""pop song oah"". you know what? i found this song!",en
413,Ellie Goulding is such a beautiful artist.,en
414,Only me got a wind turbin in my mind when i hear this song????,en
415,She really had the game in a choke hold,en
416,i have FEELINGS for this song and im not even kidding.,en
417,Imo it's still the best track from their collabs,en
418,This is a fkn banger,en
419,This song slaps,en
420,this duo is insane,en
421,Can’t believe it’s being 8 years where did the time all go,en
422,I feel like I want to be with the person I love forever and don't want to leave her,en
423, what a beautiful melody,en
424,this a banger,en
425,I’m back. And this is GREAT,en
426,"Show me hows it feels like now im at the outside 

me: Show me hows it feels like  now im at the inside",en
427,"Guys, I have a feeling that this year (2023) will have a great summer and the feeling of 2016 will come back",en
428,Best music video ever,en
429,I dont need a love i just need comfort to get my life easier,en
430,"No TikTok, No Corona, No Fortnite, No Depression. Just good times.",en
431,"Came back to this, god damn its so good",en
432,Hearing this on my way to middle school in 2015,en
433,Ahh yes. The song I never stopped singing when I was like… 7?,en
434,This gives me memories when the times were easier ,en
435,Calvin Harris and Ellie Golding were perfect together,en
436,I miss this Era,en
437,This song makes me wanna go drive around smoking a joint at night in some cold weather,en
438,These are the types of songs I listen to when the homies aren't around,en
439,Haven’t heard this since it’s been out,en
440,well i came back bc this song played on the radio in my car and i missed it,en
441,"自分用
Look at what you've done
Stand still, falling away from me
When it takes so long",en
442,Coming back because of 'Miracle' and what a journey are their 3 collabs,en
443,This song was my childhood but now I came back <3 ,en
444,"I've listen this song so much when it cames out that i broke the filed, i used to  listened on my mp3 and remember after listened it like 100 times its start to have lags and weird sounds and from nowhere later its stopped forever and didn't allow me to play it anymore.",en
445,loving this muzic still 2022,en
446,"This sounds like "" WELP! LOOK NOW I'M NOT WITH YOU! SEE? I'M O U T S I D E!"" but slowed + reverb version sounds like SO TRAUMAZED lmao idk why",en
447,it is the 2017 and it is still the best song,en
448,"I remember hearing this song in a wolves amv, remembered this from time to time, but I just had to listen to this again, the nostalgia",en
449,Omg so many memories,en
450,All it takes is 8 years and a TikTok trend ,en
451,Woah I forgot this song existed.,en
452,2013-2017 was the best time change my mind,en
453,Omgggggg I’ve been looking for this for years and finally,en
454,This music always reminds me David Laid's poses.,en
455,my favorite song as a 6 year old,en
456,How in the world can 8 years be already passed?,en
457,wish Calvin would make more songs like that,en
458,This song is the king of hardstyle remix songs,en
459,2023 I love this song ,en
460,Dance music forever,en
461,When a song randomly pops into your head so you dedicate an hour to finding it ,en
462,aaah remember this was played in the radio a lot,en
463,"Oh god ,8 years already passed  as it was just yesterday ",en
464,slowed+reverb=another world,en
465,ohh the nostalgia,en
466,The nostalgia... Damn.,en
467,I care about is what I want and need for myself.,en
468,It was so good just as I remember it btw in 2023,en
469,When the things are more simple.. ,en
470,Only people who didn't came from tiktok can like this,en
471,"As much as I don't like Calvin Harris because of how mainstream it is, Outside is just pure memories and such a perfect song",en
472,Ellie was so beautiful with those natural looks. All those surgery ruined her beauty,en
473,"uma melodia de viajar pelos cenários da vida ! ...
https://youtu.be/6CPHGu8BRVU",pt
474,they dont make songs like this anymore,en
475,I hear this track After 4 Years again. Ohhh I got the feelings of these days.....,en
476,Throwback to those Harry Potter/Draco Malfoy TikTok edits back in 2020 <3 I miss that era so much,en
477,the best music ,en
478,My childhood and not from TikTok team please raise hands ,en
479,This is my favorite song in this song was made when I was born and this is my favorite song,en
480,Original song is as good as hardstyle ,en
481," Pure video, No Ads #PureTuber",en
482,"Life is so different now, it almost feels like these times never existed ",en
483,There's a huge nostalgia,en
484,"I haven’t heard this since I got it on my karaoke machine,,,",en
485,"""We all have a little bit of zyzz in us"" ",en
486,even i could do someone better God give me a reason to stick for what I'am right now we can make this over and over again,en
487,"Ellie- ""Now I'm on the outside""

2020-""I don't think so""",en
488,Best gym motivation song,en
489,When Ellie looked her total badass best,en
490,"Calvin, please back to this tunes!",en
491,"Ellie Goulding doesn't get enough attention, she is definitely a legend.. and my God look at those abs",en
492,Damn my favorite  edm guy calving harris the alive king of edm!!!,en
493,Listening all the songs made in 2012-2014 feels so nostagicbut its so fucking good to listening them nowadays,en
494,such a great song ,en
495,Me watching this away from my childhood ending: ,en
496,caralho essa musica não sai dá minha cabeça desde do ano passado ,pt
497,I request to Calvin for making 2nd part of this song.,en
498,"I really wanna focus on the music, but OMG, Ellie's belly is stunning! ",en
499,Guys this is our “back in the day”,en
500,"1 - sweet nothing
2 - we found love
3 - outside",en
501,"Outside
Love this song",en
502,eu era feliz nesses anos,pt
503,“myself was never enough for me.”️,en
504,"Show me what it feels like, Ellie",en
505,Man this song sounds so good with the war thunder/world war planes trailer,en
506,"Look at what you've done
Stand still, falling away from me
When it takes so long
For I desire, what do you want to be?",en
507,Back in the good time,en
508,"I came back for,this woman's voice and dam",en
509,Calvin and Ellie! you should be together forever! <3<3<3,en
510,Everyone's obsessed with the word NOSTALGIA ,en
511,I think the song is referring to ancient Egyptian mythos and the relevance of the ancient culture in today's demographics,en
512,"If you're watching this in 2021, you're not alone.",en
513,David Laid kinda promoted this song back thru his motivational videos. I think I'm on an edited video whenever I hear this song. lmao,en
514,Good classic Banger tune,en
515,Just a good music could of been made yesterday,en
516,I'm thinking of the 2018 gacha singing battles  good times..,en
517,If you’re listening to this masterpiece in 2023 you’re a legend,en
518,"If you’re not here from TikTok I’m proud of you!

( it’s fine if you are though ) :))",en
519,"The Lord is not slack concerning his promise, as some men count slackness; but is longsuffering to us-ward, not willing that any should perish, but that all should come to repentance. (2 Peter 3:9)
Have mercy upon me, O God, according to thy lovingkindness: according unto the multitude of thy tender mercies blot out my transgressions. Wash me throughly from mine iniquity, and cleanse me from my sin. For I acknowledge my transgressions: and my sin is ever before me. Against thee, thee only, have I sinned, and done this evil in thy sight: that thou mightest be justified when thou speakest, and be clear when thou judgest. (Psalms 51:1-4)",en
520,POV: you were listen to this masterpiece before tiktok existed,en
521,The bar has been raised by Ellie and Hobbes!,en
522,"I refuse to believe that today is the
6 year anniversary of this song.

Time flies by way too quickly...",en
523,Miracle is coming !!!,en
524,"But for real, this Man is rippin on this honda",en
525,"if youre listening to this in 2023, your a legend",en
526,„Now I’m on the outside“ hits different when you’re in quarantine. ,en
527,"8 years ago, i think i'm getting old already... ",en
528,Finally after 10 years,en
529,POV: you're angry because some people only know this song through tiktok.,en
530,so fucking good,en
531,who's there to feel nostalgic at the end of 2022 ?,en
532,Where are those time where there were good songs like this it makes me cry thinking about those old times,en
533,Came back to this after that one Tiktok,en
534,Screamed this outside to my neighbour... Surprisingly she sung the lyrics back.,en
535,Well it's not viral because of AUTHENTIC views its viral because this song is so fucking Calvin Harris ,en
536,This song is legend.,en
537,"Me after quarantine:""I'll show you what it feels like now I'm outside""",en
538,The violin beat blew my head off.,en
539,i forgot how much i loved this song aw,en
540,"Cant believe this was made 6 years ago... 
god it’s been so long, I miss the old days ",en
541,god i haven’t heard this song in a long time,en
542,I love how she's not afraid to have a big nose! Fuck society's pressure to be perfect! ,en
543,"This will be the ""Quarantine is over"" anthem ",en
544,"Nostalgia of  2014-2015, i miss thes years so much",en
545,4 years later and im finally watching the video,en
546,I was looking for this song for about 3 years and found it yesterday by accident. Time to double up the views.,en
547,I remember listening to this song from like 2015 this shit still fuckin slaps bro.,en
548,I love this song ~2017.,en
549,"2020?


Nah We Don't Do That Here Instead We Actually Listen To The Song.",en
550,"Come back to this type of music calvin, please",en
551,"“There’s a power in what you do, now every other day Ibrewatshin you OooOooAH” 0:35",en
552,"2014, I thought that was yesterday. Time goes so damn fast !",en
553,"2014 was a great year, missing the golden days 2008-2014",en
554,"If you listened to this song before the hot german boy's tiktok went viral, you're elite ️",en
555,2014 was a great year for music,en
556,"so who else thinks this is kind of the prelude to the story for the ""I Need You Love"" Video? (as in how the two met and got together)",en
557,This being nearly 7 years is horrifying tho,en
558,Bro I still need remember this song even if it was 6 year’s ago,en
559,Only people who didn’t come from tiktok are worthy of liking this video,en
560,Who else is watching this while sitting at home in quarantine?,en
561,2019 algum português vivo ouvindo esta linda música ,pt
562,I met this song before and am I only one who doesn’t haven’t tiktok?,en
563,I hate being a teen I wish I could go back and be a happy little kid again without worrying about money and school,en
564,Listening to this music in quarantine. Fun,en
565,"Kids in 2019: “MOM I DONT WANT TO GO OUTSIDE I WANNA STAY INSIDE AND PLAY”
Kids in 2020-2021: “MOM PLEASE TAKE ME TO THE PARK”",en
566,Calvin Harris looks like a mix of Adam Levine and Ryan Reynolds.,en
567,Q U A L I D A D E  S I N C R O N I A,en
568,"Ellie: ""Now I'm on the outside.""
2020: ""Let's switch that up a bit...""",en
569,You're on the Outside if you don't like Ellie Goulding,en
570,"Ellie : ""Now I'm on the outside""
Me : Hello From The Outside...!!!",en
571,“we did everything right now i’m on the outside.” more like “we did everything wrong now we’re on the inside.”,en
572,SOU O BRASILEIRO QUE VC PROCURA KKKKKKKK QUEM TA ASSISTINDO NESSA PANDEMIA AÍ EM 2020 DA LIKEEEEE TMJ É NOIS🇧🇷🇧🇷🇧🇷,pt
573,Guys am I the only one who gets kinda sad seeing these videos times where so beautiful.,en
574,I came back for that insanely attractive boy who is always on my fyp who makes me wanna move to Germany,en
575,It should be a crime finding this song through Tiktok.,en
576,The fact that people only know this from TikTok makes we want to cry ,en
577,YouTube didn't recommend this. You searched for it. ,en
578,"It is so interesting when you grow up, your brain is stuck with different thoughts and somehow like this your remembering days when your brain was clear without any thoughts, strange right? You somehow remembering your childhood when you where open to learn things, but know you only stuck with thoughts always following your brain as you willing to just stop them one day",en
579,Imagine how many people are listening it today??? After 6 years in 2021 ️,en
580,You're on the Outside if you don't like Calvin Harris,en
581,Let's see how many beautiful people are listening to this masterpiece in 2021.,en
582,"Some ppl here from tik tok, I'm here from my childhood  , and the nostalgia is to MUCH",en
583,Only people who didn't come from tiktok can like this.,en
584,a moment of silence for the people that still haven’t found this song..,en
585,People in 2020 after being quarantined from Coronavirus will be playing this “now I’m the outsideeeeEEeeee!!!”,en
586,"2019? Every time I hear it, I imagine the motorcycle in the air",en
587,POV:school just ended on a friday of 2014 and in the way back home you think of this song and start singing it.,en
588,"bruh, how did I not realize she’s so pretty. wtf.",en
589,YouTube is the closest thing to a time machine-,en
590,Dr. Doofenschmirtz's glow up hits really hard,en
591,Remember when ellie and calvin were a thing?,en
592,Can’t be the only one who came from watching the beautiful German boy on tiktok ,en
593,"Two amazing artists but a disappointing, generic song and mediocre music video. Dont understand how anyone can say this is 'unbeatable' etc but whatever",en
594,Nice song and music and sexy voice too,en
595,"Ellie: "" Now I'm on the outside""

People in lockdown: ""Yeah.....You got that bit wrong there""",en
596, Song of the year,en
597,before Halsey there was ELLIE GOULDING. period,en
598,P.S. who else ships Calvin & Ellie?  #TeamCallie  or  #TeamEllvin  either way I think they'd be good together!,en
599,"its the second ""ooh"" for me",en
600,People who disliked are probably outside now,en
601,Use me as an ‘I’m tired of hearing about the German boy on tiktok’ button,en
602,Who' Still Listening This Song In 2018,en
603,Only people who didn't come from tiktok are worthy of liking this,en
604,Who else thinks of random songs during post nut clarity?,en
605,"everyone: tiktok
me: here cuz someone post an edits w this song ️️",en
606,I pray who ever reads this becomes successful.,en
607,"So many people are commenting""I came here because of that tik tok"" while I'm just feeling depressed because I don't have anything to do
 ️️",en
608,"Ellie Goulding: Now I'm on the Outside

Corona:*I'm about to end this woman's whole career*",en
609,I listen this On my birthday ,en
610,It's so annoying that the comment section of LITERALLY EVERY SONG turned in to: wHo Is WaTcHiNg ThIs WhIe QuArAnTiNe.,en
611,"""You either die a smart fella or live long enough to become a fart smella.""
- Dr. Doofenshmirtz",en
612,"Lil boys: Tik tok song
Men/legends: radio on parents car",en
613,I strongly believe that this should be Outside-Elli Goulding ft. Calvin Harris,en
614,Cade os BR ???,pt
615,someone watching on 2019? :3cause I like this song!!!!!!,en
616,"My love calvin Harris , the one Dj",en
617,"Eu sei que vc veio procurar um comentário br , então vc já encontrou",pt
618,"Nobody:
Me: one word for perfect music ..whispers “Calvin Harris”",en
619,It’s 2019 now and i got an Avicii ad named “Heaven” and now I’m a bit sad.,en
620,"Now this what i looking for, its about to tiktok but",en
621,Cadê os brasileiros???,pt
622,Anyone still listening to this song?,en
623,Best song still hear 26/3/2023,en
624,"When Corona ends

Me: NOW I'M ON THE OUTSIDE",en
625,I blinked and this song turned 8 years old,en
626,N O S T A L G I A,pt
627,Who's still listening in 2024,en
628,"As for me, this song reminds me of greatests songs of Beny Benassi (make me feel especially)",en
629,They don’t make music like this anymore,en
630,Who just randomly searches this song up??,en
631,she’s good,en
632,"Be safe,stay indoors Corona outside.",en
