,comentario,liguagem
633,"I'm an easy girl: 
Saw a dirtbike in the thumbnail,
Clicked the video ",en
634,"Auto play with 144p, 2020 here",en
635,every time I hear this song i think of travelling because i heard this on Scoot,en
636,"Calvin Harris
I love the music of Ellie Goulding and you just make a very nice content so keep it up  I really hope you come to my latest song by Ellie Goulding and I would be interested in your opinion how you think about it ",en
637,All these people who say “you can’t like this if you came from Tik tok” well guess what! I CAME FROM INSTAGRAM REELS TAKE THAT.,en
638,"Wow, this is 8 years old already?",en
639,Who’s here because of the beautiful blonde boy on ur fyp,en
640,May 2023. Still on top ,en
641,"Alan Walker ""Where are you now?? Ellie Goulding ""Now I'm on the outside"" XD coincidencia :v",en
642,I find it funny that the lyrics in the description are wrong.,en
643,2023 cade os relíquias?,pt
644,"This is my favourite song 
Any one in august 2019??",en
645,alguem do brasil em 2019?,pt
646,I  can  relate  to your  song in .y life,en
647,these lyrics arnt matching in the description,en
648,Who’s here from the blond German boy ,en
649,This song very famous in 2015....during I worked at clubbin,en
650,This song gym community took over,en
651,"Use me as the ""i am tired of hearing about corona"" button",en
652,"everyone: tEeKToCk rUynE d diS sOnGg


me who doesn't have tiktok: another thing added to my idgaf list",en
653,who more in 2023 the nostalgia is always nice remember this song,en
654,"50% of the comments section: ""me here after that german guy on Tik tok""
Me af: not knowing who the heck ""the German guy "" is",en
655,Uhm is it just me or are the lyrics in the description for the wrong song..??,en
656,I came back and god the nostalgıd,en
657,"Ellie Goulding: Now I'm on the outside
Covid-19: Uno reverse",en
658,"Love this song  
And today 2023:7:1",en
659,"I love it ,can I use this song for my vlog?? Permission to use ",en
660,I think they got the lyrics wrong (in the description box),en
661,Still listening to this damn,en
662,Press read more,en
663,"Those lyrics in the description are very, very wrong.",en
664,who came here for the song after hearing it in your dreams?,en
665,daymmm the nostalgia,en
666,Lol they put wrong lyrics in the description. Looooool,en
667,We know you’ve been here more than once so welcome back we’ve been expecting you ,en
668,Generic beat? Check. Generic lyrics? Check. Generic white guy and white girl fighting in a video? Check.,en
669,OMG how time flew away,en
670,2 words: john cena,en
671,Every gym rat knows this music,en
672,"Some music: A

People in the comments: CORONAVIRUS ",en
673,we are in that moment,en
674,The hardstyle version brought me here!!,en
675,meo tema ctm,pt
676,"Dogs: woof woof
Cats: meow meow
Cows: moooo
Idiots: (X) yEarS laTer... iF yoU're waTchiNg yOu're a lEgenD",en
677,Just an English comment passing through!,en
678,Who else didn't came because of TikTok is a true legend,en
679,"after hearing miracle, i came back",en
680,Come back after 1 yr  from India,en
681,nostalgic,pt
682,Number 3 collab here we come!!!!,en
683,Now im on the outside  and I lit water not out me out ,en
684,solo recuerdo está frase: shut up when i talking to you!!!!!!!!,en
685,who after ellie and calvin announced their 3rd collab? ;),en
686,Omg its the 8th year of this song,en
687,whatever sound I get to hear it's not my style even if I could I would not,en
688,WHY DOES SHE SING SO GOOD IM SO JELLY MEANING FOR IT? HERES THE MEANING ( jealous) I CAME UP WITH THE WORD JELLY FOR ANOTHER WAY TO SAY SHORT,en
689,Heard a remix and had to hear the original,en
690,Who still listening this in 2023?,en
691,This is for you honey,en
692,"honestly... this one wasn't on your recommendation, you searched for it, right???",en
693,"This sounds a little like ""Let me love you"" by Ne-Yo",en
694,My training music,en
695,Se louco essa loira é muito gata ,pt
696,olhei e sai correndo amigos,pt
697,The credit goes to Martin Garrix in Tomorrow Land,en
698,nostalgia.,pt
699,"The actual melody and chorus  are like 1 minute  long, but the song lasts 3:45 minutes hahha. It's just a giant loop",en
700,This Song 8 Years ago ,en
701,Recently found this while a david laid edit in tiktok with this as bgm,en
702,This is the best for gym,en
703,2023 still telling them,en
704,I’ve had enough of hearing who’s fault it is.,en
705,Isss ,en
706,Te amo outside,pt
707,Comeback please !! 2023,en
708,Legends are those ::: watching videos and typing the comment   from Earth,en
709,"Ellie Goulding, congrulations!",en
710,"The couple: starts arguing
The beat: drops",en
711,I came back right now! 2023 baby!,en
712,Kiss in 1000 different places so that there is nowhere to go after leaving,en
713,Only quality people will hear this song in 2023,en
714,This made me to play arms warrior,en
715,s tier gym music,en
716,the definition of nostalgia... 2014 playing cs 1.6/source/go with friends just having fun,en
717,"2023 AnyOne 
I commented for 2035. When children watch this song 12 years from today, they will realize how popular this song was / still is.",en
718,Please i need back 2014 ,en
719,How the hell they make this songs trendy ,en
720,The kids that listened to this are not legends.,en
721,when everything is done we will not communicate anymore,en
722,missing too much,en
723,This song is so David laid creatine tren ,en
724,Who listen to this in 2023 ,en
725,2023 like the music,en
726,"Thank you, si vi hehe prometo não falhar!",pt
727,Coming after watching my very shorts video where i used this music,en
728,The clash of clans tutorials with this song playing in the background ,en
729,Every time I hear this song I think of naruto for some reason,en
730,"8 years ago WE Played Games. 8 years later we go to the gym, and improve ourselves",en
731,2:38 Was this what I think it is?,en
732,Who cam back after “miracle”,en
733,Me and my fucking stupid feelings!,en
734,De nostalgia ninguna cero,pt
735,I came back in 8yrs,en
736,She's really beautiful in this video,en
737,2023 and im stick back catch me later in 2033,en
738,"come inside then,it's pouring outside. LOLS",en
739,There's a power in,en
740,"WE GO JIM, WE GO JIM NOW",en
741,"Not really nostalgic to me, sounds like a song I hear today tbh. But I think this song defintely sounds pretty and i like the melody and singing.",en
742,David Laid’s theme song ,en
743,Who listening in 2022 ️,en
744,"2023, 9 years old 🥹🥹🥹",en
745,"Me, 11 years old playing minecrzft on IYC with this music on Block party ",en
746,Who's listing at 2023?,en
747,8 years ago already,en
748,Which KSHMR does this sound like?,en
749,Here after Draco malfoy edit tbh ️,en
750,Weighting for  my permanent  house,en
751,For number 2 and 3 there is only like 5 of them each lol,en
752,"Who is singing the song, Harris or Goulding? Why is the song billed as a song by Harris featuring Goulding? Isn't it the other way!",en
753,Know the white kotos will take them away like they did good rides,en
754,Her waist is thinner than my biceps ,en
755,I all I remember when listening to this is max verstappen taking on everyone and winning,en
756,I'm only here for the sick dirtbike rollers.,en
757,In my life its been  a battle,en
758,"So... this is your boyfriend Ellie? 
Calvin... was he the creator for Calvin Klein brand? 

LOLS & LOLS again",en
759,David laid theme song brought me back,en
760,Gym Bros assemble ,en
761,I think of her,en
762,Give me the reason.,en
763,I know I have heard this song but...... Where did I hear??? Cartoon Network??? MTV???,en
764,I'm leaving my self here by my comments ,en
765,BRO HOW IS THIS AFTER MY ----- ---,en
766,My mind: David Laid posings,en
767,2:41 is the emote from Fortnite,en
768,Then knowing all my old friends are dead that all of them are dead,en
769,Elementary days,en
770,E a minha querida mina que eu não curti foi embora falando mal de mi e não curti muito muito tempo sozinho acho que sou gay de mi mesmo,pt
771,This song man to much,en
772,Fiquei malzaoporsabe que a mina que eu curtia mi olhou e dissi ele é doido mais continua a mi ver com ódio,pt
773,"Hood up, wait a minute. Is that a donk @0:14",en
774,"That looked alot like my trailer park, except mine is shitty, overrun with drugs, and has so many State violations it will soon be condemned.
America today is so far from yesterday.",en
775,Cds1️,en
776,Who else came here from a sonic x mlp tribute video in 2017,en
777,This sounds like a kshmr song,en
778,Who's listening in 2023?,en
779,Where are my gym bros at?,en
780,So this is the song lhugeny made a parody of in his Cuphead musical,en
781,instagram of the girls?,en
782,I came from a spongebob episode,en
783,David laid transformation,en
784,Symbolism is Capricorn,en
785,David Laid Theme,en
786,i love you free in the live eille,en
787,No amigo que hacía Messi ahí,pt
788,8y was enough to remember,en
789,"You tube is a literal time machine.

Convince me otherwise",en
790,Who is here in 2023 ,en
791,2023 anyone here ??,en
792,Who’s listening in DEC 2022? Almost 2023 ,en
793,You must kiss mother and sister only can be a good man.,en
794,Why’s everyone starting to comment now all of the sudden,en
795,Who in 2023?,en
796,Who is here in 2023?,en
797,And know longer living and dead that they pass on and that they are deceased,en
798,i went to trivel from you and meeting you eille,en
799,Hah! found another one,en
800,2:40 She emoting?,en
801,we did everything wright i do something rong,en
802,we got more responsibility than we have here the public market could not make any longer just to your favorite will exist,en
803,Anyone here in 2023?,en
804,Tq my family ok ,en
805,Obrigado Francisco Luiz Teixeirabota aí música brasileira do YouTube canal que eu gosto amo muito bota aí música brasileira Cristiano Neves circunstância Lindomar Castilho,pt
806,Meanwhile Africa just wants to get out of misery and hunger...,en
807,Who's here from 2023,en
808,"song is legendary, mv is not",en
809,I didn't know how well her cuirfbses did on video now let seen the way she can let me Carrie for her whole way had Carrie me to thank her full as full she goten real looking good,en
810,It's 2023,en
811,"December, 2022. Anybody here ???",en
812,This music is owned by gymrats,en
813,Anyone from 2023?,en
814,Poético,pt
815,"January 21, 2023..attendance",en
816,Roblox deadzone redux brought me here,en
817,where is the song,en
818,Pink toes- thaq,en
819,Who here in 2023,en
820,Collecting gymbros,en
821,it’s messi,en
822,"I do love women that have Moselle of that old days like to get ruff hard core and that has a wild side that she and 100,% women materials and love to get ruff play game and on line and metal hade and all cozie of music and be her self",en
823,I wait to 4 days for reason,en
824,January 10th 2023,en
825,sorry im too late,en
826,"Dariacore brought me here

Jane did it better",en
827,Frnsico Luiz Teixeira alto Longá Piauí,pt
828,Hello Princess.,en
829,Watch been tooth painted,en
830,zyzz version way better,en
831,Since to come about in thankness I'm saved to found to you that it taking my time to use it for once it comes from me to thank you with that it not my only first here it aways waited for me to stay with it now my time fitten was thier to how it been my able when I can't realized from it all of the each resonen able smooth in thinking for the waves of talk reaching my soul tells thier that I came to know the rest has to get back in me or tell to stop going out to you cause I'm doing it for the best I haven to reach,en
832,I think I think I did something bad is about you,en
833,yeat did it better,en
