,comentario,liguagem
235,"Ed inspired me to go all in  with my music . He was just like me , an artist trying to get heard .And now he's on top. It's happening for me , and I'm not stopping when it does !",en
236,I was there when this song was first time live,en
237,I’ll never be able to listen to an Ed Sheehan song the same again.,en
238,Can't believe I'm only finding out about this song now wth! This shit is FIREEEE,en
239,What a fking masterpiece.,en
240,I*M an old man .But love this song.,en
241,Ever had any problems. I'm 25 and a recovering alcoholic after my dad passed when I was 17 this song is so relatable about of people I met when I was drunk and about of time I sat on the sofa with massive eyes(cause I needed to try keep them open) it's amazing and where he looks at himself and he deflates I sometime dream. Not the extract situation but your dreaming I belive of you think you deserve to be but you know you cannot be that person so if just disappears one way or another.,en
242,"Everyone is talking about how he is flying like a royale character and him being in his emo phase but no ones talking about the people just flying and falling everywhere in the background, what is going on x.x",en
243,i love this song,en
244,Love it,en
245,Bad habits and blinding lights help you stop drugs and things like that there also my fav songs,en
246,The day this video was released was the day my daughter was born. I’ll never forget it. Now we sing to it! This song and “Clover Cage - Learning To Love Myself” are the two songs keeping me sane through these tough times. I just want to send love to everyone and I want everyone to know things will get better. We are in this together..I love you ,en
247,"""and i know i lose control of the things that i sayy""  - this song 100% describes my alcoholism",en
248,"How many people should we hire as extras in the music video?
Ed: Yes",en
249,The day this video was released was the day my daughter was born. I’ll never forget it. Now we sing to it! This song and “Clover Cage - Ego Dissolution” are the two songs keeping me sane through these tough times. I just want to send love to everyone and I want everyone to know things will get better. We are in this together..I love you ,en
250,Amazing song keep up the good work ,en
251,I love this song sssssssoooooo much it is so catchy,en
252,I love you and your songs keep it up you're awesome ,en
253,Bro Ed Sheeran is so talented with his music  and he has the best voice ever,en
254,This is how I think my friends will act like at our graduation this year.,en
255,Love this 2023 ,en
256,I can't believe Ed Sheeran did this!! What a change for him? I'm shocked but I bet he had fun doing this,en
257,1 year. Still vibing.,en
258,The day this video was released was the day my daughter was born. I’ll never forget it. Now we sing to it! This song and “Clover Cage - Learning To Love Myself” are the two songs that helped get rid of my depression. I just want to send love to everyone and I want everyone to know things will get better. We are in this together..I love you ,en
259,"Though the song's ""Bad habits"" 

He's the most well-behaved throughout the video",en
260,I love this music,en
261,LOVE   This music.,en
262,This is so not what he normally does but I enjoy it,en
263,The day this video was released was the day my daughter was born. I’ll never forget it. Now we sing to it! This song and “Clover Cage - Learning To Love Myself” are the two songs that helped get rid of my depression. I just want to send love to everyone and I want everyone to know things will get better. We are in this together..I love you ️,en
264,"Producer: How many vampires do you want? 
Ed: Yes",en
265,"This is literally if my dreams were put into a video, some of it makes zero sense but it’s all me in the end",en
266,Really love this song,en
267,Very good with ed Sherman and nice dancing with mixing,en
268,My bad habitats leed to This song ,en
269,Ed Shareen is magician: Everytime : He make us fall in love with him,en
270,"Ed Sheeran is fucking adorable, even as vampire.",en
271,"Well, shit. This video unlocked a new kink for me, Vampire Ed Sheeran ",en
272,I love this song,en
273,Ok the first time I heard this song I literally thought Niall Horan sang the first verse. It sounds so much like him,en
274,thank you for the music Long time fan really enjoy the songs and words each song very good from USA,en
275,I love your songs your my favorite singer.  ,en
276,This is one of the best songs! 1:56,en
277,I never thought i'd see him like this.I was shook lol.,en
278,Okay now I want Brendon and the rest of FOB come back and make a whole album with this thing in somehow. Idk how but I'd love it,en
279,They don't play music like this anymore. I miss the 2020s,en
280,"Everyone around me says they don't like this song because it's not Ed - his style. I love it because THAT is exactly who he is. But only a few people can see it.
And love it still in 2023 ",en
281,I love this song from 2022.. I love you Edward Sheeran~,en
282,Ed Sheeran a modern day musique magician  ,en
283,Ed is a vampire slash zombie that you cannot get rid of. ,en
284,Ed Sheeran's amazing,en
285,Thank you Ed Sheeran for all your music that you made. You are one of my most favourite music interpretes.,en
286,Ed dancing awwwww never get old....like it ..flying everyday everytime his dudes fashionista Soo cool toooo...just need their help to smasshhhh trashh balooonnn arround mee..thx youuu before Mr Ed,en
287,I loved it when he put more effort into the music itself rather than the video.,en
288,The vampire lady with the eye patch was awesome!,en
289,i  this song,en
290,I love ed Sheeran and bad habits,en
291,When you can write your talent can be endless. Gaga got tired of writing songs for people and having them saying no so she started singing her own music to prove that it's a good song. Ed can write music in his sleep. He's awesome ,en
292,"At the end when the Sunlight Comes
Every Other Vampires: We'll Vanish now or Die
But Ed: I'm Just Gonna Wash and Clean my Face and play my guitar",en
293,The little bits I'd heard where making me fear I wouldn't like the song. After hearing the whole thing I actually think it's a banger!!,en
294,I love you ED sheeran,en
295,"ED sheeran go in soo hard on this right here, straight up BANGER! He aint like all them trappers and oppas who just be usin dat HIPVIEWS      to get they hits up to go HAM... SMH seem like anyone can glow up these days... SMH",en
296, Absolutly in love with the video AND the song,en
297,God damn this is catchy,en
298,The day this video was released was the day my daughter was born. I’ll never forget it. Now we sing to it! This song and “Clover Cage - Learning To Love Myself” are the two songs that helped get rid of my depression. I just want to send love to everyone and I want everyone to know things will get better. We are in this together..I love you ️,en
299,Omg love this song I love and I mean love this song the beats are just ughh lovely,en
300,"The family loves you, Brother Ed.",en
301,"Every time you come around, you know I can't say no

僕が断れないのを知ってていつも来ているんだろう？



Every time the sun goes down, I let you take control",en
302,The day this video was released was the day my daughter was born. I’ll never forget it. Now we sing to it! This song and “Clover Cage - Learning To Love Myself” are the two songs that helped get rid of my depression. I just want to send love to everyone and I want everyone to know things will get better. We are in this together..I love you ,en
303,"ed: when your legs don't work like they used to before 
also ed: flies",en
304,Ed went from not even acting in his videos to acting as a vampire...,en
305,"Surpisingly unexpected video... Beautiful (and deep) song, beautiful video",en
306,Vampire Ed sheeran is a viiibe ,en
307,The sunrise scene... It was awesome,en
308,I love the idea of the gothic vampire.this is my favourite song,en
309,I LOST IT WHEN HE STARTED TO FLY,en
310,THIS IS FIRE,en
311,I love this video I can't stop watching it,en
312,"Producers: what about gangster or- 
Ed: I want to be a vampire",en
313,I amazed by this song.,en
314,This is different from shivers just masterful skillset  truly amazing tbh,en
315,I love it ,en
316,I love this ,en
317,If this was not his channel  I will never realised that the singer is Ed Sheeran,en
318,Wait what? Wasn't this made with Bring me the horizon? That version was just,en
319,As a ginger this is my go to Halloween outfit till I die now haha,en
320,This song is fantasy ,en
321,"Bad Habits Ed Sheeran
Shivers Ed Sheeran
Visiting Hours Ed Sheeran
Afterglow Ed Sheeran",en
322,don’t worry he’s just going through his twilight phase,en
323,I love this song so much I’m adicted,en
324,Love the scene where the balloons breaks and they both laugh2:01,en
325,You are aSo talented….. and this song … tells I think what’s going with you and I do think you understand how this can turn on you,en
326,Love it and the  Pink suit!!,en
327,I love you Ed Sheeran,en
328,Lmao i cant get over how hes flying everywhere,en
329,this song is fire,en
330,Love ed wherein he my second fave singer!! This tune a banger!!!!,en
331,i looooopve ed sheeran  from lebanon,en
332,"1:37: If he use this as the cover of his album, it'd be badass",en
333,"its ok guys, he’s just going through his emo phase.",en
334,"I can feel deep sadness.....like he wants to escape his bad habits  but he is saying I can't... but I really want...

Especially the scene in which  the red He demolishes his real one.... he can't win the red one...",en
335,I’m so happy  thanks  so very kind to the parents of this man  for being a part in my journey,en
336,Man's really gifted,en
337,Ed Sheeran Is a legend his songs are amazing whoever is watching this they are the amazing,en
338,I never thought Ed Sheeran's alter ego is Joker.,en
339,"This slaps
Absolute banger",en
340,Soo addictive!,en
341,The day this video was released was the day my daughter was born. I’ll never forget it. Now we sing to it! This song and “Clover Cage - Learning To Love Myself” are the two songs that helped get rid of my depression. I just want to send love to everyone and I want everyone to know things will get better. We are in this together..I love you ,en
342,Musical mastermind,pt
343,This looks like a movie where a supervillain and his army of vampires turns every one to ragdolls,en
344,I would die for this song,en
345,The day this video was released was the day my daughter was born. I’ll never forget it. Now we sing to it! This song and “Clover Cage - Learning To Love Myself” are the two songs that helped get rid of my depression. I just want to send love to everyone and I want everyone to know things will get better. We are in this together..I love you ,en
346,Ed Sheeran I love your videos,en
347,Ed Sheeran as a vampire is the best thing i ever sing,en
348,Gonna leave this comment here till this song is a Nostalgic vibe in a few years,en
349,And my ‘bad habits’ lead to you Ed ,en
350,This is my favourite song ever,en
351,"If there was supposed to be a story here, it went over my head.",en
352,"You know, I  was lucky to t watched the demo o this song, probably the reason why I liked it so much
This must be the 150th time I have seen it",en
353,Top de mais,pt
