,comentario,liguagem
604,PNAU deserves tons of credit for this masterpiece ️.,en
605,Nice but the original’s still better,en
606,"cold cold heart not ""coco heart"" my childhood is a lie",en
607,"Absolutely beautiful visuals and… Vocals, sheesh.

Madonna and Cher vibes- Dua and Elton, CHEERS!",en
608,the best part 2:37,en
609,TBH I could never imagined Elton singing this kind of music and nailing it.,en
610,Te amo,pt
611,Does anyone knows name of soundtrack I remember that this is very old soundtrack but cannot remember the name.,en
612,Reinvents himself all the time. Fabulous artist!!,en
613,He's still legend. thats why everyone make collabs with him,en
614,"pls show me some songs like this. It is for lounge, right?",en
615,Dua Lips singing 'I'm not the man they think I am at home'...,en
616,My friend passed away at age 27 a few months ago and he loved Elton John but never got to hear this song… I’m sure he would be happy to hear him come out of retirement for this… RIP buddy,en
617,Cold cold heart,en
618,416 Mio. klicks!!! What a tune,en
619,"dude how is this elton john man? isn't he like 74? wow, truly a timeless musician! so good!",en
620,That,en
621,"I think it would be better to refer to him as ""Sir Elton John"".",en
622,Sensacional! Só fico imaginando...estavam no planeta terra quando criaram este vídeo clip ,pt
623,Cebu Pacific's frequent passengers will recognize this song.,en
624,"Can anyone talk about the excellent mix PNAU brought this 2021, obsessed with this song ",en
625,Those strange dolls dancing around got me scared!,en
626,"""Dad why is my sister's name Rose?""

""Because your mother loves roses""",en
627,"Moving property to a better place, this song will remind of better times ahead.",en
628,If the Dancing Baby meme from the 90s featured on Ally McBeal was a song.,en
629,My mom's phone ringtone:,en
630,"Random girl i had a dream of being with my crush


My dreams:",en
631,Why are there no comments on the completely disturbing video?? ,en
632,Oi sol em relação ao que você disse das críticas pra mim não existem porque todos vêm minha devoção e admiração pelo canal e também a você então ninguém mexe com isso ,pt
633,"My father did not tell me how to live.
He lived,an
d let me watch him do it.<️",en
634,Yellow snow... Yellow summer... Yellow bird (Stuttgart. Porsche)...,en
635,"Why can't he pronounce the words to his own song?
It sounded like he was singing ""Cocoa Han, ha down  bayou"" I thought Coco Han was a person when I first heard this on the radio.",en
636,mano pq tem tanto br comentando kkk? Nao to reclamando claro só curioso,pt
637,I’m stoned out of my mind watching this,en
638,The video clip though,en
639,Is this have almost 2 years,en
640,The rocket man blessed us again,en
641,This is my brother's favorite music video,en
642,Such a vibe anybody 2023 still listening,en
643,Arkansas u and your people have definitely  made a cold heart Arkansas u and your wonderful people,en
644,I feel like I should have smoked something to watch this..,en
645,I am not the man they think I am at home,en
646,"the credits really ruin the loop experience, it is just silence",en
647,"sir! your best friend always says hi to me :)! he always makes my day better! i think hes yout soul mate, love. an old
friend who always used to look up at billboards! #lionking",en
648,"Esse povo fica oferecendo dinheiro fácil, isso é golpe.pq o YouTube não bloqueia esses anúncios",pt
649,Who is the 4 dancing together?,en
650,5 to 8 topics a day.  5 to 8 hours per topic.  1 or 2 topics at a time.  GET READY FOR THE EVOLUTION,en
651,This is more acceptable than the I’m blue and Elton John remix don’t remember the exact name but still. Axel frog was annoying and this is better,en
652,Great duo but the video is weird!,en
653,The design is very Cebu Pacific ,en
654,BRO WHATS COLD HEART? THIS IS ROCKET MAN AKA A MASTERPIECE UNLIKE THE TRASHY START SONG.,en
655,This is what I should have said,en
656,The video is really different,en
657,get the fire truck ,en
658,Elton John has made this much better,en
659,cold heart in `d space,en
660,"The song Is good amazing, but the...",en
661,What kind of music is this?,en
662,I love this song but the music video is kinda weird ️,en
663,This Remix sounds more amazing than the original score ~ Sorry Elton John ️,en
664,Came here because of the Cebu Pacific airlines ,en
665,Just Dance 2023 Edition,en
666,It's makes me sad bad about  things,en
667,"YT, stop giving me Spanish stuff, I know only a few words thanks to my mom for studying it.",en
668,I can’t even find the original,en
669,I’m sorry whoever had stop motion this,en
670,Is it just me or does this video look like Kim Jung Un's family reunion?,en
671,Road trip song,en
672,did those clay figure things just not look right to anyone else ?,en
673,I dont know why goodlord? I cant sleep the are always in my mind...,en
674,"So Rocket Man says he's Retiring and his farewell Concerts bring tears to Millions , well Elton i have one big request to make to put U and the Beautiful Dua on a Interstellar Space Ship of Love ️  that Requires Rocket Man to add his Magic Touches and Drive the Warp Drive . MICK JAGGER IS",en
675, your  song  called  Butter  cup  is  verry  funny   I   cant   stop  Laghing️,en
676,on the radio everyday at work. hate it,en
677,Am I the only one who thought it was Cher and not Elton John? Lol,en
678,Tá aqui seu comentário brasileiro,pt
679,"Yes it's good very nice 
O",en
680,03:29 I thought my cat was meowing,en
681,Cebu Pacific is waving ,en
682,While a group of young people is in the middle of Ouija game,en
683,"This is sssshhhooottt,no country Western singersss area are looking at this for a while",en
684,Who's still here?,en
685,Is this a interpretation of rocket man,en
686,nothing like the Br It Ney Spe  aRs collab,en
687,Thanks.,en
688,boracay theme,en
689,Good Song. Weird Music Video,en
690,The song is beautiful however the animation is weird,en
691,Hard to find more then 10 English comments in here,en
692,"these puppets look scary! ,good song tho",en
693,What is name of similar house song with same bassguitar melody?,en
694,The animations somehow creep me,en
695,Did they run out of budget before the video?  Sheesh...,en
696,Cebu Pacific National Anthem,en
697,"My favourite song is over 
But",en
698,I still remember dua lipa got caught lip sinking,en
699,All music vids has all seeing eye,en
700,thanks for scarring me elton,en
701,No one asked or told me what was going on because I didn't do that how sad,en
702,coco heart,en
703,Are we going to ignore the fact that the 2nd dancing character from the left in the first seconds looks like Donald Trump? hahahaha,en
704,These weird furry creatures are the most fugly things I've ever seen and I just love them,en
705,wow..super kewl cartoon and no-no-no...nono...bfd.,en
706,"At 1:35 it sounds like a misheard lyric , I farted but I kept it in  lol",en
707,We all have a story to tell yeah pretty little people pretty little houses I like to smash them all so they know what fear is like the writing on the wall really pissed me off but that's life,en
708,aw this video should of showed dua lipa showing part of her skinny stomach,en
709,What the hell did I just watch?,en
710,CEBU PACIFIC AIRLINES MUSIC 🇵🇭🇵🇭🇵🇭🇵🇭🇵🇭🇵🇭🇵🇭🇵🇭,en
711,What nationallity is Dua Lipa ?,en
712,Who else has nightmares after watching this??,en
713,Coco arde!,pt
714,I heard at Airbus A320 pal,en
715,Can bring a friend and өмнө 알았어 그럼 내가 다,en
716,"The flowers with eyes on the center are horrible and disgusting though I liked the song ,can't stop listening to it",en
717,Still prefer the original...,en
718,"I can't stand Elton John, but love this song....(I still can't stand Elton John)",en
719,Nightmare fuel,en
720,Saturday April 29th 2023 evening 616pm,en
721,I'm half American,en
722,Mick Jagger is on board and Its gonna  be one big Party that surely Rocket Man can not advoid love and kisses ️  Best Wishes for Easter . May u and ur Partner have a Wonderous time the humble Poet Peter John Ptak 08/04/2023 ,en
723,I lu v u more than numbers,en
724,Why is this very weird,en
725,God's way is the correct way,en
726,treat people the way u want to be treated arkansas,en
727,NOO!just passing through?,en
728,Men what on earth is this mv?,en
729,"It's a catchy tune, great vocals, and it's cool that he pieced together parts of his other songs... but lyrically, there isn't a whole lot going on, the picture it paints is vague and incomplete at best. Not one of his better works in my opinion. Like a lot of modern music, it's catchy but meaningless.",en
730,Original a million times better,en
731,I love the song but the animation is weird from me,en
732,"Hot, hot, hot mix of a tune.... but the ""official"" video suks.... big time.",en
733,Its just me or this visual characters are furry stereotype?,en
734,every single one like cartoon,en
735,This video is scaring :(,en
736,Is so cool  day  what is happening he's  voaci  ,en
737,who are those four nice creatures? Do they have names?,en
738,does Anyone laf this,en
739,"November the5 do wee celebrate that or just get on with it,I used. To love that untill ma dog started to lose fur",en
740,goofy ahhh stop motion people,en
741,"Awesome song, but not the video...",en
742,too bassy.  overwhelms a lot of what they're trying to do in the recording,en
743,enjoy your lunch freaks,en
744,Luis Alberto pozada,pt
745,he hates the english royals,en
746,Overtime happy easter,en
747,Make yellow snow???,en
748,Elton John scares me,en
749,Welcome to free therapy,en
750,I'm always honezt,en
751,"For an over the top comment, keep reading...",en
752,Does this video creep anyone else out,en
753,Family first,en
754,Why ruin a perfectly good pop song from 40+ years ago.,en
755,They are creepy,en
756,When he said,en
757,O,pt
758,Beside hiway 1023,en
759,"is this supposed to be the ""oldgays"" from tiktok?",en
760,"Harndrang Salzgitter

Crafts of History....",en
761,Co co ja,pt
762,Oh no no no no.....,pt
763,Ecoin Finance wallet progress 89%,en
764,Ed shirian,en
765,"forgiveness to all, from meredith",en
766,Good song but I don't like the video.,en
767,Guys I’m in danger please please come see me,en
768,É UMA VERSÃO FALSA!,pt
769,"ISUS ESTE DOMNUL AMIN AMOS 4:13. IOAN 16:13 PEPE ATUNCI TEAI GÎNDIT LA VERSURILE DIN CÎNTAREA CE O CÎNȚI TU : HAI SPUNEMI CINE CINE TE IUBEȘTE : TEAI GÎNDIT LA OANA ZĂVOREANU  

SÎNTEȚI NIȘTE VITEJI : MARE GRIJE LA FORME ȘI LUCRURI ÎN CARE ALȚII : ATRAGE ,CAUTĂ : CA SĂ RUPĂ ÎNCREDEREA , CONFIANȚA PRIN LUCRURILE ȘI SUBTILITĂȚILE , CARE I_SE OFERĂ , : SAU CONSTRÎNS SĂ TREACĂ,  PLĂCERI :PREGĂTITE : CU ALTE SCOPURI :??? ?ȘI ALTELE , :?? ",en
770,Great job on the remix ..but a very creepy and horrible video.,en
771,This wonderful song from Elton John destroyed ....,en
772,Música boa mas o clipe horrível,pt
773,What are these creepy puppets?,en
774,"the rocketman part makes me want to jam pencils in my ears. when it comes on, i literally have to sing terribly over it just to cover it up. what trash.",en
775,"The chorus is good but the rest just sounds like generic modern radio pop. Meh, I'll just stick with rock and metal like I already listen to",en
776,The animation is so bad.,en
777,the song is great but the video is bad,en
778,The videoclip is horrible. ,en
779,shatner was better.,en
780,"Im sorry, te song is exellent but the videoclip is just digusting",en
781,Good song but awful video. I don't get those characters and iimages.  Somebody decided it was cool but its not,en
782,Prigożin putin?!??,en
783,"Pass,pissed ut",en
784,The Dua Lipa song is just like a trashy remix version of rocketman that modern artists think is good despite it being awful,en
785,Am I really the only one who absolutely hates this song although I love Elton John?,en
786,I hate it. Honest opinion. Don’t hate me.,en
787,Video was painful to watch and listen to,en
788,I hate it,en
789,cringe,en
790,"Nice remix, but animation is so ugly",en
