,comentario,liguagem
300,There’s no way this has been out for a year and I’m just now hearing this,en
301,Atrevida. Eu acho que essa música foi feita pra mim com toda minha humilde  é linda ️ de mais ,pt
302,This song has been out for the last 5-6 years?!? That’s wild. This song is a banger and I just heard this a week ago. Mind blown!,en
303,Love this song Elthon still being a genius,en
304,Amoooo de paixão marcou minha vida ,pt
305,The most amazing song!,en
306,Good house music!  ,en
307,"Elton is just pure class. Enough said.
Remember this mix is made up of at least 30+ year old tracks
What a performer.",en
308,this is soooooo dope!,en
309,I love this song,en
310,Damn no one gonna talk abt how this mv is a literal fever dream,en
311,I love these 3d models <3 theyre adorable <3,en
312,I love this song. Makes me feel so nostalgic.,en
313,Hermoso remix,pt
314,i can't seem to get enough of this magical song.!! It has a uplifting quality to it.,en
315,"Co-co...co-có!!!
My daughter love this song! ",en
316,Good music and the clip is…hum…very… original. ,en
317,São tantas versões  que eu fico doido.adorei  essa música.rock Man  minha juventude a gravação original lentinha KKK,pt
318,"A lot of Music nowadays isnt really original anymore, but songs like these carry Elton's legacy. Especially with Dua Lipa's voice. #OnRepeat",en
319,A Timeless Classic!! Yes.. no,en
320,J'aime beaucoup j'adore,pt
321,"I wasn't into this the 1st time around, but this is way way better",en
322,"Elton can sing sad songs brilliantly

He can sing the happy songs brilliantly.

He is a legend of music.",en
323,"Rocketman, kiss the bride, sacrifice are a really good combination",en
324,COOL VIDEO LOVE IT ,en
325,dua lipa is such a gift in this world,en
326,This song really hit the spot it's such a great remix they did...it's like a summer song cruising down the beach..,en
327,A lot of love ️,en
328,living  in miami going to restaurants that play this song  gives me complete vibes,en
329,"Uma vibe anos 80, adorei",pt
330,So beautiful Song and brillant Video…hear and See this every Night…,en
331,"EU SOU DO BRASIL E CONHECI O ELTON JOHN SEM BRINCADEIRA  , BRASIL ESCUTA AS MÚSICA AMERICANA ADORO DE MAIS  🇧🇷🇧🇷🇧🇷🇧🇷🇧🇷🇧🇷🇧🇷",pt
332,Elton John & Dua Lipa are the most epic combo. I’ve had this on repeat for months now… This song is PHENOMENAL,en
333,"Song great, visuals fever dream.",en
334,Banger can’t stop pulling this one up ,en
335,Good music.,en
336,Essa música trás uma nostalgia e alegria extremamente incrível eu ouço essa canção umas 5 vezes ao dia e eu NÃO me canso de escuta-la,pt
337,"Elton John a beast... Check out '"" I'm still standing"" y'all sleep on art, music is the art in motion and it resonate and will never die. Art is Art! ️️️️",en
338,I still remember when he told me this was “our” song. Funny how now the lyrics hit so much harder now,en
339,"Música bonita, clipe envolvente, até as crianças gostam. Dua Lipa, grande artista, ao lado de uma lenda da música inglesa. ",pt
340,That was amazing so artistic and the song idk it well but great,en
341,Song relieves stress and anxiety. I have it on repeat.,en
342,The only thing I know is I'm the only Zimbabwean 🇿🇼 who knows this phenomenal song ,en
343,"my earworm ...
my head still stuck with this song

it's a sad old song turned into relaxing beat",en
344,Love dae,pt
345,this song is a combination of two of elton john's bangers sacrifice and rocketman,en
346,"First time i heard this song was in a party. I was like: WOW, IS THIS ELTON JOHN? 

To find out it was him, i opened Shazam then i let the magic Happen.",en
347,"Se passou 6 meses do lançamento e eu ainda não enjoei dessa versão.
Não tem como não amar, Elton e Dua deram uma nova roupagem para dois clássicos e fora a química que eles dois tem cantando juntos.",pt
348,Amo essa música ,pt
349,This is so positive ️,en
350,When I first heard I thought I was back in the 70's I had my boogie shoes on and started moonwalking.,en
351,Lots of artist today loves to bring back the 80’s vibes and I’m here for it,en
352,It definitely gon be a long time to get over this song!,en
353,Greatness!,en
354,"I came from Instagram world,  I heard the great song from Instagram world and I found that  I can find this greatness from youtube world",en
355,"Estou extremamente viciado nessa música. A maioria das viagens de Uber que eu faço, sempre começa a tocar aleatoriamente  e eu amo demais. A vibe que essa música me passa e tão maravilhosa. ",pt
356,"They have not lost the original soul of the song with this remake. Infact, it follows it's own evolutionary progression properly. The original song was sung in a very dark space in time. This remake is the emergence out of that darkness. It's the feeling of rediscovering your true self. It's the conquering of the dark night of one's soul... 
IT'S LIBERATION.",en
357,good to listen,en
358,I heard it first in the radio and thought it was Adam Levine and Ava Max.  Great song that gave me alot of stress for a whole day to find out whats the title. Finally found the right artists lol,en
359,"Loved the song! The vocals,the music just wow",en
360,It’s 2am …2:11 to be exact and this is hitting the spot…,en
361,"Dua makes this song energetic and chic while Elton John makes the heart smelt.
This song can be a legend",en
362,"Amei esse remix, ficou gostoso de ouvir, uma música cativante, dancei aqui no Sofá",pt
363,such a beautiful place,en
364,this reminds me of all the good song in 2022.,en
365,They have to collaborate and put out more music. This is so good and irresistible! Been stuck in my head since I heard it.,en
366,I am 19 years old and i love this music,en
367,One of my favourite song.2023,en
368,Everyday i am listening this  music,en
369,"I used to ba a fan, but after hearing this masterpiece, I'm a whole air conditioner.",en
370,"I can't stop listening it. Every single time it brings me joy, relaxation, good vibes, feeling like a feather, it's like antistress kinda thing for me. Unbelievable. I haven't felt like this ever again with a song. Bravo!",en
371,im confused but amazed at the same time ,en
372,"AWESOME!  They turned a ""sacrifice|"" in a""cold heart"".",en
373,"Guys, this song its a long,long journey. Its so cool.",en
374,Me too..love it.,en
375,It's an old song but it's vibe is still insane still :),en
376,Great Elton John,en
377,Que vibe gostosa essa musica! não canso de escutar,pt
378,I am learning this song now on the violin,en
379,This song feels like u in a rich party,en
380,My grandson and I both love this and we are 60 to ease apart!!,en
381,Eu simplesmente estou apaixonada nessa versão!!! ️,pt
382,"What a great collaboration. It's so upbeat and ""good mood"" music!  ",en
383,️ padrísima!! ,pt
384,This song always makes me cry,en
385,What a beautiful animation it is,en
386,"When I heard it for the 1st time I thought it was a mediocre creative experience. Now it just warms me up every time I listen to it. This song accompanied us, not by our own will, in a difficult moment.",en
387,This song is legand of longevity,en
388,Humanity really needed this song,en
389,Hearing this on the radio lately - love it to pieces!!,en
390,"Cool song, finally found it lol. Heard it at Nobu Dallas. That’s cool.",en
391,This song is like drinking a cold soda in a HOT SUMMER,en
392,I LOVE this song!!! There just isn't enough Elton John in the world! ,en
393,If this is ment to bee compensation for no more world tours.......I'm still crying,en
394,This song immediately caught my attention while driving at night. Straight away put it in my Night Drive playlist,en
395,I can tell it's quite sad and nostalgic song. I'm hurt ,en
396,What a great song this was the best song for me adding dua lipa voice to it gives other life to the song.,en
397,I Love  this song,en
398,Faz tempo que não escuto uma música tão boa..  que vibe,pt
399,"They played this at a fight night event in AZ and I added it to my playlist, cannot stop listening to it. Any others songs like this? Cuz I have not been able to find any. Btw what in tf is this music video",en
400,"I just had Monster Ultra Strawberry Dream energy drink, AND IT TASTES JUST LIKE THIS SONG!",en
401,This song makes me happy happy,en
402,The words are amazing and the pictures,en
403,People listen on Spotify! 1.5 billion streams on Spotify,en
404,Touchdown for the ages,en
405,I would love to hear a version of Elton John and Rihanna/Selena Gomez sing this !!,en
406,I consider myself a harden individual but If every man could cry it would sound like this ,en
407,I personally never thought that Elton could possibly outdo all his great songs but this masterpiece is truly genius  it.,en
408,Am I the only one who waited for “And it's no sacrifice-Just a simple word” part of the original song?,en
409,"i love this songgg from IRAN️
woman life freedom",en
410,I like the song.,en
411,Amazing how a new body makes a difference ,en
412,A remix with a great classic ..yex..,en
413,It's amazing,en
414,This feels like a very Daft Punk song.,en
415,it feels like a LSD trip with 80's pop haha,en
416,Elton love this Song .   ive written Some Lyrics for u and Dua which if u both added your magic would be no 1 for weeks and weeks just like 10ccs im not in love mid 70s . Elton U bring out Talent and and turned Dua into the complete Article . Love to Love U both The Humble Poet Peter  John  Ptak  08 /04 /2023 love kisses and Best Wishes ,en
417,"Uma versão mais ""refrescante"" e nostálgica, em todos os pontos!!!! Som lindo e muito bem montado pelo PNAU!",pt
418,It's better than the other song that he did with Britney,en
419,"Heard this song for the first time today in Dealz (pound shop), but what I don't understand is how they got footage from the shop and used it as their music video a year ago cause I am pretty sure this is just cctv footage of what happened during the song.",en
420,🇬🇾 All the way,en
421,"Listen on spotify come 1,5 bilhões",en
422,that song is amazing,en
423,The best remix 🫶🫶🫶,en
424,Sacrifice + rocket man = cold heart :),en
425,Why this remix sounds better than the original?,en
426,Great thing the song is so good. It makes video tolerable,en
427,My mood suddenly goes from bad to happy everytime I hear this masterpiece on the radio️,en
428,The sacrifice and rocket man remix ,en
429,Sorry to say but Elton makes this song awesome.,en
430,gotta see this on shrooms,en
431,"Future Nostalgia agora sim esse álbum faz mais sentido,  super dançante e gostosa de ouvir ",pt
432,"I’ve been searching for this song for some time now! 
Who sings this song??",en
433,"Demons dance, the abyss swallows the world",en
434,"Perfeito este Remix, ficou muito agradável de ouvir e curtir em qualquer local.",pt
435,so much happinesses,en
436,Those whiskered puppets are sooo uncanny valley,en
437,Elton was my first concert!  Back in the mid 70's SF CA.  My parents were so strict I had one of my favorite teachers take me and my friends.  It was the only way I could go.  Such great memories.,en
438,Madonna and share should be on this album,en
439,I love your song,en
440,Good cover remix,en
441,Is it wrong to be playing this song on repeat? I just appreciate old classics being brought back the right way,en
442,"Elton Jhon tem o titulo de SIR, nao e atoa",pt
443,this video puts another definition to trippy,en
444,Estou apaixonada por esse remix nao canso de rscutar dia e noite. Sublime!,pt
445, lovessss !!!,en
446,"I don't know if it's just me, but some clouds at the end seems some references to movie studios (the castle looks from Disney, the half moon looks from Dreamworks, and the Pegasus looks from Tristar).",en
447,The best song I've heard in year's...music has lost its way these past years but this is what I love ...one to remember in the coming years ahead...,en
448,"I cant help but hear ""He Not In"" in that baseline",en
449,From Malaysia with love ️️️️️️,en
450,Caution. Listening to this song may cause addiction. ,en
451,"Fantastic song , Elton John is timeless, voice is still beautifully brilliant.",en
452,Too dope ️ from 🇯🇵,pt
453,I CAN'T STOP LISTENING THIS MASTERPIECE,en
454,Cold cold heart,en
455,ADDICTIVE tune ! On repeat for days now,en
456,This song is so good. It's like I don't want it to end.,en
457,"The art is immaculate, the colab is wonderful, and the “remastered” music is incredible! 1000000/10",en
458,Perfeito ️🇧🇷 coisa mais fofa! Ameiiiiii,pt
459,I love this song. It has vibe of past present and future.,en
460,"A brilliant remix/mashup of Elton John’s “Sacrifice”  “Rocketman” & “Kiss the bride”, and together with Dua Lipa, it just takes it to a whole new level. ️️️️️",en
461,Amo esse remix. Amo a vibe ,pt
462,Minha nossa não canso de ouvir essa música perfeito,pt
463,The synergy of the BEAT and LYRICS are epic... Ideal summer  track...,en
464,Essa música tem uma vibe muito boa,pt
465,This song is a  banger! Driving through a big city at night while this is playing makes the experience more epic.,en
466,"How much this composition sinks into the soul is difficult to convey in words. The energy is about the same with which the soundtracks for the cartoon ""The Lion King"" were created. Amazing, amazing! Sir Elton John, I am sincerely delighted with your duet with Dua Lipa!",en
467,"Música muito boa, trás boas energias ao meu dia a dia.",pt
468,"This is truly extraordinary. It's a nice upbeat tune, and the music video is unique and colorful. In fact, I consider this my favorite song.
Edit: Thanks for all the likes and comments. ",en
469,Just went to his final concert. It was my first one and I loved it! Such a good time! Loved singing this song with him in the crowd! ,en
470,I can listen to this remix over and over and over again and again. I really love  it,en
471,An amazing ode to Elton John combined with Dua Lipa’s sweet voice. This remix is such a vibe. Makes me happy whenever I hear it.,en
472,Cadê os Br? 🇧🇷 Já perdi as contas de quantas vezes vim aqui assistir essa versão top dessa música ,pt
473,This song puts me in a good mood and I could listen to it over and over lol,en
474,"OPA, UM BRASILEIRO FALANDO, ELTON JOHN, ISSO QUE É MÚSICA. É uma daquelas músicas que te transporta para outra dimensão e você nunca quer que ela acabe só pelo jeito que te faz sentir, BEM",pt
475,"When there's not alot left in the world today that brings people together and makes them happy , this song does just that!",en
476,What a great tune. Such a cool beat.,en
477,"Parabéns pela música, está perfeita !!! ",pt
478,Música Maravilhosa,pt
479,"As one of Dua's older fans, with a ticket for pista in Barcelona next year, who was in the 1970s a buyer of all of Elton's LPs (on 8-Track unfortunately!), I love this!  In 2015 I told my Spanish friends (I live in Spain) that there was this new British singer who was really good, when Mwah! was first released.",en
480,I love this song!!!!!!!!!!!!!!!!!!!!!!!!!!!!!! Omg I can play this 24/7 365 days… it relaxes my mind every time.,en
481,"This is such a BOP!
Elton’s voice is brilliant as usual, it’s like he has a youth serum! 
Dua Lipa matches him, and the beat is knockin!! Phenomenal",en
482,This song is already a year old and it's still a great song ,en
483,"I think Elton should be really pleased with his students who made this - It´s classy, timeless, mellow but catchy. This hit will stay for ages, especially with these two artists.",en
484,This man is in his 70’s and still making hits now that is talent,en
485,This song is magical and the vocals are from another world. I come to this song every time I need a lift!,en
486,"This music takes me back to 80's, 90s vibe. Love it! ",en
487,"I heard this song when driving after work in Australia.I found it here.really a gold song.great melody,remix.really great stable male voice. chill out awesome!",en
488,Que música mais perfeita é essa? Que parceria é essa? Meu Deus! ,pt
489,"Sir Elton ,Nos do Brasil amamos vc !
E essa canção com a suavidade se dua lipa ficou sensacional. 
Parabéns",pt
490,Essa musica me da uma sensação de liberdade felicidades . É boa de mais!!,pt
491,"Viciado nessa música,passa uma vibe tão boa ! Alguém mais sente isso ?",pt
492,"Finally this is what I call MUSIC!
80's was a magical era.
All my respect to Sir Elton John and Dua Lipas.
Daniel from Beirut",en
493,Amo essa versão  ficou legal a mistura das músicas ....,pt
494,"Dua Lipa e Eton John mostraram que nada  É TÃO BOM QUE NÃO POSSA MELHORAR, bem vindos ao mundo evoluido!",pt
495,sounds like the 90s. Complete relaxation and chill ,en
496,"This was very interesting when I heard this song, one because I didn't think Elton made music anymore so it was like a rare gem... especially that he did the song with Dua Lipa which was a new artist for me and I really was starting to get into her music. Surprising combination, nice combination. A legend connecting with the newer generation, loved it",en
497,this is one of the best made and best put together songs i've heard in years thank's guys.,en
498,This song is absolutely amazing and so uplifting,en
499,"I listen to this song all day. Even when it’s not playing, the song is in my head. People look at me like why is he dancing lol.",en
500,Sir Elton John's voice is golden since the 80's. Used in a modern song suited for his tone of singing is fair enough.,en
501,"One of the best songs/arrangements/ performers EVER,,  ticks all the boxes!!!",en
502,I swear this man is going to have hits and #1s in every decade since his musical careers started,en
503,"Tudo combinou perfeitamente: batida, Elton John e Dua Lipa.",pt
504,Essa música engatilha coisas boas em mim,pt
505,"'Sacrifice'+'Rocketman'+'Kiss The Bride'
Te amo Elton!",en
506,"Not fond of ""mixes"" but I love this! Nice beat, great melody, great singers ",en
507,Can't get this song out of my head.  It's always these bittersweet songs that does this to me.,en
508,A MÚSICA É MUITO BOA EU JÁ OUVI MAIS DE 100000000000000000000 VEZES!!!,pt
509,Realmente espero que Esse Remix Eletro. Alcance 100 Milhões de Views ️ Eletrônica é Vida,pt
510,This pair's two beautiful voices. What's not to love.,en
511,"Sempre amei esse cantor maravilhoso!!! Vida longa ao doce e suculento Elton!!
️",pt
512,"Incrível! Exaltar a ""Sacrifice"" nesse remix admirável é a coisa mais bonita feita nos últimos tempos... Grande Elton John, Grande Dua Lipa!",pt
513,Que bom que brasileiro ainda gosta de música boa sou fã de música internacional de mais 🇧🇷 curtir aí alguém em 2023?,pt
514,"A masterpiece of a music track, produced by one of England's greatest music artists and one of the country's leading pop artists that fits into the decade of 2020's. John and Lipa have created something here.",en
515,"I listened this masterpiece at Coles in Australia today, and I will be re-listening it the whole day.",en
516,"Elton John is such a rare diamond, we have to be grateful to have him in such an upbeat song that makes us young people dance",en
517,Literally this song can’t get old. Great remix,en
518,"Elton John and Dua Lipa, music made in heaven, what a match, can't stop listening to this ",en
519,All I hear is CoCo Heart and I love it,en
520,I like this song,en
521,"Música linda demais gente,amei demais cadê os brasileiros ouvindo esse hino top demais,deixa o link aí e comenta.....",pt
522,Cold Heart is Sacrifice right ️ like Hold Me Closer is Tiny Dancer,en
523,The best song ever u fan,en
524,Woah that was trippy,en
525,I feel like this is the prelude to body shop,en
526,"I didn't know who they were, but I regret not getting on that escalator with them...",en
527,Such a brilliant collab! Learn those who can't get it right and see how it's done from Lady Dula Peep and Sir Elton! ,en
528,Elton John sits with the musical Dons Heaven sent,en
529,ES UNA MARAVILLA ESTE REMIX. TE TRANSPORTA A OTRO NIVEL. ES ESPECTACULAR,pt
530,Y 'am argentina y love músic...the dua lipa,en
531,This is a dream come true...will be a cool groove classic for everyone to enjoy forever!,en
532,This right here. BAM! ,en
533,"No way did I think this would be a tune that I would listen too, buts it’s completely addictive.",en
534,"Looking for like Coco heart
I mean I love it",en
535,"I've been listening to and enjoying Elton's music since the 70s, Dua Lipa's for as long as she's been recording.  This song matches their voices, styles, and decades together very nicely.  Took a while to get used to the video, but now I can't see it done any other way.  Something about the video, very Bob Mackie.",en
536,Sometimes the song gets annoying but it's good,en
537,A part of me acknowledges that this song may simply be a remix of sacrifice and rocket man but just the way both Eltons and Dua lipas voices mixes into this just puts it to another level,en
538,The person who made/directed this MV must've been smoking something strong...,en
539,Elton still number one all over the world . incredible artist . Love him so much,en
540,"Eu ouvi essa música em uma rádio no carro e passei 18 hrs pra encontrar ela
2021.",pt
541,Goes together with the previous.,en
542,I agree ,en
543,"on the way back from my brothers dorm room after helping him move in, i slowly fell asleep in the back seat, my dad played this song on loop for the whole drive till we got home, around an hour of this song. it’s a recent song but it feels so nostalgic already. I may not love my family but those moments are the true ones that make feel connected to them.",en
544,And I think it's gonna be a long long time.,en
545,"Just the sound of Elton’s voice, at his age, just amazes me!",en
546,This is Sophie Elizabeth Fisher & I  love this  song ,en
547,msc pro meu trabalho de inglês ,pt
548,love Elton John and Dua Lipa,en
549,Extremamente viciante essa versão!,pt
550,"Clever song that is a mixture of Elton's hit lyrics, it softens his voice and add's Dua's voice to raise it up over a killer classic beat, winner. Also growing up I always thought the lyric was Coco Heart, who knew.",en
551,Fabulous. Just travelling to my childhood  when the world was so beautiful and ideal. And it is indeed - with your sunny song.,en
552,Omg Elton Jonn col heart,en
553,that is so so cool.  can't stop listening to this one. absolute soul thing.,en
554,Cold heart are done by u,en
555,"1. Rocket man (1972)
2. Kiss the bride (1983)
3. Sacrifice (1989)
4. Where 's the Shoorah (1976)",en
556,i didnt take my meds and watching this made me want to take them again,en
557,When time is running very fast this was realised in August 2021,en
558,It's nice,en
559,did u know 3 of eltons songs are in this xlent song,en
560,"As much as I enjoy Dua Lipa I'm not fond of samples, and would switch the radio station-until I learned the male voice was Elton John",en
561,I came across this song by accident a few days ago and haven't stopped listening to it since!,en
562,"This voice is so soothing
Sir Elton John forever relevant in music industry",en
563,This music video creeps me out but the music is good so yah there's nothing to be scared about.,en
564,"I’ve listened to the song, and it is AN ARTISTIC MASTERPIECE! our rocketman and dua doing a collab? amazing! can’t wait to watch the video too ",en
565,I wanna watch this on shrooms.,en
566,A message to the future generations. Don't let this song die.,en
567,Elton John still got that groove on. Legendary,en
568,Elton John sacrifice  music ,en
569,Absolute banger of a song. Didn't know that Dua Lipa and Elton John have collabed together. That is something. Damn<3<3<3<3,en
570,Just passin thru ,en
571,Great song but the Video feels like a fever dream.,en
572,when we will be gone I'll miss this world...,en
573,"MAGICAL SONG
 ES INCREÍBLE EL PODER QUE TRANSMITE ",en
574,Sinistro ficou segurando vela kkkkk,pt
575,Yellow snow... Street art...,en
576,Some Things Look Better Baby Just Passing Through,en
577,thit video is so fu**ed up.  I LOVE IT!,en
578,"Estamos andando em círculos?  Esse ""clip""é  anos 80 total!!! Mas super ameiiiii!!!",pt
579,this video is a fever dream,en
580,"My dealer was vibing to this song after I got the paraphernalia I asked him ""yo who's this?"" He said it's Elton and that skinny chick ",en
581,"Pnau is so underrated, maybe this will give them the push they need to get the recognition they deserve!",en
582,The beat reminds me of Billie Jean,en
583,I maybe listen to this song 10+ times a day for the last 2 months… I AM ADDICTED!,en
584,this is balance,en
585,time flies...,en
586,"Wow Dua, speechless. That is one of the most melodic things EVER",en
587,No one listened but that's life for yeah !,en
588,( Sacrifice -gold heart ) Are these two songs the same or different songs?,en
589,"The collab no one asked for 
But everyone needed",en
590,Great video. Is this stop motion?,en
591,Congratulations to the incredibly talented Animators & Design team who brought together the Music Video for the song.,en
592,This gets this ole loggers bootie bumpin thumpin an pumpin..catchy ain't it?,en
593,It's very interesting the way that this music video mixes a lot of different styles of animation!,en
594,"What a spinoff of Rocket man,",en
595,The video somehow reminds me of 2Pac's Do For Love.,en
596,"Is it just me, I sing “ROCKET MAN!!” every time but Dua lipa doesn’t say rocket man in the lyrics  getting me confused but absolutely outstanding song ️",en
597,Happy birthday Elton John rocket man,en
598,thats why Dua lipa has the tight body,en
599,Sir Elton is just one of the greatest musician ever,en
600,This video is tantalizing even if muted.,en
601,Super hit 2023,en
602,"Something weirdly nostalgic about this video.
Can't stop watching it.",en
603,Dua Lipa is so Fing hot,en
