,comentario,liguagem
0,11 million likes achieved a first in kpop Jennie ah dammit what a queen but let's make this amazing song 700 million views for our kpop goddess,en
1,Tudo pelo 1B da Queen,pt
2,"well arranged beats, pre chorus melody, choreo,visuals SOLO IS NOT JUST A SONG ITS A WHOLE MASTERPIECE",en
3,Keep going guys we’re gonna get it to 1bil no matter what let’s support our girl <3,en
4,KEEP ON GOING YOU GUYS!!! JENNIE IS ABOUT TO REACH 1B!! DON'T FORGET THE OLD SONGS AND DON'T STOP AT 900M!!!,en
5,I love you Jennie. We are so proud of you. Do whatever makes you happy love.,en
6,"JENNIE QUASE BATENDO 1B DE VISUALIZAÇÕES, CONTINUEM BLINKS!!!",en
7,Keep going guys. We need to reach our goal ASAP!,en
8,Jennie is going to slay and trend everywhere with her red carpet look today,en
9,This song deserves 1B!Let's continue on streaming for Jennie amd make her reach higher number!!!,en
10,"Wish that this song will be 1B views,Love you a lot jennie️️",en
11,Wow  Jennie I love your solo ,en
12,Solo is an evergreen song. You can listen to it for 100th time and still feel like it's so fresh. It has such a rich vibe to it. Everything Jennie does is top-notch!,en
13,CREO EN EL RAP PODEROSO DE KIM JENNIE!,en
14,I need a album by Jennie,en
15,"vai ser delicioso jogar na cara dos outros que a jennie é a única solista com 1B
o fato dela ser alvo constante de críticas, é porque ela é literalmente a maioral. e junto com o enorme sucesso vem também a inveja",pt
16,"I REALLY CANT WAIT FOR HER TO REACH THIS SOLO MV TO 1B AND I HOPE YOU GUYS TOO. PLEASE, KEEP STREAMING SOLO GUYS AND THANK YOU FOR ALL THE EFFORTS TO STREAM THIS SOLO. LET'S MAKE OUR QUEEN JEN THE HAPPIEST GIRL IN THE WORLD. ILY ALL JENSETTERS.",en
17,"'SOLO'  Es el mejor Debut de Una solista De Kpop, es Impacto  Let go Jensetters y Blinks VAMOS POR 1.B PARA 'SOLO' VAMOS POR IT GIRL GLOBAL : JENNIE!!",en
18,When I went to vote Jennie in shining awards in morning then i saw that she was at first place in most popular Blackpink member I became so happy but now again she came in second place pls go and vote Jennie in shining awards,en
19,Jennie is really the ace of the group. She's barely showcase her talent yet she shine the most.,en
20,Hermosa ,pt
21,I love this song ,en
22,"i really can't wait for her to reach this solo mv 900M to 1B views. and i hope, she create and release another song. i miss her soloists era. please, keep str3aming guys. thank you for all the effort to stream this solo. ily all",en
23,930M as soon as possible please !! Fighting for Nini,en
24,precisamos fazer o solo da jennie chegar em 1B,pt
25,VAMOS CHICOS POR JENNIE LLEGUEMOS A UN 1B,en
26,33k come on guys cheer up we can do this !!,en
27,JENNIE SUA LINDA,pt
28,"73M to go for 1Billion for our beloved Jennie! Keep streaming, blinks!",en
29,Blink vamos mostrar que amamos NOSSA JENNIE!!!,pt
30,Let's try to complete 500k views today pls!!!! Keep streaming,en
31,"If we're not gonna work hard now on str3aming, we will miss the chance to have a billion first for Jennie.",en
32,This song brings memory years ago after it got released. We sang this a lot during our field trip back then with my coursemate!,en
33,Come on Blink! Let's make this masterpiece 1 billion!!!,en
34,"Just 200k more. I am so excited to see this iconic video hit 900 Million. Jennie shining solo!!
Yay! We did it blinks. Let's go for 1 Billion!",en
35,this song deserves 1B!! let's continue on streaming for jennie n make her reach higher numberrrr!!!,en
36,"I love Jennies solo! It's one of my favorites, I hope they give her more solo songs especially with more rap parts! I would also love to see some harder choreography, I really loved the moonlight rap and choreography hope they give her more choreos like that!",en
37,1 million views more and hello 100 million!! lets keep on streaming blinks!,en
38,"Jennie is such a charismatic person her aura her charisma everything hits hard on stage
Queen indeed",en
39,"We love you JENNIE, We will always be with you to give you our love and support, we are proud of the woman you are becoming today, continue to shine and always take care of yourself",en
40,RUMO AO 1 BILHÃO AAAAAAAAAA JENNIE TE AMO,pt
41,"Let’s make this mv
 1 billion",en
42,"We need to reach 1 billion asap , let’s make Jennie first female K-pop soloist to reach this milestone , keep str3aming harder , we are going really slow , Pls we need to do this for Jennie",en
43,So many beautiful pictures of Jennie on her I G,en
44,your voice is very peaceful,en
45,"It's going to be 900M soon!
DON'T STOP JENSETTER! KEEP STREAMING!!
We have to reach 1B soon! ",en
46,This song never gets old. SOLO will be forever iconic!,en
47,927M !!! Guys wake up keep streaming almost 1B,en
48,She's perfect,en
49,I can't stop hitting my replay button OMG JENNIE YOU ARE THE BEST,en
50,Keep going guys.We need to reach our goal ASAP!!!,en
51,This solo has everything VOCALS RAP VISUALS DANCE JENNIE KIM THE ALL ROUNDER ACE,en
52,"Only 73M to go for 1B
Come on Jensetters let's do this for our Nini fighting!!!!",en
53,"I am not a kpop fan  this girl knows how to own a stage. She has that charisma that always makes us to love her and surely she deserves  the love of blinks

Mama im famous ty for that much likes",en
54,Jennie is shiny and classy. I love everything about her. I'll support her all the way.,en
55,We need more than 20 votes pls vote for Jennie in shining awards guys,en
56,Jennie slaying so hard... she is so popular,en
57,Just keep doing what you want Jennie coz we want you to be happy... we are here to support you. Your SOLO mv will reach 1B soon ...,en
58,Vote for Jennie in shining awards guys we need more than 100 votes now,en
59,"Let's go for the billion views, he deserves it",en
60,"w/ the help of some blinks who are ot4 and jennie stans, we can achieve 300M this week right? JENNIE DESERVES THAT.",en
61,"Seriously I've never been a big fan of Bp especially Jennie but i never hated on her or body-shamed her. BUT NOW HOLY SHIT THIS IS TOO GOOD OMFG HABISHSISKWOWBSJSOJAVSHAISNKSOSK

Sorry i had to let that out",en
62,She's  totally stunning at  Cannes Film Festival ....just wow,en
63,"It's easy to be an idol, but it's hard to be Jennie... 
I love you .",en
64,Jennie is the best,en
65,Never got and never going to be tired of this MASTERPIECE!,en
66,"Don't stop supporting our princess, keep streaming Blinks!",en
67,THIS IS MY FAVOURITE SOLO SONG,en
68,Sending more and more love for my nini,en
69,Vote for Jennie in shining awards,en
70,"OMG yesss 3M likes and 60M views reached... AMAZING BLINKS
Lets not give up and keep streaming and supporting Jennie Queen <3 <3 <3",en
71,"I know this is not a competition but we need to have a billion vi3ws for Jennie first. Let's work harder, as long as Money doesn't reach 900M we still have a chance to it first. Let's do our best for our Nini! Fighting guys!",en
72,Congrats for your debut as actress Nini im so proud of you,en
73,just do it come on blinks 1b views ,en
74,Our goal 300M is done! Now we need to reach 400M for our Jendeukie! ♡,en
75,Jennie shines wherever she goes,en
76,"Jennie is that Global IT baby<333 Whenever she is, that Area gets electrifying, she has that charisma, that gets everyone s attention,  that Queen Vibe, STAR power! Queen Jenn Unbeatable SOLO STAR POWER~~",en
77,We have to reach our goal ASAP. 1B on or before SOLO ANNIVERSARY!,en
78,Always comes back to this iconic solo ,en
79,she's  know how to party   so cute jennieyah a,en
80,"Jennie thank you for being here to brighten our days and give us energy to go forward, hope we can do the same for you, we love you our precious angel",en
81,Vote for Jennie in shining awards guys,en
82,This was my theme song last valentines day,en
83,Jennie is working so hard in her entire career. Let's give Jennie what she deserves. A billion vi3ws first for her!,en
84,1 billion for our jennie she really deserves it!!,en
85,I can't stop myself from falling more and more for you Jen. You are freaking gorgeous.ಥ⁠‿⁠ಥ,en
86,Can't wait for your new song,en
87,CLOSE TO 70M VIEWS LETS GO BLINKS!,en
88,"Jennie the most soft-hearted girl in this cruel world.
Jen you deserve more love and appreciation for your hard work since your trainee days.We all jensetters love you.",en
89,this song is amazing,en
90,a princess of the idol,en
91,"This song is unforgettable, Jennie is such a great girl!",en
92,we are so proud of you Jennie,en
93,COME ON GUYS! MAKE IT A BILLION!,en
94,May is Jennie's month. She is slaying. I'm so proud of you love.,en
95,Even with the hectic schedule jennie kim never fails to slay and give us more proud to be jensetter(⁠✿⁠ ⁠♡⁠‿⁠♡⁠),en
96,Vote for Jennie in shining awards pls I want to see her receiving the most popular and beautiful Blackpink member awards,en
97,300 million v3ws coming soon! Please stream blinks! Do it for JENNIE!,en
98,Jennieee will set a fire in a red carpet today with her glamorous look,en
99,i'm SOOOO excited for this MV to hit 1B views AAAAAA,en
100,Jennie's singing SOLO means she's single and available now,en
101,Let's try to complete 930m views by the end of May,en
102,"If we want to give Jennie what she deserves, we have to move a little faster.",en
103,"L    O    V    E          Y    O    U

........J    E     N    N    I    E........",pt
104,I'm so proud  of you jennieyah all of your successful  well deserved  on you   congratulations again,en
105,"my queen, you looked so beautiful at cannes. i am so proud of you for your acting debut. :)",en
106,Jennie thank you for existing & inspiring many people you deserve nothing but the best  I’m sooo prou u love u,en
107,"Str3aming this MV is not easy,  I am here for 3 years now. To be honest there are ups and down, sometimes it's tiring but for the love of Jennie. I'm still here standing.",en
108,1B pleaseeee,en
109,"UPDATE:are you guys ready for *BLACKPINK JENNIE's solo debut stage on TV tomorrow, 11/25 (SUN) on SBS Inkigayo!?!?! Show starts at 3:30PM KST~ ""BLACKPINK's first solo take off! The shining debut stage of Jennie who is full of unrivaled aura!",en
110,this song deserves 1B!! let's continue on streaming for jennie n make her reach higher numberrrr!!!,en
111,Vote for Jennie in shining awards guys,en
112,this song deserves 1B!! let's continue on streaming for jennie n make her reach higher numberrrr!!!,en
113,this song deserves 1B!! let's continue on streaming for jennie n make her reach higher numberrrr!!!,en
114,Lets show our support for nini by getting her 1 billion,en
115,A billion vi3ws first forJennie!,en
116,1.5 million views are close!! love you jennie and blackpink!,en
117,It's time to reach 1 billion jennie it will be iconic forever,en
118,Jennie is going to shine in cannes again,en
119,"Everyone obsessed with her .she is a really something
Like queen",en
120,100K in an hour!,en
121,"For those of you who are losing hope, I know this is not an easy journey for all of us. But we almost reach a billion this is not the time for us to give up on Jennie and SOLO.",en
122,Jennie is attending Canes Film Festival today for her acting debut in The Idol. Let's support her!,en
123,"The white and matching black dress  totally  fit on you,you look so gorgeous",en
124,Jennie voices in this is amazing like her rapping and no joke,en
125,The most iconic solo,en
126,Jennie so I like this song so much and I 'm still listening to the year 2019 ,en
127,Let's give a billion on her SOLO Anniversary. For sure she will be happy.,en
128,"i’m not even turkish but he still on top, y’all can't deny this tho",en
129,A billion vi3ws first for Jennie,en
130,Lets go to 400m and more before this year end ️️️,en
131,Let's hit 930M fast,en
132,Jennie's surprise has been 1 billion get a solo mate let's just keep going she can do it it's a great one,en
133,COME ON BLINK 73 M AGAIN,en
134,omg!!! now she's  wearing  a cute black dress with simple  make-up gosh JENNIE KIM beauty is so so so amazing,en
135,Thanks  to all blinks/jensetter  who support and cheer  Jennie during her CFF event....you make nini smile !!!,en
136,The power of Jennie is crazy,en
137,"Let's get this to 500M 
Let Jennie know how much we BLINKS luv her <3",en
138,I could listen all the time. Solo is my cup of tea,en
139,BEST SOLO AMK,pt
140,"Keep vot!ng everyon3 
Only 15-20 vot3s are needed for Jennie to be first in popular category 
And almost 100 -150 vot3s are needed in most beautiful member category",en
141,"JENNIE has 46 video ( fan cam or performance ) which surpassed 1 MILLION views  
A QUEEN",en
142,Our Jennie is looking like a princess at Cannes,en
143,"Jennie Being the best, I love you",en
144,"I can't stop listening it again and again, everything does is so cool, I like this song, JENNIE FOREVER ️",en
145,Jennie makes people who call her lazy cry every day,en
146,"100m views coming soon!!!!!
Keep streaming!!!",en
147,Solo hits different ️ let’s go 1 Billion views ,en
148,Neart to 1B🥹,en
149,ARTIK LÜTFENN BİZİM ÜLKEYE DE GELİN  BLACKPİNK  SIZIN ICIN COK SEY YAPIYORUZ BUNU HAK ETTIK 🇹🇷🇹🇷🇹🇷🇹🇷🇹🇷,en
150,We love you Jennie. I will never  leave str3aming SOLO til we reach our goal,en
151,I'm already waiting for 1B views. Jenny you are my love I adore you!,en
152,Jennie is an idol who deserves 1 billion,en
153,Waitin for this mv to hit a billion and jennie's new solo comeback and the idol,en
154,this song deserve 1B!!! let's go guyss,en
155,JENNIE RUBY JANE SLAYING AT CANNES I'M SO PROUD OF HER !!!,en
156,"Still trending #1 in Malaysia 
60M ",en
157,Let's continue to support Jennie until the end. Next month we will see the actress Jennie,en
158,Wow !!! Just heard this song on FOX as I was watching the NFL game Seahawks vs 49ers as it was going into the 4th quarter. Love this song ! Wish Jennie and Blackpink all the best and success ! I don’t know much about Kpop but I do love Blackpink !,en
159,Jennie We are very proud of you,en
160,"Jennie also with the never-ending miss

He's a great dude and he will be in the top 1 million because he deserves it because he deserves it never forget it until the end",en
161,"I know blackpink wasn’t really popular in China or some places but I was shocked even ddu du ddu du can’t reach no.1in Hong Kong but jennie solo does! a new record here 
Hope rose can give this results too I love 4 of them!GOGOGO BLINKS️",en
162,"just enjoy  your day,we are here continuing str3aming to support you we love you Jennie",en
163,"This solo song will always be amazing, let’s continue on str34ming our Jennie towards 1B",en
164,So beautiful,en
165,"Who would leave Jennie?
She's beautiful",en
166,Have you all seen our jendeuki's red carpet look she slayed it looking like a real life princess,en
167,Do whatever makes you happy love. We will always be here to support you.,en
168,This solo is a legend,en
169,Vote for Jennie in shining awards guys,en
170,"Jennie will have new music soon, can't wait.",en
171,The way this video is growing.. we can definitely reach 100m views by end of the year BLINKS! ,en
172,"I love you Jennie, always.",en
173,73m only road to 1b,en
174,Eagerly waiting for your new songs Jennie Kim,en
175,a bit different .. unexpected but its gooooood...jennnnieeee is shining solo lo lo lo lo lo. .,en
176,We love our jenniya from the core of our hearts,en
177,"Cannes Film Festivall, she's shining  solo ever !!!!!",en
178,"Can we do 930million before may 31st? 
Lets try!!",en
179,Guys please don't get demotivated by seeing views increase with slow rate please keep streaming every views are important:(,en
180,Love you,en
181,Less than a day to see our Jennie's cannes red carpet look,en
182,Let's try to make 1 billion so that we can bring her happiness,en
183,wow!!! This is so nice! First solo member sings her first song named SOLO haha,en
184,Jennie will always be the main event ever ....,en
185,"You sitting on my feelings, I'm sitting on my throne.",en
186,Queen of rap,en
187,JENNIE  The Best solo,en
188,"I wish I could be there to chant your name like JENNIE KIM, the shining solo !!!! thanks  to all the people who cheated her name like she's  the totally  main event even, not haha",en
189,I think there are not much people to stream solo today:⁠-⁠(,en
190,24 hours -> 10m ,en
191,"Jennie is so humble, when her name was acknowledge and she was shown on the screen, she was shy.",en
192,73m only cmn before anniversary,en
193,"Yg: how successful you want your solo debut to be?

Jennie: yes",en
194,Jennie is iconic,en
195,Jennie is the limited piece of human,en
196,"MV-100%
SOLO-100%
JENNIE-100%
VOCAL-100%",en
197,down to 870k need more,en
198,"We are very close to 1 billion we cannot give up like this 
Let's go!!",en
199,"EĞER DOĞRU YOL SİZİN YÜRÜĎÜĞÜNÜZ, SÉ YOLLUNUZ AÇIK OLSUN",en
200,4m to go until the end of this month. We need to get 10m every month so that we achieve 1b this year!,en
201,I can't wait anymore i desperately wanna see her,en
202,KEEP WATCHING! we need 1 billion!!,en
203,#1 in Australia ,en
204,"Jennie is the best soloist, let's always support nini",en
205,Can't wait more to see her red carpet look,en
206,Go for 1b,en
207,"JENNIE ‘SOLO’ has 4,410,900 streams on Spotify",en
208,LET'S MAKE JENNIE HAPPY BEFORE THE Idol drama comes out!,pt
209,Don't forget to vote for Jennie in shining awards guys we need more than 500 votes.....,en
210,"I can't take my eyes off you Jennie love you so much Jennie and blackpink 
Keep steaming go blinks",en
211,Road to 1b,en
212,Jennie has first  solo debut  stage in SBS Inkigayo on my birthday 25/11. I can't wait !!!,en
213,the best solo the best jennieyah,en
214,73m only more effort needed,en
215,never thought I would listen to kpop until I saw Jennie,en
216,Stream muscle guys go ahead we have to be 1mr as soon as possible come on Jen Stan show your strength,en
217,JENNIE best vocalist and main rapper,en
218,only Jennie can pull of a curtain dress like that 0:47,en
219,Let's go and vote for Jennie in shining awards guys pls,en
220,Always luv and support for u Jennie,en
221,"Hi jensetters, just want to point out that there are existing playlists that you can use and loop if you are busy. Lets get this masterpiece to 1b asap! Thx everyone : )",en
222,Oh god..im addicted to this song ♡,en
223,"Jendeukie at Cannes yayyy 
she looked like a fairy ♡(ӦｖӦ｡)",en
224,I love you guys you are cute and I love your songs you made I watch them thousands of times xo,en
225,It’s already 50m??? Wow. Honestly I thought it will get 10-20m views because of the haters she gets. I guess I underestimated my baby gurl’s power. ,en
226,"Before Her new collab releases, we should make it atleast 950M.",en
227,"Just imagine Jennie wearing red gown for cannes 
She will slay it",en
228,Is 2023 now but still this song️ lysm nini,en
229,TOP 1 TRENDING IN INDONESIAN🇮🇩,en
230,This  song reminds me  to keep going on your lives...,en
231,Don't forget to vote for Jennie in shining awards guys pls vote for her,en
232,Solo is a legend,en
233,So Jennie is attending Cannes at 10:30(Paris local time) it means we are about to see her looks for cannes,en
234,Jennie and Kuma in a variety show is EVERYTHING this is Jennie year yeah (kuma year too),en
235,Let's go jensetters we can do this for our Jennie,en
236,#1 in UK ,en
237,Blinks we can reach 1b. Jennie deserves,en
238,I'm so happy to have another million added. 926M!,en
239,"I like being alone , because I should be true to myself.",en
240,I believe she will shine more brightly in Cannes red carpet look:),en
241,"Lisa -4405 
Jennie -4374 
In most beautiful member category",en
242,She shines at Cannes,en
243,"I live in a cave so only just came across Jennie through trending videos, but this is really good!",en
244,I believe that the closer we will get to 1B the more people will be here because everyone is going to want to claim to be here before 1B so don’t lose hope it’ll go faster soon !!,en
245,"My first blackpink song, I know that it is a song with only one artist but I still like it",en
246,Solo is a revolution,en
247,Jennie's 90° shoulder line is literally the sexiest,en
248,#4 trending in the US!!!!,en
249,I hope Jennie will have a rap part on the colab,en
250,Damn! One day 15 million views,en
251,Let's move faster c'mon jensetters we make it to 1 billion first(⁠•⁠‿⁠•⁠),en
252,You got your jensetters with you who will never give up on you:),en
253,"#5 Trending in Turkey🇹🇷
Jennie Fighthing",en
254,Ioved your Cannes look ,en
255,Vote for Jennie in shining awards guys,en
256,"200M before February? 
I know we can do it Blink!!
Fighting!!! ",en
257,Jennie is the most talented girl in bp,en
258,Anyone here to support her and make this solo 1b.,en
259,Vote for Jennie in shining awards guys,en
260,who else stans blackpink so much? ,en
261,I think we can make 20M views lets do it Blinkss,en
262,"Happy New Year!  International fans are in your area
BlackPink is the Revolution~~150Mviews go! go",en
263,Haters hating on Jen and she keeps slapping them with her every talent and success,en
264,Did anyone realise it’s SOLO’s one year anniversary,en
265,Actually since all the members have a solo with the release of the blackpink game they can like put all the songs together it would be a shock especially for blinks,en
266,Your smile is The Most Beautiful Sight For Our Eyes Is. Please keep it up. The world became brighter and better with your smile,en
267,Excited for our ninis cannes red carpet look :),en
268,Jensetters are the best solo fandom in bp,en
269,"I can't stop myself from listening to this masterpiece 
Love you so much blackpink
Jennie Kim 
Lalisa manoban",en
270,We love you as you do we don't distinguish between fake winks Blackpink just winks they always know you and they are happy they are happy that you are happy...,en
271,I listened to this song again in 2023,en
272,"20 milion before 24h.
FIGHT THING BLINK",en
273,"Jennie brand reputation still number 1, most female idol ranks 1",en
274,Korea will be proud of having a blackpink anywhere trending in the world .,en
275,"*Our current goal - 50 million in 4 days*
- Time left: 1 day 11 hours
- Views left: 14.4 million
Let’s do it, Blinks ",en
276,We should do atleast a 250k today,en
277,#2 in Germany:-) and yeah its perfect,en
278,Please try more guys ,en
279,my favorite comfort song,en
280,Vote for Jennie in shining awards guys,en
281,Don't give up we have to reach 1 billion before lilies please jensetters:(,en
282,Abel looks so kind with our Nini,en
283,"Jennie in blue eye shadow=GORGEOUS
Me in blue eye shadow= WHO PUNCHED YOU?!?!",en
284,Let's speed up a bit! Use short videos in between solo by that we can go back easily!,en
285,"Spoilers, Fancams...

These really affected the views but for a solo artist to have a 14-15M view despite all of that, c'mmon, thats a beast.",en
286,Vote for Jennie in shining awards guys,en
287,JENNIE you are the best omg you are HOT,en
288,Jennie only need 2 votes to come in first position of most beautiful Blackpink member and 32 votes to come in first position of most popular Blackpink member  go and Vote,en
289,Vote for Jennie in shining awards guys pls,en
290,"JENNIE 'SOLO' — 11PMKST

#1 Naver (=)
#1 MelOn (=)",en
291,i can’t wait for Cannes,en
292,"Lisa - 5558
Jennie -5549 
In the popular category!",en
293,SOLO is the best,en
294,"Great song!!!! ️

Much love from Greece!!!! ️🇬🇷",en
295,"JENNIE IS MADE UP OF STEEL. YOU CAN BEND HER BUT SHE WILL NEVER BREAK 
FROM BLACKPINKFACTS......",en
296,we must deliver this song 400 million before Solo Rose Jennie deserve,en
297,Blinks don't forget to like this MV. Number of dislikes is a lot on this MV as compared to other k-pop mvs. Let's fight those haters together!!,en
298,All rounder!,en
299,Jennie wrote on her story that she feels better but please still take a break! I don't want anything to happen to you I love you so so much!,en
300,Jennie's new vlog is prolly her one of the best vlog,en
301,But since I can't pronounce Arabic i said the words a little wrong but teacher still understood ,en
302,Road to 200M Fighting Blinks and Jendeukie,en
303,I’m so excited for what you wear in cannes goodluck love,en
304,who has already watched this video 100times but still watching this ? ,en
305,STILL TERNDING NUMBER 1 IN INDONESIA SINCE FIRST DAY,en
306,"Vote for JENNIE in shining awards
We too close to make her most popular blackpink member",en
307,"[INFO]



JENNIE will be performing her 'SOLO' tomorrow on SBS Inkigayo at 3:30pm KST",en
308,Vote for Jennie in shining awards guys,en
309,she's a baddie she knows she's a 10,en
310,"Who's here? 2020 
Road to 500M views! Let's reach it.",en
311,Vote for Jennie in shining awards guys,en
312,"blinks, today will be jennie last performance for SOLO on music shows, please keep streaming lets try to get jennie her 3rd win for her last show! (youtube views have 35% points)",en
313,It's funny to see hater's hating on jennie even for breathing,en
314,"I love you and me...... dancing in the moonlight.... Nobody can see it just you and me tonight~
What's the name of this song and who sang and wrote this song?",en
315,"Who is here after 137 million views ?
I love you Jennie so much 
I am blink and I proud of it ️",en
316,"PEOPLE CAN'T REACH 1M IN TEN YEARS. BUT THIS SOLO IS ABOUT TO REACH 10B VIEWS. BECAUSE, IT'S THE SOLO OF QUEEN JENNIE",en
317,"jennie's solo name: solo
blackpink's new album name: The Album

What a coincidence lol",en
318,Best f ace of kpop,en
319,queen Jennie is trending in my country i'm emotional,en
320,"We can do this blinks!!!! Let’s make our baby girl happy!!!! 20M in 24 hours!!!
Pls str3am!!!
10M
20M",en
321,Also I remember that 3 of Jennie's fancams are the top 5 most viewed kpop clips on bilibili( kind of like Chinese ver. Youtube),en
322,I LOVE JENNIE!!!!,en
323,highest views for kpop soloist in 2018!,en
