,comentario,liguagem
283,"We go together better than birds of a feather you and me We change the weather yeah, I'm feeling heat in December when you're round me.      I've been dancing on top of cars and stumbling out of bars I follow you through the dark can't get enough.     You're the medicine and the pain the tattoo inside my brain and baby you know it's obvious.    I'm a sucker for you      you say the word and I'll go anywhere blindly I'm a sucker for you, yeah  any road you take you know that you'll find me.    I'm a sucker for all the subliminal things no one knows about you (about you) about you (about you).     And you're making all the typical me break my typical rules it's true I'm a sucker for you, yeah.     Don't complicate it (yeah)  cause I know you and you know everything about me.    I can't remember (yeah) all of the nights I don't remember when you're round me  (oh, yeah yeah).    I've been dancing on top of cars and stumbling out of bars I follow you through the dark can't get enough.    You're the medicine and the pain the tattoo inside my brain and baby you know it's obvious.    I'm a sucker for you you say the word and I'll go anywhere blindly I'm a sucker for you,. Yeah any road you take you know that you'll find me.     I'm a sucker for all the subliminal things no one knows about you (about you) about you (about you).     And you're making the typical me  break my typical rules it's true I'm a sucker for you, yeah.     I've been dancing on top of cars and stumbling out of bars I follow you through the dark can't get enough      your the medicine and the pain the tattoo inside my brain and baby you know it's obvious.     I'm a sucker for you.      You say the word and I'll go anywhere blindly I'm a sucker for you, yeah any road you take you know that you'll find me.     I'm a sucker for all the subliminal things no one knows about you (about you) about you (about you.     And you're making the typical me break my typical rules it's true I'm a sucker for you.  I'm a sucker for you.     Hope y'all enjoyed ",en
284,After their marriage this is a masterpiece,en
285,3 years later and this song slaps as hard as will smith,en
286,Oh shit. They’re back back! ,en
287,My 10 year old daughter requested I search for this song here - so we are rocking to it in the car in the parking lot waiting on her mother to return. Lol.,en
288,Love the song!!! Dani looked amazing!!,en
289,I am in love whit this song love you Jonas brothers,en
290,"I just love how much fun everyone had with this video. Dress up in the fanciest and over the top costumes, run around and just cut loose",en
291,It’s been 4 year since I heard this and why this song still kinda slaps..,en
292,I always listen to this song my family loves this song,en
293,2 years later i remembered this,en
294,im here just to say this is a great song.,en
295,This song is fire,en
296,We must protect this song from the new generation of kids bop at all costs..,en
297,My baby listens to this songs n stop crying this song is like therapy for her thank u so much for this amazing song,en
298,Big fan of jonans brother forever and ever,en
299,"After he says "" I'm a sucker for you"" I like the melody after that.",en
300,It's beautiful,en
301,I couldn’t go to the tour back in the day but you bet my 23 year old ass is fighting my way to get a ticket,en
302,the 8th grade memories are hitting,en
303,"So catchy! Yes! Don’t ever stop! Luv ur songs! After this song I get my typical… lol. Ok thx stay safe, byeeeee",en
304,Now in 2023....still listening ,en
305,The girlfriends/wives are a mf blessing to this video  slayinggg,en
306,I love this video so much,en
307,"Lyrics :
We go together
Better than birds of a feather, you and me
We change the weather, yeah",en
308,Ima sucker for you ️ I remember when I was younger & I was obsessed with the jonas brothers.. literally had blown up posters of them.. magazines.. i would read stories about them off miss literati & wattpad . Watched camp rock so many times cant even count on my 10 fingers & toes even watched their show jonas.. im so glad they’re back song is a 10/10 for me  even tho i enjoyed nick as a solo.. this is SO MUCH BETTER,en
309,This was 3 years ago?! I thought this song was older. Still a banger tho!,en
310,Sucker is most cool i haven heard i gonna rate this about 10/10,en
311,I’m a sucker for this song ️,en
312,This song is aging like a fine wine,en
313,"I love how they brought their wives in the video and not just some random chicks️️️

They are so good",en
314,"Makes me so happy that Kevin and Danielle are still together knowing how short celebrity marriage and relationships tend to be.. I was so excited for him when they first got together, their first baby and getting married.",en
315,I loved that music,en
316,This already counts as a nostalgia song for me,en
317,I am going to buy Jonas Brothers poster for my room!! ️️️,en
318,"Is it 2008? I feel like I'm going to get home from elementary school, eat some mac'n cheese, turn on the tv and watch some hannah montana and jam to that long ass commercial that played the jonas brother's song ""burning up""...those were the days.",en
319,Henrico: adorei a música muito boa porra gostei demais muito bom,pt
320,The best song ive ever heard,en
321,Omg i missed them ,en
322,Me: This song's got a good beat---lemme just listen to it another 73 times in a row,en
323,this song is so fucking catchy and i love it,en
324,I hope One Direction can come together like this someday even if it's one song.,en
325,im a sucker for jonas brothers ,en
326,"Am I the only one who think ""Sucker"" and ""I ain't worried"" by [One republic] gives same vibe or close enough",en
327,"Off topic but I just remembered that I had a huge crush on Joe before, since Camp Rock - up until now actually.",en
328,"Haha, I'm 19 now & they're still apart of my teenage years!! Oh yeah!  La La, mmhmm",en
329,I absolutely loved seeing their wives!!!! This was brilliant!!,en
330,I'm so obsessed  with this song...,en
331,Cinematography masterpiece,en
332,It's 2022 and I'm still waiting for the moment that Kevin is going to suddenly drop some heavy rap bars,en
333,This is the best reunion EVER ! im so happy danielle is in there,en
334,After 3 years search for this song finnaly found it...,en
335,Life was so good when this type of songs was released,en
336,"We go together
Better than birds of a feather, you and me
We change the weather, yeah
I'm feelin' heat in December when you're 'round me",en
337,Probably the only siblings that haven't betrayed one another in some way.,en
338,Just can’t believe this is already 4 years ago .. literally crying,en
339,Such a underated song!,en
340,Finally I found this song again,en
341,"How is this simultaneously similar to their original, mid 2000s sound, but also something new that fits today's mainstream music standards????",en
342,I love you Nick Jonas and I also happy for you and your marriage ,en
343,I music so much so good,en
344,Music is the universal language of humanity!,en
345,Idk what to Say this is a MASTERPEACE,en
346,Too cute together ️,en
347,This song and “Did You Call Me?” by Lukaz are some of the only things getting me through tough times  I hope everyone is doing well. I love you ,en
348,Its like so much talent in this vid bruh,en
349,I love that they’re back and they put their beautiful wives in the video! ,en
350,it’s high time jonas brothers make a music video featuring jonas daughters. Three of them have daughters now ️,en
351,This takes me back. Wow,en
352,I LOVE TEAM JONAS.,en
353,"One minute I’m 16 hearing about the latest gossip of who these guys are dating, next thing you know I’m in my mid 20’s seeing them make a great comeback while being married to some of the most beautiful woman who are just as talented as them.",en
354,"here, feeling old asf bc i started to listen songs from my childhood, AND THIS WAS ONE LMAO, I feel old :')",en
355,If you ever feel left out remember that they have a fourth brother ,en
356,It surprises me that this song is from 2019. In both directions. I can swear it's been around forever but it feels super modern.,en
357,Not they’re all married this video is so iconic,en
358,Why this song views is low..? Isn't this a great song? and i love this song so much..,en
359,Oh the memories…,en
360,My childhood self is quaking at the moment,en
361,I'm genuinely upset that this song doesn't have a billion views.,en
362,"Omg 
4 years already 
I feel so old",en
363,Makes me feel like I master in real life with powers and winning,en
364,I am watching Jonas on Disney Plus. ️️️,en
365,Wow.... Jonas brothers with their wifes.... My eyes and ears r blessed,en
366,This is the best song I'm a sucker for you it's just so good,en
367,Okay this is still a banger in 2023!!!!!,en
368,I LoVe tHiS SoNg,en
369,I love your songs,en
370,"I was only 13 when i listened them,. I'm now 23... Damn i'm old.",en
371,I grew up watching this me and my mom love this legend somg,en
372,They go crazy,en
373,I love how they included their wives in this video ,en
374,including their wives in the music video just show how much special they are,en
375,"Badassed music get it done, making love to music, DONE DEAL.",en
376,Last time I heard this was 2 year's ago on a camp walk  so memories,en
377,happy 4 yrs of this song!,en
378,is it only me that loves the way joe says 'on top of cars' lmaoooo,en
379,I love that this song is basically just the brothers gushing over how much they love their wives.,en
380,This song and “Did You Call Me?” by Lukaz are some of the only things getting me through tough times  I hope everyone is doing well. I love you ,en
381,Thank you for making this song,en
382,You put three gorgeous men and women in one video and watch how magic unfolds,en
383,"Holy shit, i thought this song was a lot more older than 2019.

God damn, this song is a banger.",en
384,I like this song ,en
385,I'm sucker for this song ,en
386,"THe Jonas Brothers can never break up, Wheezing THeY'Re BrOthERS",en
387,One of the songs that's makes me miss my  LYFT passengers  5️⃣ Champions ,en
388,Wow that's great this couple are very unique,en
389,Lets get this music video to 400 million this year,en
390,"Can we have the ""making of"" this video please!?

It looks like it was fun to make!",en
391,It's the best lesson I listen to for  Jonas  Brothers,en
392,This song and “Did You Call Me” by Lukaz are some of the only things getting me through tough times ️ I hope everyone is doing well. I love you ,en
393,"Director: so which models do u want for the mv??
Jonas brothers: excuse us??!! We are married!!",en
394,so shocked that this came out 2 years ago! it feels likes yesterday!,en
395,adoro essa daí KKKKK,pt
396,I love that their wives are in the video ! Brilliant ,en
397,This song is so underrated...,en
398,My 10 year old self is fangirling so hard right now y'all,en
399,OMG HE IS ALSO A SINGER ???????????,en
400,this brings me back to 2019 to early covid days,en
401,this song is to die for bro ,en
402,THE WIVESSSS!! BEST GLOW UP EVER! From my cute childhood crushes into men with lovely relationships and families!,en
403,I'm a sucker for this song!,en
404,I respect the Jonas brothers 1000% more since they incorporated their wives (quite well might I add) into this song.,en
405,How do they all look young but we're in my childhood too,en
406,"Jonatic forever, I love Joe Jonas ",en
407,Best song of jonas brothers,en
408,12 year old me is QUAKING,en
409,I respect the Jonas Brothers so much for making a whole song and music video just to publically worship their wives,en
410,Thai masterpiece is something that can't forget,en
411,why this song is so underrated ?,en
412,"Sophie, Priyanka, Danielle!! The official 3 Jonas Sisters!!! This is perfect i'm freaking out right now!!!",en
413,"It's March 2022, Let's See how many legends are listening to this masterpiece ♡ This track is so addictive!",en
414,"""As usual, it was eminent! I never stop to be astounded at your creative introductions.""",en
415,So is no one going to talk about how much Kevin’s glowed up because daaaaamn ,en
416,What a gem by Ryan Tedder and Jonas Brothers ️,en
417,"Totally Legit Lyrics:

Man it’s a HOT one
Like seven inches from the midday sun",en
418,When you find your childhood song in one sec,en
419,6 celebrities in this video.this is so iconic .,en
420,"Jokes on you! The Jonas brothers can't break up. . .
They're brothers",en
421,This song and “Did You Call Me” by Lukaz are some of the only things getting me through tough times. I hope everyone is doing well. I love you! ,en
422,it's been years since camp rock and jonas brother on disney. I cried af lol,en
423,I Love this Song of all,en
424,a decade later...still waiting for Kevin to sing the main vocals,en
425,"i like how they don,t need models for the song their wives are so beautiful",en
426,This song is played at every grocery store/ pharmacy,en
427,"15:30 Trace Request
16:00 New
16:15 Hit 10
16:20 Hits Non Stop",en
428,Why lyrical videos are soo weird and iconic,en
429,This sounds like something that would play in a movie or somethin,en
430,This shit is cute asf and it sounds soooooo good,en
431,This song and “Did You Call Me?” by Lukaz just hits different in early 2022. Times may be tough but everything going to be okay in the end. I hope everyone is doing well. I love you ,en
432,THIS WAS THREE YEARS AGO? IT FEELS LIKE YESTERDAY,en
433,Patiently waiting for my significant future other to dedicate this song to me,en
434,It’s the Jonas brothers...except much more attractive. Literally what else is there to want,en
435,I can't believe all the brothers married such intellectual Queens.,en
436,Cool ,en
437,This song and “Did You Call Me?” by Lukaz are some of the only things getting me through tough times  I hope everyone is doing well. I love you ,en
438,"i love how joe sings ""on top of cars""",en
439,Imagine this but with all the MXTX main couples ,en
440,"In my mind, I like to think this is actually just a home video from one of their real family gatherings.",en
441,2022… There’s still hope for it to come back again,en
442,Who needs paid models if they have sexiest prettiest wives to shown up? ,en
443,"The Jonas Brothers just aren't the same without their fourth member, Takane Shijou",en
444,"In my head, my brain is repeating I’m a sucker for you. I’m a sucker for you. I’m a sucker for you. ",en
445,I suddenly felt like why am I getting the vibe of GOT and then I realised why,en
446,I'm the sucker for this song I must say!,en
447,Good song,en
448,"even if a decade has passed since I was fangirling over the Jonas Brothers, I believe Joe is the hottest bish in the town",en
449,"Jonas Brothers - Sucker

We go together
Better than birds of a feather, you and me",en
450,I need to say it loud... THEIR FAMILY GATHERING MUST BE SO FABULOUS.. BROTHERS AND WIVES ARE SO HOT,en
451,"WHY IS THIS ADDICTIVE?
like WHYY?!!!

gosh I love them and their wives so muchhh",en
452,6 years later and I'm still single,en
453,I just got hit with memories of me and my ex listening to this and I can’t get over her some help,en
454,"I'm leaving this comment here in a hope that whenever someone likes it, I'll be reminded of this masterpiece",en
455,best family Song,en
456,Sansa finally found someone who treats her like a queen,en
457,Sophie Turner is in this she slayed this music video with her outfit and other women ,en
458,isnt this just feel it still?,en
459,I am back to listen to this song 2023 ️,en
460,"its been said at least a million times
BUT ITS SO CUTE THEY HAVE THEIR WIVES IN THE VIDEO",en
461,Ok everybody hop on to the nostalgia train we're going back to the good ol' days,en
462,"nick joe lindos 
musica boa",pt
463,Finally Youtube recommends something good.,en
464,Love that they have their own wives in their videos!,en
465,love the drum solo though,en
466,Very Nice,en
467,This was such a fucking bop to me 2 years ago I knew ever lyric,en
468,"Me: 2019 sucks so far. 
Jonas brothers: I’m a sucker for you.",en
469,I literally can’t believe they all have kids now!,en
470,"2022 , who's listening to this masterpiece   ",en
471,I just finished Game of Thrones for the first time... and it hits different coming back to this video and looking at Sansa Queen of the North... now of House Jonas hahaha,en
472,So cool that they got their wives in the video. Also nice song,en
473,This song and “Did You Call Me” by Lukaz are some of the only things getting me through tough times ️ I hope everyone is doing well. I love you ,en
474,"Loove These,think get a fan",en
475,I have come to love this song I heard it on an episode of The Simpsons a couple weeks ago,en
476,my favourite song,en
477,They took their wives to the clip and it's much better now. I love it!,en
478,pov you come back to this song after many many years remembering knowing all the lyrics to this song,en
479,Who's still listening this beauty  in 2022,en
480,Love from India🇮🇳🇮🇳🇮🇳,en
481,"After listening to this again, it’s not the same without Vampire Girl Kyun in there.",en
482,Why does this song make me think someones smoke detectors have no batteries in them ?  everytime it comes on the radio I hear it in the background,en
483,"I love the Joe Jonas part-""I am dancing top of the car......""",en
484,Three good looking and talented men and their beautiful wives,en
485,I used to think this was the heat but now I think it's an oven ,en
486,They've tried to create this decadence atmosphere,en
487,Finding out that Ryan Tedder co wrote this song is why I get the same vibes from “I ain’t worried”,en
488,Omigod....Jonas wives ,en
489,"I love this like peculiar vibe, hope they have their wives in there other music videos too, that was really cool",en
490,This song and “Did You Call Me?” by Lukaz are some of the only things getting me through tough times ️ I hope everyone is doing well. I love you ,en
491,OK we are all a sucker for these brothers and their wives.more videos with these beautiful couples plz,en
492,"Jokes on you, the Jonas Brothers can't break up — tHeY'rE bRoThErS",en
493,It’s so cool how they have their wives in this video,en
494,"Please brothers, your my Favorite Teenage Singers of All Time!",en
495,This is such a fun video!,en
496,I am a sucker for this song.,en
497,"When you have beautiful wives, you don't need models. Period.",en
498,"CAN we say that Kevin is a underrated person in this song and his wife also 
The whole seems to revolve around nick and Joe it's heartbreaking  ",en
499,Love the coupletrifecta especially Priya nka and Nickgod bless the couple ..,en
500,And i love this song i subscribed and liked to you and i am a big fan of you,en
501,this is a whole mood,en
502,nicely played,en
503,i love how they have their wives in the video . this video can’t get any better . ,en
504,Just found this masterpiece and found out that it is the reference for Rimuru’s song.,en
505,"priyanka beauty with brain and mass of talent India's most talented  versatile actress the national award winner ,padmasree award winner,almost 90 award winner now a global iconwho sake up hollywood as well as bollywood one of the most powerful women of the world",en
506,I have son's that age but l'm still impressed,en
507,Loved by millions of girls and these were the lucky ones.  lucky lucky,en
508,"""THE JONAS BROTHERS CAN'T BREAK UP THEY'RE BROTHERS-*wheeze*""",en
509,I miss  Jones brother ,en
510,Good increíble excelent  Good job,en
511,It’s cool that they got this video and their wives are in this video with them,en
512,Pov:era 2019 e vc viu o video daquelas crianças e hoje reencontrou dnv o video (eu tinha 6 anos),pt
513,"One sec, I gotta go hang my old Jonas Brother posters back up.",en
514,It’s crazy how much this song sounds like Feel It Still by Portugal the Man,en
515,I heared this song before but I didn't know the song was made by priyanka Chopra's family ,en
516,"...in the choruses, the kid literally sounds like one of those wall mounted bass pro fishes that you push the red button and it starts singing.

-MCC",en
517,sophie looks so perfect,en
518,0:33 is my favorite part of this video,en
519,IM A SUCKER FOR THE JONAS BROTHERS AND THEIR BOOS ,en
520,James Daly did an excellent cover of this Hot song.   Need a club version.,en
521,I missed 2019 the world was all peacefully but now it juss ,en
522,better than the birds of a feather,en
523,"The producer:so what type of girls do you need 
The brothers:we have wives",en
524,"0:32 Electric 

1:31 A Goofy Movie",en
525,Looking at their costumes only one thing comes to my mind............HUNGER GAMES,en
526,YAS WITH THE WIVESSSSSSS! IM LIVING WITH MISS PRIYKANKA! We're SO PROUD of the boys. They're living with their queenies.,en
527,"Very nice song. I never knew it was a Jonas brothers's song. 
I liked the kiss between Priyanka and Nick. 
Where is my spouse, I want to kiss him with bad breath as well.",en
528,"I just love how Sophie drinks the champagne, dumps in it the bathtub then spits it out. ",en
529,Bruh! Great song,en
530,The way they're so obsessed with their wives is EVERYTHING,en
531,I bet Nick is thinking yeah my wife is hotter than both my brothers wives.,en
532,The Jonas wives are the besttt,en
533,Jonas Brothers come back with entire family and pets ,en
534,its so sweet and. beautiful that these woman r their wives and they just so in love,en
535,I love this song let's get jt,en
536,Queen in the North <3,en
537,Their wives are seriously gorgeous. ,en
538,I’m a big fan of the Jonas brothers and live in new jersy,en
539,"Homies really took a break, got wives and came back to kill it!!!!!!!️️️",en
540,I just love Priyanka's costumes here,en
541,I can listen this ALL DAY your the song is the best esp the other Jonas brother (the one with bossy R),en
542,0:58 this one of my favorite song,en
543,Love the Jon brathrs,en
544,I just love the fact that their wives are in the video.,en
545,The Jonas brothers can’t break up they’re brottttttthhhhhhherrrrss,en
546,This song and “Did You Call Me” by Lukaz are some of the only things getting me through tough times. I hope everyone is doing well. I love you! ,en
547,"Kevin's wife : Elegant
Joe's wife : Crazy
Nick's wife : Playful",en
548,"Here's my Christmas version, ""I'm A Sucker For Yule"" :

I've been chopping down Christmas trees
and waiting for Christmas eves",en
549,SOMEONE CALL THE FIRE DEPARTMENT THIS SONG IS FIRE ,en
550,okay my dreams have officially come true,en
551,The way Sophie Turner CARRIED this video ,en
552,I can't see nick without being reminded of Ferdinand.,en
553,Loved you guys in L.A.,en
554,Kevin and Danielle being the stars,en
555,Who came to listen to this stunning and wonderful song? ( June 2022 ),en
556,so this is what it would of been like to had accomplished your dream of marrying a jonas brother,en
557,Nick is my fav,en
558,"it's January 29th , 2022, let’s see who’s listening to this masterpiece!",en
559,I-C-O-N-I-C,pt
560,This is a funny video I have to admit their wives are like cute and full of such character,en
561,Love from india 🇮🇳 bro,en
562,"Well, I'm a sucker for this song.",en
563,"Sophie Turner looks so cool, how does she do it all the damn time ",en
564,This song and “Clover Cage - Falling For Free” are the two songs keeping me sane through these tough times. I just want to send love to everyone and I want everyone to know things will get better. We are in this together..I love you..,en
565,I love that they used their wives in this. But they didn't use Kev and Dani enough.,en
566,"Watching this song again and again just to hear him saying ""top of cars"" i am kinda addicted to this phrase ",en
567,"I liked this song after watching the drama of ""Zoe's Super Cool Playlist"".

I feel positive and the day is going to be fun♪",en
568,Yall I'm a sucker for this tune,en
569,"I want to be the girl that has all those corgis, god damnit",en
570,oh nice :) simpsons finally added the song ,en
571,i love  this  so much  i,en
572,I suddenly want to wear skirts over jeans like I did when I watched Camp Rock,en
573,Love the videos with the wives in them.,en
574,All I like in this is the puppies and bunnies not even the idols-,en
575,Amanhã café junto ,pt
576,"Oh no, I saw my childhood while listening to that song",en
577,Their wives are so beautiful omg,en
578,I haven't heard this song forever,en
579,Come on Jonas wives! Perfection ,en
580,I'm.  Biggest.  Fan.  Of.  JONES Brothers.  Oh.  My.  God.  I.   Listen.  To.  His.  Song's.  On.  My.  Spotify.  And. I.   Wanna. Go.   His.  Concert.  And. I.  Wanna. Go. Meet. Them.  Oh.  My.  God.  I.  Love. You.  Nicj. JONES,en
581,YASSSS OMG I CANT BELIEVE THIS DAY IS HERE.,en
582,"Currently am living in jamshedpur and it's way more to imagine there, where you reached, Priyanka. Love you",en
583,can joe PLEASE bring his curly hair back omg,en
584,i watch this video over and over again for sophie turner,en
585,i haven't listen to this in like 3 years,en
586,It so sweet how they included their wives ,en
587,This is the original simp anthem…that’s so damn catchy.,en
588,"I can’t listen to this without hearing

SHANARI SHANARI OJOU-SAMA",en
589,Soooooooo beautiful girls and handsome boys soooooooo beautiful songs my fav song,en
590,"time to get out my jonas brothers posters, cds, wallpapers, cups....",en
591,I've still haven't forgotten Stella- Joe  from their show,en
592,Jonas brothers & their amazing wives,en
593,this  is  a  good  one  too,en
594,They were so young and they still are and now they back with their wives ,en
595,2:00 the whistle part kinda remind me of top gun soundtrack,en
596,Im a sucker for this song,en
597,Jonas brothers are back and brought their wives with them.!!!!!,en
