,comentario,liguagem
967,Well be glad it's not his neck,en
968,"يونس brothers
lmao XD",en
969,I think I've seen Priyanka Chopra there,en
970,You do that,en
971,Rep our city for me,en
972,Life rn is just shit.,en
973,I am the fifth Jonas I'm there sister   Heidi ,en
974,disney said cancel them all! birds of a feather myot together,en
975,I did my version on my Channel? ,en
976,ultemecia for the win,en
977,i remember when roblox let u upload audios and i use to play this song in vehicle tycoon,en
978,Jared dines sent me here. This version feels weird.,en
979,Oi tem conta no outro app vizinho? Sabe qual é?,pt
980,I thought priyanka chopra was culture girl ️,en
981,Where's the vampire girl?,en
982,A Jonas brothers it's valentines day soon when you get baile Biddle a flowers a twitters page,en
983,Onerepublic song from topgun maverick is similar to this song,en
984,Indians were here for priyanka chopra ,en
985,It’s weird that The Jonas Brothers making a pop video about Sucker is giving me the heebie jeebies. ,en
986,Is she priyanka chopra From India?,en
987,I came only for priyanka chopra,en
988,Some one tag them,en
989,Matthew 12:41. ️ Greatness is the wisdom ironically  . ,en
990,What is lady Sansa doing here,en
991,Herr for joe and sophiet,en
992,Ready lanes ️open up the Gates of TJHELLZGATES NOW VIPS,en
993,Since Ahmedabad.....literally lies multiplied like anything.........UNJUSTIFIED  needed THEN BLUE,en
994,"Huh, neat",en
995,Anybody watching this in 2023,en
996,Anyone in Nov 2022,en
997,it sounds so modorn,en
998,im watching  your  videds,en
999,The only thing good about this are the wives.,en
1000,"i'm i the only one who's seeing priyanka chopra in this video?,,,,,,,,,,,,,,,,,,,,,,,,,,,,,,,,, i didn't know that she was in the video",en
1001,Greatest simp song of all time lmaoooo,en
1002,Came here from Hasu X steam,en
1003,Came here to see Priyanka,en
1004,Supreme Jhantu..learn beats and music from SANAM,en
1005,"nation""s JIJAJI...........",en
1006,Circle K brought me here ️,en
1007,"There is 355 million views but only 5.22 million subscribers. How? Why don't people want to subscribe. Miley Cyrus, Ariana, Beyonce and Selena Gomez also have more than a 100 million views but only have 20 to 50 million subscribers. Please subscribe. Don't just watch and go",en
1008,Send me the video broo,en
1009,"Mickey VS Bugs
Wolf VS Isabelle
Syndrome VS Fred
Uncle Grandpa VS Ed",en
1010,Hahaha so I finally invited poor people over.,en
1011,Courtney did this song so much better!,en
1012,For fucks sake take the candle stand thing with the table thing.,en
1013,I really don’t get the music video ,en
1014,my  name  is  arwa,en
1015,Take this Justin Bieber,en
1016,which one is Joe Jonas,en
1017,Who is an Indian??????,en
1018,Where's Takane??,en
1019,Dnce is Jonas brother ,en
1020,I'm a slime on the move,en
1021,"Like: Jonas Brothers
Reply: BTS",en
1022,sue wvery one in the media industry in one swipe ill show u how,en
1023,"I got à geasear, im so stray",en
1024,HES SON DRUGS SOPHIE YOU CAN NEVER TRUST A BISEXUAL MAN PLEASE IM BEGGING,en
1025,your  from   camp rock,en
1026,Im gonna be sick,en
1027,I'm a supper for you,en
1028,"Hi everybody 

i am kelly willems i am dutch and

I also speak Dutch so if you have something

would like to know from me please in dutch okay '",en
1029,it is arwa,en
1030,How to watched 2023,en
1031,No comments here on the game of thrones girl and quarantine girl pfff,en
1032,South Park,en
1033,mr iglesias who else??,en
1034,Why do all songs nowadays sound the same?,en
1035,So many symbolism and shit,en
1036,Bruh no one noticed Priyanka Chopra,en
1037,sorry  about  yester  day,en
1038,Mass report this video,en
1039,"The prickly discussion trivially level because uzbekistan pivotally frighten beside a wise packet. acrid, enchanting angle",en
1040,"hey cuz I'm jenniferkayejonas tell Sophie we got gaslit I'm at home I, not ok",en
1041,Sophie please this isn’t you,en
1042,cancel the cable and dish networks and antenas only dish for gregg gutfield,en
1043,619 vs 760 don't Forget the VIP#CPS?,en
1044,"Eric lindt candy Berber, only it gets Brigham Samuel adams susan b Anthony",en
1045,O Meu Quarto Era Santuário Dos Jonas,pt
1046,"The brainy canada extracellularly shade because character pathomorphologically bare regarding a thoughtful soccer. nauseating, quixotic freckle",en
1047,Love the Masonic floor and the symbols ,en
1048,"There is only one God who eternally exists as three coequal and coeternal persons, namely, the Father, the Son, and the Holy Spirit. We have all sinned and broken God’s law. God is Holy and Just and because of this, God cannot let sin go unpunished, and that punishment is eternal hell. We can’t work our way into heaven and our good deeds can’t save us from our sin. The bible says all our righteous acts are like filthy rags. We would perish if we died and faced God with our own righteousness.",en
1049,Simp anthem,en
1050,Now now...quit copying me. For real.  smh,en
1051,Simp anthem.,en
1052,Cut my song that suckes,en
1053,lovely song... but this video is outrageous waste of money... complete nonsense,en
1054,The song is not beautiful and the movements and the voice I don't like the song,en
