,comentario,liguagem
598,this is like the ten year challenge version of the burning up music video,en
599,"Good way to remind us they’re all taken/married now 
My teenage self is crying",en
600,"Kevin and Danielle are the lovable couple

Joe and Sophie are the fun couple ",en
601,I love how they included their wives in the video ,en
602,This gives me Alice in Wonderland Vibes,en
603,I’ve been dancing on top of cars and stumbling out of bars,en
604,"is....is that Sophie Turner? BRILLIANT!
Priyanka & Nick 
I love everything about this!",en
605,Who else remembers their old MV's with them wearing their cute purity rings?  Now they're all married.  I'm only 18 but damn I feel old ,en
606,im a working adult now...if they go on tour I won't be able to control my wallet,en
607,Jonas Brothers feat. The Jonas Wives  LoL love it,en
608,"The Jonas brothers can't break up they're bRotHeRs 


She wasn't lying",en
609,The Jonas Brothers have entered the chat again,en
610,"It's not just JONAS BROTHERS
It's JONAS FAMILY",en
611,"Who came back here cause this song just randomly crossed your mind?

Edit: wow that's a whole lot of likes, i have never gotten so much likes before, thanks",en
612,I’m about to put all those posters from 2010 on my walls again,en
613,"what year is it again, I feel like we have time travelled back to 2010",en
614,but why kevin never sings? he has really good voice uh.,en
615,"I love Sophie&Joe,they look amazing together",en
616,"Manager: so do you guys have an idea of who you want the models to be 
Joe: huh?
Kevin: what are you talking about
Nick: we have beautiful wives we don’t need models",en
617,"Directer: we need models
Jonas brothers: we got wives",en
618,"Director:   we need models

The brothers:    we've got wives(winks)",en
619,Don't touch me my teenage self is officially back,en
620,Every costume in the video looks like met gala dress,en
621,JOKES ON YOU THE JONAS BROTHERS CAN'T BREAK UP THEY'RE B R O T H E R S,en
622,I love how they all are married,en
623,I'm a sucker for this song,en
624,"0:03 Director: how much money do you want to spend on the house
         Jonas Brothers: yes",en
625,Damn I always knew Sophie Turner was the best Jonas Brother,en
626,The fact that their wives are in the music video just reminds me of the Burnin’ Up music video  remember Selena Gomez was in it and a Taylor swift lookalike,en
627,"Other singers - I need several models 
The Jonas Brothers - We have wives",en
628,"All I think now the “ Jonas wives “ 
Should be a band .",en
629,. . I love seeing their beautiful talented wives involved,en
630,Ladys and gentlemen. We are now back in 2008,en
631,Ok but we will need a new version of Burnin' Up.,en
632,"Jonas brothers: we're back
One direction: how's the weather ?",en
633,"jokes on you, the jonas brothers can't break up, they're Bʳᵒᵗʰᵉʳˢ!",en
634,You gotta imagine how special there wives feel after there husbands reunited to write a song about them,en
635,"Who else is here for the 1 year of ""Sucker"" ?",en
636,"I love how the comments are like 1/3 love for the wives being in the vid, 1/3 excitement for the bros getting back together, and 1/3 ""what Sansa was doing in S8E5"".",en
637,"has an immediate flashback of the Jonas Brothers, Hannah Montana and That's So Raven",en
638,Me at the age of 22: MOM YOU WONT BELIEVE WHOS BAC-,en
639,I am a sucker for this song,en
640,"This gave me hunger games and Alice in wonderland vibes.


Edit: I know no one cares about this edit... but for those who might... thanks for all the likes.️",en
641,That's Mrs. Danielle Jonas to you. THE QUEEN. THE OG.,en
642,"Jokes on you. The Jonas brothers can't break up, they're bROTHERS",en
643,We really out here in middle school all over again.,en
644,EXCUSE ME WHAt? ok I have so many things to say... let me stop sobbing first... Sophie... and Danielle.... and Pryianka... and then is it their dad??? THEY'RE AN EMPIRE that's all I have to say,en
645,13 years old me is shaking currently,en
646,This is what I imagine The Capitol in the Hunger Games to be like lol,en
647,Time to call my therapist to tell them I’m cured of depression and anxiety,en
648,I'M LIVING FOR PRIYANKA AND SOPHIE IN THIS VIDEO ,en
649,"Director: How much money do you wanna spend?
Brothers: No
We've got wives now",en
650,Is it just me or did this music video remind me of Alice and I Wonderland??,en
651,You know you're old when your middle school crushes upload a video featuring their wives...,en
652,Jonas Brothers Tour 2019,en
653,Absolutely here for Sophie Turner and Joe's weird ass relationship,en
654,I fall in love with Joe Sophie couple.. I've not known that they're  in this sweetness ,en
655,"Priyanka, Sophie and Danielle should start a band of their own now",en
656,everyone’s talking about camp rock but did anyone else watch their actual Jonas Brothers tv show that lasted a short while on Disney?,en
657,"2019: This is gonna be a great year

Me: Bet",en
658,"The Jonas brother can’t break up

tHEyRe BroTherSsSSssssssS",en
659,"'I'm feeling heat in December'

Australians: Heyy, I know that feeling",en
660,so are we just gonna ignore the fact that Kevin got no lines,en
661,Ohh.. My time travel machine actually worked.,en
662,"Director:so which models would u like
Jonas Brothers:ummm....Duh we have wives",en
663,So this is what they’ve been up to,en
664,When u get married in a musical family,en
665,Im gonna need more screen time for Kevin and His girl in future videos. K? Ok.,en
666,This song is very beautiful gorgeous live it .. I wanna thank my family LOL cardi b,en
667,Gonna Tell my kids this was the cast of hum saath saath Hain,en
668,Who remembers the Camp Rock and Jonas L.A. days?,en
669,"IT'S HAPPENING
EVERYONE STAY CALM
IT'S HAPPENING",en
670,W-O-W... apenas,pt
671,"Me: h-


Jonas Brothers: GUESS WHO'S BACK, BACK AGAIN",en
672,Awww there wifes look so beautiful ,en
673,"Patient wakes up from coma.
Doctor: You've been in a coma since 2009.
Patient: Are the Jonas Brothers still doing music?
Doctor: Well actually n...",en
674,Why is Nobody talking about Danielle Jonas ? She's so beautiful  and that dress tho ! ,en
675,why did i found this song so late???,en
676,They all married up. Their women are queens.,en
677,"Swalla: hires girl dancers.
Jonas bros: all we need is our wives.",en
678,Damn this song and the one from Portugal the man and a few other man I can’t put my finger on it but they sound so similar ..all these radio. Songs,en
679,this song gives me butterflies idc,en
680,"Mom: Who broke the Repeat button on the computer?!

Me: runs away while listening to Sucker",en
681,"Yeah, still listening to this song",en
682,"Ariana: ain't no budget when I'm on the set
Jonas brothers: Same here
Edit: DAMN IVE NEVER GOTTEN THIS MANY LIKES THANKS GUYS ️",en
683,i love and music,en
684,"jobros are back

me: let me bring back my old cds, posters, pens, notebooks-",en
685,OMG 4 years!!,en
686,Pera...é o mesmo beat do One republic? Do filme novo?,pt
687,"Nick: I'm a sucker for you
What I hear : I'm a circle for you",en
688,3 years sure is fast.,en
689,Sounds like an ed sheeran song,en
690,"new kids: ""wait... Nick has brothers?""
me: WHERE'S FRANKIE?!?",en
691,What a way to start March.,en
692,"I wish Nick Jonas was the male lead in his new movie 'Love Again' with Priyanka. The movie would have surely exploded. But its funny that he's the bad date and Priyanka saying let's take it slow when they got married in three days. But I love that they did it quickly, why waste time, we must learn to seize the opportunity to acquire something important no dulling.",en
693,My man Kevin has to get on those vocals next time,en
694,I did it for 3hour straight hahaha.,en
695,Is it just me or does this remined me of the Capital from the Hunger Games,en
696,Kevin should’ve sing.. i wanna hear his voice too,en
697,Love from India,en
698,"The beat remember me "" Die Young """,en
699,does this mean camp rock 3 is on the table now???!!,en
700,"Im a speak in russian, and today, when i know translate name of this song, im-
(sorry for my english)",en
701,We go together better than birds of a feather you me,en
702,"My notification bell rang after 5 years!!

Thank you all i got 3.5 likes for first time 
(Very Very Thank you to all)",en
703,I'll make a paper and sing it to my boyfriends,en
704,"jonas brothers: we're back  !!
me: idc ..
2 seconds later
me: screams in 9838638 languages",en
705,my parents said suckeris a bad word but i showed then this song then they got happy now sucker is not a bad word,en
706,"So this is the original, I ended up addicted to I'm a slime on the move parody hahahhahaa",en
707,"Producer: Whose wife is going to be featured in-


Jonas Brothers: Yes",en
708,WHAT TYPE OF SHIRT IS JOE JONAS IS WEARING? (the black one when the vid starts) IVE BEEN TRYING TO FIND IT FOR MONTHS,en
709,they kept this a secret for 8 months,en
710,"Reminds me of Feel it Still by Portugal, The Man",en
711,Wait what? This is a song from the jonas brothers? Hu... who knew. Heard this a couple times on the radio but always thought it was an Ed Sheeran song lol,en
712,11 year old me wasn't ready,en
713,What a number!,en
714,Aw! Adult version of Burning Up. From gfs to wives.,en
715,After 4 years of watching this.... i just realized that the girls were the boys wives.... AND I JUST NOTICED NOW?,en
716,Lady’s and Gentlemen. We are now back in 2008,en
717,I love the Jonas Brothers but I feel like Kevin is excluded no hate just my opinion,en
718,"9 year old me is QUACKING rn


Edit: I kinda want to change it cuz I feel dumb but at the same time I don't cuz I am dumb",en
719,I have a T shirt and it’s my favorite song,en
720,I have a crush on Priyanka now. Sorry nick. Shes so photogenic,en
721,jokes on you the Jonas brother's can't break up they're bROTTHHERRRSSS,en
722,I love this vidio,en
723,Love from🇮🇳🇮🇳,en
724,6th grade and 5th grade summer I was into this sonh,en
725,Now how am i supposed to study for my finals?,en
726,"Priyanka voice is just kinner voice nd face also
How nick loves her",en
727,Cool,en
728,Jonas brothers and all their wives or whateveer,en
729,No fucking way they put their real wives in the video 🥹 that’s such a brilliant and sweet idea!!!,en
730,"calls mom : Where are the boxes with all my posters, accessories and what not? I need to redecorate my house (28 yr old me)",en
731,That's my ronald Mcdonald house song I love your song so much!!!!,en
732,Pretty perfect in rose,en
733,Wish Kevin and his wife had more screen time,en
734,The last family portrait looks like a still from Kabhi Kushi Kabhi Gaam...lol,en
735,Sophie Turner is so frickin beautiful! I cant,en
736,So eu q acho essa musica parecida com uma musica do Enhypen? ,pt
737,"Imagine u r Frankie Jonas
And ur brothers open a band without u

Edit: thank u soooo much guyss for all theeee likesss",en
738,I feel like this is a message to girls ,en
739,Wow this is my fav song lollll hahahha,en
740,Is that Priyanka with those huge earrings? I love them!!!,en
741,"I just realise that Ed Sheeran has started to sound like this singer (Im sorry I dont know his name) like a lot, and I mean Ed's latest songs. Well thay maby have the same vocal coach?",en
742,Did I wake up in a different timeline or something,en
743,If Joe and his wife make a rom com I'm watching it I'm just saying guys Make a freaking movie .,en
744,"When you get indian audience, viewers increases automatically.",en
745,everything Sophie Turner appears in becomes instantly that much better! let's hope her magic works on Dark Phoenix as well...,en
746,Me not knowing the song name was Sucker,en
747,"Whenever we watch Jumanji or listen to Nick's songs, my father would be like ""Isn't he that guy who got married to Priyanka?""",en
748,omgg this is i know now but is VERY PRETYYYYY,en
749,yeah that's something vibey,en
750,Maybe they waited for nick to get married so they could release this video. ,en
751,"""And you're making typical me break my typical rules.""",en
752,well Camp Rock 3 is going to be hella interesting. ,en
753,They used there wives in the video  I think that’s the reason I liked this song,en
754,I just realised all of em our with their significant other in the thumbnail CUTEEE!!!,en
755,We love u John's brother,en
756,Wow Camp Rock 3 looks great,en
757,Including Frankie Jonas ,en
758,What a medicine,en
759,13 year old me did not see this coming,en
760,Rip Queen,en
761,"What normal people do in honeymoon period: ""actual honeymoon""
What priyanka and nick do in their honeymoon period: sHoOt mUsiC VidEos",en
762,"here before this is played in every store, radio, tv commercial..........",en
763,hell yeah I'm still here,en
764,"Imagine now there will be another YouTube channel 
Called Jonas sisters and again in future Jonas cousins omg soo cool",en
765,nah dudeee...... cant be right. How was this song released 3 yrs ago. Time went away tooo fast,en
766,So this is what Nick saw when he looked through the binoculars in Camp Rock 2 The Final Jam,en
767,If one of them divorces this video is gonna be very awkward,en
768,PSA: if you people let this song flop like you did PomPoms- Im suing,en
769,Love from nepal,en
770,Hold on I just need to go tell everyone about the jonas,en
771,"While her brother's busy escaping the explosions at King's Landing, Sansa's having party at the Winterfell Hall.",en
772,corona: ill follow you through the dark. can get enough. any road you take you know that youll find me,en
773,I'm getting a sucker warm the weather I'm cold .,en
774,Purity rings have left the chat,en
775,2023️️have a good day and night positive vibes,en
776,"Ok... literally nobody is talking about Kevin?
Edit: Thank u for the likes!!",en
777,I love this song but tf is the music video ,en
778,Its more like Jonas family. ,en
779,Joe Jonas the King of the North,en
780,WHEN JOE CAME IN I SHIT MYSELF I HAVENT HEARD HIS VOICE IN SO LONG,en
781,"0:46
”SHANNARI SHANNARI OJOU-SAMA”
Come on, tell me you didn’t sing it as well",en
782,"WHOLESOME COUPLE - KEVIN AND DANIELLE
DORKY COUPLE - JOE AND SOPHIE
INTIMATE COUPLE - NICK AND PRIYANKA",en
783,Kinda coldblooded that they barely gave Kevin’s wife any airtime lol,en
784,"""tHe jOnAs bRoThErS cOuLD nEvEr bReAK uP thEy'Re bRoTheRs!""

wheeze",en
785,"When say ""the brothers have the same kind of woman... seriously seemed like their mother""

the brothers:",en
786,say the word and i’ll go anywhere blindly,en
787,my younger self has entered the chat,en
788,Bro I'm still here,en
789,"They Barely Grew Up Since ""Camp Rock"" ",en
790,Oijte musica TV vendo,pt
791,am sucker for this song,en
792,Who's here before 1 million views?,en
793,Not the same without Vampire Girl,en
794,"Maybe all were preparing for Met gala 2019 camp theme

Edit-thanx for 427 likes",en
795,1:30 dang... I wish I could take a bath in open like that.,en
796,Jonas Brothers were waiting till they all had wives to film this video.,en
797,nick jones is a  god,en
798,They're dressed like the people living in the Capitol,en
799,the Jonas brothers with their wives .Sophie Turner and Priyanka Chopra,en
800,Camp Rock generation? ,en
801,Jonas Brothers,en
802,"Mosquitoes be like 
""I'm a sucker for you""",en
803,Anyone listening to this in 2022,en
804,Dancing on top of cars....,en
805,Purity Rings have left the chat,en
806,100000% here for Sophie Turner,en
807,just watched Chasing Happiness <3,en
808,this was supposed to be happening in yr 3000 .,en
809,dancing with dogs very nice !,en
810,"Fun Fact: This was filmed in Hatfield House, which is only 5 minutes where I live",en
811,"omg guys , iam sucker for this guy in black",en
812,Huh.. childhood..,en
813,Who listen this in 2023 ? ️,en
814,"What's Better?
Sucker: Like 
Cool: Comment
     ",en
815,Directioners listening to this song: ,en
816,This sounds like Electric Guest,en
817,Kevin is hardly there in the video . I couldn’t help noticing .,en
818,I was looking for this song singing it when I seen them. For a sec I was thinking ain’t that harry styles and them song then I was right lol,en
819,"Me: has an environment management midterm tomorrow 
Also me: IM a SuCKeR FOr YOuuUu",en
820,Who knew we would be the most famous people haha  ,en
821,Well atleast they didnt have to spend the money on models lol,en
822,Simp anthem I love it,en
823,"This song Is a good one. It reminds all of us that we all Make Mistakes. It is a part Of the Human Race. It is the truth. No One Is Perfect. ""USCCB. ""St Mathew. Jesus Died for all salvation. We all are saved by him. Thanks, Jonas Brothers.",en
824,Who's here after 6 years??????,en
825,"Is it an ost for animation,i remember heard it first at hotel Transylvania but when i search theres nothing about it",en
826,we go together,en
827,Camp Rock 3 looks different,en
828,"This looks like the show ""you"" on season 4",en
829,just here igniting the jon bellion hype,en
830,"THEY WERE ON A BREAK 
“Ross’ Voice",en
831,Video musica jonas brothers,en
832,"Nobody:


Mosquitoes at 1 a.m. :- I am a sucker for you....",en
833,Why do I feel like one of the brothers is DNCE,en
834,They made a band twice without frankie(yes theres a 4th),en
835,My junk sings this song to my wife daily,en
836,just came here again after Danny’s video,en
837,youtube is telling me this was uploaded 49 years ago... cool! XD,en
838,Ahh my 9th! Not a Sucker,en
839,What a perspective,en
840,Disney Chanel has entered the chat ,en
841,Joe tied up tho,en
842,0:03 - for my personal use :),en
843,Top 10 Anime returns of all time,en
844,I love Sophie so much,en
845,im suprised no one mentioned the sucker parody by uts in boots....,en
846,"So wait, there's no vampire girl in the original?",en
847,Is this the Camp Rock 3 teaser?,en
848,Sophie Turner is so gorgeous,en
849,"Danielle, Sophie, and Priyanka own this video",en
850,Who's here after watching the halftime show?...,en
851,Love one they have wife in video that is amazing,en
852,#whereisfrankie if you know you're a true fan,en
853,Do a song together with Kylie Cantrell,en
854,I edited my comment so no one knows why I have this many likes and the comment section makes no sense,en
855,Video musical jonas brothers,en
856,a buzz feed quiz told me that I had to listen to this,en
857,The lack of anime vampire girls is disturbing...,en
858,The Boys married three super hotties !,en
859,"I feel the heat in december when u round me
Nick and Kevin got married in december",en
860,Im here for the Corgiiiis,en
861,NOOOOO BREAK UP RIGHT NOW IM GONNA SCREAM,en
862,it's been so long,en
863,There all grown up and still awesome From this 57 yr old woman ️,en
864,This is song,en
865,"Mosquitos:

im a sucker for you",pt
866,Here only for priyanka mam ,en
867,8 year old me is having an epileptic seizure,en
868,"this did NOT come out in 2019, it was like 2015 istfg",en
869,"What has the world come to. I miss old music videos. Older music. You think the Jonas Brothers had this ""cool idea...?"" 
No... it was the directors. 
They are trying to make disconnect the normal. So we can feel more far apart.",en
870,Where is the person who gives lyrics in the comment section??,en
871,“Ooo ima piss on ur pain but no but ima shoot a shoot a shoot a shoot a” or whatever jonas bros be sayin (without captions).,en
872,"No one:

Me: I’m a sucker for- SHANARI SHANARI OJOUSAMA.",en
873,"r.i.p for people search ""I'm a sacrifice you""",en
874,DNCE has left the chat,en
875,Here’s a little story I know: Ariana grande took pictures with you and gave advice for your music and here you are,en
876,I only saw Nick’s and Joe’s wife more in the entire video,en
877,yooooo all of their wives look so beautiful  its so crazy to see the jonas brothers all grown up now️,en
878,This was written by Ryan Tedder from OneRepublic,en
879,"SHANARI SHANARI OJOUSAMA
       - Some guy who wrote this song.",en
880,"And the times of this ignorance God winked at; but now commandeth all men every where to repent: (Acts 17:30)
Have mercy upon me, O God, according to thy lovingkindness: according unto the multitude of thy tender mercies blot out my transgressions. Wash me throughly from mine iniquity, and cleanse me from my sin. For I acknowledge my transgressions: and my sin is ever before me. Against thee, thee only, have I sinned, and done this evil in thy sight: that thou mightest be justified when thou speakest, and be clear when thou judgest. (Psalms 51:1-4)",en
881,"Where's the Disney logo, I feel cheated",en
882,He asked me if joe jonas and sophie turner are still dating?,en
883,This works.,en
884,I edited this so no one knows what the replys mean.,en
885,Take me away  I want  fly  away,en
886,Priyanka Chopra has more followers than all of them combined ,en
887,Sansa Stark is not in winterfell anymore,en
888,"Who's listening this masterpiece in April 2023
Thumbs up",en
889,Jonas brother,en
890,"I actually feel the vibe of BTS's songs more when you react to them
It's the vibe ",en
891,2023 is beginning in few minutes rocket,en
892,I'm a queen  king  or a he thing ,en
893,4 years ago today ,en
894,MICHAEL ANTHONY THEME MUSIC ..!!! KICK IT IN..!!! 2023...,en
895,Plz we need Jonas back! ,en
896,He is literally cheating on you at this very moment wake up and break up,en
897,wow i forgot about this,en
898,Had to come back here after seeing Fake Nick Jonas in Jumanji Thanksgiving,en
899,Ukraine army man ,en
900,Came here after that South Park episode,en
901,Who is here after watching them received Hollywood walk of Fame,en
902,Yeah I feel like I been  in a big fight but no,en
903,"""Hey look, it's that jumanji guy.""",en
904,They took on the sinical,en
905,Jonas Brothers  - Suckers,en
906,"One Republic stole this song and made their ""I ain't worries"" thinking we won't notice. lol ",en
907,"""
We change the weather!",en
908,Ppl really think no one can appreciate their wives without being forced to that’s why ppl in the comments saying their forced now men can’t even be nice without being made fun of,en
909,"So, I was watching this video reacting to Kings of KPop Super Junior (https://youtu.be/ypVF-R0MvtA?t=1390), minding my own business , when the guy mentions that a Super Junior song made him think of this song and I totally realized ""Sucker"" and ""Devil"" sound so similar. It's like ""Happy"" and ""Sucker"" were distilled from ""Devil"" or something. I mean, it wouldn't be the first time that the US ""borrowed"" ideas from another culture.  Now I have to go listen to ""Happy"" . . .",en
910,Nice house,en
911,What does iconic mean?,en
912,The international anthem of all mosquitoes all around the world,en
913,EAT YOUR HEART OUT JUSTIN BIEBER,en
914,"Im Here cos of some coments on super junior's devil video, now agreed that this sucker hv same vibe as devil",en
915,0:44 Even in that awful dress and weird headdress. Priyanka looks beautiful,en
916,noice,pt
917,Katherine Cajulao favorite song is Sucker it's remind me thinking about Robin Torres it's part of me about all my whole life with her this song for her,en
918,Courtney Hadwin - Sucker (Live Cover). Ela é mil vezes melhor,en
919,Why is Kevin (and now his wife) given short shrift all the time?  Hardly any screen time for them in this video. I think his brothers haven’t always treated him very well.,en
920,"Am I the only one who noticed ""SHIBARI"" here?",en
921,What is the place  called Like I  mean   were  they  sang  it ?,en
922,Joss nick priang,en
923,"Mr. Nick Jonas, Priyanka?! You’re the boss applesauce, you give people hope. Not that you don’t totally deserve her or whatever I’m just saying damn congratulations. Having said my disclaimer, a fun fact for you seeing as how you are now married to a Hindu woman. There is an awesome Hindu proverb that sounds a lot like the lyrics of your song. It says all paths ascending lead to the zenith, so it doesn’t matter which one you take as long as you’re ascending",en
924,they almost didn't showcase Danielle,en
925,"July 2022, I'm here!!!",en
926,Me who only came here to see Priyanka ,en
927,I wont this song only in my life for the contenswear,en
928,Oh my nick Jonas and priya,en
929,No hanging Joe he is one of three favorite Jonas brothers! ,en
930,Actually I came here to see Priyanka ,en
931,Hehe  I made it in my  castle.,en
932,ok but where's frankie,en
933,It's Pri buddy.,en
934,"Ramsay, NJ in the house!",en
935,"I gives me Portugal. The Man ""Feel It Still"" vibes. https://www.youtube.com/watch?v=pBkHHoOIIn8",en
936,Sansa on the weekend,en
937,This was in The Simpsons!,en
938,Freemason confirm but I still like the song,en
939,Replay button is crashed,en
940,I am seeing this video bcz of priyanka chopra,en
941,The queen in the north,en
942,Is this a Courtney Hadwin cover? Lol,en
943,Love the beautiful moment you sped with your wives but am little bit joules of Priyanka chopa ,en
944,It's 2023 any one with me?,en
945,Where's the kyun?,en
946,I m sucker for u sya why I need without me,en
947,For priyanka only,en
948,Jared dines,en
949,I found this song from a parody of tensura,en
950,isn't this set in enola Holmes 1,en
951,jonas brothers - soccer,en
952,Pretty ironic name of the song,en
953,SOPHIA TURNER ️,en
954,music for all those balls about to drop hahaah,en
955,I subscribe to you every single day and I started yesterday,en
956,Is that Chopra?,en
957,No cheetah girls no problem,en
958,Musica televisão tempo suafa 🇧🇷 filme completo dublado,pt
959,my jim teacher plays this,en
960,Got here because lanie gardener is going to hanging with you all,en
961,Big whoop ,en
962,"I never knew all the Jonas brothers were now married with children. I thought Nick was a deliberate bachelor, Joe was an unintentional bachelor, and Kevin was married but voluntarily childless.",en
963,this is cool and all but Triple Q's way better still,en
964,These wofes are crazyy,en
965,And you’re from Camp rock I know,en
966,Please let this clapping fad end soon!,en
