,comentario,liguagem
285,"Jk
I just lost my language.. Nothing to sayy.. Really proud offf youuu kookiee
I purple youu ",en
286,Desperately waiting for Jungkook's first solo album. Hybe is the worst company,en
287,SOLO!!!!!!!!!!!!!!!!!I NEED HIS SOLO ALBUM,en
288,Almost in tears,en
289,"EU GRITEI TANTO!!! Parabéns Jungkook, você merece tudo isso E MUITO MAIS",pt
290,Armies proudly say he is our bunny junkook ,en
291,this was awesome,en
292,"Jk your voice is so Beautiful and comfortable, love you so much",en
293,"All love to Jk and my mother too, She sings “Oh yeah” Canary islands,Spain.",en
294,He gives Micheal Jackson vibes here. So proud of jk ,en
295,Addiction to this Alghenba,en
296,Watching over and over again,en
297,Amor você ,pt
298,Jk is unbelievably talented,en
299,He is a ultra super kpop idol Jungkook ,en
300,Will never get tired of this performance .my king Jungkook I am beyond proud of you.,en
301,miss those days,en
302,He is so handsome,en
303,3:27 the best collab,en
304,Jk is best of universe ,en
305,I miss him so much,en
306,RESPECT!,en
307,He's so beautiful,en
308,Ele também canta muito bem Elisabete Gonçalves,pt
309,Lovely voice handsome ️️,en
310,"Jungkook x Calvin Klein men's wear.
so handsome and excellent singer JUNGKOOK !",en
311,I proud of myself because l am a BTS army girl ,en
312,"Damn, I miss this, SEAGAME at Cambodia was like a joke ",en
313,Also I never ever watched any opening video @ FIFA World Cup just only this vid :D,en
314,"""Please tell JK he is impressive"" -- Chris Martin of Coldplay                                                                                                                                 Indeed he is ",en
315,"100M!!! Well deserved JK. He really looks and sounds amazing here, Main Pop Boy for a reason ",en
316,"If the antis like your one-on-one song, you're perfect",en
317,Faz 5 meses mas não ficou menos impactante,pt
318,"literally WHO debuts as a soloist a the WORLD CUP?? only bts could do it.
jungkook, you did amazing <3 i still love watching this performance months later! we are so proud of you",en
319,the way jk hug him.I'm so proud of him......,en
320,It was amazing that Fahad sang the song in Arabic instead of English,en
321,Jk you are amazing  and I purple you,en
322,Thx Redone . Best musik best word cup 🇲🇦,en
323,Jungkook is the best,en
324,JK you are very talanted singer,en
325,Best Respekt to redone the Moroccan Producer of this Song and all Song of Worldcups  ,en
326,Look how far he has reached,en
327,My baby has grown up too fast proud of u kokkie ,en
328,"Our Golden Maknae, Jeon Jungkook deserves all the love, respect and appreciation for the effort and hard work he has put in the Fifa world cup song “Dreamers”. His performance was phenomenal as always. Every single minute was just mesmerising. The collaboration between Jungkook and Singer Fahad Al Kubaisi worked perfectly. Immensely proud of our Jungkook and what he has achieved throughout his 25 years of age. I love you so much, my precious Jungkookie.",en
329,Hi my name’s Mokshita and I proudly say that Jungkook is the best,en
330,"Congratulations for 100M 
Jungkook is the best performer of our generation ",en
331,"𝐃𝐞𝐚𝐫 𝐉𝐮𝐧𝐠𝐤𝐨𝐨𝐤 𝐚𝐧𝐝 𝐅𝐚𝐡𝐚𝐝
This was such a spectacular & phenomenal performance!! JK, as always, stunning voice. It's my first time listening to Fahad, & his voice is so pleasant!
Both of you, thank you so much, You conveyed the song’s emotion so clearly!️️",en
332,"100M coming up!!
What an amazing performance. <3",en
333,Let's go 120M for our extremely talented Jungkook ,en
334,"This song brings me nostalgia, i want to go back to the day it came out. I remember the emotion i had when i saw you on television presenting you for the first time in such an important ceremony, we love your effort jungkook.

- November 2022",en
335,4:32 THE DANCE BREAK!?!?!??? OMG HE IS INSANE FOR THIS,en
336,Congratulations Jungkook and Fahad for 115 million views! Well deserved for an epic perf! Shout out to the dancers and team!,en
337,"Translation of Fahd's part:
We dream that the world is more beautiful, we live with love, we gather, and our voice fills the world with love, and we join hands to raise and wave all flags, and we cooperate, create and achieve all dreams, and we do not give up, we challenge, we overcome all hardships, and we",en
338,"ARMY APOYEMOS A NUESTRO
QUERIDO GOLDEN MAKNAE
JUNGKOOK!!! NOS REGAL...",en
339,Whoever was in charge of appointing Jungkook to sing Dreamers — kudos to you. I honestly cannot imagine anyone else performing this.,en
340,"I'm so proud of him!! he was just a new kpop rookie, and now look at him performing a song for the fifa world cup, thank you for all the other army for supporting him and defending him, Jungkook keep slaying!!!",en
341,"I'm back here again to relive this moment! The way Fahad and Jungkook's voice melted together and made a masterpiece! Truly was a magical performance!!! I'm so proud of Jungkook! Can't believe he started in 2015 with 'no more dreams ' and now it's 2022 and Jungkook made it to 'Dreamers' , that too in FIFA 2022! Can't describe the feelings in words! Both of them deserve respect and love equally for this outstanding song and opening performance! My respect, love & Dua for both of them",en
342,"3:32 I am proud to be an Arab
Fahd and jk They made the best song and I loved that it carries Arabic words thank you jk",en
343,"VAMOS ARMY A CONTINUAR APOYANDO ESTA HERMOSA PRESENTACION DE JUNGKOOK EN QATAR 2022


100M!!!!!!!GO GO GO",pt
344,okayyy it is 5 months of this song nd i still stuck on this tahtt how muchh beautiful nd admiring jungkook is he slayyed,en
345,Popular opinion: Everyone wants this masterpiece to reach 80M!!,en
346,How many international fans are here? ,en
347,Vamossss q podemos por mSsssssssssssssd!!!!¡,pt
348,Great show  jk best,en
349,I LOVE 2:22 part and I'm gonna use this comment to rewatch it,en
350,Proud of JK,en
351,comeback for my popstar because i miss him,en
352,Jbh i didn't liked Bts because id their toxic fan but this. FIFIA 2022 IS INCOMPLETE WITHOUT THIS SONG. THANKS QATAR ️‍,en
353,"I like it very much, thank you",en
354,"Really, amazing",en
355,정국 (Jung Kook) 'Dreamers' @ FIFA World Cup Qatar 2022 Opening Ceremony,en
356,How many off you come to see this video again and again,en
357,Jungkook is the best,en
358,Love from Pakistan ,en
359,Many of us are here only because of jk️,en
360,Nota 1000 pra você Jongkoo foi maravilhoso Deus te abençoe sempre ️,pt
361,I am so proud of you jk,en
362,"Qatar world cup was the best & always will be,,,I'm sure",en
363,I love you jungkookie so so so much I love you then my self,en
364,army from 🇲🇨,en
365,Proud.of bts,en
366,How are you jungkook??We miss you,en
367,Jung kook I really want to meet you,en
368,sweet Beautiful Jungkook ️cute,en
369,I LOVE YOU JK,en
370,What kind of cameraman is this ?? He should have taken the most epic jungkook dance moves ,en
371,Bunny you do this amazing I    you ,en
372,"You are  brilliant Jung kook,,,,, ""7"" Bts  is my idols,,,,,  Bts please visit to the Bangladesh,,,, ",en
373,I Like you bts I wish I would come see this song again I Like this song and I am Yemen,en
374,Love Jung cook,en
375,"Junkook you are the best. I want to come in Korea because now you are in Korea but l am sad because jin and j hope go to military and my parents hate BTS and they are not letting me to go in south Korea because l am 11 years old and my parents also hate BTS l want to see you and live with you forever
I love you BTS ",en
376,"Jk, you are breathtaking ",en
377,look who we are,en
378,ARGENTINA CAMPEÓN DEL MUNDO PAPAA,pt
379,I am proud of you oppa we  love you and miss you oppa you are reason that i smile i dont have bfo sis father but i have you oppa,en
380,wow that folds,en
381,I LOVE JK,en
382,Still here for this and from this.,en
383,Its started from nothing to all...!!,en
384,Wow very nice dance I am fraud few  I am big fan ,en
385,Bts Ilford ,en
386,I just want to like this video gazillion times!!!!!!!!!!!!!!!!!!!!!!!!!!!!!!!!!!!!!!!!!!!!!!,en
387,best world cup Qatar,en
388,Fahad i'm proud of you,en
389,You are my dream!,en
390,There are rumors that he has agreed with the organizers to sing a song and South Korea will play football in 2022,en
391,You are the best,en
392,We are the dreamers,en
393,U are my son,en
394,Stream dreamers for 200 million officialy soundtrack on FIFA YT Channel : ),en
395,Wow I didn't know the middle eastern version The Michelin Man/The Pillsbury Doughboy made an appearance prior to JK coming on stage.,en
396,flfa world cup qatar 2022 is the best,en
397,I o v e From Bangladesh,pt
398,Bts my Jan,en
399,Jk proud of u man ,en
400,2010. Ceremony best,en
401,Respect... Oh yeah...,en
402,This song is for the GOAT messi wow,en
403,I love you very much for song,en
404,Anyone know what the English lyrics are to the other singer?,en
405,Dreamers,en
406,Only love…,en
407,Junkook can you call me ,en
408,I'm afraid I don't want to get attached to BTS.,en
409,My cousin is a dancer there ,en
410,Hello I'm from Bangladesh ,en
411,"Faz anos que não o via, ele mudou muito. Parece que desafinou na nota longa. Espero que o álcool não acabe o com a bela voz dele.",pt
412,Bts my Jan,en
413,Who is listening this masterpiece in 2023?,en
414,The Arab do the best World Cup ,en
415,I like full dress hairstyle evrething nice so handsame,en
416,Love you,en
417,"This song's beats are quite  similar to the song by pop king Michele Jackson song "" they don't care "" ( Brazilian version )",en
418,"where are you, i miss you):",en
419,I am watched fifa for jk,en
420,Crying,en
421,BTS PAVED THE WAY,en
422,Sweet and Bts The sweetest band in the planet is Blackpink ,en
423,New  follow,en
424,I'm sorry your Jungkook-Shii song was used in the advertisement of the white party,en
425,Who’s here listening in 2023?,en
426,Dance smaphore,en
427,"0:10 to get the new ones from last time reply mail sender 
Ok let me know 0:52",en
428,Muslim and christion best relationship,en
429,"We apologize for the advertisement of the AK party.
We apologize for the advertisement of the AK party.
We apologize for the advertisement of the AK party.
We apologize for the advertisement of the AK party.",en
430,I hate BTS but this this time junkook was fire ,en
431,what happend there?,en
432,In this song there is no any word about the occasion or country like waka waka song.,en
433,Oi,pt
434,Yo,en
435,We apologize for the advertisement of the AK party.,en
436,Best part was when the arabic guy came,en
437,how much money do you think they paid him to perform this?? what a sell out,en
438,A Muslim in the vid?!?,en
439,Bts is overrated,en
440,"for football fan that is very bad
and terrible",en
441,"for football fan that is very bad
and terrible",en
