,comentario,liguagem
186,Really good song,en
187,LADY GAGA REALLY HAVE THE VOICE THAT WAS SO GOOD TO HEAR,en
188,"When I heard the song first, I wasn't sure how it was going to fit with the movie. But after watching Top Gun Maverick, I can clearly say that this song completes the movie.",en
189,"God,I can so relate to these words. I know Maverick's tears. I know the pain of regrets.  I have thousands of my own. He killed his best friend, I wasted a life on drugs and alcohol. Lady Gaga,I hear your words. Lady Gaga, I see you.",en
190,The greatest summer hit associated with music video in the history of music.,en
191,Never been a lady Gaga fan but then I heard this. Jesus Christ she can sing. The vocals in this is incredible.,en
192,Launching above an annihilation of vissitudes with a billion points of light creating one beautiful song.,en
193,This song is just a wow. I've been waiting for a new song and as usual she's amazing. I could feel this song and her voice in my skin. That's all I need.,en
194,Hold My Hand é incrível,en
195,Não poderiam ter escolhido melhor cantora pra esse filme. Bela combinação.,pt
196,Linda música!,pt
197,this woman has not just the song. SHE OWEN IT,en
198,"Just lost my 2 mo old grand daughter. Dedicated this song to my daughter. I was that younger Maverick type, but matured after all my shenanigans. I miss you Adeline! And love you Cassie!",en
199,Powerful song .got nostalgic about the 86 piece . Thank you lady gaga for this blast.,en
200,A song for my bestfriend. I won't let go 'til the end. I know you're scared and your pain is imperfect. But don't you give up on yourself. #05/10/23,en
201,Lady Gaga perfeita como sempre ,pt
202,Gaga you blew that out the water you are such an amazing talent!!!!!,en
203,Amazing song and movie ,en
204,This movie is a masterpiece. It is greatly more than the sum of its parts.,en
205,"Como esse filme nao ganhou o oscar...É perfeito o filme e a
Lady gaga cantando musicas assim",pt
206,Lady Gagas voice sails across the midnight skies with the centrifugal force of the Green Comet singing loud wide sonorous concentric rings around Jupiter Mars Saturn and our own lovely planet called Earth,en
207,This song really captured the essence of the whole movie. Simply goosebumps at the end.,en
208,"My dad was once a soldier. Rest in peace dad, I miss you",en
209,J'adore ,pt
210,What a beautiful voice and video! WOW! Truly beautiful voice! She has a beautiful voice!  makes you cry  truly beautiful! Moved me to tears !! A masterpiece of music! Oh my goodness speechless ! Tears flowing ! Greatly moved inside.,en
211,This song just proves yet again that Lady Gaga’s true calling is contemporary music. This is definitely going to be a strong contender for an Oscar. It’s a classic Gaga ballad. It’s so powerful both vocally and lyrically.,en
212,Voce é linda e maravilhosa adoro suas musicas,pt
213,"1:59 this part and also 3:07 this part are legit bad ass music video shots. So damn good, and a really great song.",en
214,"This song reminds me of my grandma, she went into a coma bc of a tumor and when I held her hand to tell her that I was there for her, she woke up and told me how much she loves me. She fell asleep again, and 3 days later she pass away. The first time I hear this beautiful lyric the first thing that crossed my mind was that moment 13 years ago, tears started coming down, even writing this comment makes me cry. I miss my grandma, she raised me since I was a baby. She raised me as her child, she was my mom, and to this day is painful not to have her next to me. I wish I can hold her hands again. Lady G you did it again ",en
215,Love this song so much ,en
216,"Voa Gaga, voa mulher! Talento impar, cantora, compositora, performance, empresaria, uma lenda, um ícone de uma geração! Grato por poder viver no mesmo tempo que essa mulher!",pt
217,TOP GUN hoje o agora e sempre Top Gun !!!,pt
218,"As vezes, temos que voltar ao passado,pra consertar o presente, só você sabe do que você é feito.",pt
219,I didnt see the movie but Lady GaGa singing makes you feel what it was all about. She wrote the music the lyrics then sang it beautifully with powerful heart felt emotions. Iam always amazed by her ranges of talent shes a total package & a gift to this generation & all her fans. Madonna claimed Lady GaGa is jealous of her & copied her but she only said that to draw attention to herself. Shut up Madonna it's over go home. Haahaaahhaaaaa Haahaaahhaaaaa LOL wasn't enough.,en
220,"Who would have ever imagined a second Top Gun would come out with Tom Cruise flying in it almost 35 years later. Why is it movies today can’t hold up like this one, they had to make a sequel to make an awesome movie. The 80’s kicked ass!",en
221,This song makes me cry almost every time. What a voice and what a movie.,en
222,"imagina ela cantando isso num estádio, imagina isso no palco do Oscar ano que veeemm!!!!",pt
223,eu estou tao apaixonada nessa musica ,pt
224,"I gotta be me

Gotta be I

Gotta be who I know I am inside

Can finally breathe, taking it in, look at me flying!",en
225,You've done it again Gaga. You and your music are both stunning and powerful and it looks like you'll be getting awards for this song too. Love it!,en
226,"My boyfriend is in the marines, I had to say goodbye to him last night because he is going on a 6 months long business trip. I have been a fan of Gaga since who knows when, seeing this music video today is honestly so cool. Thank you gaga, this made my day better. (:",en
227,pure     stunning     vocality,en
228,What a song!! Good enough to hear it,en
229,"Ballads are not as common today as they were 30 years ago, but definitely a throwback to an earlier era. Great song and great movie!",en
230,"After years of playing.. Ehm.. Something.
Brilliant performance. Well done girl.",en
231,"I had this as my first dance at my wedding. I have been in a bad marriage before and the man I married has held my hand every step of the way from ups and downs, depression, illness and just life itself. Life had beaten me down and I finally found that special someone to ""hold my hand"".",en
232,Best music of lady gaga,en
233,I love this song....ga ga is the best,en
234,The energy level!,en
235,"I watched TOP GUN: Maverick yesterday and you set the tone for the movie. Top Gun fans are so grateful that you've made such a nice song, for sure. Thank you so much. Regards from Brazil!",en
236,This was definitely a grower for me. Love it!,en
237,"I love Lady Gaga's music, I haven't been a fan of Tom Cruise for a number of year due to his attitude, BUT I think I may have to watch this movie, LOVED the original.",en
238,"Eu sempre soube que atraz  daquela mulher forte existia um anjo,, um sentimento verdadeiro,, um sentido de vida diferente,,, romantismo puro",pt
239,"I won't lie, I'm not a fan of Gaga, but this song is awesome, and I love the 80s feels",en
240,"Já quero uma apresentação ao vivo dessa música, já quero ver ela destruindo e botando pra quebrar com os vocais poderosos dela  RAINHA LENDÁRIA",pt
241,"J'adore ! ! !
Continue ma belle",pt
242,"I will be totally honest here . When I saw that Lady Gaga was doing the music video for a Top Gun movie . I swear I thought she was somewhat selling out . Since it seem very different from her past work . Bad Romance, Born this way , etc . But after I heard the song and saw the movie and video … I totally get it!! It’s powerful , not for what it looks like. But it represents. I’d say it’s some of her best work now.",en
243,"The music is so great, thanks for sharing it with us, love you! Wishing everyone a happy working day and luck",en
244,An amazing song for the true best picture of 2022. love Gaga. Love Top Gun Mvearick,en
245,Lady Gaga is so amazing. She should had won a Oscar for this song. She is so talented.,en
246,"Lyrics

Hold my hand, everything will be okay
I heard from the heavens that clouds have been grey",en
247,Love love love Movie and soundtrack ,en
248,Hold My Hand is one of my FAVORITE SONGS!!!,en
249,"Gaga, porque você insiste em me  destruir assim? Que voz, que talento, que ícone, ELA É O MOMENTO, QUEEN GAGA ",pt
250,"I suggest you listen to this song after watching the movie, it's really touching",en
251,The 1st time heard this song is on my friend’s funeral. I can’t listen to this song without crying since.,en
252,This song is absolutely brilliant. I'm hooked. I love listening to it full blast on My TV well done all involved. Not seen the latest version of top gun but I will do.   This song is best I've heard ever xxxx,en
253,Another Masterpiece By The Legendary Lady Gaga. The song this world needs in these bad times. Thank you Lady Gaga for holding our hands and never letting go.,en
254,It would be an epic faux-pass for me not to recommend a bilateral re-release of both versions of this song.,en
255,"Estou chorando até agora! Lady Gaga sempre se reinventando, sempre impactando o mundo da música, da moda, dos cinemas agora...ela FAZ TUDOOO! Estou impactado até agora com esse clipe! Clipe, música, perfeitoooos!",pt
256,One of the most best songs that woke me from a fall ..rise and concor defeat....ur #one,en
257,Que venha o 3 saga ,pt
258,Rainha absoluta das Trilhas Sonoras. Disparada a melhor performance para filme da década. Não tem ninguém melhor que ela.,pt
259,"LOVE EVERY WORD IN ALL YOUR SONGS TRUTH,REAL AND DEEP.CUTS ALL bad AND bad ceaces to exist.",en
260,This is just EPIC ! ,en
261,"Hold my hand, everything will be okay
I heard from the heavens that clouds have been grey
Pull me close, wrap me in your aching arms
I see that you're hurtin', why'd you take so long",en
262,Holding firmly the keys to the zone Lady Gagas music deploys through oceans of emptiness unblocking airspace boundaries forging ahead into limitless innerspace outerspace and cyberspace,en
263,"Lady Gaga is at the best moment of her career. These past 5 years she has been doing nothing but epic, thrilling and shaping career-wise moves. She's legendary.",en
264,"I love this, and this film not only for probably being better than the original, but because it made me feel like I was back in the 80s again.  Where everything about movies was powerful, and mattered.",en
265,WOW. Beautiful movie and beautiful sond. Congratulations both of you!,en
266,This song makes me cry I love it so much you are awesome,en
267,"This is one of the legendaryest song of all time, really🥹",en
268,"Essa música não substitui a clássica, ela auxilia a deixar mais inesquecível ainda. Amei a pegada anos 80.",pt
269,"God, she so looks so gorgeous  not talking about her pure talent and personality... i love her from bottom of my heart",en
270,"amo Tom Cruise, amo Lady Gaga",pt
271,"Are you listening, Hollywood? More of THIS please.",en
272,This is pure art..,en
273,"Gaga, agradezco tu exisencia",pt
274,"I’ve heard this a couple times on the radio and such, first time proper hearing it and watching the video.
It’s such a powerful performance I’m so close to tears in amazement",en
275,"Tell me you need me

Hold my hand, everything will be okay
I heard from the heavens that clouds have been grey",en
276,Hold my hand everything will be ok ,en
277,"Lady Gaga gives us a night-sky filled with swirling ultramarine and cerulean blues, thio-violets, glowing orbs of cadmium yellows and zinc white, trees of viridian, hills of rolling cobalt, hints of a church in the distance, thatched roofs of raw umbers and sienna, and a ray of sun-flower shining out the window.",en
278,"The best, only the best️",en
279,Gaga sempre dá um jeito de ser incrível ️ essa mulher é impecável.,pt
280,I love it girl.. wanna sing with my guitar... Sounded weird... I'm not erasing it though... Because they're Soo many songs I've not put words to... It's coming. I'm outta Shell now! Thank you,en
281,Eu amo esse clipe da Gaga ,pt
282,Lady Gaga Astaired her way up the stairs of Shakespeare to a thunderous Applause!!,en
283,And if all the world is a stage; Lady Gaga most definitely deserves the prestigious EGOT,en
284,I was a Teenager with Topgun1 and now Topgun2 - i love the Movie and Lady Gaga's Songs,en
285,Ela não precisa mais provar nada pra ninguém. Ela é ARTISTA! Entrega tudo! Perfeita em tudo que se propõe ️🇧🇷,pt
286,Trilha filme tudo de bom!!!!!,pt
287,Congrats 200M on Spotify!!!,en
288,"What a wonderful woman, I admire",en
289,My fiance wants to play this at our wedding because her father died before she was born and she wanted to give him a mention at our wedding.,en
290,"Has anyone else that has commented on this song actually praised the P-51 Mustang Fly by when Gaga is on top of thr Piano.

That Pilot is seriously hauling ass, at low level, with a full bank of Left Turn to port on and that Merlin Engine giving it everything.",en
291,"Lady Gaga is just like fine wine, gets better with age - incredible.",en
292,te adoro gaga ,pt
293,"Lads and gents..this is so amazing song,that i dont know if i heard better emocional song ever..brilliant",en
294,Im sure there is some divine reason that as I was slippin into a meditative state i suddenly needed to hear this.,en
295,Hold my hand this touched my heart  it is a great song,en
296,"Tell me you need me

Hold my hand, everything will be okay
I heard from the heavens that clouds have been grey",en
297,Gaga NEVER EVER DISAPPOINTS!!! Yet another great song from her.,en
298,"Lady Gaga is a MAVERICK, a LEGEND, and yes, a ROCKSTAR!",en
299,"Lyric:

Tell me you need me
Hold my hand, everything will be okay",en
300,Damn what a powerful voice!,en
301,Heard that Song right Now.  I love IT.,en
302,"The quality that Lady Gaga brings to the table is shocking - she delivers in spades. Over the past 24 months of the pandemic, my respect and appreciation for her work and contribution to entertainment has skyrocketed. I've watched TopGun so many times that I never get bored, and TBH I never thought I'd never expect a sequel - and this song for it...Wow!!",en
303,Why I feel so emotional and awestruck when it comes to the two Top Gun film. Great story and movies.,en
304,omg i really love this songggg,en
305,"My Lady, you are the best!",en
306,"This Tuesday, March 28th, is a very special date, the Birthday of Stefani, who 37 years ago was presented to the light of this world, to later, like Lady Gaga, illuminate the lives of millions of people around the world with her own light, coming from her talent, effort and dedication as an exceptional artist that she is.
Still so young and with so many memorable accomplishments, in music, cinema or philanthropic actions that she has helped so many needy people.",en
307,Great movie and this song is perfect for it,en
308,I got goosebumps listening to this powerful song.  Lady Gaga is absolutely one of the best in the business.  Her voice is amazing and so powerful.  And she’s just so beautiful!! She has all the goods.  I can listen to this song over and over.  It’s the perfect song for Top Gun too!!! Just has that feel.,en
309,Love it ,en
310,"It’s more than a song, it’s a poem. It’s a love letter. It’s an apology. It’s what can get you out of life’s setbacks. Knowing that this song exists in a world where these days. It’s all about themselves. This just tells you, someone. Stranger, the person who just lets you in traffic cares!! The world can offer something at times",en
311,This is a classic already,en
312,This was my deceased wife's favorite song. Good times,en
313,"Such an amazing Artist, I love you ",en
314,At 3:05 the goosebump-o-meter starts to red line,en
315,"That flyby on the runway was amazing, I watched it 100 times!",en
316,Very nice song!!!Love you,en
317,"So incredibly powerful, soulful voice. It gave me goosebumps.",en
318,Rainha ,pt
319,"“I heard from the Heavens” God never disappoints , I trust him because He never let my hand go ️ He signs to Me  Bravo Lady Gaga ",en
320,"My mom was in the air force, she did medical work but I know she really loved it and that's where she met my Dad. 
They were married for a long time but eventually divorced but they never stopped loving each other they just needed to go their separate ways. ",en
321,"God this song  Is everything,  It excites you and your skin being  to hurt, it brings out all  your feelings on the surface. I  never get  tired of listening or watching the vídeo. @LadyGaga  #HoldMyHand #TopGun 🇱🇷",en
322,Should have won the OSCAR FOR BEST SONG.,en
323,"This song helped get rid of my depression. But “Clover Cage - Learning To Love Myself” helped to save my life in a way I can’t put in words, you just have to hear it for yourself. I just want to send love to everyone and I want everyone to know things will get better. We are in this together..I love you ️",en
324,"What a nostalgic vibe this song gives... and at the same time, a willpower feeling that I cannot explain. ",en
325,Great artist ,en
326,perfect song,en
327,I will use this song for the contest.  You encouraged me pls .  Love your voice  love you being you. I love you my Gaga ,en
328,"Wow, this is my new favourite song, gives me chills. It’s like an 80s ballad made for the 21st century ️",en
329,"Your song, give me a reason to go a head Thank you ! YRA, ZAGREB, CROATIA",en
330,Música linda demais,pt
331,This and always remember us this way is a great back to back combo if your sad,en
332,"I love everything about Gaga. Her compassion, empathy and genuine concern for others is so good to see in someone who has “made it.” She does not forget where she came from and the struggles of life. Thank you, Gaga, for your passion. Your music, acting and grace are greatly appreciated by this 62 year old woman",en
333,"Hold My Hand (lyrics)

Tell me you need me",en
334,this Oscar-winning film was everything for his career,en
335,This woman can do no wrong! ,en
336,"Just as epic as Take my breath away in TopGun.
And yes....it happened again.....",en
337,Lady Gaga! What a beautiful Song  I  lt!,en
338,"I went to see the movie last week. As a fan of 80’s pop culture, I was quite surprised how a sequel 36 years in the making slightly justified itself. When this song was playing at the end, my dad got misty eyed. He watches the first Top Gun almost every time it’s playing on cable.",en
339,Some time we only need someone to extend a hand to us. And when the extended hand become a holding hand life is a little easier. Tnx lady g for the music that is your extended and holding hand.,en
340,My Mum and I wanted to see the Movie together....but unfortunately she left my side on 7th April 23 forever. Too early. So this Song means a lot to me now. Mum I promise I will watch the movie with you by my side. And I promise I will hold your hand forever until we see us again. ,en
341,Legend an angel when she sings from the heart,en
342,Um ano dessa música,pt
343,"Lady Gaga, uma artista de múltiplas facetas e talentos. Certeza que quando nasceu os anjos gritaram ""ARTISTA"" para ela. 
Me arrepiei todo vendo esse clipe, e agora estou morrendo de vontade de ver o filme.",pt
344,This video is beautiful like Lady G. I's magic for my ears everytime i ear this song,en
345,It's incredible !! The vibes are just out of the world !,en
346,"When the movie has magic, it doesn't need awards! This movie is a gift to us and our kids.",en
347,Happy 1 Anniversary! #HoldMyHand,en
348,"When you think she’s done, there she’s coming back, stronger and more powerful than ever. I’m in love with this song and video. ️",en
349,"Gaga is a true person, this is the real thing.",en
350,I fight tears when this song is playing,en
351,Fui no cinema agora e todo mundo se emocionou com essa música. Merece o oscar,pt
352,"THIS MOVIE WAS SO INCREDIBLE, AND THE SADDEST PART, IS THAT I REGRETTED NEVER WATCHING THIS IN THEATERS WHEN I SHOULD HAVE",en
353,I always love Lady Gaga EVERSINCE ️,en
354,simply beautiful song .. God will never let go of you .. trust Him ..,en
355,"Gaga é uma ARTISTA de verdade, a prova disso é a felicidade de cantar em qualquer estilo",pt
356,I love this,en
357,Great song,en
358,"Música foda e filme maravilhoso, ZERO lacração!",pt
359,"Hold my hand, everything will be okay
I heard from the heavens that clouds have been grey
Pull me close, wrap me in your aching arms
I see that you're hurtin', why'd you take so long",en
360,She’s an absolute legend.,en
361,Finally a song of hers that I like.,en
362,"I am 59 years old annd grew up with legendary rock greats, and if anny of the currrent arrtist would be considered to be in the legendary status I would have to say Lady Gaga is one of the best for such a position in life with her song writing to her performances tto her variances inn styles from songs like bad romance to her songs from a Star is born and top gun, and even her covers such as  edge of glory as for her voice awesome lower register sweet and sultry and her highs are the dreams of many great artists. and ti top it off she got some really nice tits lol",en
363,"Lady Gaga and 
Jennifer Connelly has the girl next door looks that all us guys fell in love with in the eighties and early nineties that we still are attracted to now",en
364,Should have won the Oacar but as usual Hollywood has to make sure to check of some boxes to make themselves feel better and prove to themselves that they are better than they really are!,en
365,3:07 goosebumps every damn time,en
366,"voz, melodia, letra e vídeo incrivelmente perfeitos!!! Gaga, você sabe que venceu ️️️️",pt
367,"Respect for Hans Zimmer spirit.
And for bass voice lady Gaga.",en
368,"I'm going to comment here. When I grow old, I will tell the next generation, this is the song of our generation.  from BANGLADESH",en
369,They literally couldn't have chosen a better artist for the job. This song just gives me the chills <3,en
370,It's easy too sing about but unless you have served this country you Don't understand the loyalty of a brother or sister you don't know I thank you all for your service to our country,en
371,Gaga is a beautiful person because   has dedicated a song to her best friend that has a cancer.,en
372,"To the person at the Oscars,that made Lady Gaga change her lyrics to not include the part where your prayers will be answered just let God whisper how... I feel sorry for you,Lady Gaga must have gone through a internal battle to agree at the very last moment to preform but God knows. Stay blessed and keep Him in your songs.",en
373,She opened It UP!!!,en
374,This movie deserves to be nominated for an Oscar and this song deserves to win a Grammy!!!! Well done!,en
375,still can't believe this didn't win the oscar for best song,en
376,Very Big Sound !!! Greetings from Swiss!!! LADY GAGA MAV.,en
377,"Hold my hand, everything will be okay
I heard from the heavens that clouds have been grey
Pull me close, wrap me in your aching arms
I see that you're hurtin', why'd you take so long",en
378,LADY GAGA IS MOTHER OF THE MULTIVERSE,en
379,"I'm not even a GaGa fan,  but last year, my dear wife passed while holding my hand.  After hearing this extraordinary song, I cried hard for 5 minutes.  Thank you Lady Gaga!",en
380,A beautiful woman to match with an incredible voice!,en
381,She's the real deal!,en
382,"I love Lady Gaga songs but my favorite is Shallow,Alwais Remember Us This Way and Hold my hand",en
383,"When the P-51 made that low pass, it gives me chills.",en
384,Best song!!!Love you,en
385,"Quando escuto Lady Gaga me da vontade de viver,ela nos ensina a nunca desistir,mano essa mulher é incrível",pt
386,"Hold my hand, everything will be okay
I heard from the heavens that clouds have been grey
Pull me close, wrap me in your aching arms
I see that you're hurtin', why'd you take so long",en
387,Lady Gaga can't wait for you to come to Milan for a mega concert,en
388,This song is from top gun two that I saw with my girlfriend twice babe and now I have it on dvd to watch again,en
389,This song is really special to me. I miss my dad a lot.,en
390,This is brilliant now but will 100% be an absolute classic in 30 years time. Perfect for the movie,en
391,My Dad is my hero! I won't let go of him!!!!,en
392,Did anyone else cry when this song came on in the movie. What a fantastic score and a wonderful movie.,en
393,This is the first time I've seen Gaga appear in a normal dress for her song.,en
394,Amo essa música és muito linda ,pt
395,Love Lady gaga,en
396,"Rainha do Pop, do Jazz, e das Trilhas Sonoras!!    ",pt
397,"Gaga, Jet Fighters and the Sound of Merlin Engine ..what more could you want ",en
398,Never really cared about lady Gaga but she was great in this video and song,en
399,But only does this song really make me cry?,en
400,Lady Gaga I absolutely believe one million percent that you heard from the heavens,en
401,Eu fiquei todo arrepiado com essa música  Lady Gaga sempre serve nas trilhas sonoras,pt
402,Until today i cannot believe this song did not win the oscar,en
403,Lady Gaga is Mother of the Multiverse,en
404,"I`m glad that Lady Gaga did this song. It fits her 100% ! Incredible song, incredible voice ! One of the greatest movies ever !",en
405,"Eu sou brasileiro me chamo Felipe,eu amo lady gaga eu amo os norte americanos ",pt
406,"How in the WORLD did a generic Indian song beat out this song for the Oscar?? This song is EPIC and Oscar worthy! I cant help but wonder if Hollywood was backscratching Bollywood, possibly for favors (cheap filming locations).",en
407,Every thing will be okay ,en
408,"Not gonna lie, almost cried when this song began to play, I will never regret watching Top Gun on a movie theater, the last act got me strapped to the seat and my eyes glued to the screen! One of the best movies I have seen in years!!",en
409,"a really great song by the lady family, love her so much",en
410,The best,en
411,This song is a cascade wave of showering starlight,en
412,"Lady Gaga é única, a artista mais completa",pt
