,comentario,liguagem
0,"My dad was a fighter pilot. Has Alzheimer's, can't remember what he had for breakfast but he can still tell me in detail about the planes he used to fly. I love you, dad",en
1,"I wasn’t a huge Lady Gaga fan, but I’m a fan now, she hit it out of the park with many generations here! Absolute beautiful voice! Salute🫡",en
2,"Listening to this song several times over I’ve realized she is talking to a war hero with heavy guilt in his heart. As a retired soldier I appreciate this song and it makes me cry, because my love holds me and comforts me in my times and that’s what she’s talking about in this song. Love it",en
3,"What a movie, what music... everything perfect, this movie brought back a part of what was good in the 80's and showed that nowadays we can still have good movies and amazing music!",en
4,I love this song so much ️️️️️️️️️️️️️️️️️️️,en
5,"My dad really wanted to see this movie. He was I’ll with cancer and every time I visited him we would watch the movie trailer. Sadly, he died before the movie came out and I had to see it without him. I took a picture of him with me when I saw the movie and I know he was with me in spirit. This song and the movie are emotional for me because I’m reminded that I lost my best friend. Great movie and great song! Thank you Tom and Lady Gaga for this!",en
6,This song has 80s and 90s vibes. It's so nice to hear. Thank you Lady for singing this amazing song,en
7,"Good to see Artists in 2023 still focus on good melody, power vocals and nostalgic scoring. Gives us hope",en
8,"Wow. This song, “Hold My Hand”, playing behind the movie clips in this video, adds an incredible emotional aspect to Maverick’s background.  He’s been told that he’s a “has been” and washed up, that the future is coming now and he’s not in it.  It’s been decades since he was in his glory at Top Gun.  Washed up vets, like me, at 71yrs old, identify with Maverick.  Lyrics like “don’t give up on yourself”,  “tell me that you need me”, “I won’t let go till the end”,  all belt out encouragement to him with extraordinary power.  With a song like this, pulling behind him, he has to “bring ’em all home alive” from his incredible mission.  Over 177 million viewers have watched this video because of the personal impact on themselves and  on this movie.  The perfect song for the perfect movie.",en
9,She is such a phenomenal talent is so many categories.,en
10,NO MISSION IS TOO IMPOSSIBLE FOR LADY GAGA,en
11,"This definitely feels like one of those 80's power ballads. Another classic , Gaga.",en
12,I adore this woman... She is so genuine and perfect in so many ways!! This song gives me big goosebumps and my heart is full of sadness and happiness at the same time. I understand too well these words... I cried when I read the lyrics and heard and singing the song with our Lady Gaga. That is so powerful!!! Thanks again for this masterpiece darling!,en
13,I feel like this is her best song. It strikes right in the heart and there is something really special about the whole song!!,en
14,"Que música FODAAAAAAA, Lady Gaga arrasando como sempre que voz é essa DIVAAAAAAAA",pt
15,"I’ve been grieving the sudden death of my mother so hard for the last 10 months. When I hear this song, it paints a perfect picture of the support I wish I had during this time. I have lots of love around me, but people just don’t know how to hold your hand and not let go until they understand",en
16,"Gaga is no one to mess with, give her just a piano and she'll make history. Her voice is such a powerhouse!",en
17,"I’ll be the first to admit I am not a big Lady Gaga fan, mostly because I’m just not a fan of the music in general. That said, I will give credit where credit is due, this is an amazingly beautiful song, a perfect song for the movie; and I loved the movie too. Very well done.",en
18,This was the last song I sang to my husband before he passed. We were both crying . Now I cry everytime I sing it. He passed from cancer last Aug.,en
19,This song will always have a place amongst the firmament,en
20,Amazing. I get goose bumps. So deep and sung with a great voice.,en
21,"I lost my brother in two days ago, he passed away with cancer blood but I still remember he showed me this song...",en
22,"It's like with every record she releases, her voice gets better. Lady Gaga is quite underrated as a vocalist. She's literally one of our bests now......",en
23,"I have never been a lady Gaga fan, because I really didn't know who she was. But after hearing this beautiful lady sing I am now a fan. She can sing great and I love to hear her voice.",en
24,I love this song. its so powerful and motivational! ️️️ thanks lady gaga!,en
25,Her voice is on another level I love it this song is amazing,en
26,I've heard this song soon a 1000 times. It will never grow old on me. Just love it sooooo much ,en
27,O mundo precisa de mais músicas assim ,pt
28,"This song hits way outta the park, so genuine, a river of gold. Perfect timing and collaboration.",en
29,"Beginning with the background murkiness of Van Gogh's The Potato Eaters, Lady Gaga is the center of a Symphonic-Art-Majored ensemble of perfection while her most eloquently melodious rich truthful voice paints a tsunami of color with a tidal-wavelength of texture ever seen anytime anyplace anywhere",en
30,"I get goosebumps every time I hear this song, respect Lady Gaga.",en
31,"After having seen the movie for the third time tonight (first time outside the theater) and having listened to this song numerous times, it still touches me like only few songs can. Reminds me of the better 80ies power ballads. Lady Gaga's best work ever, as far as I'm concerned. P.S. I'm not the emotional type normally, but somehow, I got a soft spot for this particular song, don't know why",en
32,I'll always leave a light on for Lady Gaga.,en
33,I'm still so obsessed with this song! A masterpiece indeed Gaga  x ,en
34,Lady Gaga is so versatile. Love her voice.,en
35,Lady Gaga's voice dances gorgeously around the notes and chords on the musical page sculpting colors of emotion known and unknown on any music chart or color wheel,en
36,One of the most talented women this planet has ever known has her 37th birthday today. My forever idol and inspiration. Happy birthday Lady Gaga! ,en
37,Lady Gaga can sing this to me everyday for the rest of my life and that'd be my only dream come true.  I'd be happy to say the least!!!,en
38,I love this I mean I love it so so much ,en
39,Wish I could have a chance to see her performing in a live concert.  Hope she can start global concerts.,en
40,Perfect song to end the movie on! Walked out of the theater with such a big smile on my face. Now I’ve got this on repeat!,en
41,"Lady Gaga is one of the most talented artists of our time. When she drops a new single, or album, I strive to memorize it. This song however, creates a lump in my throat, and tears in my eyes...it resonates for tragic reasons with someone I consider a friend...it's beautiful and morose. It, and she, is wonderful. Keep it up, Lady Gaga. We love you.",en
42,I love this song it reminds me of when my dad passed away in my house after having a heart attack but I never let go of his hand ,en
43,This is by far one of her most magnificent songs.,en
44,I wish Gaga could hear me sing her songs. We literally have the same voice and I feel like I wrote them with her. when she drops tracks like these that you can belt out!,en
45,Maravilhosa!!! ,pt
46,"Voa Gaga, voa mulher! Talento impar, cantora, compositora, performance, empresaria, uma lenda, um ícone de uma geração! Grato por poder viver no mesmo tempo que essa mulher!",pt
47,essa mulher é talento puro ️,pt
48,"This woman's talent is unmatched.  It's just simply wowzer wow beautiful.  It's just like ,it's so good you can't hardly believe it!",en
49,Nossa me arrepiei e chorei  com  aentrega desse clipe e com a música,pt
50,Filme espetacular e a música um verdadeiro show!!,pt
51,"Absolute masterpiece! Never imagined Gaga to compose for this film, but she set the bar high for action movie soundtracks!",en
52,Quase completando 1 ano que eu assisti esse filme maravilhoso e essa música Maravilhosa ,pt
53,Amando cada dia mais #LadyGaga ,pt
54,"Brilliant performance of music, film and clip. Perfect work set. It could only be a Top Gun.",en
55,This song earned the Oscar fair and square. What an amazing listen!,en
56,"Even as an older person,  being a husband of 25 years and have raised 3 kids. My wife and I fell in love with this young lady and her music after we seen ""A Star is Born"". She is a real gift to this world with the music she creates. My wife and I love to watch her sing. She makes it look so effortless just as though she was just breathing. We especially love the respect she ALWAYS shows her mother and father, no matter where is at.  Ms. Lady Gaga   ""My wife and I pray God gives you a handful on purpose and that you have your every hearts desire.""",en
57,Gaga has an amazing voice.....almost as compelling as the sound of the Merlin engine in the p-51.....almost.,en
58,One of the best songs of all time. I love it  I'm obsessed with this wonderful song ! I listen to it all the time! Words cannot describe how grateful I am for this masterpiece.  Thank you so much Lady Gaga ... Greetings from Italy ,en
59,This song is everything to me  forever memories of such an epic night ️,en
60,Wow that was moving & beautiful I didn't just hear it I felt it.  Shes a rock star ,en
61,Man. This song and Top Gun: Maverick are simply works of art. Just incredible.,en
62,"This song should've won the Oscar, it was miles and away better than all of the competition.",en
63,...I´ll always remember my first love ..this song is magnificent,en
64,"Or indeed, if Cynthia Germanotta were watching, she might say, ""Give my daughter the Oscar!!! Give my daughter the Oscar!!!!"" for this ever-riveting Oscar nominated song. She nailed it!",en
65,This is just amazing,en
66,It has taken me two years to choose my song to walk down the aisle. I knew when I heard this. This was it. Three people that I lost throughout my life will be holding my hand every step of the way. Lady gaga is amazing and is a very beautiful soul that not only writes songs but sings from her heart. A real gem. Can't wait to see this at the cinema.,en
67,"Loved the song. The way it is sung, awesome. Felt it. Superb",en
68,"rock on girl you made my day, so good !!! I love you and this one most of all ////// Thank you for the great music.",en
69,Such an amazing song and a powerful Lady Gaga️,en
70,"with an air of impassioned grace, Lady Gaga sings her heart out",en
71,"Best movie of the year and yet didn’t win as much oscars as I wanted it to win… a movie and a song that give inspiration and motivation at all aspects of life, an epic example of patience, dedication and passion. Tom created a masterpiece and this song complemented the whole thing so beautifully. Amazing, in my heart this song won the oscars and top gun maverick won best picture",en
72,Música maravilhosa.....,pt
73,"HAPPY BIRTHDAY,  LADY GAGA. I wish you all the best. YOU ARE GOOD PERSON, BEAUTYFUL WOMAN,  PERFECT  ACTOR AND SINGER. WITH RESPECT,  YRA,  ZAGREB,  CROATIA, EUROPE",en
74,I’m still angry that how she didn’t win an Oscar for incredible Masterpiece song...,en
75,"Imagine Gaga singing this live at the Oscars!! That would be so epic, no other artist can compare",en
76,Don't have to be a Lady Gaga fan to listen to this masterpiece,en
77,#LadyGaga this song is getting me through losing a dear friend of 32 years from a tragic accident. Thank you for this gift. Love & gratitude from #kansascity ,en
78,Such an incredible song it is!,en
79,Wow. Saw the movie twice and cannot stop listening to this song. So much passions and soul. It just hits you. It’s arguably Lady Gaga’s best song she’s ever made. I’m really rooting for her to win the Oscar for this score!,en
80,"Essa música é a cereja do bolo para esse filme. 
Música perfeita!",pt
81,I've grown to really appreciate her heartfelt songs.,en
82,"Mês que vem faz 1 ano dessa preciosidade!!
Thanks Lady Gaga i love you!!",pt
83,An absolutely amazing artist ,en
84,What an amazing song. That's actually the way I love her songs the most. With that feeling in her voice and the power of her voice.,en
85,"Wonderful Lady Gaga! The first top gun song is a real legend, no one could've done it better! ",en
86,So much in love with this song from the moment i hear it. Simply therapy. The movie and the song ,en
87,Should've won the Oscar.,en
88,Thank you lady Gaga for such an inspiring video you have such an amazing talent and voice,en
89,My older brother passed away two days ago and this is the song I heard yesterday playing as background music in a store. I’m going to cling to it.,en
90,Como é bom ser fã dessa mulher desde 2009. Não me surpreendi com a qualidade porque a Gaga é puro talento e profissionalismo. Rainha das trilhas sonoras ️,pt
91,Pure class... ️,en
92,I love this so much  beautiful,en
93,Sou Fã Dessa Mulher Vey Amor da Minha Vida (Lady Gaga) Love,pt
94,"I usually do not listen to Lady Gaga, or her songs, but lately she's been on a roll and this song, and the music video, is absolutely beautiful. I tip my hat to her, I will forever enjoy this song.",en
95,Maravilhosa,pt
96,Damm this lyrics are amazing every time I hear this song I get chills.. no doubt Lady Gaga knock this masterpiece..,en
97,This song is so powerful especially with headphones. I couldn't help but crying while listening to this. Touched my heart. I want it to be my wedding song ,en
98,"My grandfather was an in air jet refueler (he fueled the bombers) in Vietnam. He had early stage Dementia, and he loved this movie and song. He passed away yesterday 3/29/2023. He's the most amazing man I've ever been blessed to know (let alone have the privilege of being raised by him)! He's flying again, with other angels now. I love you forever, Major E.W.W., grampa you'll always be my hero!!",en
99,This woman is staggering. The lyrics thump with feeling. The sequencing is simple but dramatic. A song I'll go to my grave wishing I had the range to sing. Form is temporary. Class and talent are permanent. Song wins the Grammy and Oscar for best original song. I am never star struck but I think I've just fallen in love with lady gaga. A song that's made me cry. I never thought I'd see the day. Just wow.,en
100,Apaixonado por essa música,pt
101,"Merece o Oscar com certeza,te amo lady gaga",pt
102,What a huge Wonder of music.  Never heard a better song then this.,en
103,Is it just me or is her singing getting better and better each time..just incredible,en
104,Lady gaga is amazing he deserves the oscar very emoniotal song,en
105,Música mais linda do mundo ,pt
106,Happy 1st anniversary to this beautiful and emotional music video ,en
107,"I have just met a beautiful lady, and it feels that this song was written for us, it`s just an incredibly beautiful song. Hold my hand I won't let go till the end...
Hold my hand, everything will be okay

I heard from the heavens that clouds have been grey",en
108,Can't stop watching this performance still to this day.  Months later.  Gives me goose bumps on top of goose bumps every time.,en
109,Sometimes dreams come true ... even if it takes decades. It was worth having to wait that time. The movie is an absolute  work of art in every way and the song by Lady Gaga is to die for.,en
110,The day this video was released was the day my daughter was born. I’ll never forget it. Now we sing to it! This song and “Clover Cage - Learning To Love Myself” are the two songs keeping me sane through these tough times. I just want to send love to everyone and I want everyone to know things will get better. We are in this together..I love you ️,en
111,"This woman's voice/talent is screaming with ineffable. Her pulchritude is stunning.  Love you, Lady Gaga...",en
112,"I love this song, it's so inspiring ",en
113,Thank you thank you for this song and your voice. I lost people I’m war  and this makes me remember them. Thank you.,en
114,"Cara a cena dela no piano e o caça passando por ela, krl foi incrível. Me arrepiei todo. 
Lady Gaga entregou mais um momento épico.",pt
115,LADY GAGA IS A VOICE FOR OUR ANGELS IN FLIGHT,en
116,I dedicate this song to a friend I just met. He introduced this song to me and I truly just want to be of help to this family man going through a rough time while raising 5 kids all by himself.  It takes a village and I hope he can see he has friends right at his side to lean on to help.  ,en
117,Beautiful song it really tells a story and the story is true when you care and love someone you're always there to help them and hold there hand ,en
118,Não me canso de ouvir essa música. Lady Gaga mudou da água pro vinho. Desde o estilo musical até a forma de vestir. Parabéns pela mudança incrível.,pt
119,"Amazing Oscar performance. I didn't recognize her at first. There was no make-up or glamour...just a mic, a stool, a tee shirt, and a solemn look. She briefly spoke words of encouragement, then began to sing...(""Oh, wait, is that Gaga?!"") She blew the audience away - including me - with her raw talent and powerful delivery. Love her!",en
120,Eu só venho aqui dizer que o Oscar 2023 de melhor trilha sonora tinha que vir pra essa obra prima. Obrigado Gaga por esse hino ,pt
121,Love this song. Lady Gaga looks amazing here and sings just as amazing. She putting on the sunglasses at the end of the video is a real swag.,en
122,"in true artist fashion an artist of every fashion on a majestic set of total contrast giving an ""alla prima"" performance en plein-air with riffs of malleable raw impasto material Lady Gaga achieves highest-aspirations beyond any and all proportion",en
123,"This made me cry. Thank you for this beautiful song and how you delivered it touched my heart. 
I’m glad to see you thriving lady Gaga beautiful inside and out",en
124,Love that song  she's such a beautiful songwriter and singer absolutely love her ,en
125,I love you my LADY THANK YOU SO MUCH FOR THIS SONG IT HAS BEEN BY MY SIDE THROUGH IT ALL AND MADE ME CRY AND SMILE AT THE SAME TIME ! IT WAS LIKE YOU WERE SENT FROM THE HEAVENS TO SING AND HOLD MY HAND! I LOVE LEARNING AND SINGING IT WITH YOU EVEN THROUGH THE FEAR AND TEARS! ITS GETTING BETTER! YOU ARE A BLESSING TO MY HEART AND EARS AND I TRULY LOVE WHO YOUR HEART TELLS ME YOU ARE! MAY YOU FOREVER BE BLESSED! MISTY POPE ,en
126,With vibrant vocal pirouettes abound Lady Gagas most eloquently rich brilliant melodious voice dances brilliantly around the notes and chords on the musical page lifting upwardly painting dazzling words of emotion both known and unknown on any color chart or wheel,en
127,"With Lady Gaga, you don't ask, ""DO you go to the gym?"" The question is, ""Which gym do you go to, and how often do you workout? and exactly who is your dance coach and choreographer because I must say that all your efforts are having THE MOST SPECTACULAR RESULTS!! WOW!!!""",en
128,"Meu sonho essa mulher lançar um álbum com esse estilo de música, a voz dela é tão linda que só ela + piano supera qlqr um️",pt
129,"This song is my new anthem. I have a disability that makes it hard for me to make friends. I often feel alone. Then, in July 2016, my cousin passed away. She was like a sister to me. During that time, I was going through a rocky time in my relationship with my girlfriend, and we got through it after a short time. Then I had several people close to me that passed away. Now, another person close to me is sick. 3 years ago, I lost my job, and I've had a hard time finding another job. Sometimes I wish things had gone differently. This song reminds me that things will be okay.",en
130,"I love it so much !!! 

 We have another facet of Lady Gaga, which came out of her Universe, like with ""A Star is Born"" and it's just beautiful ️.",en
131,Top ,en
132,My all time favorite from lady gaga ,en
133,I can feel the emotions in her voice.,en
134,Gaga has one of the biggest voices of our generation so its great when she utilizes it on large ballad tracks like this. Great job!,en
135,Soooo good! She is the best singer-songwriter ever!,en
136,Quite a sensational movie song and stunning performance.  The movie is also stunning. This is Oscar material !!  I don't get the Oscars at all.  This is fantastic !!  #1.,en
137,This song gets better every time I hear it.,en
138,"P*rra!!!!!!!! Gaga, você é demais. Que hino! Que clipe F*d@!!!!!! 

Você é brilhante. ",pt
139,I LOVE THIS SONG!,en
140,Piece of art ! Amazing!,en
141,Love you Lady Gaga don't ever change,en
142,Did anyone else walk out of the theater sobbing as this song played during the credits? This movie touched my heart just about as much as the first Top Gun did.,en
143,This song is a Masterpiece I think this is one of Lady Gaga Best,en
144,"I LOVED Top Gun! And just vibing to this song on the radio, I was curious then searched for it. And here I am now",en
145,Muito lindo o vídeo e a música em si....,pt
146,Lady Gaga is a generational talent.,en
147,Lady Gaga acaba de garantir mais um Oscar. Que música! Que artista! E que voz essa mulher tem!,pt
148,A nomination is everything. When it comes to selecting a winner politics sometimes gets involved. But as far as music is concerned your song was the winner hands down. !  Love.,en
149,Hermosooooo este tema te hace reflexionar sobre tu misma vida ,pt
150,This is prob one of my favorite Gaga songs.,en
151,"Eu assisti recentemente e ja vi mais 2X! Top demais, e a música, incansável de ouvir! Lindaaaaaaaaaaaaa! Filme tem que ser assim, inspirador, motivacional, onde podemos ver a vitória em momentos impossíveis!!!! Final brilhante! Fora que a Lady Gaga arraza na beleza e que vózzzzzz linda!",pt
152,I hope Top Gun: Maverick sweeps the Oscars! Deserves it! It's been a long time since a movie met so many expectations. And the soundtrack is iconic. Love this song so much. ,en
153,Lady Gaga is the definition of Art Major elegance.,en
154,"She just elevated herself into the Adel, Whitney, Alicia class with this performance 
Hopefully this is the new her",en
155,ESSA TÁ PERFEITAAAAA️,pt
156,"With wheels of fire on the ground and fully-throttled engines supercharging above, afterburners-on boosted and heightened, Lady Gaga's stealth voice opens up to the heavens accelerating at mach speed creating vibrant vocal pirouettes abound and the most brilliant display of celestial fireworks ever seen.",en
157,I love this song.,en
158,A mais completa artista da sua geração ♡ ela é talento dos pés a cabeça! Que voz! Que hino!,pt
159,Love this song,en
160,Your song made me cry with joy!! Good Work God Bless!!,en
161,From what I’ve seen in my life Movies don’t get much better than this,en
162,Linda canção ,pt
163,"Such deep pain and fear , 
God is telling us to hold his hand through this pain and fear and everything will be okay. 
Complete Acceptance and letting go of pain and fear is only possible with holding God's hand.
Such a beautiful song and message",en
164,"Never was a Lady Gaga fan but this is a masterpiece of a song, and I’m saying that as a guy who listens to nothing but 80s and 90s music.",en
165,I don't know why my tears keep dropping when I see this video.,en
166,Wonderfull.... lady Gaga for ever,en
167,This song blasts through a nocturne of nightfall with an orchestra of aviation,en
168,"Love this song. Prefer the film version of it a little more, but I won't deny this is a powerful song. And I appreciate that, at the very end when the song hits the final tune, the dedication to Tony Scott is there. Beautiful.",en
169,Definitely needs to be nominated for an Oscar. Don't care if it's not till next year. This is a classic once again for this legend. ️,en
170,This song rocks I wish I could marry a woman like  this,en
171,The movie we all needed to have-experience at the end of a very difficult two years globally.  Thanks Tom and to everyone who made this masterpiece happen.,en
172,"Versátil, atemporal, talentosíssima e dona de uma carreira impecável 



SIM GAGA, VC SABE QUE VENCEU ",pt
173,"Beginning with the background murkiness of Van Gogh's The Potato Eaters, Lady Gaga is the center of a Symphonic-Art-Majored-Ensemble of perfection while her most eloquently melodious rich truthful voice paints a tsunami of color with a tidal-wavelength of texture ever seen anytime anyplace anywhere",en
174,She could be the most dynamic female vocalist writer producer ever her ability to take a song to a level make it look so easy when it’s not rock on baby girl,en
175,Nice song. Love from india 🇮🇳 ️  lady gaga,en
176,I don't know why but this song is like a therapy....it give peace and contentment to my heart,en
177,"Tell me you need me 
Hold my hand, everything will be okay  🇧🇷",en
178,"I've already seen the movie twice, yet I still want to see it again. It's indescribable the feeling why, but the best I can come up with is this: for 2 hours, all is right with the world. And this music video just brings that feeling back every time I watch it.",en
179,God i love this song so much! And the film is so great!,en
180,"I am speechless , I cried on this song . 
I am very happy that there songs that say something and talks about Friendship.",en
181,Great Song Lady G,en
182,This song is even more emotional after seeing Maverick. Much of her music is used as cues and motifs throughout the film. Lovely and powerful/uplifting! (As are most of her music tbh lol),en
183,This song has made me sob everyday since I first heard it. Liver failure took my husband 2 months ago . beautiful vocals,en
184,Always a first responder; Lady Gaga never fails a call for help.,en
185,she is always AWESOME. I LOVE IT,en
