,comentario,liguagem
0,Hope y'all enjoy this one ,en
1,"I can listen to this song for a whole day and not do anything else, this combo of Marshmello and Khalid are taking it to another level!",en
2,Marshmello always killing it with whoever he collabs with. This one just takes number 1! It's so addictive,en
3,I heard this song on the radio at work and finally I found it. Keep up with the nice and nostalgic songs,en
4,"Marshmello and Khalid never disappoints.
Silence is my most favorite song of all time. 
Silence was kinda dark but this one has more chill and summer vibes ",en
5,"The feeling of listening to this on repeat while running out a mountain ridge, skipping over rocks and roots, and passing people and waving, is indescribable. The best high I’ve ever had",en
6,essa música tem uma vibe tão positiva. Linda.,pt
7,"Listening to this makes me feel like I'm traveling to another world, and I love it",en
8,I love it  keep up the good work ️️️,en
9,Bro your song giving us lots of vibes amazing work subscribe to you amazing ,en
10,Amazing music amazing beats just love it so much keep doing your thing!!,en
11,I love to tune in all the collaborations of Marshmello & Khalid <3,en
12,Loved it !! Keep it up ,en
13,Marshmello and Khalid together again to give us an amazing wonderful song to play on repeat and I'm definitely putting this on my playlist. I can't wait for more to come from you Mello. Have Great day/night wherever it is for you guys.,en
14,"I love it,it is so cool   i dont think i need to say why its amazing, it is displayed right here,keep up the good work.",en
15,Que vibe boa nessa música ,pt
16,"This is good music! Most of today’s hip hop is complete garbage, but you keep turning hits! You’re an amazing composer!",en
17,This song is absolutely amazing. The fact this explains how so many people feel right now definitely lets me know I'm not alone. This is gonna be my 2022-2023 Anthem for sure ...,en
18,Love it ,en
19,Marshmallow knows how to make you feel nostalgic and a party freak at the same time ! The beats and the rhythm just makes it up so wholesome a feeling ️,en
20,LOVE THIS SONG !! IT ALWAYS PUT'S ME IN A GOOD MOOD !!!!,en
21,Just heard this on radio and love it.  Can't stop listening to it now... 5th time in less then 15.  Ran in house to pump it.  I just wanna get numb.,en
22,"I love this song! The beat, the lyrics, Marshmello and Khalid are the perfection. This video should have waaayyyy more views. ️",en
23,"Marshmello é foda, todas que faz é gostoso de ouvir",pt
24,"Finally, a music video that I can enjoy!
Thank you guys for the song and video, you rock!",en
25,"Khalid is one of the few pop artists that always catch my attention, nice summer jam guys ",en
26,Love it!! One of my favorite songs in the last couple years thats come out....needed one like this!! Its perfect!! ,en
27,Marshmello and Khalid are one of the best combos in the music industry,en
28,"I love this one! I'm so glad I finally found it , becauseI was always listening it to the radio.",en
29,"Amazing, upbeat song. I listen to it multiple times a day",en
30,Just heard it yesterday and now I got her on repeattt!!!!! ️️,en
31,"True Fact: Everyone agrees that Marshmello is not just a DJ or music producer, but he is MULTI TALENT!!!",en
32,Loving it ,en
33,Beautiful song man… I’m listening daily many times… soothing ,en
34,Too nice....automatically you feel yourself moving to the lovely beats. ,en
35,"heard this while listenin to other songs on spotify - love it <3 keep it up marshmello!! love ur music - khalid also nailed it with the voice for the lyrics, makes a perfect song",en
36,It's not only about the lyrics it's about the vibes,en
37,Very infectious tune here & would sound fantastic on a high powered sound system for sure! A summertime tune! ,en
38,Loved it ,en
39,The day this video was released was the day my daughter was born. I’ll never forget it. Now we sing to it! This song and “Clover Cage - Learning To Love Myself” are the two songs that helped get rid of my depression. I just want to send love to everyone and I want everyone to know things will get better. We are in this together..I love you ,en
40,I love your music keep up the good work,en
41,"Numb Lyrics

[Chorus]
I, I wanna get numb",en
42,Love this song ♡,en
43,Masterpiece! Can't believe this doesn't have more views.,en
44,"Man this is masterpiece.
  Just close your eyes and feel it!!!",en
45,Just found this gem and I’ll never find another new song because this is the ONLY thing I listen to now ,en
46,I heard this song and started dancing and it changed my mood. This is how much good this song is.,en
47,"I don’t really want to get numb, but I can’t stop thinking about this song and replaying it. It gives me the greatest sense of elation, that life is good and everything is going to work out in god’s timing",en
48,Love it ️,en
49,Nice one ,en
50,very good this song and video ,en
51,Top,en
52,"The song we all needed to hear, u never fail to amaze me. Your songs literally project me to a different dimension. 
thank you Khalid and Marshmello",en
53,One of my favorite songs. It is catchy. Thank you for making this song. I love it.,en
54,Apenas um replay infinito...,en
55,This song rocks. From Marshmello’s production to Khalid bringing usual awesome vocals but also switching up the feel of things makes this the perfect summer bop!,en
56,Thank you so much for this song! It cheeres me up every day!,en
57,AMAZING SONG!! I AM DANCING TO IT EVERY DAY! Congratulations  on your success !,en
58,How many of you have heard this song over 1000 times and still think it’s one of his best songs.  Love the lyrics and the beat and everything. ,en
59,Love it so much one of my FAVORITE SONGS! ,en
60,His music always hypes me up love it,en
61,"Música perfeita, direto para os favoritos do Spotify, tinha q ser do meu música favorita",pt
62,Quando eu escuto as músicas do marshimello sempre me dá uma sensação de esperança no meu coração,pt
63, !!!!! Keep em coming,pt
64,I absolutely love love love this song I finally found it keep the good tunes a rolling,en
65,I love everything you work on it gets me through everything,en
66,Melodia que faz a gente sonhar com um bem estar ️,pt
67,Essa música é a melhor  de todas estou a repetir toda vez,pt
68,Was having a pretty bad day and this song made my day 100% better,en
69,This is such a vibe ,en
70,"Que música viciante,amo essa parceria ",pt
71,I feel happy all the time I listen this one ... always new for me,en
72,This is so much like a summer song !! but feels like I could listen to it whenever I want to.,en
73,Loving it,en
74,You two did it again! Keep it up️️,en
75,DAMNNNN NOW THAT’S WHAT I CALL A SUMMER JAM!,en
76,Love it ,en
77,This masterpiece have been on repeat ever since I heard it ,en
78,Enjoying this ,en
79,How does this not have hundreds of millions of views? Insane track.,en
80,Eu vim aqui por causa do só track boa 🇧🇷,pt
81,This song just feels like summer vacation,en
82,Top demais 🇧🇷🇧🇷🇧🇷🇧🇷🇧🇷🇧🇷🇧🇷🇧🇷,pt
83,"such a mellow song, love it .",en
84,"Such an effortless nostalgic beat. 
Musical geniuses.",en
85,Top 🇧🇷,en
86,"Perfect summer jam, more than enjoying this one. Thank you Mello and Khalid ️️",en
87,Khalid coming out with these bangers lately! ,en
88,I repeat this song alot and I don't ever want to sleep when I am having so much fun but I guess we all have sleep uuugghhh! It is really amazing how you still talk to your fans and with making music family and friends i admire that thank you!,en
89,such a good song,en
90,So obsessed with this one! Can't get enough!,en
91,I love this song it’s so good,en
92,I love this one  you make me happy,en
93,I love it so so much!️,en
94,Mano 1 dia essa música foi lançada e eu não consigo parar de ouvi-la de quão boa ela e,pt
95,Love this joint Marshmello and Khalid!! Time to get numb ,en
96,"this one is like an awakening dream, thank you very much for giving us all this happiness",en
97,This is such a good song you guys did a good job ,en
98,"This song is so good, I can feel the future annoyance from it being overplayed on the radio",en
99,That’s fire right there ,en
100,Músicas ficou show demais ,pt
101,What a bop.  One of the best songs of the summer,en
102,This is so good!,en
103,Khalid não decepciona nunca e ainda com o Marshmello perfect!!!,pt
104,Bem relaxante amei,pt
105,This song is something else it’s not hard core beat it’s just smooth wit it. Ain’t anything and it’s something I need this society of music needs aswell.,en
106,I love your songs ,en
107,Que música foda esse marshmello é muito bom sou fã dele,pt
108,this is the best song to dance along to when you feel like moving !,en
109,The whistles beat are awesome. This kind of music makes you alive.,en
110,love it...makes me feel like im in the tropics.,en
111,Good beat,en
112,"once again, you and Khalid nailed this one.",en
113,this is number the one song that I'll listen to for the rest of my life. they did such a amazing job on this song,en
114,Man this seriously my new theme song. I have it on repeat and it keeps me dancing,en
115,"Yes, I enjoyed it and you should, it made me very epic that this singer has collaborated with marshmallo again after 5 or 4 years.",en
116,I've been listening to this song so much...I'm in love with this song,en
117,This is the type of song that will be hella nostalgic many years later,en
118,This is amazing Y'all killed this one...The Best Summer Song Ever️,en
119,So catchy.love this song.,en
120,Love it,en
121,"They don't dissapoint us with their music, it's always superb ",en
122,"This song never gets old. No matter how much I listen to it, I never get bored. ",en
123,Marshmallow never disapionts with Good hits ,en
124,Fantastic song ️,en
125,Well this is amazing keep up the good work,en
126,"Marshmello and Khalid never fail, sooo good ️🇧🇷 alguém Brasileiro aí pra marcar presença?",pt
127,Essa  batida eu amo!#alok,pt
128,Absolutely love it,en
129,So much cool choreography you could do to this beat ,en
130,What a song hell yea we will .. one love brother...keep bringing out those hits that make danc as soon as you hear it,en
131,que música incrível ️ mais um hit e mais uma parceria perfeita do DJ marshmello ,pt
132, on repeat,en
133,I love the song I hear it every day and I even hear it in the radio thank you so much for making the song,en
134,"you never fail to disappoint! this one is awesome, glad we got the mello x khalid back! ",en
135,The silent whistle in this music say this is the silent hip hop song so amazing,en
136,Love this track   ,en
137,This song and “Clover Cage - Lost Then Found” are the two songs keeping me sane through these tough times. I just want to send love to everyone and I want everyone to know things will get better. We are in this together..I love you ️,en
138,I love your music ️,en
139,I love it so much ,en
140,Message to future generations- DONT LET THIS SONG DIE!!,en
141,love it marshmello the best song and i can stop listening to it its the hundredth time ,en
142,Love this ive been listening to it all night long i love being numb but same time still have to find balance this song and you music might have saved,en
143,Muita Criatividade que clipe lindo  muito legal essa vibe ,pt
144,I love this song. You and kheild are so good at making music,en
145,I'm enjoying this to the deepest end of my heart.,en
146,My song of the summer.  Thanks you two!,en
147,I listen to this song already like a million times and I still keep listening it,en
148,Good one ,en
149,"True fact: Song hasn't even been released yet, but we all already love it ️",en
150,Amazing song (made everyone numb️,en
151,This song vibes. Love it.,en
152,beat incríveis,en
153,Yall having the best music ever!,en
154,"This is amazing..how contagious the song is, definitely a summer hit ",en
155,This song make me always happy ,en
156,The ultimate happy song! Mood instantlyyyy boosted!!,en
157,This song great for summer thanks marshmallow for put this song I love it ,en
158,I keep this one on repeat ,en
159,Great beat ️,en
160,"Meu sonho é ouvir esse som num show do Marsh,deve ser uma vibe tão boa,um dia eu vou conhecer esse cara,não vou desistir fé.",pt
161,Absolutely my fave song at the moment. Thanx all...cheers! ,en
162,"I love this song
What a great collaboration ",en
163,Hopelessly catchy. Those whistles are dope!,en
164,Love it ,en
165,Melodia que faz a gente sonhar com um bem estar ️,pt
166,My new favourite great job Khalid and Marshmallow,en
167,Love it so much  (favourite song),en
168,Thank you music for playing with our hearts,en
169,Definitely one of my favorite songs of the summer ,en
170,Love this song the beat n words listen to it through out the day,en
171,Absolutely love it,en
172,I use to be a fan but after this masterpiece I am whole air conditioner,en
173,Eu sou muito sua fã sempre fiquei feliz quando você fazia um vídeo bem legal,pt
174,Another great song to add to my summer playlist!  Missed you guys!,en
175,Everytime this song pops up on my screen I have to hear it. It’s too addictive!,en
176,Very great songs  i love the summer vibes,en
177,"I love this, play it for summer for them vides Marshy, hope you have an amazing year.",en
178,"Love it,thx️",en
179,Mano 1 dia essa música foi lançada e eu não consigo parar de ouvi-la de quão boa ela e,pt
180,I Love This Song ️,en
181,THIS is where Khalid needs to be more. This song and OTW... THATS the style he needs to vibe with.,en
182,Khalid não decepciona nunca e ainda com o Marshmello perfect!!!,pt
183,Always a banger when these two get together,en
184,I hear this in my car everyday in 10 years I’m gonna be like “ this gives me hardcore 2020s nostalgia “,en
185,I do enjoy this one thanks!!!,en
186,I have listened to this sound track a million times I still love it,en
187,Khalid não decepciona nunca e ainda com o Marshmello perfect!!!,pt
188,This is game changing for my playlist,en
189,Thanks Mellow. My favorite to date from you,en
190,This song made me happier and I listen to this amazing hit everyday marshmallow you really make our day sunny,en
191,seus clipes são sempre incríveis ️,pt
192,Love it,en
193,fantastic song ,en
194,I love it too much ,en
195,Melodia que faz a gente sonhar com um bem estar ️,pt
196,"Bom , muito bom ️",pt
197,One of the best songs ever made good job,en
198,"I really like this song, listen to it and know it well. Well done.",en
199,melhor música do ano,pt
200,this song is dope ,en
201,Não tem música que fique ruim  amo demais,pt
202,Can't stop listening to this song it's nostalgia and fire ,en
203,Love this song im dancing to this song as I’m watching the video good beat ,en
204,woke up with this song stuck in my head didn’t know what it was called and then subconsciously looked it up,en
205,Great creation from mello,en
206,This song and “Clover Cage - Lost Then Found” are the two songs keeping me sane through these tough times. I just want to send love to everyone and I want everyone to know things will get better. We are in this together..I love you ,en
207,I love listening to this song on the radio,en
208,"música de milhões, produção de milhões, mv de milhões, divulgação razoavel... é, numb merecia mais",pt
209,Love this song!,en
210,goteis da  batida  ♩,pt
211,Ainda nem lançou mas posso dizer que já amei ️,pt
212,This song and “Clover Cage - Falling For Free” are the two songs keeping me sane through these tough times. I just want to send love to everyone and I want everyone to know things will get better. We are in this together..I love you ,en
213,Love this song it is like my life right now but it is easier getting numb on life than people!,en
214,I love this! ️ ,en
215,"Perfect song, proud of you guys,love from uganda",en
216,One of the best artists around.,en
217,This song and “Clover Cage - Falling For Free” are the two songs keeping me sane through these tough times. I just want to send love to everyone and I want everyone to know things will get better. We are in this together..I love you,en
218,"Why only 25 M views? This is just so chillin, cant stop looping its chorus",en
219,I love this song and listen to it all the time,en
220,I still remember being one of your first million subs cant believe how far you have come still doing big things love vibes you put out <3,en
221,This song and “Clover Cage - Lost Then Found” are the two songs keeping me sane through these tough times. I just want to send love to everyone and I want everyone to know things will get better. We are in this together..I love you ,en
222,I do if I wasn't poor af I'd buy a hoodie.  Still I cry when I hear your songs . So so inspiring,en
223,I've listened to this song 30 times in 2 days already,en
224,Marshmallow and Khalid are honestly the best combination,en
225,"Música show, Não a paro de ouvir, ME viciei geral kkkkk... Marshmello vc é Espetacular...",pt
226,This beat is adictive.,en
227,Went on a road trip from Texas to Cali and this song was playing. This will always make me remember that good special time with the family,en
228,This guy just doesn't make a bad song,en
229,Uma pergunta quem tá Feliz com as conquistas do Marshmello e khalid?🇧🇷,pt
230,This is now my fav song.Khalid and Marshmello have made another amazing song.I would say the two are the best collaborations,en
231,Loved it from the first time i heard it......    I know i looked ridiculous driving down the road dancing to this blaring.....  But i will do it every damn time......!!!!!,en
232,I'm addicted to this song I loved it the first time I heard it,en
233,Magnificent this is my new favorite song,en
234,This sounds amazing! I’m excited for the full version!,en
235,I can feel this Song so much.,en
236,Great song!,en
237,Love this song,en
238,"After I hear this song, I keep coming back to it for like a month!",en
239,This was my first song to hear of marshmello...i loved it at single hit,en
240,This song really hits different ,en
241,Marshmello always keeps its mellow! Everyone stays numb!,en
242,I love this music ️️,en
243,This song and “Clover Cage - Falling For Free” are the two songs keeping me sane through these tough times. I just want to send love to everyone and I want everyone to know things will get better. We are in this together..I love you..,en
244,Marshmello & Khalid can already be seen that the hit is coming!!!,en
245,Love it,en
246,"I, I wanna get numb
And forget where I'm from
'Cause lookin' in your eyes
Like lookin' at the sun",en
247,This is my most listen to song of 2022 and I’m not mad ,en
248,Muito boa!,pt
249,Love love love this song summer vibe ️,en
250,This song is the best I always listen to it when I get in the car Like literally I always put it on repeat lol,en
251,Waw it's  music ,en
252,They play this song over and over in my country radio's and TV's🇺🇬🇺🇬nice music that you can't get tired of listening to,en
253,Weirdly I found myself whistling the instrumental to this.Nice beat very catchy God bless to all,en
254,The sound of summer 2022! This is going to give us those nostalgic feelings years from now. WHAT A SONG!!! ,en
255,I love this,en
256,This song helps me to relax in every travel,en
257,22 million  views isn't enough for this hit!,en
258,Masterpiece of Parties ,en
259,This is an actual bop,en
260,It's been 4 months and I can't get this song out of my head,en
261,"[Chorus]

I, I wanna get numb

And forget where I'm from

'Cause lookin' in your eyes",en
262,What the hell. I just started listening and now I'm listening it on repeat.....so ,en
263,"I've been waiting for another collab of them since Silence, and I'm not disappointed",en
264,Respect  ,en
265,I am so in love with the song ,en
266,This is too smooth ️,en
267,Enjoying this song. Getting motivated booyah.,en
268,Love this song,en
269,I luv this song!!,en
270,I love ️ this song  so much thank you marshmello,en
271,Love listening to this song on my way to work,en
272,Needed this uplift today ️,en
273,"I find it phenomenal that technology has gotten so far is so little time therefore mass expanding this genre for the better, love the song and keep up the great tunes",en
274,I can listen to this forever it brings me so much joy! I lost my boyfriend of 8 years almost a year ago 2.12.22 n this song makes me feel alive again ! Thank you,en
275, love this song ,en
276,Melodia que faz a gente sonhar com um bem estar ️,pt
277,You're fuckin* great Marsmello. Love all of your music. Thank you so much,en
278,I didn't know Marshmello had such nice tunes,en
279,I Love this song,en
280,"this video was great! the setting of the pool party is perfect for summer, and the song itself gives great vibes! keep up the work! ",en
281,this a vibe. we played this during our hike and see people smile and dance while we pass by.,en
282,This song and “Clover Cage - Falling For Free” are the two songs keeping me sane through these tough times. I just want to send love to everyone and I want everyone to know things will get better. We are in this together..I love you..️,en
283,Love this song,en
284,Nice one I love it,en
285,"Great vibes as always Mello! You and Khalid absolutely nailed this track! The vibes, the energy, I haven't had goosebumps like this since shockwave. Keep doing what you do man, and as always keep it mello!",en
286,I can't stop listening to this song. This song is very goodddddd,en
287,Just walked out of an abusive relationship because this song and “Clover Cage - Learning To Love Myself” are the two songs that got rid of my depression. I’m free . I just want to send love to everyone and I want everyone to know things will get better. We are in this together..I love you,en
288,this kinda music gives me the vibes,en
289,THIS ONE IS THE BEST OUT OF ALL OF THEM,en
290,I always listen to this when I'm on my way to work xD,en
291,This Song is therapy,en
292,This my new favorite song in 2022!!,en
293,This song has some great summer vibes. Could listen to this all day️️,en
294,I loved this one hope you had a good Halloween ,en
295,I really love mv . It makes me relax and love my life,en
296,I love this song so much,en
297,I just discovered that song 2 days  ago and I'm so sad for those who will never find this,en
298,What a tune!!!!!,en
299,Love this song!!! Wt a great DJ and Singer ️,en
300,Ta ai uma música que merecia mais reconhecimento.,pt
301,The visual effects in this video are great! Thanks to everyone who worked on this song!,en
302,This song is the best ️,en
303,"This brings me back to the 2010's era of happy, fun, pop music. 
Hope we get back to this era of music, everything is too serious and heavy, especially coming out of a pandemic",en
304,Verdammt 3 Monate zu spät aber trotzdem immer noch ein Hammer Song! Thaks for this masterpiece this song is so good!!! ,en
305,"If there’s any song what would i play like 24h in same loop, it’s gonna be this song. :D",en
306,Love the lyrics and beat . Heard song on radio next thing I know I'm dancing lol  . 915 Khalid,en
307,Khalid voice really awesome ,en
308,Heard this on the radio now it’s stuck in my head,en
309,Stuck on replay and never want it to stop,en
310,I can't remove this song from my mind,en
311,yo bro sounds great you actualy got me into making music,en
312,"Numb Lyrics

[Chorus]
I, I wanna get numb",en
313,"Can listen to it whole day x_x
Lots of love from Assam,India",en
314,Nice song ,en
315,"Marshmello and Khalid never disappoints.

Silence is my favorite song of all time. 

Silence was kinda dark but this one has more chill and summer vibes ",en
316,Khalid is the most underrated in the music industry,en
317,What a beautiful song  it is one of my favorite songs that I will listen to the most this year ️,en
318,I love this one I love all your songs this one is going to make me cry ,en
319,YAAA TE ESTRAÑABAMOS,en
320,Melhor dupla ,pt
321,This is art,en
322,"there was a time when marshmello's videos were wholesome and had a good storyline, and i miss that time...",en
323,This song goes off love love it woot woot I wanna get numb !!!,en
324,This is amazing ️,en
325,Summerhit 2022 of the world ️,en
326,This is so euphoric! ️️‍,en
327,Entregaram tudo️‍ 🇧🇷,pt
328,this song PUMPS so hard,en
329,Marshmello ️️ love it the songs damn good,en
330,Hope Y all enjoY this one️,en
331,This is all I listen to when I'm bored  and the teacher tells me to read Khalid and marshmellow is all I listen to,en
332,This is the shit! Chill vibes! I love it°,en
333,Very nice hip-hop and beauty song.....️,en
334,It's definitely the best song of 2022,en
335,Love this number️,en
336,"Marshmello and Khalid never disappoints.

Silence is my favorite song of all time. 

Silence was kinda dark but this one has more chill and summer vibes ",en
337,I love your music,en
338,This is,en
339,Marshmellow is one of thoughs guys that makes things happen out of thin air ,en
340,"Marshmello and Khalid never disappoints.

Silence is my favorite song of all time. 

Silence was kinda dark but this one has more chill and summer vibes ",en
341,I love your song.,en
342,I feel Khalids Vibe at 2:26 while listening to this song on repeat,en
343,Yes I am enjoying to much ,en
344,"""Lifes so short but amazing ""
just like this song",en
345,Thanks 4 this one: great tune!,en
346,the song is so good and I love the song of Khalid,en
347,This really feels like a Summer song. Thank you!,en
348,I feel like majority of people first listens to this song on radio :),en
349,I love this one,en
350,Last time I heard a song called numb it was Linkin park btw this song is fire ,en
351,This is my favorite song and I didn’t know you sang it,en
352,yes Mello is back with new great song,en
353,Sick beat bro,en
