,comentario,liguagem
354,I love your songs,en
355,Nice one my guy I found this from Spotify,en
356,This song stuck in my head right away! Love it!,en
357,i love this,en
358,Love it ur the best,en
359,When I first heard this and saw it featured Khalid I was like “this doesn’t sound like him” but the more I listened to it I could tell it was him lmao. But it’s a really good song. I love it.,en
360,Can't wait for to come to Indonesia soon ️️️,en
361,the official song of Summer 2022️,en
362,"Discovered the song today, 14,/11/2022. Looooove it",en
363,Yooo this bangerrr goes really harddd ,en
364,Tenho que escutar essa todo dia ,pt
365,i love this song its the best,en
366,A good workout and shower song. ,en
367,"This a jam, Khalid really in his bag on this one.  Before watching the videos I questioned if it was him on the verses or not.  Fucks with this one",en
368,This song is amazing it’s the best,en
369,I cant stop listening,en
370,"This is such a chill and relaxing song. Marshmello and Khalid, collaboration of Legends",en
371,"Once june hits, this will go from 27 mil to 50, or at least 40, idk. It has over 200 mil on spotify",en
372,"The music you bring is amazing, it always makes me happy",en
373,"10 de junho de 2022,me lembro até hoje quando escutei pela primeira vez ...,linda música ",pt
374,This is one of my favourite songs,en
375,"For those who want the lyrics:
 I, I wanna get numb

And fuck you where I'm from

'Cause lookin' in your eyes",en
376,This song lives rent free in my head,en
377,Numb numb numb numb ️‍ what a song,en
378,Loving this. Gonna be part of my birthday playlist for sure,en
379,i wanna get numb and forget where i am from i love this song please do more,en
380,Missing Marshmello's old edm ... What a banger hits they were ,en
381,This song is therapy for me,en
382,Top de mais amei,pt
383,Yo this is my jam ,en
384,I love this song,en
385,I love this song,en
386,These two never dissapointon repeatttt!!,en
387,Thank you for this blessing,en
388,Marshmallo we enjoy and we watching and we listen to you️️🇺🇸🇱🇨and we always love you bro,en
389,Heard this song many times at work. I had to find who is the singer. Sure Love it Beautiful Song,en
390,"I'm tired of being what you want me to be

Feeling so faithless, lost under the surface

Don't know what you're expecting of me

Put under the pressure of walking in your shoes",en
391,This is the greatest song ever!!!!!,en
392,Bro this is so catchy I can’t,en
393,The beat is dope  Well done guys !,en
394,I absolutely love        it on the 100,en
395,Slept with my earphones on listening to 947 then woke up to this song ,en
396,This is a bop,en
397,"Música Boa, Incrível Demaissss!!🇧🇷🇧🇷",pt
398,That's a good song,en
399,This is af,en
400,My favorite song from marshhhhhh yessss ,en
401,"My favorite song, i have it downloaded on Apple Music, btw my second favorite song is Bye Bye",en
402,This Song is so good,en
403,I LOVE THIS SONG,en
404,I ️  the song,en
405,"Ok, I love this song ️",en
406,This song has a direct line to my soul! It makes me happy everytime. I can listen to it 200 times a day. Idk what it is but its .  Thank you so much for this!,en
407,"Feel good song,.  Joy of driving n listening all day,, , forget where I'm from ,, get numb numb numb ,, very realistic,, ,, repeat mode ,, on n on ,,",en
408,Who’s still listening to this masterpiece ️,en
409,I lost this sound on shorts and idk why this channel literally helps everything,en
410,Can't Stop Listening To This Masterpiece ,en
411,I love this song,en
412,Very nice song ️,en
413,We are feeling this ,en
414,"I hear this song, it feels like it slows everything down for me in that moment, then I never want the song to end. lol. Great song wasn’t sure at first, but after hearing it more then 20 times I’ve made up my mind",en
415,this song is still on thw radio hot damn,en
416,I love it so much you could listin to if all day on your tablet or phone  or TV,en
417,"[Chorus]



I, I wanna get numb",en
418,why doesn't this have more likes wife and I just jammed to this like 10 times in a roll lol,en
419,My daughter has Autism and ADHD and she just loves all the Marshmello music when I showed her this music video she wanted me to repeat it for her.,en
420,This is my favorite   ️   song,en
421,Can't believe that till this day Silence is this my favourite song...Khalid and Marshmello never disappoints... this duo is underrated ...when they collab...everything is so perfect ️️,en
422,I love this song,en
423,I really liked Mellozinho ️,en
424,Ayyyy this song is fire ️️,en
425,Man I listen to this since it came out and I dead ass didn't know that this was khalids voice️,en
426,Like this song,en
427,Absolutely love this song ️️️,en
428,Loveee this song,en
429,I love listening to this while I am driving in Fortnite!  I don't get out of the car - just drive around while this is on...,en
430,Sumer hit !!!,en
431,This is a fuckin bop. Always making fire I swear,en
432,Greatest hits always come with you and Khalid ️️,en
433,"Why is this such a bangerrrrrrrrrrrrrrr
omg",en
434,My dad loves this song i also love it greatjob,en
435,Khalid and Marshmello duo is undefeated,en
436,I love  this song . As I smoke this Doobie I declare: I wanna get numb ,en
437,Just missing summer to perfectly marry this song,en
438,Muito bom,pt
439,This my jam every morning as im smoking my weed b4 work. Thank you for this banger ,en
440,Shit this song is made me goosebumps ️,en
441,Love it baby,en
442,Absolutely Love It,en
443,Lol I would dance on this song I love this song great music,en
444,i love the milky chance vibe of the song,en
445,Love it ️,en
446,Bro I kept on listening to this video bc I’m too addicted to this song,en
447,"This song makes me so… I don’t even know!!! It’s amazing, but it makes really emotional . Cause I have a friend named Noah… well let’s start from the beginning… so I transferred to a new school and he was the first person to talk to me, and now where best friends but he’s moving in like three months, and I have no way of communicating with him. And this song makes me think of him.",en
448,"Numb is the 2 best song  for me alone ist the best one  ️ 

Bty thanks for your great music makes me happy every sec I hear  
 ",en
449,I love a good Khalid and marshmello collab,en
450,"Khalid x marshmello  return combo

Happier and Numb ",en
451,How doesn't this have 100s of millions of views,en
452,Good misic love from Madagascar ,en
453,"I used to be a fan, but after hearing this masterpiece, I'm a whole air conditioner",en
454,There's just something about the whistling that I just love. Epic,en
455,Mello has done it again,en
456,Love the song,en
457,Nice song,en
458,Love this track ️,en
459,"Throwback to the days when mello used to do high school shit . As they say, old is gold.",en
460,Okay so I'm 54 years old and I just listened to this song 3 times in a row & my teenage daughter is telling me that I've listened to it too much  Give it a thumbs up and I'll tell her I have to listen to it this many more times!,en
461,my favourite video. Please release this 1000 times.,en
462,I love this song I always blame my mom to play it,en
463,yeah love it ,en
464,23/06/2022. Viva a Boa Música #Marshmello# Um dos melhores Djs' e Produtor Musical Eletrônico de todos os tempos.🇧🇷,pt
465,ngl I didnt know marshmellow has good music like This is my 1st time watching him,en
466,This is my favorite tune,en
467,this video clip is very good,en
468,Yo this is fire I love this this might be my new favorite song but next time or in a couple of months I will also be a YouTuber like uou,en
469,Most replayed portion restores my faith in humanity ,en
470,I LOVE THIS SONG TYSVM (thank you so very much),en
471,This is a song for summer,en
472,I can't live without you girl.,en
473,this song is amazing,en
474,This is the greatest song in my life,en
475,Khalid and marshmellow ,en
476,"Beautiful song  since it premiered, I can't stop listening to it ️",en
477,Yo this a bop in the mornings bro,en
478,I. Love this song too much ,en
479,Now I know the lyrics!! I honestly thought they said something else! ,en
480,"When I hear this, I just wanna move! Straight banger!!!",en
481,Real good song,en
482,Essa vai ser mais uma música nostálgica!! CADÊ OS BRASILEIROS? 🇧🇷,pt
483,"This collab is good I still luv this song
Something cool",en
484,"This vibe song,.,, ",en
485,Banger of the year,en
486,"So glad I discovered this masterpiece when it was fresh from the oven. Sick collab dudes, I love both your work in general.",en
487,I never heard about this song .. ever until  Donny P. sing it in asap today... oh my god ... very nice song.. wow,en
488,"I first heard this song while I was half asleep and the lyrics my head came up with were decidedly more... crude. I know better now, but my sleepy brain thanks you for every morning i've woken to this because even while knowing better, it doesn't care.",en
489,"Oh my gosh I like this song 
I love your videos",en
490,"Hollyoaks brought me here. People diss the soap, but IDC - they do play a lot of the best tracks. 
I love this & only heard it twice now, will enjoy listening with my gorgeous Nephew in two weeks.",en
491,I like that song!,en
492,"I have never seen a gifted singer like you before. Your songs hit differently. 
You have touched the hearts of millions with your song. A lots of love from 🇮🇳 🇫🇷 ️ ️",en
493,Ive listened to this like bajillion times,en
494,2022 is not good 4 EDM songs but this song deserve hit,en
495,i love this song,en
496,"I, I wanna get numb

And forget where I'm from

'Cause lookin' in your eyes is like lookin' at the sun

I feel like you're the moon",en
497,"This song gets stuck in my head all day, I love it. So good!",en
498,Let's go fans reach in every million,en
499,This is the best song ever,en
500,I first listens to this song I did not know you made it but after listening to your top song o was like oh you made this lol nice song it’s my fav,en
501,Whenever I was playing in Old days with my friend noah it reminds me of it fire ,en
502,I repeated this song 20 times Brabo Marshmallow and Khalid,en
503,I love it!!! Great song!!!,en
504,This is my new favorite song of time that I can listen to on repeat and not get tired of listening to it while I sing along with it,en
505,"I used to be a fan, but after hearing this masterpiece, I’m a whole air conditioner.",en
506,A modernised pumped up kicks :) my nostalgia couldn't with this one ,en
507,I'm going crazy for this song,en
508,Nah bro since I love mellos songs I even bought his whole mask,en
509,this songs hits harder than bus fr,en
510,"This Song makes feel like going out drinking with people (In the summer time down the bank or at the park) lol Getting Numb out there haha Listening to music 
Summer Song.",en
511,That was an amazing video! This song is stuck in my head and I can't get it out! Save up to 90% on flights using Mighty  Travels  Premium.,en
512,Summer Hit 2022 for sureee ️,en
513,This song cheers me up ,en
514,"Literally just typed ""recent song with whistling"". Been searching for this song for days! :)",en
515,This is my new 420 song ️,en
516,Love it!   Much love from South Africa,en
517,Really great song ,en
518,"I really wanna see you do a collab with Wilbur on a song, I ain't a dream stan but his music is good, even tho it's off beat",en
519,Love you️️️,en
520,"It's just what we needed 
man i got so numb watching this vedio",en
521,I like this one,en
522,"Love love love this song   I’m going to BLAST IT over AMAZON OAK4 AFE2 on Wednesday 9/26/22 for our packers g trip g your shipments out on time!! 
Always with with you Amazon :)",en
523,Greetings from Czech Republic 🇨🇿,en
524,"""Numb"". Lyrics

I, I wanna get numb
And forget where I'm from",en
525,"Marshmello never, NEVER misses on god .",en
526,It's amazing how Marshmello and Khalid make songs better than other singers without nudity and make the internet better which is something I deeply respect,en
527,Comprei Um Capacete Do Mashmello Foda ,pt
528,This is gonna be a summer 2022 anthem i feel it. ,en
529,it's even the funniest song silencer by Khalid it's right finally I always like that song? ,en
530,"I’m leaving this comment here so after a month or a year when someone likes it, I get reminded of this song ",en
531,Whole sh this song is a Bob good work!,en
532,Life's so short... I wanna get numb numb numb,en
533,that's all I need for a chilling weekend!!!!!!,en
534,Greetings from Germany. Marshmello is the best :),en
535,This is my favorite song to marshmello,en
536,"YOO Mello, each on is better than the last #Marshmello4Eva",en
537,OMG️,pt
538,"THIS SONG IS SUCH A VIBE, DEF A SUMMER HIT !",en
539,"this song describes one of my friends wich did suicide by hanging last week..
RIP Vy
Share love to each other everyday, no need to be mad - Life is short",en
540,"If you're living in 2023 and still listening to this song, you're amazing!
Nothing will stop you!",en
541,I I want to get numb and forget where I'm from......always ,en
542,comprei tua coke porcausa desse clip perfeito tenho sua skin no fortnite tenho uma coleção de latinha de coke por sua causa tudo e por sua causa e por eu ser feliz valeu por melhorar minha vida,pt
543,Happy Song of the Summer 2022!!,en
544,label what will we do to make this song a hit?    Marshmello: my name is enough ️,en
545,"Wow it,s amazingly he beautiful this marsmello guide lines ",en
546,Finally the 5 minutes hacks songs  seriously though great tune ,en
547,I lov this one,en
548,Marsh needs a custom 50mil playbutton,en
549,"Invasão dos BR 🇧🇷🇧🇷
Que vibe incrível dessa música ",pt
550,Most replayed part ,en
551,Fan yours is good music,en
552,Epic song,en
553,Song of the summer! ,en
554,"Videos where one person moves normal and everyone moves faster/slower around them always freak me out, lol",en
555,Me And my mom loved this song,en
556,I don't really listen to marshmello but this songs something else.,en
557,Amazing how Mello hits them all!,en
558,This song the best,en
559,"I clicked on the most replayed section, thinking it was the drop",en
560,I think there already exists a slightly better version.... ;),en
561,Good song  I'll never fall asleep on U or forget Ur birthday or father's Day yes ur the one and only for me . I love you for life my butter cup.,en
562,That beat Is sooo addictive,en
563,This was the best song ever ️,en
564,I enjoyed on yst! Thx for ur coming f1 Sg,en
565,Just checked the most replayed part and it's exactly what I expected,en
566,"Só vim parar aqui por causa da minha amiga  kellen que falou que ama vcs, realmente vc estava certa é boa mesma pequena",pt
567,I’m recommending you start  a animation story channel,en
568,The world will discover this masterpiece later but we are real fans here!,en
569,This is my feeling right at this moment.  Cuz I am a lil drunk... lol,en
570,"marshmello did it again invited khalid to meet,their first track was silence",en
571,"Muito top 
De Moçambique🇲🇿",pt
572,"First: Silence
Now: Numb
All good vibes in each moment",en
573,I've always enjoyed your music marshmallow I grew up to this music I'm your biggest fan your music is so upbeat I really vibe with it it's something to dance to thank you your an inspiration to me and the other people thank you,en
574,So summery and insanely refreshing! I've been waiting for it!,en
575,Summer is on its way!! I can feel it ,en
576,"This song has one of the catchiest baseline 
Totally fallen in love with this song ",en
577,About to be the best summer song of 2022,en
578,Who agrees we need an album from these two,en
579,An iconic duo has reunited,en
580,What a so long waited recollab,en
581,"I, I wanna get numb
And forget where I'm from
'Cause lookin' in your eyes
Like lookin' at the sun",en
582,Lovely rythmitic simple and nice clip video specially the song it's amazing ️,en
583,"LYRIC 

I, I wanna get numb

And forget where I'm from",en
584,marshmello is gonna conquer the world with this one,en
585,This gonna be a hit on TikTok trust me 🫰,en
586,Melodia que faz a gente sonhar com um bem estar ️,pt
587,"We need this kind of collabs   .
This is my 5th time listening to this sound ",en
588,So happy I came across this video ,en
589,I am a big fan of yours and I listen to your songs every day . you make more cheer up when I am sad ,en
590,Wow im so excited for this,en
591,Forget all your life problems and listen to this good music   .Wishing everyone the best life has to offer.,en
592,Brabo,pt
593,Your music is something else Marshmello we love you in Rwanda,en
594,Maravilhosos .,pt
595,It's great to see another collab between Marshmello & Khalid. The great ones finally broke their SILENCE.,en
596,Uma pergunta quem tá Feliz com as conquistas do Marshmello? 🇧🇷,pt
597,"Lyrics
I, I wanna get numb
And forget where I'm from
'Cause lookin' in your eyes",en
598,"The duo is back, 5 years later after the hit single silence",en
599,Eu oro todos os dias para minhas músicas estoura Deus abençoe ️️️,pt
600,"Marshmello and Khalid go in soo hard on this right here, GOATS <3! They arent like all those other artists out there these days who just go big on YT by using that AU TH EN TI CVI EWS dawwt cawwwm to go BIG like those Island boys did... SMH",en
601,"I'm going to be on top of the MUSIC INDUSTRY, I promise ",en
602,For no reason when I see the word 'Numb' I miss CHESTER,en
603,"This song is so chill, By the way I saw Giyu from Demon Slayer at 1:20",en
604,thank you for having thick models in this and not just super skinny ones!!!!!!,en
605,"this  music dropped so hard in this Nation 🇳🇬🇳🇬🇳🇬🇳🇬 
   Khalid. & Mello we🇳🇬🇳🇬.  love you",en
606,Marshmello the king of music!!!!!!!,en
607,Love this vibe...it's a stony daydream :)~ yesssa,en
608,É impressão minha ou tem mais BR nesse comentário do q americano?,pt
609,"made me remember Linkin Park's Numb
RIP Chester",en
610,"For anyone who wants to play this on guitar, here's how :)

- Standard Tuning - Capo 3rd Fret -",en
611,Nice song!!!,en
612,Gather all those who are before this issue reaches the million,en
613,Love it,en
614,Guys you betta go for summer sales of authentic views thank me later with gifts :P,en
615,"I feel those who would allow the market dynamism to determine when to trade or not are either new in space in general or probably just naïve, the sphere have seen far worse times than this, enlightened traders continue to make good use of the dip and pump even acquiring more equities towards trading sessions, I'd say that more emphasis should be put into trading since it is way profitable than hodling. Trading went smooth for me as I was able to raise over 11.4 BTC when I started at 1.5 BTC in just a few weeks implementing trades with signals and insights from Harvey Barrett FX, I would advise y'all to trade your asset rather than hodl for a future you aren't sure about or hold it and risk losing all.",en
616,Yeah im going to enjoy this,en
617,Wow this is music!,en
618,"I LIKE IT, WHERE IS A GUITAR AND WHISTLE, JE TO TAKÝ SUMMER CHILL (AND GREETINGS FROM SLOVAKIA) ️🇸🇰",en
619,this is the best,en
620,Hi melo your the best dj and musical maker your the best (:,en
621,Marchmello I love you and your music,en
622,"Once the summer hits, that 26 million will turn into 50 million",en
623,20 mil baby. How bout 25-30 before the year ends,en
624,the best,en
625,We do enjoy this,en
626,102.3 NOW! radio made me have this as my fav song,en
627,I am I want to be numb like this every night lol! Maybe every other night!,en
628,0:57 I wanted to see more of her tho ,en
629,best of the best,en
630,"i like this sounds, thank you very much...",en
631,Sweat.. urban puppets vibe,en
632,U are the best,en
633,"Start singing the chorus to ""Pumped Up Kicks"" whenever the drop hits.  You're welcome.",en
634,i never thought that this is a marshmello song lol,en
635,The peak views at 0:59 . Men of culture,en
636,I did enjoy this song it’s fun it’s cool,en
637,"Everytime I hear this song I 
Think about the singer",en
638,Can you put this version back on Amazon music?,en
639,The gophers need to wear the Marshmellow helmet!,en
640,Your songs are the best and happy hallasen,en
641,This song is too short I want more ,en
642,Lady :What do you want to be when you grow up ️  : kids I want to be a marshmallow ,en
643,My best playlist have this.....,en
644,Me and my boyfriend love this song he loves the part part where you say because looking at your eyes like looking looking at the sun,en
645,Very surprised when I heard this track for the first time while driving a car in Fortnite the game,en
646,WW Cute,en
647,"I was in a marshmello music vid, he’s dope",en
648,Dude wow.... enough said holy shit,en
649,Numb  means = the OG Linkin park ,en
650,I always see marshmallows videos,en
651,Can some one tell me what brand sunglasses he is wearing at 1:05?,en
652,Yes I enjoyed it you is my fav,en
653,Who else besides me was at the premiere for this back in june?,en
654,Love of My Life,en
655,Goodness and n happiness forever GIRL.,en
656,don't worry Marshmello you're not alone,en
657,Nah you can’t name this numb and not expect me to think about Chester Bennington aka the lead singer of linkin park,en
658,Love From India,en
659,I feel like your the moon I feel like your the one ahhhh banger you no this song drops ,en
660,WOOOO i don’t care if the song is bad I just DANCE WOOO,en
661,You are really cool marshmello,en
662,"""Totally agree ""   Big Love & Aloha from the Big Island Puna Hawaii ",en
663,Good job marshmellow and you're friend khalid,en
664,Why do I visualize the Gallaghers having one of their living room dance parties to this song?,en
665,2022 December Jam. In South Africa it is summer so this is a pool side beat!,en
666,Hey l love your song,en
667,This was speaking right at me 12-992themoon@hollywood aka @donrichjuan @marshmello,en
668,Cool song,en
669,Who is here to listen this masterpiece in 2023.,en
670,Marshmallow you are  my favorite Dj,en
671,It' very nice,en
672,In this song I just want to get mixed up,en
673,Best song in the world,en
674,The whistle sounds like unbelievable by owl city,en
675,"Went to High School with Khalid, cool kid",en
676,It my favorite song,en
677,Love it and you,en
678,Enjoy this favorite song,en
679,i love this vid,en
680,aquele cara da limonada tava com a camisa do tomioka ? ,pt
681,i played thks song at my pool party  next door come over and joined the party,en
682,What a camera view 0:59,en
683,It's a summer song,en
684,the song make me cry,en
685,Workout to this song,en
686,i love it its a beast song and marshmello is an beast  singer i nov,en
687,Catchy song….video clip budget must have been pretty numb.,en
688,I was born in Toronto.  Never heard Jamaican Gaelic before,en
689,We all love you marshmellow,en
690,"The Chipmunks Tho 

1:25",en
691,Can YouTube make a repeat  button?!,en
692,This song is too short :(,en
693,When I first heard it on the radio I swear thought he said... fk ya where I'm from. ,en
694,I love that nume song,en
695,"First Linkin Park, then XXXTentacion, then Marshmello? Damn, that's a lot of numbness.",en
696,This is  so funny ,en
697,Love you,en
698,"Rich people: Omg, I have so many concerts to go to! Marshmello, Clean Bandit, etc.
Me: I have never been to his concert",en
699,Benson long since I heard these songs,en
700,Cool,en
701,iJust wanna get lost tonite & dance w/ YoOuUu ,en
702,YA we did cause it's u,en
703,almost a year now,en
704,Thanks ! We really did.,en
705,Sou brasileiro maís gosto de sua música,pt
706,I laugh at inappropriate times ,en
707,a formula that we all knew works,en
708,Who's the guy at 1:20 with black hair. He's gorgeoussssssss.,en
709,Almost everyone was speaking a different language on the alok version I’m confused 🫤,en
710,Hi this is lacey. The grandaughter of this user. I just want to say that i love this song! Top list that i can tell you.,en
711,Here is the meaning of marshmellow,en
712,Okay I was being baked right type numb for linkin park and my high a**thought this was a cover tribute song lol my bad,en
713,Who still listen this in 2023 Let me know in comments,en
714,This song is Prayer in C....almost exactly,en
715,"Me: I love this song :)
Parents: YOU WANNA GET DUMB? F**K IT?",en
716,Plis comeback,en
717,i am so numbness now,en
718,Best one yet marshmallow,en
719,I pray god will give me a job I’ve been applying hopefully ,en
720,right click -> loop ,en
721,I LIKE HIS MUSIC THIS IS THE BEST ONE NIMB WOULD BE MIY FAVVV,en
722,Yes marshmelo my brother loves this song,en
723,The music video is boring  but I love the music ,en
724,I’ve become so numb I can feel you there become so tired so much more aware I’m becoming this all I want to do is be more like me and be less like you-linkin park,en
725,coca cola references too top the good music I'm your fan,en
726,"November 20 19:00
Encore Beach Festival Armenia 
Live In Concert Dj Daniel Marshmello",en
727,BroI heard this song on fortnite while driving to get the dub. I was cruising till my car got bashed ,en
728,the chorus reminds me of extraball by yuksek,en
729,"I, I WANNA GET NUMB. AND FORGET WHERE IM FROM. CAUSE LOOKING IN U EYES, LIKE LOOKIN IN THE SUN~ ",en
730,"I hate this song…


Because it gets me numb️️️️️️",en
731,Who else is here because of the link from happier ,en
732,Bro I didn’t this black man was singing Jesus thank you Lord Represent baby ,en
733,cool ,en
734,How much for that floating mat ?,en
735,This might be cringe but I heard this on the Fortnite radio and had to imminently search for it,en
736,Cool music I wish I could meet you. Make a Tamil music,en
737,This is on tinker.,en
738,I have a marshmallow shirt lol,en
739,I like the video,en
740,It love,en
