,comentario,liguagem
741,What does numb mean?,en
742,I heard dis song in a fortnite cars lol dis is the best song i ever listen :3,en
743,dam she got roasted cuz if u look at sun your eyes burn,en
744,Please come to Hungari too to the western part please pl... ,en
745,what does he mean when he wants to get numb,en
746,Loved it marshmallow why come I enjoy all of your videos,en
747,I like this song oh and also I have the swetter of marshmello,en
748,All i can think about is the coke commercial,en
749,Jaia she's like a brother too me,en
750,Gg on getting ur coca cola flavours i brought 10 boxes,en
751,Idol can you send me your helmet ...love you from mizoram.,en
752,"Top song of the year!! But the music video isn’t on the same vibe. I was looking for dancing, better camera effects, fist pumps, more flashing lights. I think I felt alive hearing and dancing to this song but I didn’t feel that while watching the music video.",en
753,The animals dancing lolllllll,en
754,Rip SKYLORD ,en
755,Hello marshmallow  l am from brazil,en
756,who searched for LINKIN PARK'S numb..and found this one,en
757,I Always misheard this part (forget where i am from) and i thought the lyrics were (and f**k it where i want) ,en
758,We do =>,pt
759,Your  songs are the best marshmallow,en
760,I love you so much marshmallow,en
761,Who's here because of DONNY PANGILINAN's birthday prod on ASAP,en
762,muito injustiçada.,pt
763,The song is good and that make me cry the son,en
764,If you have any other ideas or comments about the event,en
765,I love you DJ marshmallow,en
766,track 10,en
767,The marshmallow can talk I only fight he can’t talk I only fight he can type,en
768,"Please dont, its great to feel ecstatic but numb overkill",en
769,Shawn Mendes hi cool songs ️️️️️️️️️️,en
770,Is Katy Perry in court over this one?  Sounds like Friday night to me.....,en
771,Thanks marshmallow,en
772,"I thought the lyrics said f*ck numerous times but it was forget, lol",en
773,YALL THE SONG SUCH A BOP EVEN THE FUCKING ANIMALS DANCED,en
774,"Me
It’s a good song",en
775,Te amo masmelo,pt
776,Marshmallow I was at your music plays with everybody,en
777,Did not know that he cut his hair,en
778,Thanks,en
779,Welcome to the famliy @Marshmello .,en
780,numero 1,pt
781,"I find it amusing where the ""most replayed"" thing is",en
782,Thanks,en
783,That feeling when you really like the song and then you finally watch the video and it ruins the song,en
784,Oh he didn't eat you ,en
785,If you can that would be great,en
786,Check 1:20 it's a giyuu's uniform,en
787,"Hope y'all enjoy this one 
Everyone - Not all enjoy only 100-200people who there enjoy 
And",en
788,NPC music,en
789,I love. It’,en
790,Marshmallow is Christopher Comstock,en
791,I can just play Roblox bed wars but this is better ,en
792,lmao mid   dance club 2000s >>,pt
793,he changed,en
794,I listen six times a week making me ah weak one matshymuchs,en
795,Love it and my baby girl do,en
796,It sounds like he said the f word,en
797,"Who here thought he said “I, I wanna get numb, and fuck it where I’m from.”?",en
798,Wow is this marshmallow,en
799,I lost my dog Sheeba happier nice. Not nice but nice.,en
800,I saw your face reveal,en
801,Yes I will be a good friend,en
802,India misses you,en
803,Can you remake alone?,en
804,Forget in the song sounds like a swear,en
805,PROXIMA MENTE XXX 2023 REGRESA PURA LUMBRE ???? JIMI HURTADO GARCIA ESPERAL 16/12/2022,pt
806,Me from argentina,en
807,Didn't know DJ Khalid was black.,en
808,Are you in 24 years old marshmellow ?,en
809,Its the guy from fortnite!!,en
810,When will you reveal your face,en
811,VALENTINE DAY EVERYONE else And jaia cat noir is a great place to work for you and your family is very red and stingy,en
812,Every masterpiece has a cheap copy,en
813,Thank,en
814,Bro is she the moon or the sun i’m confused,en
815,"Mars look space Going at the
Looking do You want",en
816,Welcom to algéria Bardo.T,pt
817,In love this song but when  he says forget it sounds like a cuss,en
818,Oh… he says forget…,en
819,sad it reminds me of Linkin Park,en
820,"No offense but this sounds too similar to  'Pumped Up Kicks' , even down to the whistling part.",en
821,marshmello will you do a collab with txt? ,en
822,bandits no  not numb the real numb is LINKIN PARK NUMB SOLOSSSSSSSSSSSSSSS!!!!!!!!!!!!!!!!!!!!!!!!!,en
823,bro u gonna do a face reavel,pt
824,That was a Cray,en
825,"I Searched For : 
I Wanna Get Dumb & I Fucc Where I'm From ",en
826,All I want is my girl kp4hunnid,en
827,I LOVÉ. You,en
828,Who want BTS and marshmello collab?,en
829,Be anonymous ,en
830,It’s more like a song of Shawn mendes,en
831,How do scuarls dance,pt
832,Where are you from marshmello?,en
833,"Watch out my new YouTube Shorts: 

Bangladeshi Marshmello 
https://youtube.com/shorts/RJo6DSXYZQs?feature=share",en
834,Numb your not in it!!!,en
835,Yes mate,en
836,One of them ripped off the others hard work.,en
837,Hey marshmello how about 1 million likes u reveal ur face how about that hmm,en
838,Thanks Marshmello I hope you do a face reveal video one dau,en
839,The happier song is way better,en
840,I can hear the F Word in this song.,en
841,Gringos era bromista broma perdonenme,pt
842,"Let us hear the conclusion of the whole matter: Fear God, and keep his commandments: for this is the whole duty of man.
 For God shall bring every work into judgment, with every secret thing, whether it be good, or whether it be evil.   (Ecclesiastes 12:13-14)",en
843,Prayer in C.,en
844,"And for get where I,m  from.",en
845,Isnt happy with the food,en
846,Marshmello who are you are you inspired by someone? PLEASE ANSWER PLEASE,en
847,Marshmello can you collaberate with a k-pop girl group?,en
848,This isn’t linkin park wtf,en
849,Marshmello you are the best,en
850,Rock can I get a shout out,en
851,"Heard "" f*ck you in the sun"" lol ooppsss",en
852,Why is it just khid In the vid come on marshmallow Be in the Vid more but 4/5 It could be better,en
853,I know who you are Chris Comstock,en
854,Good song but bad words,en
855,Can Marshmello take off his mask.,en
856,He said the f word 100%,en
857,I did hi I'm Joe this my granpa.s phone but yes I did enjoy it,en
858,Only one song can have this name. And that song is not this one.,en
859,"Malho cm essa música,",pt
860,Umm sorry for this but I'm a Muslim and I don't like seeing girls half nakid but I like the karaoke! :),en
861,"Fuck, wrong Numb.",en
862,Me name Khaled,en
863,I do,pt
864,The way this song flopped ,en
865,"Kind of a weak drop, especially, for this ""dj""",en
866,I do,pt
867,I do,pt
868,Who is under marshmallow?,en
869,"it make,s me whant to danes",en
870,"people can go to hell for scandal. ""Whoever looks at a woman with lustful intent commits adultery with her in his heart"" - Christ Jesus.
CATECHISM OF THE CATHOLIC CHURCH SECOND EDITION 2284: ""Scandal is an attitude or behavior which leads another to do evil. The person who gives scandal becomes his neighbor's tempter. He damages virtue and integrity; he may even draw his brother into spiritual death. Scandal is a grave offense if by deed or omission another is deliberately led into a grave offense""",en
871,BOYFRIEND JAIA AND COURTNEY,en
872,Lot a roblox playing,en
873,"KALEI PAIK is only for JORDAN WATASE.
Kp4hunnid Jdubs808$ ️‍️‍️‍",en
874,Corse,en
875,I mean hallaween,en
876,COPYRIGHT,en
877,You copy linkin park name,en
878,"please good my you, you much yellow the girl I",en
879,What Where my friend Roblox,en
880,this song is so annoying its always on the radio i hate it,en
881,Only Allah and prophet Mohammed,en
