,comentario,liguagem
637,got stuck in my head every time I hear it on the radio,en
638,I love when rappers do rap with a bit of rock,en
639,Her part isn’t even bad it’s catchy and her voice sounds good too,en
640,I'm literally saving all your songs. Such great artist,en
641,I loved this song!,en
642,Dude this song goes so fucking hard. Someone give this woman an award.,en
643,this song really deserves more views,en
644,I literally can't stop listening to this,en
645,this song needs more attention its so good,en
646,polo really needs to make some pop songs,en
647,This hits so much different when your listening to this song on your “Better Days” or Best Days!,en
648,"polo g is phenomenal how he started the song touches my heart, his words giving me comfort bless him",en
649,i adore this song,en
650,Litteral banger polo g really didn’t miss,en
651,I'll gonna sit and wait for your first album! ,en
652,"this really shows how talented polo g is. He can make a Nice flowing song with a pop artist, and make it flow in such a beautiful way. The lyrics are good too. you can tell It was thought out unlike cardi b's bullshit music.",en
653,This songs makes me feel nostalgic. Random emotions suddenly show up.,en
654,"I heard it first time today in my car driving to home from work and make me remembering Doja Cat's hit ""Say So"". I loved the mood of that song and now I love this also. The same great beat and melody. Brilliant job!",en
655,"My neighbors bump this song everyday, whether they like it or not.",en
656,"This song is fire than other songs pls dont give up, keep up and keep up u r amzing",en
657,The tune of this song is heart touching. Authentic Views,en
658,This song should've dropped in the summer bruh definitely a summer banger,en
659,"Y’all praising polo g only but in my opinion Mae did amazing job here, this song is such a vibe <3",en
660,Polo’s verse is amazing but y’all sleeping on her vocals Fr ,en
661,What a absolutely banger tune I love this song and the singer ️,en
662,This legendary song will not be erased on Today's top hits Spotify album.,en
663,This is what soul train was supposed to be,en
664,While everybody is talking about Polo G can we take a moment for her singing skills,en
665,"Can I get an ""Amen""? Introverted, can't make friends
Pray for better days, now it's three hundred K when my day ends
Do you remember last night? 'Cause I blacked out
In that all white dress with her back out",en
666,this is what i looking for in a song that is nostalgic and it elvokes me the feeling of 10 years ago when i started to listen US-UK,en
667,"Said, be careful with her heart 'cause it's fragile
And thinking 'bout her past make her lash out
See, with me it ain't no worries at all
Any problem I'll be there, one call",en
668,Ngl Polo definitely carrier this songs like he show his true versatility,en
669,"Billboard Hot 100: #23(+23) Better Days new peak

DESERVED! This song is so good",en
670,Everyone out here talking about Polo G but NEIKED'S beat and Mae Mullers vocals also elavate this!,en
671,1:07 The best part,en
672,polo's verse on this song is so good,en
673,This shit is about to blow up,en
674,Even on a song like this his verse is still hard,en
675,Mae looks and sounds stunning in this!,en
676,i don't get why people hate her for making a song with polo man. Yall trippin,en
677,"polo really needs to do a song in this style, i think he could pull it off... well i know he could pull it off",en
678,"my music is blowing up right now, speaking it into experience ",en
679,Polo g verse was the best I can’t stop listening to it tik tok is addicted,en
680,“ Do you remember last night when u blacked out” went hard,en
681,Polo g is literally the goat,en
682,"Anyone else listening this song like 15-20 times a day? I f*ckin love it.  Also, no one says a thing bout NEIKED. Damn, guys, he completly caught my attention.",en
683,This song and “Clover Cage - Mad Scientist” are the only two things keeping me sane through these tough times. I just want to send love to everyone and I want everyone to know things will get better...We are in this together...I love you..,en
684,"Polo G is  when he hops in his pop bag. Reminds me of ""Patience.""",en
685,Polo carry fr. GOAT,en
686,Polo g went hard on it,en
687,This song gives me 2020 tiktok and pandemic nostalgia even though this just came out,en
688,She made the right choice with polo ,en
689,Track is straight heat,en
690,"Be honest, you're here for polo g only.",en
691,Polo g’s verse is a ghost writer,en
692,"Polo G sounded really good on this, he needs to sing more imo.",en
693,wants to hear it on the radio  me: oh it was only popular in 2020 why would it be here?! remembers: KATE BUSH IS ON THE RADIO NOW WHY AINT THIS SONG ,en
694,"Polo g once said:
""One time I got paid $150k for a feature.""
We all know who paid him.",en
695,Why is no one talking about mae’s part in the song,en
696,"im from VietNam, i replay this song a lot today",en
697,This song feels like the last day of school,en
698,I sang this song all night with the wrong lyrics ,en
699,Shes sounds like bebe rexha just as banging too xx,en
700,This song feels nostalgic and I don’t know why,en
701,"This song and “Love Me” by Lukaz are some of the only things getting me through these hard times, thank god for music! I love you  ️ ",en
702,Searched Mae Muller after eurovision announcement,en
703,Too bad they didn’t post this during summer. This could’ve been an amazing summer song </3,en
704,Finding myself...I'm worth too much for ya..TOO MUCH,en
705,Polo G is surprisingly good on this type of music ,en
706,Polo g the GOAT,en
707,Bro this is for you polo g amen.,en
708,This somehow giving me doja cat vibes,en
709,This shit hot,en
710,"Dear person who may be reading this

.

.",en
711,Life is beautiful when do everything well and taken easy,en
712,"Support the independent music movement, so that artists can be heard in their pure form! It will make music a better sound!",en
713,Legends searched “do you remember last night cause i blacked out”,en
714,"This reminds me of Dua Lipa and DaBaby’s Levitating, Pop Star + Rapper combo songs are so good",en
715,"Why tf did I think this was a Doja Cat song?! ️ Either way, love it!",en
716,"It's sad how everyone is only talking about polo's part, Mae did an amazing job too",en
717,Reminds me of a song or two from the 90s.. can't remember which,en
718,Polo’s pulled an absolute mad one…,en
719,Who agrees polo carried the song,en
720,Bro polo g helps this songs reputation so much,en
721,I don’t understand why this is so underrated..,en
722,I thought polo g made the song by his self,en
723,for some reason i never heard this on radio,en
724,"""Remember last night cause I blacked out"" hits different",en
725,Polo getting that crosseover money,en
726,looooooove this song lol,en
727,Polo g on patience by KSI same energy. Love when polo does these kind of verses. He needs to do more,en
728,Polo g really ahead of his tine ,en
729,I knew this was for me when she said my name,en
730,"I’m sorry,but this girl is so good. I understand people love polo g’s part. But let’s show this girl some love as well. She did good on this track",en
731,It's so Catcy...! & Unique,en
732,"""i will survive"" vibes..",en
733,1:08 go so hard tears are rolling down my cheek,en
734,so am i the only one who think her and dua lipa’s voice sounds similar?,en
735,Love this! It kind of reminds me of Doja Cat “Say So”,en
736,I didn't know this song if it wasn't for Polo G,en
737,"""Thinking about her past make her last out"" her past: cheats 3 times n ignores boyfriend whole relationship so he left n that what's her past",en
738,Everyone’s dissing Mae’s part when it’s so good. Honestly my favorite part.,en
739,1 Million finally this song is so underrated ,en
740,When will the next video drop?,en
741,"There’s no question about it, they definitely put crack in this song",en
742,Why is she so pretty? Damn,en
743,Thank you very much,en
744,"Mae was so beautiful hereeee just like her voiceeee , so lovely!!",en
745,"""Mom, can we have 'Say So' by Doja Cat?""
""We have 'Say So' by Doja Cat at home.""
'Say So' by Doja Cat at home:",en
746,I’m the biggest polo g fan boy but her part was fire to y’all ain’t gotta always act like y’all tough and can’t listen to her part to that stuff fire fr,en
747,Yk its fire with Polo G  ,en
748,MAE'S  vocal was good but i think polo g did most of the part,en
749,"When Polo G Said “Introverted,Can’t Make Friends.” I Really Felt That Before Half-Term Of High School",en
750,She’s pretty in my eyes ,en
751,Everyone is talking about Polos part I like mae muller's part,en
752,This is weirdly specific but those gumdrops at 0:51 look insanely delicious,en
753,Who came here after the Eurovision,en
754,I used to think this was a Bebe rexa song . Came here as looking for mae muller for Uk Eurovision,en
755,All y’all keep talkin bout polo g’s part but Mae go hard I can’t lie,en
756,This sound like 2015 vibe,en
757,You can tell when polo is coming in because of his famous double moan,en
758,I only knew it because polo g was in it,en
759,This song should play in VH1,en
760,polo g carries even tho his verse is 46 seconds,en
761,polos part da best,pt
762,The tune in places reminds me of Primadonna and Baby by Marina,en
763,"All I see are Polo G comments, but yall are really downplaying on Mae Muller, her vocals are amazing. It's her song, for heaven's sake.",en
764,"0:54 reminds me of  Adore Delano's  ""Hello I Love You"" video. ",en
765,Bw i love this song,en
766,This song Is really showing off polos ability to hop on any track and destroy it,en
767,i came here for polo g ,en
768,now lets be real you only came here for the polo G part,en
769,"everyone’s talking about polo, but can we please appreciate mae and how absolutely gorgeous she is????",en
770,"*Sad twerking 
Polo: “introverted, can’t make friends”
*Crying, twerking ",en
771,I don't know who polo g is but he's Alright ig,en
772,"Lmao, these compliments are talking about Polo G more than the song",en
773,This brings out my inner woman,en
774,Pretty. Nice voice. Sounds & looks like every other singer her age. Mostly they all sound the same - like who??  OH BENEE THAT IS IT !!! The sound is the same even contestants on AI. They all followed suit & sound like Benee. Looks vary a little but yeah the sound is infuriatingly the same. Doja too. I like it but if I was one of them I would not like that everyone else is being produced the same.,en
775,"The only polo g song I'm ight with, and only listen to it cause of the polo g part",en
776,Polo G is the GOAT,en
777,ima keep it a stack I only listen to this song for the polo part,en
778,Polo verse sounds like a good verison of soul train,en
779,Wow wow wow aloha from Uzbekistan good luck thanks for amazing and beautiful song yehuuuu,en
780,I do the same and polo g is the real g bro,en
781,"Yo bro On rapstar polo said “ I been living life 2000 a minute”
Here he said “now it’s 300k When my day end” theirs 1440 Minutes in a day 
(1440x2000)= Is Around 300K when rounding it up. His crazy",en
782,Right on da money...  ,en
783,Discovered this song via my local Walmart Supercenter,en
784,"You could blindfold Polo and tell him to throw a dart off the Empire State building and hit the target, he would get a bullseye every time",en
785,Who else Spotify randomly played this as a alarm now your obsessed      anyone,en
786,My lil sister loves this song fr,en
787,Somehow she reminds me of Madonna during the La Isla Bonita era. It's her brow and eyes.,en
788,0:41 scratches my brain,en
789,"1:09 
Thank me later",en
790,thank you <3,en
791,polo just carriend the song with a simple short verse,en
792,"lmao I really don't know why but, Mae Muller with blonde hair in the retro TV set reminds me of the young Madonna. Idk if it's just me ",en
793,Who else came here for polo ??,en
794,I wish polo g’s verse was longer ,en
795,Mood lately,en
796,Is it just me or this song is giving Gwen Stefani?,en
797,I love this music a lot but I listen to what 100 *,en
798,She’s the little girl on the piano on Mika’s Grace Kelly music video,en
799,am I the only one who thinks the instrumental sounds really similar to gwen stefani’s “make me like you?”,en
800,Only here for Polo G,en
801,ksi rlly showed everyone first polo can sing,en
802,POV you do this song for your UDA performance,en
803,this is exactly what nahmir thought he made with soul train,en
804,"everytime i open yt, first thing to do in search engine is to type 'better days'",en
805,"I was convinced that he said “pee on my arm, and it’s shining bright”  and Im disappointed that it is not the case ….",en
806,POLO G CARRIED,pt
807,"first ksi patience and now this? as the legend no life shaq said: ""This ain't Polo G this is Polo J""",en
808,Is that a sample or original music? ,en
809,Who is here after the Eurovision announcement? ,en
810,Thumbs up people who saw this live at Highest Point 2022,en
811,Polo just sky rocketed her non existent career lol crazy,en
812,Idk why nobody been talking abt how this song literally sounds like In Your Eyes by The Weeknd,en
813,How long until Benny Blanco drops a tik tok saying he wrote this?,en
814,It’s giving DUA LIPA ,en
815,Y’all act like polo was the only good part of this song and that Mae Muller didn’t kill it too,en
816,"1:40 I the only one that hears ""you pee on my arm and it's shining bright""",en
817,"So, I Will Survive by Gloria Gaynor meets Say So by Doja Cat, basically. Anyone noticed?",en
818,Polo low key carried this song,en
819,Me at 3am watching YouTube: 0:15,en
820,OMG this was related on my birthday ,en
821,Why is everyone talking talking about Polo G is the best. Both of them were amazing!,en
822,"the first time i heard this start playing I thought it was ""Say So""",en
823,Ayo this song slap harder than will smith at the Oscars but fr don't listen to it with the gang,en
824,1:42 Pee on my arm and it’s shining bright,en
825,Wish I would have seen this earlier.,en
826,"People will listen to this and then still call him ""piano g"" Overhated asl",en
827,This was just a W song,en
828,What your here for. Your welcome.1:05,en
829,Me only coming here for polo g,en
830,always that sunday song,en
831,Polo should of just made a song by himself with this this song would be ass without him,en
832,"i am leaving this comment so that every time someone likes it, i am reminded of this song.",en
833,Call me crazy but I thought that was a Mac Miller cameo @ 0:22,en
834,im pretty sure the only reason people are watching this is because of polo g's part of the song  at least i am,en
835,"I asked for my friend to gave me a song this was it. Tbh I was suprised cah he a dude that absolutely doesnt look like he would listen to this anyways 
You wanted stop cc w me at 24th november 21, after 8weeks you texting me back to know how I was doing, at the time I was still so mad at him and I also moved on already, but after he texted me after rlly getting mad the convo did continue like a daily convo but then 3days passed and I thought you wouldve text me you didnt I couldnt wait so I said that you should block me because knowing that you were able to text but didnt rlly made me upset Idk why youre just my friend tho. I wanted you to block me bcs atleast if I were blocked you wouldnt be able to text me so basically just an excuse that I made myself feel better by thinking like this, then on your birthday 9th february I texted you w my fake acc Ik that you knew exactly that it was me but I didnt say it but yk Ik that you still knew it. Believe or not I kept checking yo acc even tho it was a private acc I kept checking yo profile so often, I realized that you rn unblocked me I keep checking, I rlly want you to text back tbh but I dont think you would cause I told you to block me so yk. (bcs it would be easier to move on) but yeah after that I couldnt move on suddenly I still wanna talk to you. His initial is O. ",en
836,"I love how no one compliments maes part as your all just s*kin off polo, give her the credit she deserves",en
837,"I want an A+, not an A 1:08",en
838,This song just screams early 2015 ,en
839,Bro made it to nickelodeon,pt
840,That’s the uk girl from Eurovision!!!,en
841,"The beat at the start sounds similar to ""River"" by Charlie Puth",en
842,Who is just here for polo,en
843,polo got no right goin this crazy on this typa beat,en
844,Soshi Tam Tam show...i listen in repeat like 20 times to listen the lyrics and found the song..jjj,en
845,Or is it just me or Polo G sounds like Rarin,en
846,1:14 is the meme,en
847,I can’t use this for an outro cause its copyrighted damn,en
848,When I first heard about this I thought Bebe Rexha sang this lol,en
849,It looks like a tornado hit your house ,en
850,Mae is beutiful ️,en
851,U would ever known this song with our polo,en
852,Bro got her feat in the tv,en
853,i found this song in mtv,en
854,She sound what the battle pass skin Evie would sound like,en
855,Introverted can't make friends lol that is me,en
856,Why are ppl acting like Mae isn't in this video,en
857,Her diction is slurred! ,en
858,Whats the meaning of Mae Muller being the weather announcer on the TV?,en
859,Cool,en
860,I did this song like a few months ago in drama,en
861,heat,en
862,"I'm Tryna understand why NEIKED in this if he isn't doing anything instead of playing the guitar, should be (Better Days- Mae Muller FT (Polo G). I think that's how it goes lol",en
863,It's always playing in target.,en
864,I like the song of Better days,en
865,Polo g makes the songs better!️,en
866,Can i use your audio for a video pls?,en
867,Almost out of the woods..It's all gravy,en
868,sounds like a song dua lipa would make or something,en
869,I never knew Jesse Pinkman knows Guitar,en
870,No disrespect but polo g's verse was the best part,en
871,"0:08 looks like ""Say so"" by Doja Cat",en
872,I'm just counting the pics with neiked,en
873,Only here for polo g.,en
874,1:02 reminds me of fairy godmother from shrek,en
875,"Literally know no one here exept polo g, and I only know his names I didn't know what he looked like until now",en
876,"the summer I turned pretty ep 5 , 14:18 - 15:35",en
877,Polo g is the best one in the song,en
878,vibes when alien exist,en
879,Do Mr Incredible Singing Better Days,en
880,Do Mr Incredible Singing Better Days,en
881,Crazy this only has 23M views bruh,en
882,"i hope... Someday, 10 billion view",en
883,"She looks like Madonna, but in better and… younger! ",en
884,Polo g carried if it wasn't for him I wouldn't be here,en
885,why’s everyone hating on the Maes part it’s good ??,en
886,Polo G makes this song,en
887,It sounds like the end of the song FORMENTERA - AITANA,en
888,Turn that shit up fam,en
889,White one dancing is loved by me,en
890,This song ain’t bad but the goat makes it way better,en
891,I heard this song everywhere but it's not famous,en
892,I bet you're reading this while the song is playing.,en
893,Sofia song,en
894,IN THIS VIDEO ED SHEERAN IT'S TOO FUNNY!GREAT PERFORMANCE!,en
895,I can hear plastic love in this,en
896,Polo Carrie’s this song,en
897,I still don't know what I did wrong though,en
898,Shes beautiful,en
899,The beat is the same as say so,en
900,It has doja cat say so vibes,en
901,She sounding just like Babe Rexa,en
902,The beat song like Doja Cat Kiss me more,en
903,Funny cause I was just shopping when I heard this song,en
904,introverted can't make friends I cry,en
905,sound like an euphoria song,en
906,Good joob from morooco,en
907,this song sounds a lot like follow you by imagine dragons ngl,en
908,this song reminds me of Alfred from Bloodborne xD! Alfred with the Logarius wheel I don't know why xD!,en
909,lakey inspired better days and i find this,en
910,"I saw a reply commenting on a comment that someone was saying that this song sounds like it would be played while shopping and I third that.

Catchy song but lol that shotgun mic isn’t attached to anything ️",en
911,Standard MTV PUSH as usual. One of better PUSH selection on MTV. It was PUSH on MTV in January 2022...,en
912,Sounds like Sofia- Clairo,en
913,Everyone in the comments :  the video can I get a amen,en
914,She looks like a dark haired Anne Marie ,en
915,"the into part I feel I've heard it before when I was young, can you help to find out ?",en
916,I like how everybody is just appreciating Polo G,en
917,Origin song of the Black pink ‘hard to love’,en
918,Doesn't her voice sounds similar to bebe rexha ?,en
919,carried by polo was always,en
920,Polo G with that hard carry,en
921,it sounds like a doja cat song,en
922,This song is nothing without polo g,en
923,Absolute warzone in the comments. Just enjoy a good somg,en
924,"I'm reading Polo G is the only reason this song is any good. He does great in his part. but it's an all round combination, firstly for any song to be good it's all about a good beat, secondly good singing. so neiked, polo g and mae Mueller make it work. seeing  it was released half a year ago. only heard on YouTube few weeks ago. Good tune",en
925,Polo g almost fu*ks the song up. The beat and Mae’s beautiful vocals save it.,en
926,I thought the girl singing was bebe rexha before I searched it up,en
927,Song carried by Polo G,en
928,My only reason to be here : Pianist G,en
929,Who else came here from minecraft pvp montages and heard the song playing in the montage,en
930,Backseat maybach lavish life ,en
931,Dua Lipa has been real quite when this dropped,en
932,It was made 8 months ago I thought it was made at least 2 years ago,en
933,In which song this was inspired? Talking about the first rithm,en
934,Why isn’t this song on top 100? Please it’s time to mute dua lipa and weekend for few days pls ,en
935,Why’s everyone putting the lyrics when they’re literally in the description????,en
936,Polo g did the best,en
937,1:07 just leaving this here,en
938,Thanks nfl shorts for this,en
939,Main part sounds like this song by Joy Crookes: https://www.youtube.com/watch?v=huOMunNyw1Y,en
940,mae parts not bad even tho im here for polo g,en
941,Nicolas and the other three men are the same age and I don’t know what they look at in terms that are not in their prime yet and they have been married since they are three and three months apart but I think they’re still together for the longest period and I think they’re going through some issues with the family but they have been through some of their issues with their parents,en
942,Reminds me of Doja Cat and Dua Lipa doing a crossover using a younger version of Madonna for the video. With some rando who just found autotune doing the 'rapping',en
943,Tf? GAAAA DAYYYUUMMMM SHE GOT A FOREHEAD ON A FOREHEAD 1:36 CRAAAAZYYYYY ,en
944,Damn she’s fine ,en
945,She sound like a mix of Doja Cat and Dua Lipa and Bebe Rexha,en
946,Who is here after Tahsan's coke studio part?,en
947,Oh dang the girl from Louis the child and Charlie xcx cool cool cool I like it,en
948,Introvert can’t make friends is so true,en
949,polo g carried soo harf,en
950,spider man atsv will be good with the song,en
951,1 year ago?!! holy sh-,en
952,The song about covid :'(,en
953,she sounds like babe rexha,en
954,"DON""T WORRY CIEL I WILL STOP CRAFT STRAIGHT AHEAD AND SAVE THE WORLD",en
955,Sounds like Lazy Baby by Dove Cameron.,en
956,Pov u heard the kids bop one,en
957,"We drove through the city of Ameridus, the parallel reality of Earth. 

All of the animal people stared at us. ",en
958,"I mean yeah, nice song, but how is it any different from Doja Cat - Say So?",en
959,They should have chosen Rina.The Europeans would of loved her sound ,en
960,Make a remix,en
961,that is the most English looking woman I have ever seen,en
962,Mashup with cupid and say so please,en
963,I really thought this was Bebe rexah when I first heard this,en
964,Tbh Polo G carries,en
965,SSS from trails of Zero and Azure- we feel that,en
966,Hello I'm jibran from Pakistan city Karachi I'm your biggest fan,en
967,That's an unlimited contact,en
