,comentario,liguagem
290,This is such a great song,en
291,I love this song,en
292,"This gon be that one song, You can’t play round the homies ",en
293,Would love to see polo g making songs with this kind of instu,en
294,This really giving me summer vibes,en
295,I listen to your songs every day,en
296,Polo need to drop more fkin songs he playin with us,en
297,This is such a vibe. This is what dancing with my depression would sound like lmao.,en
298,This song is stuck in my head. I ain't mad though.,en
299,I'm here because my homie went hard singing this in the whip I was like wtf  but been in my head since and her voice is nice :),en
300,Kinda depressed rn and i can relate to this song it comforts me,en
301,this is a bop that forever 21 would play in their store,en
302,Finally Swedish band with quality content!,en
303,this sounds like a song you would hear on the last day of primary school,en
304,Everyone saying how good polo is but she wrote the lyrics and doesn’t get enough credit for what she does,en
305,J’adore ,pt
306,I'm so addicted to this song.,en
307,Really don’t understand why people hate on polo. But I’m glad to see people start enjoying his music again because he’s never been bad he’s versatile for sure but “piano g” is still good too,en
308,Didn't even realise how relatable the song is,en
309,This music video is gonna be nostalgic one day.. ,en
310,beautiful I love this music ,en
311,I might get hate but polo gs part really make this song skyrocket and become super popular,en
312,"This reminds me like ""Say So"" by Doją. It's a really catchy tune. Love it!",en
313,This sound like a song they would play at the end of a movie ,en
314,This song hype me up!!!,en
315,The best,en
316,I saw the kids bop version first. I'm not gonna lie this song is great both ways. Love it. ️,en
317,Can we talk about how beautiful maes eyes are!<3,en
318,"Polo absolutely spazzed on this Never thought he’d sound this good on a song like this, really suprised me. He was the highlight of the song for me. and maybe one day i can be as big as him with my music",en
319,"Everytime this song comes in my recommendation, i always listen to it.",en
320,i love this song so much thanks boxbox :),en
321,This better be popular now :),en
322,This my favorite song I love her ,en
323,This song reminds me of a movie theater. Because I heard it a lot in the movie theater when it first came out,en
324,Polo could be number 1 if he had good producers   And ever1 knows it,en
325,j'adore,pt
326,Yes this video released on October 7 but the actual song released on September 24 so happy 1 year anniversary to this extremely incredible song!,en
327,When polo g said “be careful with a heart cause it’s fragile” I turned it up !!!!!,en
328,I love this song good job,en
329,This song is too good to be real,en
330,"Two things:

1. This song is my new obsession
2. Is it just me, or are all these artists obsessed with 80s nostalgia when crafting their music and music videos?",en
331,Honestly was planning on staying in bed and be a depressed little girl but  decided to bump this and get out my feels and get the day going. Can I get an Amen,en
332,0:38 that vocalizing tho ,en
333,this song is such a vibe,en
334,polo can really collab w anyone and NEVER miss. he’s sum different,en
335,This is a banger!!,en
336,This sounds like a song that would ply in the summer of 2016,en
337,"I've been feeling lonely
I need someone to hold me
Come on, baby, hold me
Yeah, I've been feeling jaded",en
338,Dude on the bass is low key fire,en
339,Wow this song is so original! It doesn't sound like anything else I've ever heard before period I am so glad that today's young artists are able to express their originality and creativity.,en
340,"I'm here to say this song is gonna be a classic, move your body kind of classic...",en
341,Addicting ,en
342,I love this song,en
343,1:10 most iconic part of the song ever,en
344,This sounds like a song you should listen to during Christmas time ,en
345,this song is whole vibe when listening in long car ride I swear,en
346,So... I guess I should thank my university cafeteria for playing this banger while I was dozing off during recess.,en
347,Why isn’t this viral️,en
348,"""Chilling with the Stars like a satellite, AP on my arm and it's shining bright."" That verse fire",en
349,"very similar to say so, both with great summertime vibes",en
350,Sounds like an anime ending credits!!! Like it!!!,en
351,Polo shoulda had a longer verse,en
352,Do You Remember Last Night Cause I blacked out In Tha All White Dress With Her Back Out” THATS MY FAVORITE PART ThO,en
353,Damn. I love Mae's voice. Incredible song. So catchy,en
354,this song. this lady. so underrated.,en
355,Just Awesome,en
356,"Watching this in 2022 gives me 2021 vibes.
This song is a literal BANGER.",en
357,"im conviced polo G can sing any genre of song ever, man is a beast like wtf",en
358,officially 1 year since this video came out!!!!,en
359,"5 secs into this and you know it's gonna be on repeat. Such a vibe, this.",en
360,I looooove this  song,en
361,Wow this song underrated AF,en
362,"Why does this isn't famous in tiktok, this is so good",en
363,Finamente  achei essa música,pt
364,This song has a special space in my heart ,en
365,"I've been going through a horrible depression that started off mild in 2021, but severely worsened in 2022 and is still present at the time of this comment (4/2023). This song is unique song as it provides comfort in two ways: 1. Relatability (e.g., going through dark times, depression, waiting for a miracle, etc.) and 2. Upbeat Pop song (i.e., this song can still provide an upbeat vibe/mood - regardless if things are good or bad). As mentioned above, I've been going through this awful depression and this song is one of my go-to's, mainly because I sure have ""been waiting for Better Days"". Psalms 34.18 ",en
366,This is awesome,en
367,This is so underrated,en
368,"this just proves polo g was being held back by production, he can adjust to any beat",en
369,life was good when this song dropped well at it peak,en
370,"love the music video! old school vides, retro!",en
371,Underated song,en
372,i love this song.. it has happy posisitve vibes thru this chaotic world. shows that.. there will be better days.. maybe not today.. maybe cocovivi still exist..maybe world war III was stupid ideas for our next generations,en
373,I so need an Amen.,en
374,"Mae Muller finally getting the recognition she deserves, what an amazing voice, what an amazing song!",en
375,polo g DID SOOOO GOOD in this song,en
376,This song goes hard,en
377,Everyone saying it should be a summer song but it really is. I forgot what it was called and typed in summer days ,en
378,The only thing I’m appreciating is the thumbnail it’s literally my aesthetic,en
379,I heard this song on Pandora now i like it. Thank you Pandora,en
380,"If this song doesn't make it to #1, then something is definitely wrong",en
381,This song really hit different,en
382,I'm just waiting for everyone to come back here in a few years and feel nostalgic lol,en
383,bring me back to 90's,en
384,"got this song/video as an ad on a video and for once i didn’t skip, the aesthetics and visuals are so pretty and just perfect!! mae is BEAUTIFUL!! can’t believe how few views this has, deserves so many more! <3",en
385,The best hits.,en
386,Omg I love this song,en
387,"Thank you for playing this on my Dua Lipa station, Spotify. ",en
388,This is a mood,en
389,song of summer eveningsGreetings from Turkey ,en
390,I’ve never been the biggest Polo G fan but I’ve had some of his songs on repeat recently icl. I love this song.,en
391,"I never knew this song.i listened to this
on the radio then it was my favorite song",en
392,Love it ️️,en
393,How does she not have more subscribers ,en
394,Can't help but think what a cool name NEIKED is!!,en
395,I love this song,en
396,Something about this song gives me early 2000s vibes. Love it.,en
397,This song made me feel better about my voice  I got this song from my ex Bro today he said he liked my voice,en
398,it is a very happy note for you are a goddess <3 I love your music it is so beautiful,en
399,I love this song,en
400,1:09 is when polo g starts,en
401,"I can't help but listen to it every day, it's addictive!",en
402,NEIKED is wholesome ️,en
403,love to play this song in school,en
404,"Ok well, I can relate.
And I imagine one of my tough guy friends singing the man",en
405,This just straight gangster move by Polo remixing this type music yeah now this it's what real hip hop is about,en
406,Best part of the song 0:00 through 2:55,en
407,"She is one of the most beautiful and dashing singer rising now.. 
Can we just appreciate her amazing efforts for such masterpiece.",en
408,"I don't know why, but I love that they used the map of Europe, making it so cute",en
409,Polo g part is so good I keep replaying it love polo g,en
410,I finally found this song after months and months of hearing the beat continuously at work,en
411,"so damn good , i love this classic color of this mv, so i love her vibe and her flow too",en
412,Shout out to target for helping me discover this song while I was shopping one day and special thanks to Shazam as well ,en
413,This song is giving vibes,en
414,Polo G is so underrated right now lol,en
415,Summer 2022 playlist ️,en
416,"There's a lot going on in the song that I like. It's got a happy summer vibe, but also has a clapping sound in it that was common in 80s songs that I liked, like Jennifer Rush's 'Ring of Ice'. I love this song.",en
417,my kitten had leukopenia and yesterday i listend to this song and he sat next to me. I still remembered well as I replayed this song lots of time. And today he died. I feel like I have a big hole in my heart. I hope my lovely kitten could have better days in heaven. Rest in peace my angel. 17/05/2022,en
418,Polo G carried this song so hard,en
419,“be careful with her heart cause' its fragile”,en
420,I accidentally heard this song in shopping centre and finally i found it!,en
421,Polo G is versatile and always ready for collaboration ,en
422,Polo carried the whole track,en
423,"I thought i heard Ariana Grande singing this song in the supermarket but i coudnt find it, gladly i final find the great melody that cannot stop ringing in my head",en
424,This song gives me ending movie credit vibes,en
425,How did polo g get this feature  shit go hard ,en
426,"This song never gets old. No matter how much I listen, I never get bored.",en
427,"Damn, can't believe it's been 1 year already",en
428,"Beautiful song just like you 
I honestly thought this was Dua when I first heard it. Future collaboration maybe ",en
429,1:36: pure beauty!,en
430,I was only listening to polo g verse but the other part has rubbed off on me. It’s bumpin ,en
431,Didn't know how versatile polo g was until this Song I'm impressed.,en
432,My friend died recently in a car accident. He always played this song when we hung out. RIP Gabe️,en
433,What a perfect song for these COVID19 days? We are looking for better dazes !!,en
434,THE SUMMER I TURNED PRETTY BROUGHT ME HERE ,en
435,"This was my favourite song, but now that it’s 1y after, it hasn’t been noticed lately. ",en
436,Polo G can't let us down he creates bangers when he releases a song,en
437,Omg I fking really love you guys.️,en
438,Idc who these people are this is literally so good,en
439,This song makes me so happy. I play it whenever I’m crying.,en
440,It's funny how this song amuses me and makes me sad at the same time.,en
441,Why does this sound nostalgic even though it's only from 11months ago,en
442,It’s a vibe,en
443,"She looks like Elettra Lamborghini, the sound is amazing!!! Love this song️",en
444,OMG THIS IS THE SONG I I WANTED TO FIND,en
445,"There’s no Carrying, Mae killed it. ️",en
446,Why is this song so happy and depressing at the same time,en
447,1:36 she’s staring right through my soul ,en
448,My jam makes me not want to do anything or work,en
449,It plays 20 times per day here in Brazil,en
450,"Heard this song on ""The Voice"" on November 30, 2021 and came here.  Love it!  Just a good song, fun, relaxing, no stress.  Float on a cloud and listen to this everyday.",en
451,"For some reason I feel like this song has an undefined vibe of sorrowness, and whenever I tune to this I feel sad. Really good song however ",en
452,This song is clutch ,en
453,Bro why is she underrated cuz her vocals bro,en
454,Beautiful and can sing,en
455,Who else listened to this song just to hear Polo G’s verse,en
456,Mae’s music never misses,en
457,Amei essa música,pt
458,Nah this honestly gives me summer vibes,en
459,Heard it on Dubai 92 - fucking what a proper Radio song - proper 90s vibes,en
460,My new favorite song,en
461,"Looking at the comments, it really saddens me how underappreciated and disrespected Mae Muller's parts are. I feel like rap fans and pop fans greatly misunderstand the other's genre. All three of them made an excellent song with Neiked's vibrant and upbeat production, Mae's stellar vocals, and Polo's fantastic rapping skills. Let's all just appreciate this masterclass fusion of Pop and Rap by 3 talented artists!",en
462,"He aint gone.building a foundation which hopefully translate into our future generation,something that represents what we are and not what we have become",en
463,"I dont know who the freak Polo G is, thanx Spotify for showing this masterpiece, I am now officially a fan of Mae Muller",en
464,Why do I love this omg,en
465,"Mae is such an amazing singer, I have been listening to her songs for the last few days since I heard this song on the radio!! L'chiam, To Better Days!!",en
466,Surprised how much her and Bebe sound so similar. I know I’m not the only one that thinks this because better days pops up in the search when you type her name ,en
467,I would never know this song existed if polo g wasn’t in it,en
468,Finally a “MUSIC” in modern days,en
469,mae has such a good voiceeee this is on my driving playlist,en
470,So nice to see a music video where they're fully clothed!! Awesome!! ,en
471,Why this song is so underrated??,en
472,Man how'd it take me so long to find this one ,en
473,"For people who only want the polo g verse, it’s at 1:00",en
474,"Everybody is talking about Polo, but can we appreciate Mae’s voice??",en
475,"Honestly at first when this played randomly on spotify I thought its Bebe Rexha 
But amazing amazing song ",en
476,Love this son,en
477,Wow the best song ever🇮🇱,en
478,I was learning my past present and future verbs to learn this song LMAO,en
479,Heard this song at my talent show and they stopped when polo G said amen at the start of his verse ,en
480,Feeling disco vibes from this song. Love it ️,en
481,"Polo g: perfect
Mae: Perfect
Overall the song: AMAZING",en
482,i love how the dude with shades doesn't say a word and yet still fits in with the video,en
483,This is so underrated :<,en
484,Ok but can we talk about how Mae looks?! Shes sooooo pretty omg,en
485,This song starts at 1:09 and ends at 1:44 for those wondering,en
486,"Nice, found this gem ",en
487,I feel good when l hear the song,en
488,If this was in polo g channel it would’ve gotten way more views,en
489,This song is really great the girl that sings has a beautiful voice so is her I absolutely love it!,en
490,"This is my fav song (snowy loves it)
Lol I love u ur so good at singing <3",en
491,Addictive ,en
492,Polo g be carrying every feature,en
493,Mae muller is a beast on this song,en
494,I Shazamed it when it was playing in a documentary in the TV,en
495,He just proved the whole world that he’s a goat with this,en
496,"Been hearing this song from the TikTok 2022 Hits playlist I always play on Spotify. Just now I’ve seen the music video. Cool! Retro vibes right here. 
Ngl, I thought I heard one of the Migos in the rap verse. ",en
497,Her face looks like a beautiful sunny filter in the thumbnail. She is just so beautiful ♡♡♡♡,en
498,A cross between  BEP & NO DOUBT,en
499,"I've never felt every bone and joint in my body move as much as they do when I listen to this JAM. I love the nostalgia feeling, I love it all. :)",en
500,This is the song I’m doing for my showcase!!!!!! I’m exited! Love this song btw! 🫶🫰,en
501,normally I dont like songs like these but an asian boba shop forced me to listen and I loved it lol,en
502,Underrated,en
503,Life was good when this dropped fr,en
504,Why is this song underrated ,en
505,"Show some respect to everyone on the track, even if polo goes hard",en
506,"dunno why it sounds more of like ""Say So"" of Doja Cat, but with Dua Lipa's voice ! ",en
507,"The intro to this song sounds like a complete ""Say So"" to me.",en
508,Roll 1 let’s get high tonight ,en
509,Nice song really like it,en
510,"Why is Mae Muller so underrated?
She deserves so much fame like Taylor Swift,Ariana Grande,Selena Gomez and Billie Eilish etc.",en
511,Polo the goat frfr ,en
512,"When you are an Ambivert, and get the best of both worlds.",en
513,Only know this song because of Polo da goat,en
514,Song gives me a 2015-2016 summer when it's evening and I'm going to the carnival on the boardwalk with my girl and I love it,en
515,Things have a way of working themselves out..Lies come to light EVENTUALLY ,en
516,"Your are soon becoming  a legend ,no cap and I hope ya dig",en
517,Bro polo is the only reason this song blew up,en
518,Underated,en
519,This gon be so great. Love you Mae!!!,en
520,"If this song was released in summer, it would be this years Roxanne",en
521,this is my anthem,en
522,Me knowing that strawberry icecream is better than chocolate,en
523,"I kept whistling the first part, and it took me forever to find the song lol",en
524,"Found this on the radio
And intensity fell in love with the song
Great work!",en
525,Birdy for Eurovision! ,en
526,"My ex best friend who talked bad about me behind my back an literally f**king tried to deny it when I saw him. He showed me this song when we were ""friends"". And whenever I want this in my recommend I started tearing up thinking about how I wish I could go back to better days.",en
527,Sounds Good!!,en
528,Polo G hands down carried this song I wish his verse was longer,en
529,it wouldn't be hot without Polo G ,en
530,Visuals are on point guys. Love it!,en
531,Polo G slayyyed,en
532,"Yes they both did amazing at their parts, but can we talk about the TRUMPETS",en
533,Mea Muller did great and polo g and don't forget my man with da guitar  this song hits,en
534,Mais uma pra minha playlist ,pt
535,This is the song can make me happy. thanks,en
536,"Your daddy misses you.I never seen him like that,I PRAY FOR Y.O.U BOTH",en
537,I remember this song playing but I didn't realise it was polo g,en
538,"The tune/beat, it's like I heard it somewhere before. But I just can't recall the song title. It's a bop song too.",en
539,OMG POLO IS SO GUT IN THIS,en
540,Guys polo G snapped but you gotta give her credit too she got great vocals,en
541,I kind of wish Polo g had a longer verse,en
542,They might be singing terrible but I love this song,en
543,Plays at work ever day lol ,en
544,This song and “Did You Call Me” by Lukaz are some of the only things getting me through tough times. I hope everyone is doing well. I love you! ,en
545,I'd give that an Amen! Mm.,en
546,"I literally love this song, so much.  it’s so 
Catchy and a vibe. But definitely a summer song. And the vocals they give ",en
547,I applaud you for such a great song that is catchy without being inappropriate for kids.  I have played this many times for my students and they keep asking me to play it over and over.  Kudos to you guys!!!,en
548,Yea you would have banger is a banger no matter who's in it. Btw first time hearing polo G.,en
549,1:17 for anybody who needs it,en
550,Who else came here just to listen to Polo G's part ?,en
551,"Mae, Loving your vocals, simply Amazing ",en
552,"My favorite part is when he says, “Hey pee on my arm and it’s shining bright.”",en
553,"no idea why people are talking about polo g, like mae muller is the part of this song that's like actually good. a killer melody and great delivery. polo g is fine, but mae muller is fantastic.",en
554,POLO CARRIED,pt
555,tbh I feel like this song belongs to Polo G ,en
556,The instrumental reminds me a bit of A Hat in Time,en
557,this kind of song is so refreshing during this age of music,en
558,Polo G is the only reason everybody likes this song,en
559,This song and vid are God’s answer to the hellish doja cat…,en
560,10:08 if you want the good part,en
561,You could put polo on any song bro is legit built different,en
562,This song is me rn,en
563,This song is AMAZING there’s nothing wrong with it.I love it ,en
564,They needa throw this in 2k23 fasho,en
565,Damn this is only 4 months old? Why does it feel nostalgic then? Interesting,en
566,1:14 i would not notice this song at all if it wasn’t for that part,en
567,This song shows that polo's voice can work anywhere,en
568,the instrumental sounds like something you'd hear in a pokemon game,en
569,"I have no idea who the polo g is, but Mae is amazing ",en
570,"“introverted can’t make friends” Neva make plans on da weekend, prayed for better days remember when I was in tha trap house. Now I’m up and it’s alright, put me and my fam in da spotlight, now I got shit I neva had now, each night that’s three thou, hopped ona summa beat das a vibe now, polo g das me man I swear I’m jus to verse-I-tileeeee. ",en
571,I like the beat the song is okay,en
572,Love this song!!! Can’t drive without it!!!,en
573,Fark me this is such a bop!,en
574,Polo ate this pop song up,en
575,Im addicted to this song my favorite fuckin song,en
576,"Is it just me or this song would be way more underrated if Polo G wasn't featured. Still underrated tho. Now that I think of it, she you're happy, you listen to the beat, when you're sad, you understand the lyrics.",en
577,Pray for Better days.......,en
578,Love the beat and her voice.,en
579,Polo carried this song so hard,en
580,I love this song,en
581,I like this song,en
582,Música servil bem nessa época de guerra e incertezas!,pt
583,The polo part is fire,en
584,mae her voice is beautiful also her vocals so much for her!!,en
585,Been looking for pear drops for months and there she is eating them like they're caviar. Hoarding the pear drops.,en
586,sadly my life's theme now lol,en
587,Who loves the polo g part,en
588,polo g really carried this,en
589,"I love this song, I have heard it so far 10 times.",en
590,Sounds better at x1.25 speed ,en
591,everyone in this is so pretty!!,en
592,nice video this go hard,en
593,I can listen to this masterpiece all day… Music in my ear,en
594,Knew this song from Fishychair's CPU Valorant crosshair video and it is so good!,en
595,The first few seconds sounds unmistakably like another song and I can't remember which song,en
596,Neiked went all in with this beat and it's fire.,en
597,When everyone does their job on the group project.,en
598,How to can you work out to this? Gym got it stuck in my head,en
599,Let’s be honest everyone came for polo but maes verse was till fye!,en
600,I've listened to this song about 20 times already its addicting,en
601,polo g carries the song,en
602,I knew this song when it only had 60k,en
603,This song and Blackpink Rose's song Hard to love gave off the same vibes ,en
604,"40 second verse carried this song, just saying",en
605,Polo g definitely made this Fire,en
606,"The lyric video got me thinking the song's about general depression, but the music video is just about being down bad ",en
607,The girl is actually pretty good,en
608,The weather sucks for Mae muller ,en
609,Polo just fits in soo smooth love it,en
610,polo g carries this song,en
611,The beat is jamming though,en
612,"After hearing this song its been on replay, I can't get enough of it. I hear it  and automatically start dancing",en
613,"Nobodys talking about Neiked. everybody that made this song popped off mae,polo and Neiked",en
614,It's literally a sad song ,en
615,Give this woman the cred she deserves. Polo G is the shit but this track kills on it’s own and I don’t see him listed as producer.,en
616,polo g is the best part of this song,en
617,the expression of amen is funny,en
618,Guitar dude (NEIKED) on his super chill shyt playin that guitar,en
619,this feels like the song that will blow up when a web series or movie in the future will use it in their script like 'running up that hill - kate bush'[stranger things s4],en
620,Bro I know polo gs verse by memory ,en
621,"When a rapper collabs with a pop artist it
means the rappers doing good IMO. It takes a certain amount of clout for this",en
622,What's up with polo g's verse being so dope??,en
623,Tbh even if people have their own opinion about the song in my opinion the girl's part would  be fine even without polo (sorry for the late comment),en
624,i wish this song could be only with Polo,en
625,I wanna see the guitar dude hehe. I love this song!,en
626,"Enjoy the whole experience of this song, not just polo g verse. This is a masterpiece. ",en
627,Polo the goat.,en
628,I thought this was the hottest video and song at that x I fell in luv I had forgotten what love was,en
629,I randomly heard this on Spotify and got addicted ever since,en
630,Sounds like the Rocky theme song,en
631,This is such a radio song and it’s great this is gunna be one of those songs we listen a decade long dancing and screaming it,en
632,All i can think about after this song is this girl that i hung out for 4 days and she unadded me as a friend after i invited to party and blocked when were about play Among us,en
633,I love the 80s beat ,en
634,SHOW ME OTHER MUSIC LIKE THIS PLEESAAASSEEEEERERE,en
635,This song is a banger! Wished there were more polo g tho,en
636,This will be my new favourite song for a while.,en
