,comentario,liguagem
0,This just shows how versatile Polo G is.,en
1,This song sounds like something you’d play during summer and I LOVE IT I’ll be playing this during summer it’s such a vibe!!,en
2,sometimes I feel that these people who dont sing dont get a lot of credit. NEIKED actually created the script and music of this song!,en
3,"This song and Mae Muller are both so amazing, I can’t believe it didn’t shoot through the charts.",en
4,"finally, just heard this on radio and cant get enough of it. this is perfect for radio. very addictive to listen to.",en
5,this song hits different when you actually sit around and wait for better days,en
6,"That Polo verse basically carried this song into the limelight, and I'm more than happy about it",en
7,Love this song  beautiful voice mae muller,en
8,"I saw a comment saying this sounds like a song that would be played while shopping,and I agree sm. It's a song I'd want to hear while shopping.especially in a mall during summer",en
9,"Awesome song, Polo G always delivering  in his verses. Glad I discovered Mae, she’s a great singer and is gorgeous.",en
10,Love this did not know Mae Muller until the Eurovision 23 announcement today! Great Entry Great Artist! Wow 🇬🇧🇬🇧🇬🇧 Goodluck for the Win ,en
11,Mae Muller got such good vocals. And Polo continues showing how versatile he is,en
12,one of those coming through the pop-charts that just suddenly lift your spirits,en
13,"this is the type of song you would hear while shopping, on the radio and during summer",en
14,"This used to be the song I played the whole day for months. One year ago when I knew about this song, this became one of the things that triggered my motivation. One year later, compared to where I was back then, I feel so proud of myself. I knew better days were coming, and I did work hard for them.",en
15,"Mae Muller is waaayy too underrated - this is fire. heard it on the radio on the way to school this morning and it was stuck in my head the entire day; couldn't stop singing/whistling to this during school, in the afternoon, and the tune's still jammed (pun intented) in my head rn and it's almost bedtime. songs like these we don't know we need more of.",en
16,"As a Polo G fan, I can confirm that they both did their part good af",en
17,All I do is sit around & play this song on repeat...!!! ,en
18,This song hits different an hour after leaving a job you hate for a better one ,en
19,"Every bit top notch, great spring/summer vibe and what a bassline",en
20,"Polo's verse was amazing, but you gotta admit Mae deserves a lot of credit too",en
21,"I’m far too old to be listening to this music genre, but I can’t help it - this song is too addictive, it’s got me hooked.",en
22,Dang Polo is so versatile with his voice. It’s like he can tweak it to fit any song.,en
23,"Literally since i saw their live on mtv on january i've been obsessed with this song, i love it so much",en
24,I love how this song spread the vibes ,en
25,"música muito boa, que vibe essa colab entregou pqp",pt
26,The music is so positive and it automatically makes you happy!,en
27,Polo G is incredible. He fits perfectly in pop songs not just rap,en
28,Um tremendo sucesso aqui no Brasil.,pt
29,I would never know this song existed if i didnt see her in eurovision,en
30,I LEGIT CAN'T GET ENOUGH OF THIS!! It's so HAPPY & #CHEERFUL !!,en
31,"Polo G's verse is so addicting, I keep replaying it",en
32,It's always great to see big artist like Polo G making/feature songs with new small artists. Definitely a big W for Polo G!,en
33,I came back to this song because it gives me summer vibes  I’m ready to blast this all the time,en
34,Absolutely love this track!! Extinguishes all My stress!,en
35,"I have never been to a concert, any concert. But if I did get a chance, Bruce and the ESB would  be my choice, the energy and love I feel from their videos, I can only imagine what a live concert would be like :)",en
36,I would never know this song existed if polo g wasn’t in it,en
37,"I've been feelin' lonely
I need someone to hold me
Come on, baby, hold me
Yeah, I've been feelin' jaded",en
38,I cannot express how much Brooklyn 99 means to me. I just love how comfortable it is to watch and that is thanks to the great actors and amazing crew,en
39,"Lyrics

I've been feeling lonely
I need someone to hold me",en
40,"Love this. Also, great running track as so uplifting when it gets tough. Nice video too.",en
41,The song I was hearing each and every single day on the pool this summer. Brings such joyful memories. Summer hit no.1,en
42,This song should've dropped in the summer bruh definitely a summer banger,en
43,I love this song make me think about summer vibes ️,en
44,Loved this song since release. Nice work on eurovision. Better days!,en
45,Excellent voice and a very good video!,en
46,"NEIKED really makes bangers, this is awesome",en
47,Great song very catchy  positive vibe good mood type ish,en
48,goes right in the playlist “don’t listen around the homies”,en
49,"Listening when I'm stressed out today ️ makes me happy and less stressed, thank you",en
50,Just goes to show you my generation has some songs that are absolute bangers. I'll be looking back a few years from now being struck with the nostalgia,en
51,Give that bassist a raise ,en
52,"LYRICS
I've been feeling lonely

I need someone to hold me

Come on, baby, hold me",en
53,It’s been 11 months and this song is still a banger,en
54,I like how everybody is just appreciating Polo G,en
55,"All the participants on the creation of this song are amazing and valuable , because this song is a masterpiece!!",en
56,When I heard polo g on the radio I literally almost shed a tear,en
57,"Remember it was pandemic , and she was so right on . Beautiful  female  voice . Love her .",en
58,"Press F to pay respect to this awesome underrated song!!!
Lowkey this is literally the most groovy song I know",en
59,this sounds like a song you’d hear while shopping,en
60, Great Song!! Great Voice!!    Thank You!!,en
61,"Everyone talks about Mae and Polo G, but NEIKED is also amazing. He made this song sounded so good.",en
62,I love this female singer she gives me Amy Winehouse vibes . Rip  but her lyrics are spot on any track she does. But for me its about relaeting to lyrics. And her loving her unique edge she give to each track she does.,en
63,Thank God this music video doesn't have anything inappropriate! This is great! And the song is also very upbeat and catchy.,en
64,Damn this song is so cool and wavy!  Makes me want to drink a good cold glass of lemonade ,en
65,This is a good song Polo is really showing his versatility with this song. Mae has good vocals and the beat/melody along with overall production is good.,en
66,"I've been feeling lonely
I need someone to hold me
Come on, baby, hold me
Yeah, I've been feeling jaded",en
67,"This song never fails to pick me up, even if I was mad before the song starts playing",en
68,"A year later and this still make me think of summer in San Diego, love this son so much.",en
69,"Heard this on hot hits Spotify at work and love her retro voice

all I do is sit around and wait for better dayzzzzzzzzz",en
70,14 years later and this song still goes hard,en
71,"this just proves polo g was being held back by production, he can adjust to any beat",en
72,mae has an amazing voice :),en
73,This song deserves 1 billion views.,en
74,I love this song girl you did amazing,en
75,Polo had such a fire part. Favorite song he collaborated in just because Mae's voice is so pretty with Polo's rapping.,en
76,This song should've blew up way more than it did. These lyrics are so meaningful and catchy..,en
77,This Channel deserves to be MUCH popular,en
78,This is the perfect feel good song for me ,en
79,"It just amazes me how toxic people can be.
Both of them are good singers, what is the porpouse on tryin to put Mae down?
This song is good the way it is. Why don't we just appreciate how good their voices are together?",en
80,"Im getting Baby I'm jealous, Levitating, Good in bed,  and kinda break my heart vibes as well, LOVE IT",en
81,congrats on the eurovision <3 been aware since this,en
82,"Polo g cant miss, he fits in every music beat it's actually crazy",en
83,“Can I get a amen introverted can’t make friends. Pray for better days now it’s 300k when my day ends” POLO G KILLED THAT,en
84,love it ...Im just discovering this woman wow she's gorgeous n love her voice ...polo g never disappoints,en
85,Very very catchy let's smash it this year we was robbed last year but this year I think we may have it xxxx,en
86,You been moving on … (hits hard) Love this song ️,en
87,LOVE IT!,en
88,I am here for all three. Mae has a beautiful voice. Polo G is amazing at rapping/singing and Neiked are fantastic producers and songwriters.,en
89,this song is so good i feel like its illegal to share it to others,en
90,Such an underatted song...! Great hit ,en
91,Love this song I love the beat,en
92,Polo G’s part feels nostalgic already and it’s not even nostalgic yet,en
93,"This song lives in my head, rent-free. 

XD",en
94,"I love this song bru,like everything just sync perfectly.",en
95,"That chorus tho, and Polo’s verse ",en
96,This is so catchy and I love it !! Heard it about 20 times thanks SirusXM and Teennick!!,en
97,I love this song!,en
98,He just makes every song good️,en
99,Love it !,en
100,I love these song ,en
101,this kind of pop is never get bored,en
102,"I really love this song , makes me wanna meet summer really soon",en
103,I love maes part. ITS STUCK IN MY HEAD SHES SO GOODDDD,en
104,Never thought Polo would come this far being from Chicago and having that drill rap to pop like ,en
105,Heard this song on my way to the gym. Thanks for today's musical inspiration to get going,en
106,I love this song ,en
107,I get so excited when I hear the first few beats of the song in my car and blast the shit out of this song.,en
108,This song is good vibes!,en
109,This shows that all polo needs is better production.,en
110,I absolutely love POLO G's part ️,en
111,"Great song,  beautiful signer, this applies to so many. Sitting around waiting for better days. So true. I need to get my ass up and moving. TY ",en
112,It's a great summer song that makes you feel like a great summer ️,en
113,Thank you for the beautiful and catchy song!,en
114,"Only heard this song cuz of my Uber the other day, and now it's stuck in my head  most relatable catchy song I could remember recently lol",en
115,"this sounds like such a radio song, and i love it",en
116,This song and “Did You Call Me?” by Lukaz just hits different in early 2022. Times may be tough but everything going to be okay in the end. I hope everyone is doing well. I love you all! ,en
117,Fucking love mae muller she never misses ,en
118,I love this song. ,en
119,This is a masterpiece,en
120,"I don't know why, but this song gives me a lot of 2018 vibes. Back when i was in 8th grade.",en
121,This feels like the perfect song to play at the end of a movie while the credits are rolling.,en
122,Some songs trying to mix pop and rap feels horned in to make the super sweet song tolerable at all but makes no sense. This is not that! Polo G adds to this so much! It feels like a complete story with mae and him. LOVE THIS! Also the song isn't so overly sweet. It is a super nice fusion and song! well done!,en
123,Just found out about this song. I'm telling you this song is a banger.,en
124,"essa música tava passando na rádio e eu gostei, fiquei caçando até achar, e achei.GLORIA",pt
125,I always play this song on the way to church,en
126,Luv this song  ,en
127,My boy neiked killed that shit.  beat,en
128,This song is the type of song u geek out to in the car,en
129,As a single and STRONG mom I felt this ”all I do is sit around and wait for better days I could use a break” ,en
130,"I loved this song the first min. I heard it! She's a bad AsS! Gorgeous girl. Won't b long til the haters start up with her and yes, the rapping part does add  to the song",en
131,Hopefully she does this for Eurovision,en
132,Even though it’s been a few months.. this song is still on the radio and it’s the only thing I listen to atm..,en
133,Love the Polo G verse  fire no cap 1:05 to 1:44,en
134,I’m glad people are liking polo g again. Never hopped off the wave,en
135,Love this song so so much I listen it to it 10000000 times,en
136,I keep playing the first 30 seconds of the song because it's so good; Mae Miller is a crush.️,en
137,Love it !!!!!,en
138,Polo really proving that his singing styles can vary and he can do them perfectly.,en
139,Can't get enough of song,en
140,Love it,en
141,LOVE THIS SONG,en
142,Mae has such a pretty voice and Polo G’s rap is just amazing. The music fits the lyrics perfectly!,en
143,How come this song hasn't reached over 100 million views. Such a good song is underrated.,en
144,Love this song,en
145,OMG congrats this song and video turned out so good! I really enjoy listening to this song!,en
146,"I just listened to this a gazillion times!!

LOVE IT!!",en
147,This song is so underrated.,en
148,"This definitely has that early summer night of 2013 vibe and as someone here who, I'm pretty sure along with just about everyone else in the world, misses those day, I'm all for it",en
149,This song beencin my head at work all I do is sit around an wait for better days,en
150,Gotta be one of the best songs Ive ever heard,en
151,Song is perfect for the summer,en
152,It's such a good song it give me rhythm heaven sounds if anybody played it as a kid,en
153,Got a folder with like 4 songs in it I listen to only w headphones on or alone in my room this song is one of them.,en
154,"Never heard of her until this song played on the radio and I must say I am in love... and I can listen to this everyday without getting tired of it...it puts me in a wonderful, fun and loving mood. Simply nothing but awesomeness at its best!!!",en
155,Love this song from 🇦🇿,en
156,Holy Shit what a sick Song! Im so happy someone got it in his Video!,en
157,So glad this song blew up on Tiktok. It’s a banger ,en
158,"Big Levitating vibes, more artists need to start striving to make these “radio” hits if they really want to be big",en
159,Voice and music just ,en
160,Everybody keep saying polo’s part was best but the whole song itself is just CHEF KISS! It’s also such a catchy song and it’s gonna be in my “best songs” playlist ,en
161,"Love this song,that’s why I subscribe and get music I like even at my age.",en
162,This song makes me feel good. Definitely a summer jam,en
163,This song is such a bop on radio I heard it all he time and I feel inlove with this song<3,en
164,imagine its the summer and your roller skating with your friends while vibing to this,en
165,this song is such good vibes,en
166,"I don't normally like pop music, but the 70s backing style and the message behind the song hits different.",en
167,"This must be the first best song I have heard without any cursing, swearing words like you know what I mean.",en
168,"This is so cool, what a vibe!",en
169,I heard this in the car and i saved it to notes I DO NOT REGRET IT,en
170,"Everyone talks about Polos part,but the girl is actually amazing.Great vocals.",en
171,Thanks YouTube for allowing these outstanding singers into the YouTube community! ,en
172,"I was really blown away by that video! This song is so fire, I can't believe NEIKED made it! I saved almost 90% on my flights using Mighty  Travels  Premium.",en
173,This song is a banger. Needs more recognition,en
174,This song should've dropped in the summer bruh definitely a summer banger,en
175,Love it,en
176,Love this song,en
177,Wow Mae this song's great I think I can sit  around and wait for BETTER DAYS,en
178,I would never know this song existed without seeing polo g perform this song on stage,en
179,The vibes tho -,en
180,My brother introduced my dad to this song and my dad introduced it to me :0 NOW I LOVE ITTTTT,en
181,"I agree that polo g's verse was heat. But I think Mae Muller deserves way more credit than I see her getting. Besides, this is literally her song. Her lyrics and vocals were melodic and the song would not be complete without her, don't care what anyone says.",en
182,Top !!! ,en
183,"this song is so addictive, i feel like i've known it for years",en
184,Enjoyed it!,en
185,This song along with Dua Lipa's Levitating  and Camila's Bam Bam are songs I can listen to all day without ever getting sick of.,en
186,This song is a vibe,en
187,she has a really nice voice..it’s so chill and pretty,en
188,All I do is sit around and wait for better days story of my life!,en
189,Pop charts love it,en
190,cant believe mae made this! here she is in EUROVISION!,en
191,Bro polo gs verse in this is so amazing ong I wish there was a whole song like it but tbh what gives it is charm is how it pieces into the song when it isn't what polo g does,en
192,"I’m listening to this in the living room, and I can my brother vibing to it lmaooo",en
193,I was beginning to lose faith in pop music but some songs actually are bringing the spirit back and this one of them this song is actual slapper,en
194,The beat of this song prolly the best I've heard in a while,en
195,"i feel like everyone loves polo g's part, which is true, but mae's part was outstanding",en
196,Heard this song over 1000 times in my brothers car,en
197,Polo G's verse is one of the best thing in this Music video... ,en
198,"as a polo fan, i fw his versatility heavily. the fact that polo can make drill songs n then turn around and slide on a pop song like this is insaneee ",en
199,"A collab between a big edm name, one of the best upcoming singers and one of the best rappers out there rn. What more could you wish for?",en
200,Fucking rad!  Thank you very much SR FM!,en
201,Oh my god! This is freaking good,en
202,The way this song hits tho!!!! Polo g  the reason that this song is fire,en
203,Shit goes stupid hard idc what anyone says,en
204,Chilling with the stars like a satelite. Damm this hits different,en
205,i wish she would release the choreography when she was in the blue outfit with the two dancers. it looked so good :),en
206,The alarm woke me up with this beat this morning ,en
207,This song would sound perfect for like when you are roller skating with friends or family,en
208,Im so in love with this,en
209,Can we get a W for NEIKED because I feel like he doesn't get much recognition online. His tiktok account is so unknown and just because he's a beat producer doesn't mean he can't get his share of recognition. Well done with this song bro.,en
210,love this so much!🇬🇧,en
211,I love this song,en
212,This song sounds like a disco party in space 🪩 ,en
213,This song gives me good vibe <3,en
214,This song and “Did You Call Me” by Lukaz are some of the only things getting me through tough times ️ I hope everyone is doing well. I love you ,en
215,I love her voice. The song is so addictive.  Definitely add this on my playlist.,en
216,"Kind of a chill song. It’s nice, semi relaxing.",en
217,Polo's flow ,en
218,"I listen to this song about 10 times a day, im hooked.",en
219,Such a feel good happy song.. reminded me of John Mayer’s New light,en
220,"Polos voice just brings a certain vibe with it in every song he's in 
Thx for the likes didnt expect so many :)",en
221,"its not just Polo G who is amazing...
its everyone!",en
222,1:07 is just when the fun starts till 1:44 is pretty good,en
223,this is song is amazing and the polo g part was LIT,en
224,i love it and this is a bop,en
225,So mae muller is the UK eurovision entry 2023.,en
226,polos part is what the last day of 8th grade feels like,en
227,Love this song,en
228,Listening to this as I puff away on a Sky Walker and wait around for my second night of nightmare-free sleep in my life.,en
229,Ok mae muller is amazing. Ive actually never heared of polo g before. Them singing together sounds amazing. ,en
230,this song was on our playlist at a grocery store for a few months. fucking banger,en
231,"Polo G went from being an introvert to chillin with the stars like a satellite.

Mad respect ",en
232,one year and this song still slaps,en
233,This song should've dropped in the summer bruh definitely a summer banger  2022,en
234,Not sure why it's not classified as a top song here in the land down under,en
235,This song should've dropped in the summer bruh definitely a summer banger 2022,en
236,When everyone does their part on the group project,en
237,Found this song on teen nick while watching Danger Force fell in love with it instantly.,en
238,literally my favourite song rn!,en
239,This song is such a vibe omg,en
240,Mao estou a meses atrás dessa música e finalmente eu achei,pt
241,i use this song for my skincare routine and it's so satisfying <3,en
242,"lets all be honest, polo is the reason this blew up",en
243,This was so fun to watch ,en
244,I've loved this song ever since I heard it on the American military broadcast in Japan in 2022.,en
245,"My current situation, better days will come, (I'm working on myself) Thank you for creating this for us...",en
246,This is exactly how i felt in quarentine,en
247,"""Can I get an amen. Introverted can't make friends"" I felt that",en
248,This is gonna be a radio hit for sure,en
249,This definitely has a bigggggg K-POP vibe to it ,en
250,puttin this in the bussin playlist,en
251,"I heard this song while shopping in this fruit stand store around my neighborhood and it instantly caught my ear, it reminded me of Doja Cat's song ""Say So"" with that similar rhythm and melody. And apparently i was right in feeling that way cause it's literally showing the link for that video on the side of this video",en
252,Sofri mas achei essa musica.. Tocou poucos segundos na serie The resident :),pt
253,Love this song,en
254,i love how polo is finally experimenting with new flows and beats,en
255,"I love the line ""do you remember last night cause I blacked out""",en
256,"People be talking about Mae and Polo, for good reasons, but NEIKID's production is perfect.",en
257,How did this song only come out a year ago but it already feels so nostalgic,en
258,Polo's verse actually hits different,en
259,This is a masterpiece,en
260,"Let's get one thing straight 
They both did well, you just have to be able to see it. And who cares who made a song with who, if you don't like it just listen to something else ️",en
261,"That’s insane. This song feels/ sounds like it was released early 2013 or something…..

I’m like 5months late to seeing this music video.",en
262,Used this song for a school project. A+. TY POLO G,en
263,It’s streaming every day in my workshop  so booom 0:46,en
264,SHAZAM! ️️️ Why is She Soooo addictive? And I mean all Her Personas! ,en
265,I'm randomly find this song and NOWW I'M ADDICTED TO THIS SONG ,en
266,"when he said ""introverted, can't make friends"" i felt that",en
267,Polo G’s verse was what I came for and it was good ngl.  He should do test out other music genres but his rap careeer seems to be successful.  Not to much of a fan of Mae Muller’s parts but it was okayish,en
268,"Love this song, so good to listen too while stoned l.",en
269,Still a brilliant track.,en
270,it's so great. even in the time of covid,en
271,Love it,en
272,This song will blow up over time and then in a few years people will come back to this song for whatever reason claimed they always listened to it! Just saying️,en
273,This brings me such good moments,en
274,Why couldn’t this have been the Eurovision song?,en
275,So bright voice like a flying butterfly wings.  i hope tthis songs artists keep going to the top!!!☆,en
276,"To me it sounds like she has an absolutely effortless control of a very sweet, slightly nasal voice. I'd love to hear her sing Blues.",en
277,Fuck. This song was made to be played in the summer. I wish summer would come sooner. Don’t really wanna wait anymore. Been sick of it.,en
278,I like Polo G he's a cool man I like his voice and his talented,en
279,This sounds so 2015-2016 and I love it,en
280,Love it,en
281,this song is underrated,en
282,"Polo G is so versatile. Didn't expect that. Great piece by him, Mae and NEIKED.",en
283,I don’t care for this type of music but I have to admit it’s very catchy,en
284,I just feel like all of us listening to this are somehow a family.,en
285,"I was SHOCKED when I realized this song isn't from Bebe Rexha, Mae Muller's voice sounds EXACTLY like hers.
It took me months to find this song because I've been googling the lyrics along with Bebe Rexha's name ",en
286,"People forgot that polo doesn't want to be seen as a rapper, he wants to be seen as an artist ",en
287,This song and “Did You Call Me?” by Lukaz just hits different in early 2022. Times may be tough but everything going to be okay in the end. I hope everyone is doing well. I love you! ,en
288,i always play this music on spotify,en
289,"Lyrics
I've been feeling lonely, I need someone to hold me. Come on baby, hold me. Yeah, I've been feeling jaded. Don't know how I should play it. Tell me how to play it. Now you, you've been moving on. Let me know, can I come along? Since you're gone, oh, it's been so long. On my own, my own, my own, my own. Living in a haze, staying in the shade. All I do is sit around and wait for better days. I could use a break. Can I get an Amen? All I do is sit around and wait for better days. Living in a haze (Haze. Staying in the shade (The shade. All I do is sit around and wait for better days. I could use a break. Can I get an Amen? (Amen. All I do is sit around and wait for better days. Sit around, sit around, sit around, sit around and wait. For better, better, better, better days, oh. I could use a break, oh. For better, better, better, better days. All I do is sit around and wait for better days. For better days. All I do is sit around and wait for better days.",en
