,comentario,liguagem
269,This is such a beautiful song,en
270,This is simply mind blowing,en
271,I love this song is the best song ever you’re so creative expiring and I just love your music. This is the best song I have on my playlist on Spotify you’re so creative and expiring in your such a good artist and I just love you so much and you’re beautiful.,en
272,"Good day in my mind, safe to take a step out
Get some air now, let your edge out
Too soon, I spoke, you be heavy in my mind
Can you get the heck out?",en
273,Ive never seen a more beautiful music video,en
274,Sza is what I imagine Mother Nature to look like.,en
275,"1 complete song + half another song, but both on the same track?

Sounds good to me!",en
276,""" i´m worried i wasted the best of me on you baby, but you don't care"" hits me",en
277,She is the music industry,en
278,"Thank You SZA,cause this song I found my DRIVE and I'm on GO",en
279,"Omg she is jus B- E-AUTIFUULLL!!!! LOVE HER!!! She blew my mind with her beautiful dancing tooo!!! That jus topped it off 4 me, EVERYTHING she does is jus so.... like...I'm n awww right now️️️️ N this is a whole year later!!!! FINALLY I FEEL LIKE WE GETTING BK TO REAL R&B SINGING YALL When I 1st heard her, n a very few other new girls@ that time!!! I'm Literally BEGGING jus YOU n  the couple other new women to pleeeasse DNT STOP MAKING BEAUTIFUL MUSIC LIKE THIS PLEEEASSE we really need to b getting BK to actual ""GOOD SINGERS"" sh*#: BLK MUSIC right now!!!; No cap FACTS ",en
280,"That ending though... why she always gotta tease us like that, we need the full song NOW  ",en
281,I like this song very creative music video. I like the magic mushrooms motif. I like that she does gymnastics. Very talented woman. Looks like she went on the trip.,en
282,you can tell she was excited to make this.,en
283,what a masterpiece,en
284,THE SHIRT SNIPPET... she’s in a different dimension no ones doing it like her,en
285,"Good day in my mind, safe to take a step out
Get some air now, let your edge out
Too soon, I spoke, you be heavy in my mind
Can you get the heck out?",en
286,"Still patiently, waiting for the full version of the last part of this song… 🥹",en
287,the way we could see her aura when she was dancing,en
288,"Omg how can I been so blinded and senseless. That I swear God I didnt know about you SZA. Im sooo stupid really!!!. I love you so much. Youre amazing. And your energies are so so so so so so so so so so so amazing, I have almost the same energies. You MUST BE a mermaid! No way!.
Love you so much.",en
289,"nobody is coming close to sza, she is on a level of her own",en
290,"i didn't really appreciate this when it came out but damnn, the visuals, the vocals, the lyrics. girl at and left no crumbs!",en
291,her SOS album will win so many awards.... I have a feeling,en
292,Imma bump this on my next shroom trip,en
293,Calm this energy from this song ,en
294,"this video , this song, youuuu ",en
295,Nobody understands how all of sza songs add up to a story,en
296,"I remember going out side on a sunny day tanning laying with my kitty listening to this song, whenever I’d close my eyes for too long she’d put her paw on me.. I’d like to think she was checking if I was okay.. Everytime I hear this song I think of my kitty, she passed away with leukemia shortly after I found her on the streets, she was my best friend since I have a hard time keeping friends because of my depression. I’m sure this will get buried deep in all the comments but I just wanted to say it’s okay to hurt and be sad, but just remember good days are coming no matter how far they seem.. I promise. Rest In Peace kitty ",en
297,These songs make life better,en
298,Just wowwww and dayum.... Everything in this song is special,en
299,She's such an inspiration for me,en
300,"Y'all ... I dont think y’all realise how deep this shit is. I was crying when I saw her dancing but still focused reading the book, which is her shit y’all. I love you Solana, if you ever come across that comment: your music saved me. Manifesting shit and listening to your music is what keeps me alive. I will always owe you.",en
301,SZzle is officially the most beautiful woman my eyes have ever witnessed ,en
302,THE WAY IM STILL OBSESSED WITH THIS SONG AFTER A YEAR,en
303,The video for shirt in this video should've been the music video the vibes match PERFECTLY.,en
304,she literally helps the world spin,en
305,Man those lyrics are genius. Love you SZA. You gotta give a regular dude like me a chance. Industry ngas are  always gonna do you wrong,en
306,"""I try to keep from losing the rest of me,I worried that I wasted the best of me on you baby, but you don't care"" Man this hits home way too deep ..",en
307,SZA proves that R&B isn’t dead,en
308,Who has this on repeat in 2023 because they can't seem to get enough?,en
309,no bc this song is soooooo good like fr on replay everyday,en
310,"This song is a sad song, a happy song, a chill song, and a song to play while your at the beach or watchin the sunset",en
311,SZA IS MY LIFE ,en
312,This song makes me happy,en
313,I came to listen to this song and I saw she changed some things it looks so good,en
314,Gymnastics and cheerleading was her thing in highschool. As a sophomore she was ranked as one of the top gymnists in the country. Girl got skills!!!!!!,en
315,That has to be the most beautiful music video I've ever seen...,en
316,"I have a theory.

She knew this would be the beginning of SOS, because it hints to it so much in this video and in the shirt video. Here, we see her in this mound, she's battling her soul, battling the control she has. Also we can notice that the video takes place in a nature setting, which is a big theme for Ctrl, but a lot of the videos for the Ctrl have very dark lighting, contrary to this video. She leaves the mound, un-grounding herself and letting all control go. She finally falls asleep and her soul rises. I think that the soul went into the next era, of silence. Nothing. Then in the shirt video we see her soul rise again, this time we see it transport to SZA. Solana is gone, left in the forest of Ctrl and SZA has taken over, deploying all missiles.",en
317,Such a deep song and ms girl is a Yoga warrior!,en
318,Simply beautiful,en
319,"had to come back to this when shirt dropped, forgot how perfect good days is",en
320,"Bruh her songs are actually good and they look like they take time and she doesn’t rush them. Yes, her songs take forever to come out but, at least she isn’t like any of these other musical artists who make a song almost everyday and doesn’t put no effort into the songs. Good job SZA, your a wonderful woman.",en
321,75 million  views  in  1  year..I  will  say  it  again..Her  greatest  song  to  date.  Broken  clocks  54  million  in  4  years. Clorox  Bleach  and  Myles  edits  you  heard  that ! Enough  said.,en
322,I swear her dancing in this song a spiritual manifestation for good days,en
323,Am much more attracted to her music. Much love szn,en
324,Perfecto,en
325,Sza doesn’t know this but this song is the most healing thing for me ty queen,en
326,She is so uniquely beautiful and very talented. Gurlah!,en
327,SZA and Jacob absolutely KILLED it,en
328,sza music is so beautiful bro,en
329,"Two years before SZA dropped her long-anticipated second album, SOS, in December, she showed off her pole-dancing skills in a 2020 Instagram post teasing single ""Shirt."" (And when lead single ""Good Days"" arrived in March, she continued her seduction in the outro of the music video.) The LP details the journey of post-lust heartbreak and how to regain one's confidence, from the sneaky affair of ""Low"" to feeling empty on the punk rock-inspired ""F2F.""",en
330,WE NEED SHIRT TO COME OUT RIGHT NOW!!!,en
331,The endinggggggg she stay leaving us hanging it’s like a never ending story,en
332,"I literally have an obsession with gas stations since I was a kid, and over that I’m completely in love with this video rn! ",en
333,"I hope she could release this form of shirt like how she did an alt for love galore, I prefer how this version is more mellow",en
334,"My favorite song By Sza is 
Good Days 
The weekend 
Broken clocks ",en
335,"people keep saying that the video didn’t match the song, but people needa realize that this is what good days are for HERRR.",en
336,"As a man, I start my day off with this song every morning",en
337,the hair flip i love it your a queen ,en
338,I just think.... .. this is the best song I've ever listened to.. .... .,en
339,Honestly haven't felt a song like this in a while.,en
340,This my vibe big heavy!!!!,en
341,i cant stop listening to the ending of this song its so fucking good,en
342,So are we gonna get the song at the end and a full video for it in a year and a half? ,en
343,"The scenes with the mushrooms so remind me of Björk. And that's why I love SZA. H.E.R, SZA, and FKA Twigs are my favorite neo-soul singers. I'd love to hear a collaboration with the 3.",en
344,"This song makes me feel like, I go back to being a kid on a car trip with my parents, just looking at the beautiful landscapes, out the car window. I know this is so random. ",en
345,I feel like I'm floating every time I hear this song ,en
346,"SZA go in sooo hard on this right here, straight up BANGER! SHe aint like all them artists who just be goin HAM ON THE GRAM by usin dat IG ROCKET    to get followers up on the gram like them Island Boys dun did",en
347,She is on another level,en
348,SZA keep it up and you’ll be the next Rihanna !! On GOD,en
349,i cant believe the song at the end of  this mv is finally out,en
350,the symbolism of her reading while she’s pole dancing. powerful,en
351,Half of us chasing fountains of youth and it's in the present.....beautiful,en
352,"i love sza, but this is her best song till date",en
353,Love this songggggg,en
354,Wow she held on to the extended end for SO LONG WOW,en
355,Sza really have a spell on me ...2023 still running bac to this song,en
356,Sza is a soul healer,en
357,the visuals.,en
358,this song is beautiful,en
359,Bro i am so in love with SZA She is Perfect bro ,en
360,SZA serving us being the Mother Nature × Educated Pole Dancer.,en
361,i'm crying so hard sza i love you so much.,en
362,This song gives me SO much life I get emotional  absolutely LOVE LOVE LOVE IT. -Hisgf,en
363,"Shout out to my Wife she introduced me to this song, I couldn’t even fake like it wasn’t good.",en
364,this song has gotten me through so much,en
365,2023 still listening   letsssss gooooo happy new years everybody ,en
366,"This woman is talented in so many ways, i think in every single way, she can sing, dance, pole dance and she have an incredible mind, like omg, she just deserve everything",en
367,I listened to this song on repeat the day before I turned myself in and went to jail. Now I’ve completed my sentence and am home and this was the first song I wanted to hear.,en
368,Her emerging out the ground was beautiful,en
369,"This song helps me get through so much dumb shit, and yet afterwards(after I listen t this song) I feel good about myself.",en
370,"I love the pole dancing and books, the symbolism of being sexy and intelligent at the same time is beautiful",en
371,"once you vibe to this, theres no going back",en
372,I always thought female rappers are always flexible but never knew sza could be damn flexible,en
373,"Good day in my mind, safe to take a step out
Get some air now, let your edge out
Too soon, I spoke, you be heavy in my mind
Can you get the heck out?",en
374,Journal Log:  It's been 538 days since hearing Shirt and still no full song with or without features. There are days when I believe it was just something I imagined. A siren's song from the fabled sophomore studio album.,en
375,Had to come back here after she dropped “Shirt” ️,en
376,OK ARE WE GONNA JUST IGNORE THE FACT THAT HER DANCING IS PHENOMENAL!,en
377,I love this song my ex introduced hope we'll both get to trip out there again !,en
378,My ex would slap SZA when we were together. This is my favorite song from her. Thank for sharing those good days with me. I’m forever grateful for you.,en
379,Seriously!!!!!!!! masterpiece,en
380,even in its eroticism this is art..so grateful,en
381,"3:13 i love how she just twerks, slay queen",en
382,Sza is really giving us “shirt/bloodstain” i’m not ready,en
383,SZA I love all that u drop us,en
384,Better days are coming ️,en
385,This whole music video makes me think of the 1990s and the 2000s,en
386,"If you think about it, our minds can't even comprehend the future. This is such a good reminder that It can always get better than we realize",en
387,This song really helped me get through my breakup and I cherish it. Just wish the video was more about the lyrics instead of sexual,en
388,she literally just saved all of us and doesn’t even realize it,en
389,a beautiful song from the most beautiful woman in the world,en
390,"The guitar is definitely written by Jacob Collier, it just sounds so heavenly",en
391,Back again in 2022 after hearing shirt full version,en
392,"Good day in my mind, safe to take a step out
Get some air now, let yo edge out
Too soon, I spoke
You be heavy in my mind, can you get the heck out?",en
393,She just posted on Instagram that she's going to release the song in a few days!!!,en
394,"SZA doesn’t realize that she makes literally everyone’s day better when she posts  She’s a big influence on my music, I hope I make a song with her one day ",en
395,I WANNA MARRY THIS SONG ,en
396,Today is the day I became a SZA fan,en
397,I got goosebumps when I put this song,en
398,"Let's be real, everyone enjoys SZA's music. 10/10 song",en
399,"this emotionally, mentally, physically changed me. even my soul bro.",en
400,i swear that i won’t get bored of this song never ever,en
401,this song still makes wanna cry,en
402,this song still makes wanna cry,en
403,This song is what heaven sounds like,en
404,Oh my gosh I love how the ending of 'Good Days' is connected to 'Shirt'.,en
405,4:21 i don't have to listen to this anymore just for shirt YAAAAAASSSSSS,en
406,sza really outdid herself with this song. she is beyond underrated.,en
407,This song is crazy... what a Great,en
408,Lovely ️,en
409,Time to wish for more good days!,en
410,This song kept me alive during quarantine fr,en
411,Who else is back because of “Shirt” being released finally ,en
412,the amount of power this women holds.,en
413,I love how Saw is singing about her ex then is just twerking and dancing majority of the whole Mg its amazing,en
414,My peace of mind ,en
415,I listen to you every day.,en
416,This song and “Did You Call Me” by Lukaz are some of the only things getting me through tough times. I hope everyone is doing well. I love you ,en
417,Sza on a stripper pole... in a gas station is the aesthetic I never knew I needed in my life ,en
418,This song goes out to my GAD I was diagnosed with last month. I will not let my disorder define me and take over my life.,en
419,this song is beautiful af,en
420,"It’s been years. I finally found this song

3:14 she ate that up",en
421,“Half of us chasing fountain of youth and its in the present” that shit is soooo deep. Love that line.,en
422,SZA is so pretty!,en
423,"Good day in my mind, safe to take a step out
Get some air now, let your edge out
Too soon, I spoke, you be heavy in my mind
Can you get the heck out?",en
424,I’m here to listen to shirts the way it was supposed to be released,en
425,"Good day in my mind, safe to take a step out
Get some air now, let your edge out
Too soon, I spoke, you be heavy in my mind
Can you get the heck out?",en
426,Back here because Shirt is coming TOMORROW! 🥹,en
427,THIS IS A MASTERPIECE!! *hits replay*,en
428,"Good day in my mind, safe to take a step out
Get some air now, let your edge out
Too soon, I spoke, you be heavy in my mind
Can you get the heck out?",en
429, I never thought I'd fall in love again!...,en
430,Starting @ 4:43 this is a good next song fr ,en
431,This woman is talented in so many ways...I love her sm.,en
432,"i fucking love u sza, i need your new album pleaseeeeeeeE",en
433,"Good day in my mind, safe to take a step out
Get some air now, let your edge out
Too soon, I spoke, you be heavy in my mind
Can you get the heck out?",en
434,Shirt needs to freaking come out it’s been a year,en
435,addictive and the lyrics r appropriate,en
436,the best ,en
437,i love how she just starts aggressively twerking out of no where,en
438,"Good day in my mind, safe to take a step out
Get some air now, let your edge out
Too soon, I spoke, you be heavy in my mind
Can you get the heck out?",en
439,Sza betta win a mfn grammy this year and that's on period.,en
440,"Lirik :

Good day in my mind, safe to take a step out
Get some air now, let your edge out",en
441,I don't even know how to explain who she is yes I just know she's her and will always be and that's beautiful who else would put a stripper Pole in the middle of a library Her cause she's showing you you can still have smarts being whoever the h*** you wanna be you keep it up I love you,en
442,This BLACK WOMEN is a WHOLE VIBE BY HERSELF,en
443,"Amazing talent this young woman is, uniquely gifted video is interesting with the different dance styles, not understanding the stripper pole tho other wise good work...",en
444,Still remember the first day i heard dis ,en
445,Hands down. This is me my whole vibe 2023,en
446,SO THE LYRIC IS ‘Damn bitch you like 30’. why’d she change it now that she’s finally released it ,en
447,"This feels like watching a fairy ️ perform, she’s stunning.",en
448,"Why hasn't she released 'Shirt' from the end, such a good song, 808's slap too",en
449,"All those discord fights gave me bad days, I listen to this",en
450,I'm just listening to this. I'm late.  This was beautiful!!!,en
451,This song is my happy place.,en
452,This is literally psychedelic music I feel bad for people who watch it sober and have no clue what’s really happening lol,en
453,"This era is like , indie, y2k, and 90’s lmfao. Overall goal is to have a nostalgic feeling to it.",en
454,this song is so dammh peaceful,en
455,yes ma’am u strike that pose  so strong slay,en
456,this is art,en
457,"I feel like no ones talking about her pole dancing. it looked so effortless.
edit: yes guys im aware she was a gymnast. just wanted to mention how effortless it looked :)",en
458,"i see it all. but the background singers ""All always in my mind , always in my mind..."" ahh that part speaks directly to my soul. yerr @SZA youre a genius. All the way from South Africa",en
459,This is one of the most beautiful videos I've ever seen ,en
460,"Wow what a positive song! And then at the end all the sudden I’m like, wait? What’s wrong with me in 30? Such a negative ending!",en
461,"Amiga, saudades demais",pt
462,"I'm still looping this song...Diddy, don't make me come for you! #Semper Fi",en
463,i love the song,en
464,The orange hair definitely fits her she looks pretty,en
465,This is a beautiful video(my fave in recent memory) and easily my fave track off the album. I will say though I'm on the edge of my seat on what's gonna happen if her dog eats those shrooms off her book. It gonna chill in the library with her?,en
466,"Universe, I thank you deeply for this song",en
467,Listening to this in the summer time will change you,en
468,The best song ever,en
469,"“I don’t miss no ex”
“I don’t miss no text”
“I choose not to respond”
“I don’t regret, I just pretend like shit never happened”",en
470,"Good day in my mind, safe to take a step out
Get some air now, let your edge out
Too soon, I spoke, you be heavy in my mind
Can you get the heck out?",en
471,"This is absolutely stunning
a masterpiece !!!",en
472,Just came here to say the song that plays at the end has been released today. It’s called shirt and it is magical. You’re welcome .,en
473,been listening to this a lot and crying lately,en
474,I love how she just starts throwing it back randomly,en
475,"jesus, a voz dessa mulher é identica a da Ludmilla aaaaaaaa",pt
476,This song enlightens us,en
477,After brokens clockes SZA still sleeping on The floor,en
478,my day was really sucking and this definitely just made it a good one,en
479,"For the love of my life She couldn't make the concert tonight, but Good Days are ahead. ",en
480,This is her best and only non toxic song,en
481,She is what i think mother nature would look like,en
482,First time I'm seeing this video... Wow beautiful song ️,en
483,"Y’all I was at ACL last night at SZA’s set and she confirmed the rumors about shirt - its coming out this week, it was supposed to be released yesterday but she didn’t like the video",en
484,The image of her pole dancing in the library is beautiful. So poignant.,en
485,"Good day in my mind, safe to take a step out
Get some air now, let your edge out
Too soon, I spoke, you be heavy in my mind
Can you get the heck out?",en
486,she is so beautiful i cried,en
487,"Essa música me lembra o budismo, que aliás é oq pretendo seguir como se fosse um mantra (dslp se tô errada)",pt
488,Always on mind,en
489,she is litterly one of the prettiest people ever,en
490,Dude I am tripping balls right now and this sing is really boosting it for me man,en
491,this song changed my life i’m so serious,en
492,If I was to imagine Mother Nature? It’ll be sza,en
493,"U know it truly is mushroom music, all those jingles they were beautiful",en
494,I’ve never seen someone roll down a hill so majestically before,en
495,I swear I fell in love wit SZA,en
496,"Lmao even though it's been out for months, hearing shirt just end like that in this music video still gives me PTSD of the anticipation and waiting for it to come out. I can here from hit different and after this video YouTube directly took me to Shirt. God it's good to be alive now lol.",en
497,This video is ultra spiritual,en
498,SZA IS MOTHER NATURE AT THIS POINT,en
499,"This was the song of the year, idk why grammys didnt even nominated to soty and roty",en
500,How did this woman become so beautiful?,en
501,this song cures my seasonal depression,en
502,Wow the orange hair rlly suits her not my kind of music but her pole dancing is captivating,en
503,I’m gonna tell my kids this is Mother Nature,en
504,3:59 me praying for her next album,en
505,listening to this was one of the best choices that i have ever made,en
506,this shit feed the soul,en
507,This video..This Black Queen..its all ,en
508,The instrumental of this song just cleansed my entire mind from all worries god damn,en
509,a whole year later n shirt finally dropped ,en
510,About damn time u dropping this song,en
511,"My good sis said she don’t miss no ex, she don’t miss no text, she just choose not to respond. Now that’s a boss energy I love to see.",en
512,Not SZA curing my depression- ily girllll,en
513,Had my first  trip and watched this and it was a spiritual experience.,en
514,"the divine feminine energy this gives off is so immaculate, divine power of the female ️",en
515,"The new album is gonna eat!!! Already sold over 500,000 units and the album isn’t even released yet!!!!",en
516,Not sure why this song makes me think about that person that I cannot be with,en
517,This song IS…Mushrooms. I feel it.  lol,en
518,no sza you really ain’t have to do us like this the way it started with the acoustic version then you GOBBLED good days and teased us with BLOOD STAIN️ I LOVE YOU,en
519,Qué lindo canta,pt
520,this song is addiction frrrrr,en
521,She's gonna drop Shirt yass we got it,en
522,"This is realy Song for ""End of the World""! ️",en
523,How she so flexible i can never ,en
524,I LOVE HOW SHE PUTS HINTS FOR HER NEW SONGS AT THE END.,en
525,You express a lot in this video. that is my favorite song,en
526,This literally relates to imaginary relationship with this girl in my class.  After we broke up then i realized I'm not bi  it's still hurts me to this day even know we broke  yesterday ,en
527,i listened to this song in rehab and shit changed everything,en
528,is it just me or did she change the lyrics from “damn bitch you like thirty/dirty” to “damn bitch you so thirsty” ,en
529,Sza could literally have every single person as a superfan and still be underrated somehow,en
530,she is a master at this pole. WOW,en
531,"Pole dancing is so beautiful honestly, I wish people stopped seeing it in such bad light and appreciated the art and beauty behind it ️",en
532,If only it was named great days (LET THE VOICE OF LOVE TAKE YOU HIGHER),en
533,"The song : ️
The music video : ",en
534,Still so good. Jacob collier on guitar and backing vocals,en
535,always in my mind,en
536,"This song is such a vibe, and SZA is just throwing it back like there’s no tomorrow",en
537,I swear you're thee sexiest RnB artist out lol. And most talented imo,en
538,that Kiss Me More cameo,en
539,Yes queen girly ,en
540,SZA definetly a Queen imagine twerking on this song. lmfao i love you God bless your soul <3,en
541,only SZA could make pole dancing at a gas station so graceful. like wtf lol,en
542,How much magic mushrooms would I have to do to have a little mini version of SZA come out of them and dance?,en
543,On ,en
544,this song sounds like spring sunshine,en
545,She out here astral projecting and giving the world bops,en
546,I like how Shirt was teased a whole year before its proper release,en
547,yall sza's music is growing slowly and rn its eating,en
548,gosh the lyrics explained this month so much,en
549,Her new album drops Friday,en
550,"Just lost my brother 3 months ago, and I don’t know how but this song is giving me so much hope, good vibrations. Even through this storm, I still believe in good days  Thank you Sza for this masterpiece",en
551,Great somg️,en
552,Love the son ,en
553,This song is literally the bedt,en
554,work of art,en
