,comentario,liguagem
555,I swear if she doesn’t drop this “shirt” song I-,en
556,"Proudly represented by our chocolate ambassador,  restoring beauty in our Blackened Dailias",en
557,I have watched this video so many freakin times and just noticed Jacob’s in the TV ,en
558,She reminds me of Hideaway by Kiesza a lot. Very good vibe.,en
559,So she did this to us fully told us PATIENCE IS A VIRTUE,en
560,Smh her body was amazing as it is in this vedio. Flawless,en
561,I'm never forgiving myself for sleeping on SZA for this long,en
562,I seriously think SZA is one of the most beautiful women ive ever seen ,en
563,This song is my comfort place,en
564,The library poledance really got me,en
565,"She is descreetly showing us what put he in this ""artistic state"".",en
566,something about her throwing in a circle while serene music plays is sending me,en
567,I would proudly hold her bags while she shopped ,en
568,Sza on the pole is fuckin heaven,en
569,It’s like it’s in the middle of the spring and she’s literally dancing all night long and a book shelf like the background what is THAT? And she’s dancing in the jungle I never seen a music video ever in my life like that WTH. But the music is powerful I love it! But at the end I’m pretty sure I heard that song before,en
570,"she's literally stunning. call this a stretch but she's literally as pretty as a dryad

edit:
she's as stunning as a dryad, angel, and queen, as vocally gifted as a siren, or a mermaid, she's quite literally the whole package.",en
571,"shower time, time to listen to this song",en
572,I was in the hospital due to a mental breakdown a year ago. This song helped me through and it has been a blessing ever since I first heard it. This song gives me life.,en
573,I wish you were just my cousin  I just love your songs even my mom loves it sings that all the time in your car and the rhythms,en
574,I always wondered what this song was when I heard it on the radio lol,en
575,Fave of all time.,en
576,"depression: your gonna have a shitty day.
SZA: oh no i don’t think so",en
577,"Great song , try listening to it on Shrooms even better",en
578,my mom love this song so much️️️,en
579,Beat sounds like a heart beat,en
580,“half of us chasing fountains of youth when it’s in the present” that hit hard,en
581,i adore this song but learning the words is nearly impossible like girl what are u saying it sounds beautiful tho,en
582,There's something that's just FANTASTIC about the strip pole in a library... UGH!,en
583,she finally released shirt ,en
584,"LMAOOO I’ll never forget when I first seen this and I’m like “I stay in Houston, I never seen gas that high” now our shit higher than that.",en
585,SHE JUST RELEASED SHIRT OMFG,en
586,PPL DON'T UNDERSTAND HOW ATHLETIC STRIPPERS/DANCERS ARE! VERY STRONG AND BUILT LIKE A STALLION NOT A STICK! HATS OFF TO MY SISTAS OUT THERE DOING THE DAMN THING!,en
587,I love watching this on shrooms,en
588,i love that SZA loves mushrooms,en
589,When she started throwing it back furiously I knew this wasn’t a regular song,en
590,Shit is fire.,en
591,What a Beautiful Video. You are so Talented & Gifted. Bless You & Happy NewYear. 2023 Here We Come.,en
592,"""half of us chasing fountains of youth, and it's in the present""",en
593,You still need to drop that Snippet at the end there.. We have not forgot,en
594,"Fucking QUEEN!!!!! 
You ate every second!!!!",en
595,Haha it is hot to be in a libary and read ( so I loved that contrast or perhaps potential symbolism). I also loved the transition to the naturesque landscape.,en
596,I love how she shakes by the start of the bridge lmaoo,en
597,Dedicated to my love K.C..miss ya,en
598,IT'S THE LYRICS FOR ME.,en
599,"I can't say enough about this entire thing! The lyrics, the way she sings it. So poetic. The visuals of the video. So calming but not a slow song. The vibe is beyond amazing. Dreamy version is amazing too. Sza is the entire package. Talented and wow that pole work. Is there anything she can't do? Love it!!!",en
600,"Salute to those Hebrews, Father Jeremiah and Father Job. True Blood, Guys who put in work for the Better cause. Hebrew by Blood or NOTHING",en
601,I can’t still differentiate sza and Summer Walker,en
602,In my mind I am SZA! ️️️️️️,en
603,love isn’t even the word to describe how i feel towards this woman. i cant,en
604,Yes sza and shirt was fantastic,en
605,I got to find more words and add them here recurring. ,en
606,"Anyone else notice the ""Self"" at the pumps in the gas station, in the outro? I see that as she's using that setting + pole dancing  as a metaphor for trying to achieve self-love (i.e. ""gassing"" herself up). Ugh,  I love her!",en
607,I’ve  been ignoring this girl for way too long. She’s dope,en
608,GET ITT!!!,en
609,Damn is Love this girl️,en
610,i’m really hoping she doesn’t name her next song “shirt” BUT YESSSS,en
611,So how many of us waited a year for shirt,en
612,"""I don't miss no ex, I don't miss no texts, i just choose not to respond""
Is the best line ",en
613,She makes pole dancing look so therapeutic,en
614,absolutely beautiful. thank you thank you thank you for everything you do <3,en
615,THE BLOODSTAIN TEASER AT THE END THO.,en
616,"Jesus I don’t stan out for too many people but SZA god damn. She wrote the song, she can sing like an angel and I forget that she can dance like thatwtffff",en
617,You can’t just tease “shirt” like that and not give me the full song ,en
618,"I don’t miss no ex, I don’t miss no text. I choose not to respond! 

Me: Sza spittin ",en
619,SO NO ONE IS GOING TO TALK ABOUT THE ENDING  DROP IT SIS,en
620,"Not me still waiting on the ""shirt"" official audio to come out- ",en
621,"I knew “Shirt” would be the next single, we need that",en
622,I didn't think this song could get any better until I saw this video.,en
623,Is no one gonna discuss how sza is a literal goddess ,en
624,THE ENDING! WHY IS NOBODY TALKING ABOUT “BLOOD STAIN ON MY SHIRT” AT THE END,en
625,"Producers: do you wanna be a plant or be a stripper?

Sza: yes",en
626,I need to stopped being teased with the last song. Just gimme the whole thing already!!!!,en
627,I don't know why i laughed wen she rolled down that hill but this is fire love it,en
628,Does this song make anyone else insanely sad and happy all at once?,en
629,I can't be the only one who also imagined her dancing in a magical forest for this music video...,en
630,Protect her at all cost ,en
631,but can we talk about the fact that she directed this herself,en
632,I love that she's doing beautiful pole work in front of a library of books. I love the symbolism so much,en
633,"No one:
Literally no one:
SZA pole dancing in a library because she's just that cool:",en
634,I love how she adds little sneak peeks of her upcoming songs at the end of her music videos. She's teasing us so hard and we all want more! ,en
635,I’ve been coming back to replay the end scene for days now,en
636,I think the people that disliked this were just too dizzy from the pole dance that they hit the wrong button,en
637,SZA tumbles down hill me: “she’s such a baddie”,en
638,Funny how i ended up here because of this being at the end of “hit different “ now i am here for the next song at the end  THATS HOW U GET US EVERYTIME SIS️,en
639,She’s so pretty it physically pains me.,en
640,"[Verse 1: SZA]
Good day in my mind, safe to take a step out
Get some air now, let yo edge out
Too soon, I spoke",en
641,This is therapy. SZA is therapy. I am transcending.,en
642,This woman is just.. Beautiful.,en
643,She's been teasing us with this song for too long now.  pleeeeeease let us have it. I'm sicka repeating those lil lyrics we got,en
644,Still mad that the Grammys robbed her of the best new artist award.,en
645,"THE ""SHIRT"" SAMPLE AT THE END OMG SHIRT IS THE NEXT SINGLE IVE BEEN WAITING FOREVERRR",en
646,SHE HAS THE SPLITS,en
647,Sza is 30 years old ?! 30 is not old but she looks a lot younger. From the body to the face straight up gorgeous.,en
648,sza:*respestfully twerks*,en
649,"Pole dancing in a library whilst reading books. Nothing says sexy and intellectual like that. I like this song, the lyrics are intelligent and as usual SZA's voice takes me away to some surreal place.",en
650,The stripper pole in the library is iconic ,en
651,"... and there’s people who don’t like Sza. 
embarrassing.  ",en
652,starts twerking aggressively,en
653,"SZA’s angelic voice + Jacob Collier’s Genius production = THIS MASTERPIECE

Edit: I found out that Jacob Collier mainly contributed in terms of songwriting background harmonies and not production. My bad!!",en
654,I love how Darker skinned black female artists are starting to get more recognition again they owned the 90s and 00s ,en
655,"“I don’t miss no ex, i don’t miss no text.”  IS SOOO ICONIC!",en
656,“Half of us chasing fountains of youth & it’s in the present now”,en
657,It’s the preview of the next song for me,en
658,bro sza need to have a grammy awards for this,en
659,"Good day in my mind, safe to take a step out
Get some air now, let your edge out
Too soon, I spoke, you be heavy in my mind
Can you get the heck out?",en
660,The people who disliked obviously have bad days,en
661,AND MAAM WE’RE GONNA HAVE BAD DAYS IF YOU DONT HURRY UP AND RELEASE THE SONG AT THE END️,en
662,"Nobody:
Literally no one
SZA: aggressively twerks out of nowhere",en
663,The atmosphere that this song gives is beautiful like a relaxing day in a hammock,en
664,I swear she's like a disney princess,en
665,I don’t know how her beats are always so well chosen for her voice. They are always so soothing and then her voice comes in and its like it puts the listener in heaven. Just every note hit to perfection. I don’t have much of a singing voice myself but I take inspiration from the kinds of beats SZA likes to use when I am producing my own songs. I can’t wait for whats next for SZA. Such a beautiful voice. ️,en
666,nobody's gonna talk about how multiple tiny green jacob collier faces are radomly popping while she twerks in the woods ?? Literally the best music video of the year.,en
667,aesthetically twerking,en
668,ethereal twerking,en
669,she literally is one of the if not the prettiest woman I have ever seen,en
670,Sis really came through with her pole skills,en
671,"The way she just dropped a teased of ""shirt""and nobody saw that coming",en
672,"""Feeling like Jericho. Feeling like Job when he lost his shit."" SZA reads her bible. LOVE this verse.",en
673,I didn’t even know this came out five hours ago no one said anything,en
674,"Nobody:
SZA: dancing aggressively  with mushrooms",en
675,"So nobody is going to talk about how she put her unreleased song, “Shirt”  at the end of the video???",en
676,"how the fuck can this human being be SO TALENTED and GOURGEOUS and EVERYTHING 
AAAAAAAAAAAAAA i'm gonna freak the hell out",en
677,Imagine how many people are listening to this with you right now.,en
678,"Good day in my mind, safe to take a step out
Get some air now, let your edge out
Too soon, I spoke, you be heavy in my mind
Can you get the heck out?",en
679,The 1.9k dislikes are the people who never had good days,en
680,"Random person: How much do you wanna pole dance in this video?
SZA: Yes.",en
681,Damn I guess it IS a good day today,en
682,"“feeling like Jericho, feeling like Job when he lost his shit” HAD ME. She did it again! xx y’all don’t understand",en
683,If you're British you know this gives in the night garden vibes,en
684,I CANT WAIT FOR SHIRT I NEED IT NOW PLS,en
685,let me find out that SZA is reason everybody in the hood is now getting high off Shrooms,en
686,I will now have a good day,en
687,Imagine walking through the woods and you see SZA just throwing it back furiously Edit: I don’t wanna be that one person who edits their comment but holy crap yall 1.5k likes?!!!??? I’m not that funny T_T,en
688,YESS. IT'S HERE!,en
689,spiritually twerking,en
690,"Pole dancing and reading, best multitasking ever.",en
691,She’s giving Poison Ivy and I’m fucken in love ,en
692,"""All the while, I await my armored fate with a smile"" and ""feeling like Jericho"" are my fave parts of Good Days",en
693,The fact that this video is one big psychedelic trip she’s having from being passed out on that floor is nuts  lol it’s cool though,en
694,it feels like she's a dream!!!,en
695,I’ve  been ignoring this girl for way too long. She’s dope,en
696,"""I don't miss no ex, I don't miss no text

I just choose not to respond

I don't regret, just pretend shit never happened""",en
697,cottagecore twerking,en
698,"This is giving me Alice in the wonderland, Poison Ivy and Behind Her Eyes.",en
699,This is what being on shrooms feels like.,en
700,twerking while manifesting,en
701,“Good days” is cute but “blood stain on my shirt” would take over the world,en
702,she is very lovely,en
703,It’s like I don’t want Shirts to finish,en
704,Sza’s body is SICKENING ,en
705,Ok I’m noticing in the comments a lot of people aren’t understanding that those are shrooms on the book which she obviously ate so she’s having a shrooming trip .. damn reminds me when I ate shrooms in magic kingdom best time ever I was with my ex boyfriend and best friend Jhonny who just passed away Jan 9 wow I just started to cry How I miss you J... this song is so beautiful angelic like most of her projects she’s just amazing ,en
706,What Belle does in the library when the Beast is not home,en
707,"Why this isn’t trending yet ? Who’s here before 1 million

Edit:thanks for likes guys",en
708,The pole in a stacked library is so original never seen this before,en
709,the little grass computer hinting at her ctrl roots I'm sobbing :( shirt is gonna be a number one I feel It omfg solana you served,en
710,That sneak peak at the end though ,en
711,It’s the way nobody’s talking about how she added SHIRT in the end!,en
712,Not me in tears because I realized that I’m worthy and fine AF,en
713,The people who disliked this... having bad days,en
714,"Me just waiting for the end song to come out …. 

  ",en
715,"Not me, who is in tears because I've discovered that I'm deserving and perfectly fine.",en
716,"Sza marketing team knows what to do, because now I want ""Shirt"" as soon as possible",en
717,"""I don't miss no ex. I don't miss no text, I choose not to respond."" P E R I O D",en
718,Newest biggest fan.save me from the madness!!,en
719,I just realized she was in a fairy circle ️,en
720,"When Sza said 'feelin like Job when he lost his shit' ,I felt that",en
721,"She cleaned the grill, the tongs, then went inside did the WHOLE damn kitchen and I'm still over here starving after that ""Shirt"" outro",en
722,Quem está aqui pelos 400 milhões? FODAAAAAAA!!!,pt
723,The people who disliked this need to get a COVID test because they clearly don’t have any taste urgh...,en
724,UK Singles Chart #13 - 1 wk (04 Feb 2021) | the Best Music Video!,en
725,we still need that song at the end sis,en
726,Quietly twerking,en
727,sza said: academically stripping ️,en
728,I love you and I love your songs so much,en
729,It’s “shirt “ at the end for me  making me wanna learn how to pole dance,en
730,It’s giving black Ariel ,en
731,Ngl this song made me believe in SZA,en
732,I’m so childish I started to laugh when she started to go in circles when dancing ,en
733,WHY IS NO ONE TALKING ABOUT THAT ENDIN?!! So she’s just gonna sneak det in there ,en
734,not her teasing us with another song at the end like she did with good days at the end of hit different mv,en
735,Watching this music video instead of responding to my ex’s texts ,en
736,"No one:
Sza: put that pole in the centre of the library so I could read dancin",en
737,Imagine how many people are listening to this song with you,en
738,officially drop ‘shirt’ right now please!!!,en
739,This song got me thinking about him I need see my baby again this weekend,en
740,Girl- I- not her teasing us at the end,en
741,"The RZA, the GZA and the SZA...",en
742,"Sis, 11 months and nothing, still waiting for a New album or New songs solo :((((( waiting for completly final song of this video",en
743,she really took us seriously when we said she looks like Mother Nature or sum,en
744,Finally shirt will be out soon,en
745,"Can y’all believe, that I never listened to this song before. Until now",en
746,claim your “here before 1M” ticket here,en
747,I want en extended cut of that last minute good god.,en
748,respectfully twerking,en
749,"Are you dancing with her, so beautiful and talented, thanks for amazing song ",en
750,SHIRT IS OUTTTTTTTTTTTTTTTTTTT,en
751,claim your “here before the TikTok guys” ticket here,en
752,magically twerking,en
753,sza my therapy ,en
754,Starts twerking madly,en
755,Cottagecore twerking,en
756,Back here after Shirt finally got released,en
757,They can't handle a good deep soul,en
758,Spiritual twerking,en
759,The “Scrolling through the comments while listening” squad,en
760,New Fan,en
761,80% of the comments : twerking,en
762,"I'm here just for the ""Blood Stained on My Shirt"" part",en
763,She previewed shirt a whole year ago 🫢,en
764,So we just finna ignore the fact she was dancing in a hole ,en
765,This song is so better than the video record company getting her to strip off to sell ,en
766,AND THEN added a snippet of “bloodstain” in the end.,en
767,Spread those spores ,en
768,Watched this in my 2002 Honda Civic now it’s a Lamborghini,en
769,Damb only one year and the bbl is such a dramatic difference today. I’m not mad she sound good and look better good lawwwwdddd,en
770,Really good watch. ,en
771,remember when sza tweeted she shroomed for a month straight .... girl ya,en
772,Why am I crying and shaking?  I feel like somethings about to burst into  my skull lmao,en
773,eco-friendly twerking,en
774,For some reason this is just stuck in my head I don’t even listen to her like that,en
775,claim your “here before 100M” ticket here,en
776,Her in the library  damn she bad af!,en
777,Me : start therapy twerking,en
778,i be able to move on because of this songs,en
779,"Half of us laying waste to our youth, it’s in the present. ",en
780,This song touch me,en
781,why yall twerking? confusedly twerking,en
782,Why did someone so natural blessed modify herself man,en
783,The BBL ok!  But her natural body was it,en
784,Shes laying on her apartment floor astral projecting herself in the garden,en
785,Should have at least 100 million… her team barely promotes her,en
786,You are Star Woman. ,en
787,Her body was perfect ,en
788,these “youtube dislike bots” really need to go away,en
789,and then 2 years later she released the very thing she teased at the wnd of this video,en
790,head empty twerking,en
791,yess girll love your kill bill music video,en
792,Why are we all twerking? questionable twerking,en
793,Psychedelic RnB... It's like if Tame Impala and Janet Jackson had a baby,en
794,After seeing this im convinced she should dance on the side.,en
795,Wait .. the gas station is called self.. so if you go there you’re gassing yourself up omg,en
796,DAT MAGIC SHROOMS DID THEIR MAGIC AGAIN! DEIM! PEAK CONSCIOUSNESS THIS IS.,en
797,Damn I didn’t know SZA was doing it like that on the pole ️️,en
798,"My eyes = reading comments
My ears = listening song
My hand = scrolling down
My mouth = singing song",en
799,i just want her to release T.shirt,en
800,Nice video I had know idea she was this flexible.,en
801,Is no one going to say anything about the fact that the gas prices are almost 5 dollars in this video that is ridiculous,en
802,cottagecore twerking,en
803,"y'all, stop twerking",en
804,I like this one girl,en
805,this good days sounds different than the single,en
806,shirt y’all,en
807,$4.399 for gas..? chile- i'm moving to Oklahoma,en
808,i want the second part in solo,en
809,i think im in love,en
810,SO THIS IS WHERE I HEARD “SHIRT”,en
811,I wish the end of this song was on the good days song on Apple Music,en
812,when is she dropping the second part of the music video,en
813,Sda don’t dance much but when she does she dance her ass off,en
814,It's like she was a beautiful plant-fairy hybrid  lol,en
815,When you have to come here cause she changed the song on Apple Music,en
816,I LOVE U SZAAAAAAAAAAAAAAAAAAAAAAAAAAAAAAAAA U MY BABY FR I LOVE U SM OMG UR MT Y QUEEN ACRYAULLY I LOVED U BABE,en
817,She ion psychedelic shrooms in the video lol that’s dope  if you never experienced that feeling when you on shrooms then you should try once lol,en
818,Alltymfavsong ..szz you're really a musickiller ...wowwww wooww loveu,en
819,She's sick and twisted for keeping me waiting for Shirt ,en
820,Who's here 4:30 after watching Shirt Music Video...,en
821,I love that...,en
822,Makes you Vizaulize that lover you don't have,en
823,"I have never heard an angel before, if black woman stop loving us, we will destroy the world.",en
824,This part 4:33 >>>>>,en
825,3:14 when bae tells you to throw it back ,en
826,is the outro going to be a new song?,en
827,Just noticed that she teased shirt in thiss she’s so smart for doing thatt,en
828,just wondering what book shes reading in the library scene,en
829,*claps in awe,en
830,I rather believe in good days,en
831,“our youth is in the present.” man…,en
832,blasting this cuz my ex j texted me after we broke up 2 months ago and i blocked him ,en
833,Hard to imagine she's speaking English. I first thought it was another language.,en
834,Is many one here because shirt coming out,en
835,Why the song not on Apple Music is the question and it’s been on YouTube for two yrs now smh,en
836,my comfort song,en
837,Here until shirt releases tomorrow,en
838,Shirt’s dropping soon,en
839,DJ Khaled brought me here. God did. Great video SZA ,en
840,I think this is a Beckett's play reference! How brilliant!,en
841,Nahhh this is my gay awakening i love this <3,en
842,My bf Alvin loved this song we’d listen to it smoke some maryjane just enjoying each other company. RIP baby,en
843,Who’s here on the debut of shirt!,en
844,How she sing in cursive,en
845,"in retrospect, someone involved was on shrooms when coming up with the concept for this video",en
846,"Book reading, stripper poles, and shamanic dancing! I am your target audience ",en
847,Baby I wish you didn’t get work done… u were perfect just the way u were ,en
848,Im just wondering how many times she had to roll down that hill,en
849,"yall need to put sza on p,vally ",en
850,Y'all see the gas prices in this video? This was 30 years ago. The song is never dropping. ,en
851,Back bitches!!!!!!,en
852,"Ummmm-

What?
Jk I love all of her, everything",en
853,this gives me mgmt vibes I fugs with it,en
854,Go Jhené and Xtina on the set design!,en
855,Love your nails .. that black ,en
856,Very good song I like it thank you for it,en
857,What's the song that she merged it with at the end?,en
858,Is she tryna tell us she made this on shrooms,en
859,"The only thing i can do when i miss her. Listen this song with some cigg and remembered when she so excited to tell me this song, "" Babe please listen this song, I know you will like it!."" But the only thing i know, Maybe She's listen this song with another man.",en
860,Holy shit this vid hits different when you're tripping I never noticed all the call outs to shrooms as stupid as that sounds,en
861,Big Momma is back on the PLANET yall ass in TROUBLE ,en
862,now it’s “you so thirsty” instead of “you like 30”,en
863,she’s the girl version of giveon,en
864,Jesus Christ…Sza on that pole given me p valley vibes… would love to see her on that shit,en
865,we truly don't deserve,en
866,This over bird chest drill rap music anyday,en
867,te amo,pt
868,"Estevan picked up the science teacher, how cool, he got the better of both of them when she entered their classroom",en
869,"Dear Lord, thank you for today. .",en
870,@sza when does the song at the end come out or is it out anyone know?,en
871,Wait what is this ending. Is this a different song?,en
872,Ong I came back to check if she said you like 30 not thirsty.,en
873,"Did it take her a year to release “shirt""? R u kidding me??",en
874,I would like to join that library,en
875,I want them pants ,en
876,I really thought Shirt was released ages ago.,en
877,Y'all Shirt is out,en
878,I wantedvto ask how old is Sza and than I remember Google.,en
879,Makes me remember my baby Hillary dancing to this… I miss u girl ,en
880,Comeback here until she releases shirt,en
881,I came because of Libianca,en
882,This song speaks 2021,en
883,When a girl say have a good day your dad he say the same thing,en
884,I wish we could've gotten the pole scene in the shirt video,en
885,This song.,en
886,That's my fantasy wild.,en
887,They were playing this song in the hood near Bojangles,en
888,Still worried that I wasted the best of me on you baby but you don't care CL,en
889,What type of camera/camcorder did she use?,en
890,What's the name of the song that this video opens with again?,en
891,Nice song,en
892,"when i don't even know how to speak english, but i know how to say i'm sad, what does that mean?",en
893,IT'S SHIRT AT THE END OF VIDEO LMAO,en
894,Anyone have the lyrics the song in the end?,en
895,I wanna hear this song while dying,en
896,Some scenes on this video reminds of Sade's music video BY YOUR SIDE,en
897,"Thanks, love.",en
898,"I'm marrying SZA.

Don't lie everyone else is thinking the samething......",en
899,"goot keep believing in better days

note to self; Must listen to more ""black music""",en
900,"Holy shit….I’m officially attracted to women….and this a shared account of a straight woman, and a gay middle aged man….🥹",en
901,What’s the name of the song towards the end of the video?,en
902,Can someone tell me the name of the song at the end?,en
