,comentario,liguagem
0,ahhhhhh i’m so excited about this. enjoy ma friends https://smarturl.it/TatexSAIWB,en
1,THIS IS WHY YOU'RE ALWAYS GONNA BE ONE OF MY FAVORITE SINGERS. YOU AND OLIVIA ARE MY LEGENDS.,en
2,"I love how near the end they kept showing up-close how the other girl is also struggling and exhausted. Like yeah, the girl you're jealous of, she's human too. She gets tired of all the pressure just like you. And the ending was perfect ️",en
3,"Tate is so underated, her voice is so unique, she's so young, and she literally can't write a single bad song!",en
4,I like the meaning. It doesn't push a generic stereotype of beauty but instead makes a remark at how this new girl is everything her SO is attracted to. I think everyone out there has a unique type but tends not to be with the person they idealise physically. So the song makes quite a vivid depiction of someone who's dating a partner that doesn't see them as their ideal SO appearance-wise; and as such she's getting caught up on it and feels inferior.,en
5,"I love it when tate and the ""perfect"" girl started dancing and have their first interaction with each other, tate started smiling as if realizing that the girl she envied is actually a good & fun person. they even started having fun together they also realize they both are not very different and had lots of similar interests (they both love dancing). Until both of them were disqualified from the ""competition"" meaning tate lost her insecurity and stop feel threatened to continue competing with the ""perfect"" girl. in the end, they even become friends.",en
6,"Her voice is so unique and beautiful, she’s an amazing dancer and such a relatable story line! The song is so good and catchy, love it ",en
7,"I love how the two girls don't seem to hate each others. The problem is not the ""other"" girl but the feeling of being insecure.",en
8,I love how realistic this is. The problem is not the other girl being better it’s the feeling of insecurity that u have in urself. She is one of my fav singers bc she is so relatable and so similar to me.,en
9,This girl should be nominated for the Best New Artist category this coming Grammy Awards 2023. She's a great performer. And she is the first Canadian finalist to be on So You Think You Can Dance. ,en
10,Can't imagine how nostalgic it will be to come back and listen to this song in ten years. ,en
11,"The way she sings “you say she’s nothing to worry about, then why did you close your eyes when you said it out loud” is actually heartbreaking; you can tell the actual concern she had for the guy. Yeah she is jealous and insecure which is what the song is mainly about but she is also concerned for the guy. You can also hear the  sadness turn to anger then into confidence through out the song.",en
12,"Tate literally has it all: looks, dancing, vocal capability, beautiful songwriting, great personality etc. Let´s make this go viral guys, she deserves it.",en
13,"I remember when she was doing “some day” on her old piano in her moms house, she’s gone so far! And really is inspirational",en
14,I love her voice period… it’s all on point vocals and the way she just let her voice just go out so smoothly,en
15,Ok can we just take a moment to appreciate how angelic her voice is and how gorgeous she is... I could never.,en
16,I come back to this video whenever I’m depressed and I need energy. Thanks Tate ,en
17,"Eu conheci a Tate McRee por causa dessa música, então ela sempre vai ser muito especial para mim, já faz um ano que eu acompanho essa artista incrível.",pt
18,This is such a bop Tate! I'm so happy that Bailey is the other girl :)!! <3!!,en
19,"I'm honestly so proud of Tate for making it this far, it's unbelievable, she's gonna be extremely massive one day",en
20,Absolutely stunning voice. Been a fan of tates music for ages now,en
21,I hope you have grown from the feeling you had writing this song. Because you are worth more than ever wanting to be like anyone else. This song is amazing Tate. Thank you for making something we can all relate to. <3,en
22,I've listened to this song multiple times on Spotify and this is my 1st time watching the mv. Loved it. I'm always rooting for you Tate . Lots of love from India,en
23,"I love that the ""other girl"" isn't made out to be the villain. She's her own person, and it's not her fault that Tate's SO is looking at her.",en
24,"wow - this song, the vocals, the amazing range in her voice and this video so much meaning to it. Also love how at the end neither of the girls get chosen and they are ok with it. LOVE IT great beat",en
25,"Fantastic voice, stunning dancer…Tate is definitely a superstar. ",en
26,"I love the rythm and the lyrics are so relatable, some times you compare yourself over a boy that is not worth it, we are perfect the way we are ",en
27,"The vocals are soooo nice. These days it seems like every pop star sounds the same, she sings so beautifully",en
28,"When I first watched her she was still writing original songs and posting them on youtube, this is incredible!",en
29,Anytime you need a boost of energy this is the perfect jam to turn on ,en
30,I'm so excited she has some of her SYTYCD mentors in this video. She is such a great dancer so glad she got to branch out because her voice is wonderful ,en
31,Long time since I heard new music that made my heart jump a little. Great song.  Important message for young girls.,en
32,"As a Chinese woman, I’m so excited to see the “mean girl” cast as an East Asian girl! Growing up I never got to see this of representation, we were usually cast as nerdy or shy. So excited to see that teens get to grow up with more diversified media.",en
33,"This music video is just as good as the song. Damn, love this so much. Love the message, love the lyrics, love the choreography. Its all beautiful!! Thanks so much",en
34,I really love how in the end they just vibing and have fun dancing with each other. Such a wholesome mv of an awesome song ,en
35,Eu simplesmente amo essa música de mais.,pt
36,"My daughter showed this song, now we listen to it on the daily, we absolutely love it <3",en
37,"mais uma msc de sofrência pra lista, te amo rainha",pt
38,Tate i’ve been here since “i wrote a song...” i can’t believe how much you’ve grown- you came out with this song the day i needed it and it’s amazing luv you gurl ️️,en
39,"Wow the way she matches all the lines, sounds so creative and talented ️",en
40,"SHE NOT ONLY SINGS SHE IS A MAGICAL DANCER! Wow, Tate, wow. These moves...",en
41,"Been here since ""Dear parents""
Tate has really helped me learn how to deal with roadblocks in life
So happy for all the success she has gained so far.",en
42,cara eu gosto muito dessa música! que cantora maravilhosa. 🇧🇷,pt
43,"The fact that the ""it girl"" is not a white mean blue-eyed blondie like all stereotypical it girls is genuinely so refreshing. It is about time we start showing that beautiful women come in many different ways and while blue-eyed blondies are beautiful, so are other women. Also the it girl isn't mean or self-absorbed and I love that.",en
44,This song is perfect and I don't get tired of hearing it ,en
45,"I've been sleeping on this song for a while bc the title gave me ""other woman vibes"", especially considering that I found Tate McRae through her more sad songs- but wow I'm obsessed with this. Most of the comments hit the nail on the head + I'm not big on music videos but I love this one and I can't stop watching it. I also just want to say my favorite part is the end. Not only is there no visible animosity between the girls, but I love so much how at the end neither of them win, but they still run off the stage laughing. This is SO important to me bro I'm literally in love with this song, this video, choreography, EVERYTHING.",en
46,"You want the girl with the small waist
And the perfect smile
Someone who's out every week day
In her dad's new car",en
47,"The more I listen to this song, the more I like it!
Keep on Tate, you're doin' well and kisses from a french fan!",en
48,"2 things about this video that I love:
1. There’s jealousy but not hate, neither girl is mean or bad, just normal comparison and insecurities.
2. The “it girl” isn’t the stereotypical blonde white girl. I absolutely love that a beautiful Asian girl with funky style is portraying the “perfect girl”. ",en
49,"Ahh just can't forget her songs.
Tate and Bailey just rock my heart .
Her voice is like i never had  thankyou Tate for this song",en
50,"I love Tate McRae, she is my favorite singer ️",en
51,Is it just me or is Tate beautiful inside and out and HER SONGS MAKE OUR DAY,en
52,This is my new favourite song . Great song tate ! ,en
53,I love the choreography n all the dances n emotions.self proclaimed no.1 fan️️️,en
54,"this is an incredible video. as a dancer i felt the stress when he began eliminating dancers, honestly a dance audition is such an effective way to plant insecurity with comparisons, and a brilliant metaphor for feeling insecure in a relationship. when she pulled out that leap my jaw dropped, literally the power she has in jumping alone is incredible.",en
55,"Love to listen Her voice...Headphones on up to max...Rrrrrrrr - goosebumps! Smoky, velvet voice. Almost hypnotising! Love this feeling!",en
56,"This lady's talent, so unusual ️",en
57,I relate to this song because it shows how easy it is to compare yourself to others,en
58,"I love you Tate McRae!   
…such an incredibly beautiful and talented singer!! This song is so catchy I find it replaying in my mind sometimes!! ️️️️️️",en
59,This song is strangely addictive and the singer is absolutely gorgeous.,en
60,"It’s insane to watch an underrated artist making music in her room, to producing music videos and having sold out concerts. She’s so incredibly talented and I’m so proud of her.",en
61,Maravilhosa ️🇧🇷,pt
62,"Been listening to this song almost every day since it launched, I remember listening to it when I got graduated and it brings me so many good memories ",en
63,She needs to be the biggest star!  Her songs are litt,en
64,"Im not familiar with her so i thought they only hired a double to do here dance routines but after watching the video for so many times im surprised that she is exactly doing the dancing like wow, impressive dance line. Beautiful and graceful big time",en
65,Já perdi a conta de quantas vezes eu vi esse vídeo clipe perfeito,pt
66,True fact: Everyone agrees that Tate is melting everyone's heart with her songs,en
67,Tate is such a good dancer as well as a great singer ️,en
68,This video is so iconic. The talent this woman has. Amazing.,en
69,Just heard this on the radio and had to look it up . A great song .,en
70,When you’re an avid metalhead but have been a tate fan since 2017. This slaps so hard,en
71,"Absolutely Love this song, and haven't been able to get it out of my head (so catchy).
Also, like that it's Clean so I can play for/share with people, unlike some others.",en
72,"I like how the ""mean girl"" isn't actually mean, it's Tate's character's wariness making her seem mean.

Also the bit at the end where neither of them win is so clever, it's like they're competing for the boy (the audition) at first and they end up smiling at each other and running out together because they realized it's silly to be so competitive with each other when they could support each other instead.",en
73,"Tate is great, even when she's just singing with her piano ",en
74,I can't stop watching this video. Great song!,en
75,Amazing song can’t stop repeating her album,en
76,"I love how they're having fun dancing together at the end, in my head that's the start of a great friendship",en
77,Tate has everything that others don't have.,en
78,"I don't know why but this particular SONG always POP OUT in my mind whenever I am down...
I love this song....@Tate McRae",en
79,"I'm of HK (Chinese) ethnicity and to see the 'it girl' as an Asian girl makes me feel so grateful because I've never seen us portrayed as such. Thank you for this and thank you for the new song, I love it all!",en
80,"Como eu amo essa música ""I love this songBrazil....",pt
81,I blast this song whenever I feel sleepy or down at work (which is pretty often).,en
82,I don’t normally like Tate’s McRae’s music but this is really really good. Love the music video!,en
83,Listening to this song on repeat while trying on outfits I never have occasions to wear,en
84,"This is my favourite song on i used to think i could fly so far! 
I love you, Tate!",en
85,"The bit where the music paused and the guy said '5,6,7,8!' and the music like exploded and everyone started dancing perfectly in sync was amazing, i love this video ive watched it over and over again the talent is incredible love you Tate! xx

(edit) mOm iM FaMoUs",en
86,This is absolutely fantastic!!!! Love you Tate!!!️️️ #ShesAllIWannaBe,en
87,"I love it, Tate has a very very good voice",en
88,"Depression, anxiety, insecurity. Refreshing to hear without breakdowns. Pop only gets better with time.",en
89,Tate mc Rae has an amazing voice and the message is always soo close to the chest . Great music ,en
90,"As someone who did show choir and thespian in high school and college, this is bringing back some traumatic memories  I love it",en
91,"I love how the music video didn't necessarily portray a relationship, but inner feelings abt insecurities within yourself. And the song inst necessarily sad but a vibe.",en
92,"I love the song,i love her voice,i love the video,i love the message",en
93,One of the few pop songs that I know that I will remember for years. Great music video aswell!,en
94,This song was great last Spring.  This is my DJ playlist. I play this song a lot when I host the virtual dance parties,en
95,i love all your songs i made a playlist and more then half of then are by you! your songs are amazing and keep up the good work!,en
96,TATE your voice boost up so many people  ..... LOTS OF LOVE gurlllll ,en
97,"are we gonna ignore the fact that Bailey Sok, the “it” girl, killed it and shined so bright with tate?? love them both so much",en
98,Love this song ,en
99,I literally love all her songs,en
100,I love it so much ,en
101,Guys just look at Tate she went from making cover to writing her own songs and now she is a singer who goes on tour . i so proud Tate love you . I can't stop listening to this song it's so good ,en
102,Loved the frenemy chemistry they had going on. And FINALLY top level dancing is back in music videos. McRae is fierce.,en
103,Great message in this video. No need to base life on worthless things,en
104,"I'm not always interested in this type of music, but I love this song",en
105,I love how the dancers are dressed like dancers but also very euphoria inspired.,en
106,This is my number 1 favorite song from Tate McRae she’s the best then any singer I could think of,en
107,Fact: Tate McRae is making everyone's day so much better with her song,en
108,eu amoooo essa música,pt
109,I love how Tate can dance and sing!!!,en
110,"Tate, you don’t have to be “her” you are a VERY good dancer, and very beautiful when you dance! Be yourself! ",en
111,love this jam i totally understand how tate fills she be making relateable music i love it keep doing good girl,en
112,"This song needed to be number one in billboard but sadly Tate deserves so much more recognition like Billie , Olivia",en
113,This is one of the greatest MV I’ve seen for some time now ,en
114,It’s so cool to have pop stars that can actually dance,en
115,Amazing song and video! I love it ,en
116,FACT: Every song Tate writes is absolutely amazing and listening to it will always make your day <3,en
117,This song is awesome! In a league of your own,en
118,Heard this come up in pandora and now its on my daily playlist.,en
119,I love the end when the “perfect girl” goes to join Tate dance! They looked amazing! Can’t stop listening! I love the whole song in general too!,en
120,"i love this concept, and i absolutely adore how none of them won in the end LMFAO i was thinking about it but didnt expect it to actually be like that ",en
121,"Heard this song playing in a Netflix movie ""do revenge"" made me watch that specific part like 20 times.. you're just too good!! ️",en
122,"I can relate this so so much. Being an insecure person due to the tons of flaws, its really hard not to compare with the other superiors . It makes me super underconfident as I am.
 People say it out - ""love yourself"" but its  not easy as that, when you""re  just unable a find a single capability within yourself.",en
123,"this is my first time listening, not bad and i love her voice <3",en
124,"I love that in this music video the ""better"" girl isn't this stereotypical popular mean girl but just another girl like Tate. It shows most of the time what's making girls feel low about themselves when someone else seems ""better"" is just their own insecurity not letting them love who they are. The other girl isn't better or prettier they are both beautiful in their own unique way but Tate just can't see it. And in the end, they both get along so it doesn't pit girls against each other unnecessarily. Ik I'm stating the obvious but it's refreshing to see :)",en
125,this song is shockingly good ,en
126,"This song reminds me a lot of “Did You Call Me” by Lukaz. They both bring me up this emotion i cant explain. I use them as fuel to push through tough days. Thank you so much for this music, I love you lots! <33",en
127,So rare to see 4K music videos like this ,en
128,"Супер хит

ありがとうございます
Tate i’ve been here since “i wrote a song...” i can’t believe how much you’ve grown- you came out with this song the day i needed it and it’s amazing luv you gurl ",en
129,This song has a nice catchy flow to it from the beginning until the end,en
130,OMG- I’ve been waiting for this,en
131,I love the way this is giving me musical vibes,en
132,Love it,en
133,Hello Tate McRae.  Your music rocks.,en
134,how can no one comments on the feature of one chorus line in this video <3 love it!,en
135,Tate and the production team - outdid yourselves ,en
136,She is so underrated omg- i think i've just found my new fav singer. Go Tate!,en
137,This song is so good!! ,en
138,"am I the only sapphic who just loves singing the line ""she's got everything that I don't have, how could I ever compete with that?"" on top of my lungs because in my reasoning, it's like yes, she's everything I don't have and that's exactly why I want to be together with her? ",en
139,What a beautiful voice,en
140,"We love a dancing, thriving Tate ️",en
141,"This song is amazing but what I really loved was seeing Bailey freaking Sok!!! <3 No matter how many times I watch it, I get so much joy seeing Bailey on the big screen! From dancing with Matt to this, WOOHOO!!!",en
142,this song hits like my angsty 2010 days I love it,en
143,Hey Tate love your stuff!!,en
144,I’m not into this type of music. And idk how it came across my playlist️But dang it’s perfect!100!!! The video and song it’s just great!keep up the good work MCRAE,en
145,I love how her songs about normal experiences many people have been through. They're true masterpieces,en
146,you can sing so good and ur voice is so cute and calm:),en
147,"Doin Canada 🇨🇦 proud  
Glad Tate is getting the recognition finally. If y'all have heard them yet, check out 'You' ft Troy Sivan (another incredible artist) , 'Feel like shit' , 'Vicious' and 'You broke me first'! Connor Maynard has a crazy good version of 'You broke me first' too",en
148,These lyrics hit different when your going through shit,en
149,Tate singing about another girl like  she's not perfection herself. ,en
150,wen ur happy u love the music wen ur sad u understand them,en
151,"This song is on repeat all week, I love her so much! ",en
152,Just love this she is showing mature competition not like stupid other movies showing girls catfighting ,en
153,"One of my biggest insecurities in one song .
Can't stop listening!!!",en
154,"Really, this is the only song I can think of right now. It is so googd and relatable. I love you tate mcrae <3",en
155,"I just love the video, it's fun to watch and just funny in general. Love that the two girls even though competing are civil and friendly with each other... Its how girls should be raised",en
156,"I think Tate once said that she writes her songs from her own experience. No one should feel like someone is better than them. I feel bad that Tate felt this way, she is so beautiful in her own her way. Everyone is beautiful. People shouldn’t be compared to other people because they’re unique and different, there is no one else like them. Everyone has pros and cons, even people who seem “perfect”.",en
157,"Her voice is beautiful!  May be a bit deep for a girl, but it is really unique for sure. ",en
158,I love this song my fav song good job Tate McRae ,en
159,"I know this sounds so stupid… But as a trans woman who’s not able to come out, this song hits on a different level. “She’s got everything that I don’t have, how could I ever compete with that?” ",en
160,She is actually so talented. Didn't expect her to dance that good.,en
161,"This song popped up on YouTube when I choosed random play, I’ve never heard of her before, this is the first song I heard from her. I kept playing it over and over and saved it, it’s my favorite for so many reason.",en
162,we gotta make this song top 100 in music video global charts,en
163,Tate is like one of my favorite singers but there's so many singers that it's hard to choose between them so she's one of my favorite singers,en
164,Tate McRae Has a Great Voice,en
165,Que música nostálgica ouvindo em pleno 2023 ,pt
166,"I remember watching and supporting Tate’s “I wrote a song” videos 3-4 years ago and thinking “one day this girl is gonna be big”. Then one day I heard her song “You Broke Me First” on the radio, and now she’s blown up and she’s so well known, making high quality music videos and writing all these beautiful songs. I’m proud to say that I’ve been here since the beginning and I am even prouder of her. For all the new fans and supporters here, thank you so much for choosing to love and support Tate and her music. You’ve made a brilliant decision. Let’s continue to show love and support Tate through everything. She’s so talented and deserves everything good",en
167," I love you and this video and I didn’t know you were a classically trained dancer! 

I hope you stick around and do really well and are successful",en
168,This song was the best in Spring 2022.  I dance to this a lot and played it on my DJ Pro Al app.  I saw Tate performed this at Jingle Ball last Tuesday,en
169,"This song, summer evening in your friends old car, blasting thru the broken speakers with the windows down 🫶🫶",en
170,This makes me realize that even tate doesn't always feel pretty even tho she's a stunning queen. It makes me feel pretty in my body,en
171,Knew that song for a while but now it happened to me too (How can I ever compete with that?) and now I know it from the heart.,en
172,My best friend is going through this feeling with her significant other. I wish no one would ever feel this way. Great song ,en
173,I like his voice its excellent,en
174,u were born the way u were born it does not mean ur ugly its mean ur unique continue loveing urself no matter what people say and belive in yourself,en
175,"met you years ago, amazing to see where you've taken that amazing voice :)",en
176,this song is the best! and the lyrics are so accurate,en
177,"I love the way it sounds when she says ""stupid boy""
Her voice sounds so buttery ",en
178,I love this song!,en
179,This song and “Clover Cage - Falling For Free” are the two songs keeping me sane through these tough times. I just want to send love to everyone and I want everyone to know things will get better. We are in this together..I love you..,en
180,"I love that Kathryn, Comfort & Robert from SYTYCD are judges. Tate was a part of the juniors version one year. I love cameos like that. ",en
181,THIS IS WHY YOU'RE ALWAYS GONNA BE ONE OF MY FAVORITE SINGERS. YOU AND OLIVIA ARE MY LEGENDS,en
182,"You want the girl with the small waist
And the perfect smile
Someone who's out every week day
In her dad's new car",en
183,"Tate literally has it all: looks, dancing, vocal capability, beautiful songwriting, great personality etc. Let´s make this go viral guys, she deserves it.",en
184,"You want the girl with the small waist
And the perfect smile
Someone who's out every week day
In her dad's new car",en
185,"You want the girl with the small waist
And the perfect smile
Someone who's out every week day
In her dad's new car",en
186,"You want the girl with the small waist
And the perfect smile
Someone who's out every week day
In her dad's new car",en
187,"Listen I have been watching and listening to this song non-stop im obsessed! Im a huge dancer and singer and this is just the song, dance, and everything for me! It’s amazing! Mark my words, this girl is gonna famous! ️ to me she already is!",en
188,She is 19 now. That means she was 18 when this song released. Im obsessed with her voice.,en
189,"I love this song, because it's so relatable",en
190,My 2 year old son and I love tate mcrae and her music!! Such a talented and beautiful girl ️️️,en
191,I will never get over the fact that you can see the EXACT moment the girls decide to stop seeing each other as competition and just embrace their parallels!,en
192,"I hate pop. But this song is just… wow. Hits hard. Thank you Tate, bless you. Or if you’re atheist, science you. Idk I’m just really happy this exists.",en
