,comentario,liguagem
193,What’s crazy is I never knew Tate McRae sung this because I’ve seen it in shows and stuff but it was always other people singing it,en
194,I was brought here by 10:35. Tate's dancing is just breathtaking. I really hope her talents are highly rewarded,en
195,this song probably shouldn't do this to me but it just made me breakdown into tears,en
196,simply a natural talent deserves every success so beautiful in sound and vision,en
197,"This one hits home for me personally. My girlfriend struggles with insecurity and is afraid she's not good enough for me. That one day I'll grow bored and choose someone else. Me though, I wouldn't trade her for the world.",en
198,I really enjoyed this! Gonna echo a lot of people with my love for the popular it girl not being cruel or mean and that the girl Tate plays actually ends up laughing and smiling with the other girl as they get thrown out by the gentleman looking for a Star hahahaha <3,en
199,I love this song ! You sing and dance too well ! She's my favorite singer . (And the French love you too !),en
200,Today I went in the car and turned the radio on and I heard she’s all I wanna be sooo bad and then the songs ended I was like love her songs ,en
201,I still can’t believe after wavering this video that she can stand still while Tate is in her face,en
202,How is she soo underrated...,en
203,"Ever since I listened to one of her songs, I've been a huge fan. I just love her voice!!!!",en
204,Her music videos are all visually gorgeous,en
205,Very nicely done.,en
206,"You want the girl with the small waist
And the perfect smile
Someone who's out every week day
In her dad's new car",en
207,Tate is a TALENT herself,en
208,Great song I love it so much,en
209,The smile at the end when both were dancing was just adorable... Love how it shows that even when you see the other as a competitor he/she is not a villain and you guys are not enemies,en
210,I love your songs   and your behind the scenes,en
211,"i actually love this music video. its great.

tate is so pretty <3",en
212,you should never let anyone make you feel insecure about your body or anything else everyone is great in their own unique way,en
213,Tate is so talented!,en
214,Can't stop playing it,en
215,"Mad respect for the entire crews dancing skills, it's not the type you often see now in the mvs. Fantastic job Tate, go get it girl!",en
216,i find it crazy that tate is both a popstar and one of the best dancers in north america. as a teenager.,en
217,"This song and ""Lukaz - Did You Call Me” are the two songs keeping me sane through these tough times. I just want to send love to everyone and I want everyone to know things will get better. We are in this together. I love you ",en
218,SOCORRO EU TÔ VICIADO NESSA MÚSICA,pt
219,"The other girl is Bailey sok  … 
She is one of the best dancer of our time..

Every girl who dances wants to be just like the Bailey ",en
220,"SHE'S A DANCER, SHE'S A SINGER AND SHE IS THE MOMENT",en
221,i love this song cause my little girl has a problem at school and she always gets send to the office. this song always makes her day. and i love seeing my little girl like this,en
222,"This is a very girly song, but I just like it because she has a beautiful voice ",en
223,I Love This Song ️,en
224,Im really feelin it,en
225,Bailey Sok and Tate McRae are literally just so amazing together,en
226,"I love the end where he says "" Congrats Honey, You Won"" That was sooo funny! Great song Tate!",en
227,Tate McRae is all I wanna be so bad ️,en
228,"You want the girl with the small waist
And the perfect smile
Someone who's out every week day
In her dad's new car",en
229,I just recently discovered Tate McRae and I can honestly say I have a new crush,en
230,"I freaking love this music video. Finally a new era of women who have SOs that don't value them, but don't make the other woman the enemy. She's just another person with her own flaws, the enemy is the fact that you ever thought you had to compete. No one is better, just different and it's normally just a case of an SO with a ""grass is greener"" complex.",en
231,One of my aunts saw u at the hockey game I couldn't go to and I just wanna tell u how much I love ur songs. ,en
232,this song is just incredible ,en
233,"I'm so happy I randomly came across this song in my apple music. I'm also upset because growing up where I'm from, you would be teased or shunned to listen to pop songs like this because it would mean that you were weak or less masculine. I'm at the age now where I don't care anymore and I'm going to listen to what I love no matter how anyone feels because they can be removed from my life. The lyrics are so relatable and beautiful, you can't help but not love it. And the guitar riff! whew!!",en
234,BEST new song I've heard in a long time ,en
235,"I love that Tate includes her passion for dance within her music videos. I can almost FEEL emotions from her dancing alone, it’s amazing and it makes me wish I was able to dance so well that it portrays raw emotions. I love how far she’s come, i been here since she started writing music, so so proud of her growth.",en
236,I love this song!,en
237,"Every time I hear this song, I cry because of its beauty🥹",en
238,great song tate i heard it on the radio yesterday,en
239,I really love the sad version.️,en
240,"You know she’s the only classically trained dancer with impressive dance skills the moment her ponytails touched her butt with the head tilt @ 2:28. Great voice, killer dance moves. God this girl is gonna be big one day! Go Tate!",en
241,she probably doesn’t have tate’s awesome singing ability’s ️,en
242,pleeease more duets with you and bailey!!,en
243,I'm pumping this in the gym almost every workout the track is fire ,en
244,"I am single, but when i hear this type of songs, than i feel i am in love. This is power of music."" ...",en
245,"Looks like Tate also has a ""Heather"" This song is so perfect for my playlist",en
246,"this music video will forever be my favourite. it is so well-directed, the hair and makeup is perfectly done, the choreography in this mv is just so creative and it blew my mind. i love all of tate's songs but this has to be my favourite",en
247,Gostei essa música muito legal,pt
248,I also love the part when they dance together ,en
249,Can't stop rewatching the grand jetè at  01:54. It's so perfect ️,en
250,Perfect song Tate love you Girl,en
251,I love how with this song she’s bringing back the pop/rock sound that was big during the early- mid 2000s! I’m 25 so this song brings me back to that time when artists like Kelly Clarkson and Ashlee Simpson were really using that sound…. Love you Tate! I’m a big fan now after seeing you at JingleBall in Philadelphia ,en
252,i love this song so much. My fav parts r when she sits ont he ground to warm up and when they both untie their hair,en
253,She is so talented,en
254,I love you so much Tate your so beautiful and don’t ever forget that. Girls you were put into this world for a reason. That reason definitely isn’t to compare yourself to others. Also give compliments it can make a day from terrible to amazing. Love yourself and others.,en
255,Not a bad song and I’m a dude that mostly likes rap and country. This is a good sound,en
256,"Y'know I don't care much for ballet, but I think it's pretty sick to learn that she's actually a tremendous dancer before a brilliant singer.",en
257,"This will going to be Next Hit song after 'Feel like Shit'....This Song Is Really addictive... I've Keep Listening  this Song and still not getting over it....
Thanks You TATE MCRAE for such Amazing Songs ️️",en
258,"U know, i've been followed you since you're just made a cover song..  And now wow..  Look at you.. Im glad though.. Congrats!  And fyi,  i really like your hair then,  and now  for your voices? Nahh u dont have to  use autotune for that,  i love your voice since 2 years ago",en
259,I love this song.,en
260,the energy at the video is incredibly,en
261,"I loved this song for a while now, and tell me why this is my first time watching the music video and just now realizing that that’s Bailey Sok!  I’ve watched her from the Stephen dance videos, OMG she’s all grown now 🥹 glad to know she in such a cute music video like this 🫶",en
262,I love this song sm ,en
263,"I'm so honored to be one of those few people who used to know Tate before her singing career, when she was ""just"" a dancer. I knew you would be famous the day when I watched your first singing video. Keep it up Tate, you are amazing.",en
264,"“Music touches us emotionally, where words alone can’t.”– Johnny Depp",en
265,My favorite song from you!,en
266,She is just the greatest reminder of a godess,en
267,i love this song :),en
268,Beautiful and powerful.,en
269,"Tate (to me) is the singer you've never heard of, but as soon as you hear one of her songs you become addicted to it!",en
270,"As someone who has a warlock player with devil sight, I started freaking out when you started with "" it doesnt say in darkvisuon that it CANT see in magical darkness"" hahahahaah
Good vid, so interesting diving deep into vision, one of the trickiest mechanics to keep on top on duing a game.",en
271,I love this song I love you TateMcRae I love you so much I love this it’s not about fighting and I love your dances ,en
272,I'm SO late to the party. I didn't know Bailey's in the video until now (to be fair I didn't know the song until today when someone on Instagram used it). I feel like a proud mom watching both Tate and Bailey grow. Been there since they were kids!,en
273,I     love    this   song.,en
274,"Tates songs are so unique and absolutely beautiful, this girls got talent guys! First SYTYCD and now shes a teen popstar making millions of people happy:)))) Tate if you see this you are going places you are so beyond talented and I LOVE YOU SO MUCH ",en
275,i love your music it is a amazing song,en
276,"First time seeing this vid, I was first introduced to Tate on SYTYCD, and I swear the judges in this vid are the contemporary judges from her season. Lol Am I seeing things? ",en
277,First time hearing this song today and it's really faking me up now I know exactly how she felt,en
278,This is a powerful song.,en
279,Can't stop listening to it now,en
280,I can't wait for this MV to drop.  I am so proud of how far Tate has come. I am so obsessed with SAIWB and I can't wait to see Tate's visual vision for her song on Friday.,en
281,MY NEW FAVE SONG GIRLY! U should be so proud of yourself️,en
282,"I´m gonna say they same thing as I said when Rhianna was in her first years: This girl is gonna be a HUGE star, much bigger than one senses",en
283,Both are unique in their own way,en
284,"@tateMcrae’ s eyes are amazing!
Girl you got this!",en
285,great video tate  loved watching xx,en
286,Tate and Bailey Sok dancing together and SYTYCD members all in this video = EPICNESS ,en
287,"Stumbling upon this and seeing a dancer I admire?! Bailey Sok is great, this song is great, you’re great!",en
288,This needed a VMA nod. Amazing videography overall.,en
289,Amazing! I loved the nod to SYTYCD with the judges ;),en
290,she makes me wanna do better be better that voice is heavenly,en
291,You don't need to be insecure you are so beautiful already!!,en
292,"This song is a SUCCESS!!! She's criminally underated!... Definitely she deserves more credit!!!
Love u Tate️️️",en
293,Who can relate to this song with their reality? ,en
294,"Oh that’s Bailey, that’s why she’s so amazing ️‍️‍️‍ they are both amazing",en
295,I love this song so much it's one of my favorite songs,en
296,"Супер хит

ありがとうございます
I love how near the end they kept showing up-close how the other girl is also struggling and exhausted. Like yeah, the girl you're jealous of, she's human too. She gets tired of all the pressure just like you. And the ending was perfect ",en
297,"You want the girl with the small waist
And the perfect smile
Someone who's out every week day
In her dad's new car",en
298,Before even clicking on the thumbnail. I knew it was gonna be a very good song.,en
299,Love this song so much,en
300,"Tbh I wish I had been there.  It looked like a lot of work to make this and I'm sure it did, but they also looked like they had a lot of fun.  You could even see the other girl trying not to laugh when she was dancing in front of her. xD",en
301,"i love tate and bailey sok so much, i can’t wait to see them in this together!! both AMAZING dancers <333",en
302,When these release a few months I'm inlove with this song ,en
303,Love it ,en
304,Why am I just seeing this! Really great song & video! Amazing dancing skills as well.,en
305,"I love this song and I love that people can see that the other girl isn't the villain...
But was I the only one that thought gurrrrl if you can get your leg up like that you got nothing to worry about ",en
306,"How is this not a mad massive hit, all over yea. Plus how fucking catchy is this track. All around 9/10 .. easy",en
307,"Okay okay okay, but who has been following her since sytycd next generation?? 
She shocked all the judges with her audition and now she’s straight up shocking the world. You rock Tate!",en
308,Im a guy and I am not ashamed to say that I blast this in my car on repeat. Tate is so fine too,en
309,"Here`s an edited Version of mine for the heartbroken Boys like me out there:


You want the Boy with the bad style",en
310,Your amazing I love this song ️,en
311,Mcrae is só beautiful  shes all I wanna be ️,en
312,This is a HIT!,en
313,Well…that was definitely another breathtaking performance and arguably one of her best music videos to date! I love how all of her songs are just so relatable but I’ve honestly never related to any of them more than this one. ,en
314,i literally got chills,en
315,It's a great song!,en
316,She has everything that I don’t have,en
317,"If you're in the same situation as the girls in this song, leave the guy. Leave asap so that you don't regret it later.

Get someone (better) who suits you well and that someone who's perfectly happy with YOU. ",en
318,Omg i wont stop listening this!!!,en
319,Tate & Bailey dancing together = Perfection!! <3,en
320,"“shes got everything that i dont have, how could i ever compete with that?”
no. youve got everything she doesnt have, how could she ever compete with that?",en
321,"This is good, but I love the original too much. I think it's much better as a stripped down raw ballad.",en
322,"I remember when this was in radio in 2022 spring, nostalgia and its 1 year only ",en
323,"I think it’s great representation of insecurity and overthinking. The running thought is “I wanna be like that”. But in reality you’re trying to compete with someone and stressing about what you lack, to find out that you and that person may be working hard for that one goal but still will come up short. You shouldn’t be so focused on your insecurities to lose sight of the hard work you’re putting in. Everyone is chasing a goal. Don’t worry about everyone else!",en
324,"It makes me so happy to see that the ""other girl"" is an Asian, and not a thin white blondie with blue eyes. It's so unbelievably refreshing to see a more diversified concept of beauty. Thank you Tate McRae and wonderful joke Bailey Sok. I'm truly so happy right now.",en
325,ALL YOUR SONGS ARE ,en
326,This song is so underrated,en
327,I loved the line at the end so much ,en
328,Wow brilliant song god i loved this song for years,en
329,I am so happy to see one of my favourite artist perform with one of my favourite dancer. Tate and Bailey are honestly such a power duo. ️,en
330,Not me having imaginary scenarios in my head while playing this song on repeat mode,en
331,"I love your song,it's so good",en
332,"great Song and much better Act of Her!!  the music scene should take care and take a view on her steps and Songs that an comming!! I really like Her Voice and emotion in her sound of singing!! best regards, Frank Liebe",en
333,She sings this but she’s literally perfect,en
334,"I love it I think all girls relate  to this and it made me cry wa,ll I was singing/screaming.  ",en
335,"Tate is just that girl every boy liked in junior grade.
her vocals are way too much for her age",en
336,This song is all over the radio,en
337,she can still dance!!,en
338,You are the best singer you are my idol ,en
339,LOVE YOUR MUSIC BRING OUTB MORE PLEASE,en
340,Great  music ,en
341,"HER TALENT IS OUT OF THIS WORLD! Its unfair how underrated she is, this song is a masterpiece. I cant stop watching it!",en
342,"Sure love this video! ""One at the time!"" Love you, girl!",en
343,Omg!! You and Olivia need to do a collab. You and Olivia are our legends!!!,en
344,Seriously ads lead me here ...and it's the first time .  and Ur angelic voice being the  reason where I've no power to skip the ads .,en
345,Weirdly I like the summertime balls concert more than the orignal and Im hearing the concert on repeat,en
346,Tate you look absolutely amazing...the fishnets layered over the glossy shimmery tights really makes you stand out amongst the other gorgeous legs!,en
347,Thank you for letting the other girl be someone who looks like me. Representation matters! That speaks so much volume and helps us Asian women/girls feel like we are just as worthy. Awesome video and song.,en
348,Why is tate the best singer the best dancer like wtf ♡,en
349,this music video is so beauitful and cute love you Tate keep goingggg Canada has your back 4 ever <3,en
350,Tate you should do a song with Mimi Webb! You two are both amazing singers and it would be the best song ever! ,en
351,She never makes us dissapointed,en
352,"Um, I am replaying it. It's so damn catchy!",en
353,"All girls can relate to this, “she’s all I wanna be”",en
354,I love how both girls tate an the other girl blew it intentionally  so the other girl can win. About  time others start putting ppl before there selfs and that's what this whole song an video is about fuxking awesome,en
355,This song is so amazing I can’t even,en
356,She must have had a lot of fun dancing with her looks like so much fun,en
357,"Tate Rocks This Song, Great.",en
358,How is this not a hit yet omg,en
359,"Wow,this is a long ways from the pop music i used to listen to,as far as we talk about time.for an example,i used to listen to lots of Cyndi Lauper.all music has evolved.there are still new pop music out there.sometimes it is the new sound and the stars we will have to get familar with to like them.if they sound good as far as love at first ear,you have my heart.️",en
360,This is so heartwarming.,en
361,"I was playing fortnite when this song played on the radio, I was dying to know what it was called and finally I found it, too perfect song ",en
362,In case y'all forgot Tate reached the highest tier of dance before she went and rocked the music industry ,en
363,The positive look gets me every time,en
364,You're the best Tate Mcrae Love you ,en
365,"Takes a lot to admit when you’re jealous of someone and feeling insecure when next to someone deemed “more” attractive, smarter, cooler etc than you. At the end of the day you have to love yourself and realize you both are beautiful, intelligent, cool etc in your own way  love this song wish younger me could have seen this.",en
366,OMG. I LOVE THIS!!! Thanks to Elle’s song association cuz that’s how I learned about her... and this song! ,en
367,I LOVE THE AESTHETIC ️,en
368,it’s amazing how she went from bedroom studio and living room to on live radios and performing on stages touring the room and making so much fantastic music,en
369,I understand everything to your words of this song :),en
370,goosebumbs listening to this,en
371,"She's not singing about the guy, she's singing about her insecurities",en
372,"Damn, this song is stuck in my head ",en
373,"Can’t believe how much you have gone forward since your “I wrote a song....” days, I’m so proud of you, ilysm ️",en
374,This is a great song,en
375,That end is so deep. They fight for him so hard and someone completely random gets him. That pain XD,en
376,"this is my nth time listening to this song. gosh, this is my anthem. it's such a beatiful song",en
377,If Olivia Rodrigo and Billie ellish songs can gets hits why not Tate McRae she always deserved much more success,en
378,"Tate mcRae go in soo hard on this right here, she aint like those who just be usin that  *authentic views * jawnt to get they hit up to go HAM... SMH seem like anyone can go big these days..",en
379,I really appreciate that this artist appreciates the art of dancing. It’s not a bunch of ass shaking. It’s emotional and actually connects to her music.,en
380,love how the two girls don't seem to hate each others.,en
381,Love this song,en
382,"this girl has the most unusual voice, i had to come here to see what she looks like haha",en
383,Tate is my favourite voice on the Tokyo Ghoul OST,en
384,This perfectly explains how I feel when my boyfriend watches  … giving his attention to it instead of me. I just want to be the only one he looks at like that and thinks of like that… ,en
385,"can we talk about how all of tate's music videos are literal films and just so incredible to watch, amazing job to tate and everyone who worked on this. so unbelievable.",en
386,"Wow she dances tooo, and so beautifully",en
387,"""She's all I wannabe""
Yeah. Anybody that's not me. 
Feel like this daily.",en
388,I love your singing,en
389,This song is how I feel right now! He broke my heart and its the same... She has everything that I want... Confidence... Cute smile and laugh.. ,en
390,I always end up here when im shitfaced drunk because i hear it on the radio when i drive home from the cafe,en
391,I started listening to her 4 years ago when she first posted her original songs with her little keyboard withe stickers scratched off. I can’t believe how far  she has come. I’ve listened for a while now and over the years her songs have really changed my life. When I was suicidal I used to sit in a dark room crying and signing/listening to her songs. They always made me feel like I wasn’t alone and I’m so happy now seeing her all grown up and getting the recognition she deserves for her talent. I’m just kind of sad we have to share her r with the world now instead of the small youtube crowd who knew her way back then.,en
392,"Aside from a few verses that wouldn’t apply, the song just makes me imagine myself looking back at 7 year old me, and wondering where that girl went.",en
393,"It's not only about jealousy , competition or admiration in life of girls.
We boys also often say ""why can't I be like him"" he got all perfect, perfect life, perfect body, and then we hate that person because it reminds us we will never be like him...ughh",en
394,Good job being yourself tate ( Amazing ),en
395,"""If you say she's nothing to worry about

Then why'd you close your eyes when you said it out loud?

Stupid boy makin' me so sad

Didn't think you could change this fast",en
396,she really has no bad songs at all. everything is just SO GOOD,en
397,"Did anyone else realize that the judges were some of the all stars from so you think you can dance next generation, I almost screamed when I saw that",en
398,🇬🇧 I didn’t know she sang this song!! ,en
399,"This is how I feel about my friend, it's so sad when I think about.",en
400,"Gurl you slay, you ate and left no crumbs!!!",en
401,I AM ADDICTED TO THIS MUSIC,en
402,"Listening to Tate's beautiful voice and seeing she dancing with Bailey Sok is EVERYTHING to me! Talented girls, WOW!",en
403,The girl in the video who Tate is insecure about reminds me of a girl I knew her name was Sophie and she was beautiful and she made me really insecure but she was always nice to me and told me how pretty I was.  And I felt bad because of how much I judged her.,en
404,I love this song,en
405,i love this music video cuz its kinda what i did with college lool,en
406,"When you just want to listen to the song you love it but, when your depressed or sad you understand the lyrics",en
407,This is my favorite song but just she is super good at singing I can't even sing,en
408,I am so proud to see how far she's come  Way to go Tate!,en
409,I love the ending ️,en
410,It's nice to know I'm not the only one who feels like they're at the bottom of the totem pole. Honestly how could I ever compete with that.,en
411,"..brilliant,  I love this, music and video..",en
412,This is my fav song girl!,en
413,"I don't relate to this feeling anymore, being in my adulthood, but Tate is such a damn good songwriter and the visuals in this are amazing <3",en
414,the lyrics hit me hard,en
415,This reminds me of the film ‘ballerina’ so much! Neither girls actually hate each other they just don’t know how to treat each other cuz 1 wants to be the other,en
416,Bailey Sok be killing it everywhere ,en
417,Love all your songs,en
418,FACT: Tate does not have a bad song ,en
419,This song fire ,en
420,Men want someone their mother will be of. Good looks gets you in the house. But it takes way more to get you the key for the door.,en
421,i love tate and i love the way they advertised the bottled water and that nude lipstick.  any body who noticed?,en
422,Flexibility is the key,en
423,Is it me or does she kinda remind anyone else of Colleen Ballinger in the audience with the suit? She’s so gorgeous!,en
424,this looks like it was such a joy to film!! such a perfect song and the perfect video to go with it - go Tate!! ,en
425,this is amazing oml,en
