,comentario,liguagem
114,"I've been crying seriously for almost an hour.
I feel that I can't anymore:(",en
115,The comforting comments in this video really understand me better than anyone I know.,en
116,"Hey there! How are you?

- if your response is good",en
117,"The dark comes before the dawn, so your going to need a pair of sunglasses - Thomas Fuller",en
118,"Ya know, it's funny. How I went from being the worst I've been in years to perfectly fine. It's crazy how in seconds you can save me from drowning waters, but the moment you turn away, I'm lost at sea again. Maybe you're my anchor. Keeping me in place during the thrashing waters. Maybe you're the thing keeping me afloat. Keeping my will strong. Making my body able to endure. Or maybe it's all just temporary hope. False strength from the ever fleeting moment. I mean. Humanity has a way of repeating itself, and I wouldn't be writing this if it hadn't happened to me at least once. Hehe. I say once... but the number of times I've been used for my belongings and/or body just to be tossed aside till the next time I'm "" needed ""... it feels like it's all I'm good for. Like I'm made to give, but ill never see the same kinda love or care I give others. So what makes you different from them? Who's to say it won't happen again? I.. It would be the last time it happens. Period. End of story. I just hope fate doesn't have something else planned for us. You're the best thing that's happened to me in years. And fate has a horrendous habit of pulling people out of your life when you feel you need them most. Sure, you can tell yourself that "" it was time for them to go "" or that you're "" better off without them,"" but the truth of the matter is that you still went through it. That pain will always be there no matter what you do. A part of you is gone, and you're expected to be perfectly OK. And again, sure you can pride yourself on the fact you made it another day. That you're getting stronger. But for what? To have to fight the battle again the next day? And that pride you feel? It's just an outcome of  shame. Your body trying to overcome it all. And gaining confidence from thriving is such an environment. And with your ego and spirits high, you fall again. Harder this time. Breaking and cracking more parts of you you didn't even know you had. God life is great. But I think I'm getting attached again. And I'm sacred. Bc when I'm not with him... idk. It's not the same. When he's there I feel I can rest. I feel comfortable and safe. I feel at home when I'm with him. And it scares me bc I've felt this before. Maybe not exactly the same feeling but close enough. And ik this won't end well. I just have that feeling. He's in it for the sex. For the free shit. For what I can give. And even if he isn't how am I of all people suppose to be enough for him? How am I supposed to be good enough to make him happy and I'm not even good enough for my friends. My family. Let alone myself. I'm too clingy. Too loud and obnoxious. I get startled to easy and freak out too much over any and everything. There's no way I'll be enough and it's only a matter of time till he starts looking for someone else. And I'll be right back to drowning by myself again. That why I can't stay too long.  That's why I can't get too attached. That's why I can't call it love. I know it's going to happen. You can't lie to me I'm an overthinker. I already saw it coming.",en
119,i promise it will get better. im proud of you.,en
120,"Don't mind my singing here 

We're no strangers to love
You know the rules and so do I (do I)",en
121,"Though You May FEEL upset just know there are people who care because it is what it is SO GET UP MOTIVATE YOURSELF NO MATTER WHAT WORDS MOTIVATE YOU MINE WILL ALWAYS BE ""SET YOUR HEART A BLAZE"" BECAUSE THOSE WORDS MEAN MORE THEN YOU THINK. THOUGH PEOPLE MIGHT LAUGH OR MOCK ME FOR THOSE WORDS. I DO NOT CARE FOR THOSE WORDS MEAN MORE TO ME THEN YOU CAN IMAGINE SO STAND UP AS THERE IS MORE TO OVERCOME AND I KNOW YOU CAN OVERCOME THIS FEELING SO DONT GIVE UP AND SET YOUR HEART A BLAZE FOR THOSE WORDS MEAN MORE THEN YOU CAN IMAGINE AND THOUGH LIFE IS DIFFICULT I KNOW YOU HAVE STRENGTH REMEMBER STRENGTH DOES NOT REFER TO THE PHYSICAL BODY SO STAND ON YOUR FEET I KNOW YOU CAN DO IT DONT FAIL ME NOW AS THOUGH YOU MAY FEEL DISHEARTENED DO NOT GIVE UP AS THERE IS AT LEAST ONE PERSON WHO WILL LOVE YOU FOR WHO YOU ARE..",en
122,I needed this playlist,en
123,Do you have this list on spotify?,en
124,"My heart is broken, my mind is closed, I can't cry in front of anyone, I can't speak with my family I really tried to love myself my laugh stopped years ago I feel like negative energy made a tree inside me, 
Just for once in my life I want to be Happy...",en
125,"After 2 years of being together, through her suicidal periods I was there, through her sleepless nights and every lows she endured up until she got fine, one thing she feared the most was me living her as everyone else she valued. I promised myself to be there for her throughout. And yesterday she finally told me she can't be with me anymore, she's back with her primary school boyfriend. I've learnt though that fears can be overcame and promises don't really matter. I skipped my lectures for today and stayed in my house listening to this playlist, thank God it's raining outside they(people) won't see my tears when i'm crying. It hurts",en
126,I love my parents and living only for them ️,en
127,Life is so hard especially when you have to figure out life for everyone in your family because you know nobody can  do it beside you...,en
128,"HEYYYYYYYYY TODO VA MEJORAR, TÚ ERES FUERTE, SÉ POSITIVO, TEN FÉ CARIÑO. TÚ PUEDES, YO CONFÍO EN TI",en
129,"It's okay, I know someday I'm gonna be with you.

Ah- the one sided lovers. Us. The heartbroken people in the society. It hurts to be one to always end up crying staring at the roofs while the person who hurt you is sleeping unknowing that you, my love, are a field of destroyed sunflowers.",en
130,"I'm pushing everyone away. I'm barely going to school more then once a week. I'm not cleaning my room and I'm not keeping it perfect like how I used to. I've stopped trying to do anything right, I'm not putting in any effort to make things better. I'm just so exhausted from trying anything anymore. Just so tired",en
131,these made me cry. life has been so hard trying to get over my eating disorder and insecurities.,en
132,"Tired but there's one thing I want to know before I die, the meaning of life.",en
133,"Imagine waking up and listening this first , thàts how i start my morning with béing on the edge of knife , im hollow from inside nd willing to die out of something suddenly one day soon so no one says it was my mistake that i left , i wont mention anyone but it was never me but them. Imagine in your own house everyone is fed up of you and they want you to die and teling that he was like that only , he used to take drugs and what shit they told bout me even when nothing like that used to happen . Sry everyone i cannot keep up with myself more. ",en
134,"my parents just got divorce, but this song comfort me sm <33",en
135,"The moon is beautiful, isn’t it?",en
136,"Everyone has their own story, their own worries, their own battles, most make it through, and they're stronger from it. Some, on the other hand, lose those battles, and we have to respect, and accept those who have failed these challenges. Even if you feel like giving up, or you keep getting knocked down in life. Get up, try again, it will only make you stronger, you have already went through the small battles, you made it through those, but now you're at war. You're at war with yourself, with others, but they dont see what you see. You dont see what they see, everyone has their perspectives but no matter the perspective, or battle, or the event. It always makes you stronger, you made it this far. We're all proud of you for that, proud that you're breathing, that you're blinking, that you're existing.It's hard, but keep fighting on, you've got this soldier. Keep on, keep going. Dont let this stop you now",en
137,"Just thinking about a life without her,makes me feel so dead inside",en
138,"I really feel so good and nice whenever I read all the comments which are written by kind people who all try to give some hope and give their best to make the person feel that their life and they too are beautiful and also that they have many reasons to live ....which help not to give up in life  
️️THANK YOU EVERYONE FOR TRYING TO HELP ️️",en
139,"I just want to sink to the depths of the ocean where it's dark, cold and I'm all alone, life ain't the way it used to be anymore, I'm better off alone",en
140,"Leaving a note of how I currently feel, maybe in case someone relates. Life is just really so fucking ugly, you know? Writing this, I just feel crazy at the moment. I don't know why. I don't know why I'm the way I am but I really do try. Its just depression has taken so much from me. After my hospitalization last year, I started feeling hopeful again. Not to say im not still. I feel like it sort of just goes away sometimes, the hope. But its hard to appreciate the good things in life when I'm hardwired like this.",en
141,sad playlist is not sad at all without another love song ,en
142,This playlist,en
143,"(1:34am) I'm not sad or hurt . I just feel empty, tired. I don't have tear to cry anymore, feel breathless without reason , feel sleepy but can't sleep . I don't know what I been gone through but I feel nothing. Don't need anyone or anything.",en
144,"I missed me when I was happier,when life was simpler.",en
145,Maybe at this point i just have to let all the tears I saved through the years go,en
146,I am tired of being judged all the time,en
147,It’s too hard to get over someone you still love but situations complicated and hard ,en
148,Everything just hurts so bad ,en
149,Love in the dark Hits hard ,en
150,"""People who laugh the most, need a hug the most""",en
151,"M so scared of my life, I feel like I'll leave without saying goodbye to my parents and my siblings. I love them so much, they are the only one I have in this world. ️",en
152,I'm Crying my heart out right now.,en
153,thanks you so much for this play list,en
154,"Does anyone else feel like they can't feel sad unless they listen to music? I hate the fact I can't feel strong emotions. I hate the fact that when someone tells me something tragic that happened to them I don't feel sad nor can I empathise with them, but I wish I could. To me not feeling emotion is not living at all, just existing. I'm 26, I've experienced a bit of life and I can say for sure that when I was a kid up until 13 before my parents broke up life was good.",en
155,"I miss... 
Always smiling at me... 
Me who always has good days... 
Me who gets on well with her family... ",en
156,"Dear the person who is reading this, please live your life til the fullest everyone deserves a good and happy ending.Eventhough we human beings have feelings we are valid in a bad or good way but we have eachother right? We deserve the best dont we? So what im tryna tell ya is that we need to forgive people who did us wrong as some point because theres no need to hold grudges when our lives are short. However, i am not telling to forgive them fully but try and ignore who is doing you wrong and walk past smiling like they arent there because thats we are good at sometimes and its good to have a cry at times. Try and be happy because you dont know how much your loved by people around you.I know i dont know you or what youre going through but try and be happy for the people who care about you.",en
157,"Hey, I just wanted to let you know that you matter and you shouldn't give up because you are braver than you think, stronger than you can imagine and impenetrable than titanium. Just hold on, it will be over soon. Stay strong Soldier.",en
158,I never thought someday YouTube comments are gonna make me believe in humanity again...I LOVE U ALL thank u so muchhh,en
159,"been in chronic pain for 4 and a half years. full body burning head to toe continually plus over 100+ other symptoms, cant die cos my parents would die too and i can't do that to them. but no one understands what it feels like to be in this much pain and how hard it is to try to stay alive :( im so tired",en
160,"What ever you are going through now God is there to guide you. You just need to ask Him. Don't worry things turn out for good, but your situation is going to get worse till it gets better. Keep looking for the light at the end of the tunnel. God bless you all",en
161,This is the lost song I'll here I'll make the sky beautiful for you guys good bye<<33,en
162,Ii was led to by someone I trusted with my whole heart and this song makes me cry out all my frustration ,en
163,"Its hurt so good when you realise that u don't  even have freedom to cry youre lungs out have to smiles and waiting everyone would go out so you can cry 
If yes we all are alike have nobody to comfort us",en
164,Idk why but sad songs make me happier than happy songs. I think it’s bc Ik other ppl are listening and are also going through there own problems and feeling. I just feel understood listening to sad songs knowing that the writer is or was in a bad place in life too….,en
165,"im so hurt that whenever i try to cry i just look sad, i can no longer shed tears",en
166,I cant think properly after losing someone u love for so long i will stay strong until i break,en
167,Tired but need to stay because you have people that believe in you,en
168,"To people that someday had that one friend, that you trusted them 105% but they just left you: I had a friend like that she left me and didn't lied that its because people around her were thinking that we are a couple, which she said that she hates it. Next day a spoke to her friend and it turned out that she lied about everything. Since then I can't trust anyone.",en
169,"Me and my bf broke up.we had been together since second grade. We were the best couple in our class everyone says “ Camila and …. Will be together forever” I thought the same. Everyone talks abt their mental health and how u don’t want to do anything but they don’t talk abt their physical health. Things u used to love doing don’t feel the same. It feels like ur heart has been split in half. Usually people have bsf to help them get through it.but me , no. When I walked into my classroom my friends were talking and I went to talk to them and my “friend “ pointed at me and laughed I told her it wasn’t funny and my other friend said yea it’s not that funny and she said to me it is . I told my friends not to tell anyone especially her. ",en
170,"She lit my fire, she made me smile, she was the reason i was pushing through with my depression and anxiety, but i guess things dont always last like you want them too. Im sorry i never got to say goodbye grandma, they didnt let me. 

ill miss you.",en
171,pov: you feel extremely emotional since you got into a fight with your important parson... and the best way to escape is to cry and listen to that playlist...,en
172,Hey you sweet thing reading this I am here to tell you thar there are alot of great things out there that you haven't experienced yet just give life another chance and let no one love you more than you love yourself.,en
173,I’m so scared of being alone. And some people don’t know the difference between lonely and alone. I feel lonely every day. But I am never alone. So I guess I’m scared of being empty not alone. Right now I feel empty.,en
174,I just wanna close my eyes and feel alright,en
175,"‘Did I kill my best friend?’ 

This is a story of revenge and rage, through the view of a 16-year-old girl named Anna. She witnesses her old friend's suicide and is haunted by nightmares leading up to her funeral. She relives her own bullying and the darkness which she had sunken into. Descriptive and vast, this tale explores the mind of a young girl and her plan to destroy her old best friend. Living in a small Russian town, she feels suffocated, with no meaning to her life. As time passes, the story blurs. And it becomes unclear how much is true and how reliable Anna really is. ",en
176,Thanks you soooo muchh i needed thissss ,en
177,Just broke up with my boyfriend  and this just make me think about  the good times ,en
178,"I’m proud of you for waking up.

I’m proud of you for brushing your hair.

I’m proud of you for blinking. 

I’m proud of you for breathing. ",en
179,"Have you ever Felt like loving was the worst choice you’ve ever made? Like when you thought you truly found your real love, who would give you hope, happiness and all.. they would suddenly change and start making you feel .. unwanted? And you feel like all the hopes and plans you had have shattered into.. nothing? I feel like this..",en
180,CAN THE WORLD JUST TAKE ME I CANT ANYMORE,en
181,The worst pain is thinking your finally getting better after years of this shit just to realize you were just distracted,en
182,Very Good Video! And also the song.,en
183,Now that life became hard to live in .. id rather be gone for good than suffering in this shitty world,en
184,"I'm not gonna lie, I wouldn't be here now if I didn't hold on a bit longer because I was actually making a video for the people I've run into. family, friends, even my friends online. I was making a goodbye video for them I was going to go to the nearby bridge record a voice recording while alone, reading off the note in the video of a slideshow, I was going to go through with it but for some reason I gave myself a reason to just hold on until I could meet someone very very important to me.. me and her aren't friends anymore but id still love to meet her before I go. I remember saying in my head ""I'm sorry everyone for being a disappointment"" because that's all I feel like i am. there is more but I'll hold onto it. ",en
185,the only song that makes me cry is home :),en
186,"The only phrase that goes through my mind is "" stay alive""...",en
187,I’m reading these comments and they help. I’m so proud of all of y’all I’ve been upset. Hurt for way to long. Surrounded by a lot of death. Got into a relationship for the first time in 4 years cuz how bad I got hurt thought she was the one. I was perfectly okay letting her in. Liked all of her flaws. They were perfect. Every last one of them. I had two friends die in the same month and found out she cheated on me :( it hurts but I’m fighting I have been since 01/03/20 and I will continue to fight🫶,en
188,Nice music thank you   I have joined now,en
189,"I just tired of my life.....  i cant even sleep, i over think a lot, i have no one to talkto... There is no one who understand me...every night i just sit alone and cry for hours.. Music been like my soul mate, when i feel alone ",en
190,I love this,en
191,"Aos 22 sem vontade alguma de lutar, mas sigo não pq quero,mas pq tem possoas não merem sofrer por mim,temo por um dia não suportar ",pt
192,"Ur life is not a film so don't end it
Ur size is not a book so don't judge it 
Ur wrist is not a  paper so don't cut it 
U r leaving to make ur parent proud",en
193,came here since we broke up. When I first met him it felt like i found my last piece and that I completed my life with him. I thought that too soon. I miss him everyday and it’s been 2 months.,en
194,"I remember when I used to have hope, those were the good days, now I fight through each day because I have to. I wish time would stop for once so I can take a single breath.",en
195,its the beginning of another love makin me sob silently,en
196,"you’re not a burden ,
Love yourself please, you deserve it.",en
197,5:33 im crying for how much is my tears now and how less were then,en
198,Waking up in the morning and already feeling like a failure even if you try you best to be a better person there’s always the thought of  deception and failure in your head … everyday… feeling hopeless about life,en
199,"eu preciso..
eu preciso dormir, preciso fugir da realidade, preciso sair dos meus pensamentos, eu tenho pensado bastante, isso tem me afetado tanto
eu amava uma pessoa e pensava que ela estaria sempre, sempre comigo",pt
200,melhor coisa é ouvir esse estilo de música e ficar fumando pod sozinho dentro do meu quarto,pt
201,"I don’t know what u are passing through, maybe u lost someone, maybe u lost something but i’m here to say that u are amazing! U are god’s children, he loves u, and he send me here to say that there’s still hope for u, so don’t give up, the owner of the universe loves you  May God Bless you !",en
202,"God to think im turning 20 in june and i didnt think id make it past 16 years old,",en
203,I wanna cry but all my tears are being used up on Another Love ,en
204,"I broke up with my boyfriend about a week ago, it was almost 2 years of a relationship …I love him but it was just wrong timing. I will forever hold him in my heart. And after we broke up everything feels like it is all falling down. My grads are bad, my friend is pushing away, etc…everything feels numb right now and I know my issues are that big of a deal but it still hurt you know? 
I just wanna lay down in a pool of own blood and cry and cry. I feel like a complete failure for my dad and he doesn’t know it. His little girl…innocent, smart and strong girl, is not what he thinks…I use to be against drugs and alcohol…but now I smoke weed and drink. The world just feels so loud I wanna shut it out. I wanna cry into my pillow and lay there. And I’m not okay. And it’s okay to not be okay. I just expect it….and I am feeling sorry about myself when I have a good life and a chance to ",en
205,I'm crying so much it's sooo sad,en
206,"Sometimes I pretend I’m just having a really bad nightmare, and I’m gonna wake up in April having dreamt every single heart wrenching, painlessly agonizing, lucky bad thing that has happened this year. I’ll wake up to the smell of your cheese quesadillas and be able to hug you. You’ll kiss my head and say smth stupid like “what’s wrong rat”. I’ll collapse to the ground at the realization that I never attempted suicide, that you never got beat, that they didn’t post those TikToks abt me, that I didn’t move schools, that I didn’t have to call cps for you, that I still have all of my friends, that I’m not covered in scars, that I’m at my old school, that your not talking to my best friend, but most of all, you will be the boy you used to. My boy. Not the boy I beg god to give back. I know you like her, I know she likes you, but she was my closest friend at this new school and with everything that happened to us, how could you do smth like that to me. I’ve loved you every second of every day and I will for the rest of my life in spite of my young age. I will love you black and blue. I won’t ever let you don’t. I won’t leave you alone on this earth either. That’s why I go back to the hospital, over and over, you are my motivation, my reason, my second chance. If the world was ending I’d be on your doorstep, but you’d be on hers, and I would follow you. I’d stand from a distance and watch you hug her, just so I could see you happy once last god. damn time. Never have I felt such emotion for one person. but I can’t possibly love you, I’m only 14. maybe I could get lucky tonight. Would u tell me you are okay. Add me and lmk your okay. Please tell me your happy. I just wanna know your smiling, even if it’s at my best friends texts. I’ve got to go back to the hospital tmr, and I want to be able to know your okay. I love you Jacob. Don’t forget it.",en
207,"I am dead inside since i lost the only one who would listen to me, care for me like it was for him. Right after our marriage he got killed by a car. I had him in my arms hours ago, his lips touching my neck and his heart beating over mine saying ""'ll come back im just going to see some friends"". He never returned. And now im still visiting to his grave, telling him my life like he still listens to me, giving him flowers. ",en
208,"at the end of it all... we will be alone and sad again. we no longer cling to beautiful things and words, because they hurt in the end when they cease to be",en
209,"I am crying myself to sleep every night 

My heart is in pieces i dont know what to do anymore i honestly dont",en
210,"Reasons to livemy friend
1.    You are important

2.    You are not worthless",en
211,I needed a this thank you so much ,en
212,"I have been through so much. I have done so well. I stay positive about everything I can, always tried to. That saved me. I will go on to live a successful life, successful in many areas. 

I don't want to tell people about what I've been through too much.",en
213,I'm here in comments to comfort myself  life's hard lately and I don't know what to and it's taking me dark place day by day . People say so many things to try that will help me but they don't understand that I don't even have any energy to do anything I love or just to drag myself up from bed .,en
214,I don't know what's happening to you right now and I can't imagine what it is but I hope it gets better friend P.S get some sleep buddy you need it friend,en
215,I really wish i have a mood fixer... A brother.. Wish i had a person to listen and motivates who understands me idk someone who give the same effort i give him /her to have a friendship,en
216,I needed this,en
217,I don't understand i don't even have a reason to be sad but life is still hard,en
218,I may be smiling outside . But I'm already empty inside. I just wish to be gone .,en
219,"immediately the late queen Elizabeth ll comes to my mind especially when she was in her first days as a queen, also the series the crown is related to this song ( another love ). :)))",en
