,comentario,liguagem
0,"i’m not depressed but i’m not happy, i can go all day laughing and smiling, but when i’m finally alone i turn into an emotional wreck..",en
1,"100 reasons to stay alive: 

1. to make your parents proud

2. to conquer your fears

3. to see your family again",en
2,"Lovely-Billie eilish and Khalid 
3:53 Another love-Tom Odell 
8:33 Somewhere only we know-Keane
11:38 It’s ok-Tom Rosenthal",en
3,"I'm tired of living. But, I live for parents who believe in their little daughter",en
4,"To anybody reading this, I pray that whatever is hurting you or whatever you are constantly stressing about gets better. May the dark thoughts, the overthinking, and the doubt exit your mind may clarity replace confusion. may peace and calmness fill your life.",en
5,The fact that a lot of people here in these comments are here comforting random people is so kind and sweet they are more like friends then the people see everyday. And Thank you to the person who made this because this is what is helping me through this thought period. Thank you so much x,en
6,"I stay strong for my family and friends, but rn Im just soaking my pillow in silence. Thank you for this mix, I needed it.",en
7,"I’m proud of you for waking up.

I’m proud of you for brushing your hair.

I’m proud of you for blinking. 

I’m proud of you for breathing. ",en
8,"0:00 Lovely-Billie eilish and Khalid 

3:53 Another love-Tom Odell 

8:33 Somewhere only we know-Keane

11:38 It’s ok-Tom Rosenthal",en
9,"i dont know what to do anymore, just sitting alone in my room with this playlist",en
10,"I miss the old me

The girl who was stress-free

Had kind parents ",en
11,POV: the strangers on the internet understand me better than anyone I could ever know,en
12,"I have no idea why I'm crying, but this playlist works great",en
13,"hey to you reading this (: whatever brings you here, wether it's to fall asleep or to relax from something stressful, i just wanted to let you know that everything will be fine. If you're going through a hard time right now, it's okay to remind yourself that this is temporary, and there are many good and relaxing days to come. If you're about to sleep, i hope you will have the most beautiful dreams, and the most peaceful sleep. You are an amazing person and the world is lucky to have someone like you in it. I hope only good things, love and strenth will come your way. Goodnight (: ",en
14,"Hey there


What are you doing here so late?",en
15,faking a smile is easier than explaining why you're sad.,en
16,"When listening to this it reminded me of a random childhood memory of me watching my dad do yard work out my window. It was relaxing to watch. But now I’m constantly stressed out from school and making people happy, when I get home I can’t wait to cry, tonight was the first night in a while that I actually cried from it all. It felt good but it didn’t either. It felt like I was living in a hallowed out husk, a shell that would do nothing but homework. I’m done crying and my eyes are tear streaked. Thanks for this playlist and helping me let it out tonight, thanks for bringing back my childhood memories.",en
17,Y'all comforting eo even without knowing makes me feel that angels still do exist   :(,en
18,"Dear person whoever reads this, 



Hey, you, yes, I am talking right to you. I hope you will see yourself with the eyes I see you one day because I can tell you have some awesome music taste :) You’re such a beautiful human being and worth and enough. I hope you know that you do only need yourself to be happy, I know society builds up the standard that whenever you’re alone you’re not living a happy life. But in fact, that is not true, if you start to realize that you actually deserve all the good things happening to you, you will treat yourself a lot nicer. I hope you let yourself rest, don’t beat yourself up over past mistakes, over regret, and over everything your mind wants to destroy you. I wish I could remove all those demons inside of your head because you deserve to feel happy. If you ever feel lonely then watch the sky, because you know, someone, at the same time is watching the sky too, maybe feeling the same way...I am glad you exist and I hope you won’t ever remove your own spot in this world, maybe you don’t feel like you belong here but, Angel, then build your home here. I don’t want you to leave this world unhappy. I want you to live every little second, I want you to feel alive, I don’t want you to see yourself just existing. You deserve it. Whatever happened, it’s not your fault, the demons in your head recognize that you have a beautiful heart, they want to take it because they have never seen such a beautiful heart as yours, so why let them win over you? . You’re not selfish for isolating yourself, but you deserve to talk to someone. If you’re reading this then please never forget to breathe and smile. ",en
19,When you are laughing and smiling outside...but you have this playlist in the inside...,en
20,Essas músicas me acalmam de uma forma que eu não sei explicar.,pt
21,"gosto muito de escutar musicas nessa vibe principalmente pra estudar, vlw por ter feito essa playlistzinha",pt
22,"My grandma just passed away earlier today. This kind of music is oddly comforting, in a twisted kind of way.",en
23,"I know whatever your going through right now is really REALLY hard, but I'm so proud of you.
Remember that this sadness will pass, and one day you will be able to look back on this and say
Wow. I did it. 
One day you will find happiness again. Just keep going.",en
24,"hey ! I don’t know what situation you’re in.. but I hope you recover soon ! keep going , I can tell that you are SO CLOSE to getting there ! Sadness doesn’t last for ever ! please take care ! ️",en
25,"when ever I hear these song, it reminds me of a time. A time when I didn't have to worry about anything, didn't have problems, talked and played outside with my friends for hours just to come home later and play on the game with them. It brings me back to times when I was happy and I had everything I needed. I don't have that anymore. I moved away from my friends and we don't talk really anymore. I drown in schoolwork and have no time do anything with anyone. I only have time to think of what once was. When life was good, when life was enjoyable and I had no problems. These songs brings me back to a time when I was just me and wasn't worried about anything. I would do anything to go back to those times. just to know what its like to be happy again and to be surrounded by people that care. This song is nostalgic and every time I hear it, it brings me to tears because I know it will never be like that again. Im so grateful for those friends. They helped me just be me. I hope they are doing well and maybe I will talk to them again in the future. Maybe I might find the perfect girl, but until then, im stuck, falling through the endless void of which is my thoughts, just waiting for something to happen...    ""There are some moments that can change us forever. There are some pains that you never forget."" -Wahi Noor",en
26,"When you are happy you sing the song , when you are sad you understand the lyrics  ",en
27,UNDERRATED! this playlist just defined my mood :),en
28,Keep in mind that the ones crying are not weak they just have been strong for too long -Wise person,en
29,"This playlist makes me question my life. I'm going to finish middle school next year but if I pass the high school entrance exam, my life depends on this exam. I'm afraid of failing. Making my family proud. Thank you for reading this far. Take care and remember that you can always succeed. Thanks for these songs.",en
30,"what relief and tranquility you feel when listening to this version, LOST DREAMS thank you",en
31,I have cried listening to this song while remembering my mistakes in the past ,en
32,This playlist describes my emotions so well,en
33,Tbh this playlist helped me so much and I have started to realise that I need to love myself,en
34,"I did it I took a shower,
 I didn't cry when they shouted I talked back,
 I finished my assignments,
 I drew,",en
35,"you know the feeling when you smile all the time at work, you're cheerful and that's how everyone thinks you are... and then you come home and lie down alone and can't wait to cry",en
36,32:50 sounds so beautiful,en
37,"I wrote this a few nights ago listening to this. Just, read. This is the story of two beings in the afterlife, each line is said by the other being.",en
38,"I used to listen to this music to cry, I now listen to it to teach myself not to cry.",en
39,"Pin me please
0:00 Lovely-Billie eilish and Khalid 

3:53 Another love-Tom Odell 

8:33 Somewhere only we know-Keane",en
40,Whoever is listening to these song is probably going through something right know and if that’s you just in case no one told you today you are beautiful not just on the outside but on the inside too,en
41,"not my story or quote but 



Unforgettable 

Your image like a photograph ingrained ",en
42,thank u for making this playlist i really needed it it helped a lot ur amzazing ilysm bestie,en
43,You know sometimes life is hard but you still need to live for those who couldn't live and be proud for what you have,en
44,"Guys,I know how much hard life  can be.But listening to sad music won’ t help you. 🩵Every storm has ending.Keep going.And in the end of the storm, you’ll see shining sun️",en
45,Love the video keep up with the good work  these are also One of my favorite songs! Tht I like to lessen to on my free time and sence I've lost my best friend I've been lesuning to song's like this sence I've lost him on birthday that was like a cumple day's ago so yay  thanks for making my day for putting my favorite songs together Bye bye! ,en
46,This rlly helped me to sleep thank you ️‍,en
47,The music fits perfectly with my current situation,en
48,everyone i know turned against me i seriously don’t know how to deal with this situation so just using this playlist to let it all out in empty room so i left with no tears or emotions to show anyone.,en
49,°•The Saddest Part Of Life Is The Person Who Gave You The Bestest Memory Become's A Memory•°,en
50,"Best playlist so far, keep going",en
51,"""Her Love"" (an original)



I stand on the edge, ready to fall

A heart shattered, a broken soul",en
52,"I'm so young yet so unhappy, nothing is working out I'm just thugging it out everyday. Thanks for the playlist.",en
53,Please make a mashup for all those songs together ,en
54,Keep going u got this....DON'T STOP TRYING WE ARE HERE FOR U....THIS IS UR SAFE PLACE,en
55,"I first included my characters for the sake of the plot (to be inspired)a sad part in their story, but I remembered my grandfather...2 years flew by like a white golob, soaring into the clouds...and will you meet him again?..The memories came flooding back and I couldn't hold back the tears...I'm sorry, that's it...may the earth be down to you Grandfather Sasha...",en
56,there are times when you get tired of always being strong and you need to cry to take out the burdens in your heart. IDK how many of you feel it but yes I do and here I am.. its not always that you are sad and so u are here. sometimes u need to be sad to come out even more stronger.,en
57,This is the best songs to make me relax!,en
58,Pov: you don't feel like your best friend isn't your friend anymore you feel like a stranger in your own friend group you felt leftout your stressed out and had nobody to talk to about it but you still smile for your parents and say I'm okay to yourself ,en
59,am obsessed with this playlist ,en
60,"Even through the darkest times of our lives will bring us nothing but pain, a ray of sunshine will always shine through the gaps of hope we hold in those dark times. This playlist is bringing comfort in many ways.Thank you Lost Dreams for understanding us <3",en
61,What hurts the most is when you love someone so much and your best friend takes them. I keep a smile around my best friend and his girlfriend. I love her so much. He got her first so I can’t be mad at him but it hurts every day when I see her. That is a permanent feeling I get all the time. A peace of empty space that can only be filled by her and it will never be filled. That is the worst because around them you have to congratulate but at the same time hate it so much because you wish it could be you in her arms. When you ask to hang out with him  and he says no I am hanging out with her and you feel lonely and jealousy at the same time. When you go to sleep crying because the next day you try to impress her. When you wake up and the first thing you think of is her. When she comes and talks to you and you have a normal conversation but in your mind you almost can’t hold back telling her that you love her with all your heart. She is all you think about and your friend takes you for granted. He talks about that he would rather do something else or gets in an argument with her and just says whatever when I would be on my knees begging her for her to accept my apology even if I did nothing wrong. I want her to look at me during class not me look at her whenever I get the chance. When I have to change my schedule so I can be in the same room as her. Talking to my friend and asking questions about her like what is it like being with her and what her favorite thing to do is. That hurts the worst because no matter how hard you try you can never get rid of the feeling of love.,en
62,"Its 2:31am....I am thinking about my future and getting depressed.... sometime i think that dying will be much easier but then i look at my mom and.....u know the responsibilities of a boy becoming men..so here we are listening this masterpieces... I don't know what will happen with me or what I'm gonna do but after seeing the comment section full of good , kind & motivational messages i remember that humanity is still alive...atlast i just want to say that all who are here or will be , always keep one thing in mind that you all are heroes and have faith in yourself , one day your parents will be proud of you...take love , take care of yourself and don't forget to spread love...Good Night & Sweet dreams ",en
63,"You all know that everything is going to be okay please don't cry and don't be sad...  You know when a person cries does not mean they are weak, it means that they have been through a lot and they are strong so everytime you are going to be sad or cry just remember that you have to calm down and remember all the goods in life and not just the bad ones, because everytime you are thinking about something bad it is getting harder to built new good memories... Stay focused on your beautiful life and i don't care that i don't know you, i want you to know that everything is gonna be fine... If you are still not fine take a break and have some sleep or do some hobbies like drawing or dancing or something else and remember if you wanna vent i am here for you and i can help you... Do you want to be my friend?",en
64,god bless the person who made this playlist; i dont think u realise how many people u r helping <3,en
65,Makes me remember the time when life was quite simpler and everything seemed better then ever...,en
66,"Really needed this playlist
Ty",en
67,Listening to these with headphones is an completely different experience,en
68,"I just hope that you people in the comment section don't get lost, because I know deep down... that when you all are writing something inspirational or trying to help and give hope to the ones reading your words, you are the one who need help... 

And I hope you will be alright... take care of yourself and try to stick to your own words please, I wish you the best",en
69,I didn’t even listen to this to cry these are just good songs️️️,en
70,"My grandma past away and I didn't really cry to stay strong for my mom, and when I saw her going underground I thought I never said goodbye when she was alive, so now I so much gilt and I am crying my eyes out for her.",en
71,"If you feel sad, go out and run. Make yourself sweat, feel the nature. That can scientifically make you happy. Do not listen to sad music, that will only make you more upset. I've got no advice if you choose to stay in the room, listen to sad music and make yourself sad. I have one word for those who do that, Drama kings and queens.",en
72,"Tears in my eyes, feeling real empty  contemplating something that other people frown upon but ive kind of came to accept as of lately and I cant help but think im so glad I was able to listen to this ;.",en
73,"I'm from Russia, so I use a translator. I have read a lot of comments and thank you so much for your support of people. I really felt better, Thank you! you are very cute️",en
74,"All the strangers online understanding all the pain and supporting each other, that’s true love right there. People in person act like they do but tells you to get over it like they ever understood it. I’m struggling with a forced marriage and I’m only 20.",en
75,love this so much..,en
76,"Endless void of trees
As I walk the earth, I see only that of trees that stretch for days without end
An endless path full of confusion and fear, and all to guide you is but a mere road made of gravel
The path lays there, marked by the foot steps from those who once walk this very same trail.",en
77,"Thank you, you help me to read a book ️",en
78,"When there’s too much to handle, feeling urge to break down. Lie in tears while listening this.",en
79," keep going x 
This is beautiful x but stay positive !",en
80,I would have loved to see the lyrics but amazing song choices.They made me happy.,en
81,"To everyone that's Struggling, you are loved by many people. Those thoughts that are trying to bring you down, there trying to kill u. People care about u. You are the most friendliest person if you put your mind to it! I believe in everyone! <3",en
82,"I'm crying because of the memories we made. I'm upset for you deciding to stay with your dad, yet I'm beyond happy for you. You're doing so much better than you were here in GA. You're presence/company no longer being next to mine ... Hurts. More than you know. We're still together and will officially be 4yrs soon. I miss you everyday and everywhere I look... There's a piece of you. You're my best friend and my bf. Everytime I'm upset I want to hop in my car and go to your home. Then I remember you're no longer here ... You're no longer an arms reach away.",en
83,"""Children get suicidal thoughts and deppresion too...""
-a wise girl",en
84,I was betrayed by my best friend and now I just want to listen to this. =(,en
85,"Sometimes I really wish I could escape this reality and live in my imagination where everything's fine, where one can feel loved, where one can genuinely feel happy :)",en
86,"I can't take all the pain im going through right now, but the only thing thats keeping me from not giving up is my freinds that i can trust. And that i can talk and express my feelings, And please dont give up, remember that there will always be people who love you for who you are. I know you can do it.",en
87,"PARA TODO HAY SOLUCIÓN, MENOS PARA LA MUERTE, NO SE RINDANNNNNN POR FAVOR, USTEDES PUEDEN",en
88,"I listened to this playlist, and I actually cried, imagining that something tragic had happened to me. And I do that every night and every day, with or without listening to sad playlists. (I'm delusional)",en
89,"Everyone don’t be sad about ur life 
It’s okay just remember in ur birthday that u pass the whole year in urself that’s means how much u r strong ",en
90,"Live a life you will remember whatever it is, in happiness or sadness please live... Don't leave room for regret, eat the food you want to eat, hear the music or the artist that you want to listen to, touch the leaves, the soft flowers, see the blue skies, the smile of the people, the beautiful nature, feel the love, the sadness, the sorrow, and the excitement. Because at the end of the night, you are the most beautiful creature the world has been seen, you are you despite the  unjustness, and the ugly circumstances the world has agreed to be made...you are the only one, the one who is breathing, the one who will keep fighting and the one who will love herself and himself against everything.",en
91,"I'm here and I'm suffering too but i will always help,listen and support you 
You're not alone i will be waiting and cheering you on 
Pick up the pieces one by one and soon you will be finished with the puzzle it may take a long time but you will get there 
I'm here for you so just smile(you look beautiful)and also start finishing your puzzle and make sure to take your time no need to rush healing takes a long time ",en
92,"~to whoever is reading this right now, NEVER LOSE HOPE, don't change yourself for anyone, don't cry because of them, THEY DONT DESERVE YOU! Be. You. Don't ever change that. You are strong, you are smart, you are beautiful, don't let anyone say differently! stay strong (keep passing this on!!)",en
93,I didn’t mean to come along this video but hey it’s quite relaxing,en
94,"i feel like i have 10 years worth of tears flowing out of me right now. i didn't even know i could cry this hard. my heart is so broken while she seems to be going in life without any hassle. i promised myself on my last heartbreak i'd never let anyone in this deep again yet here i am. it's like love's never worth the risk. i wouldn't wish this pain on the worst person in the world. i haven't been sleeping and idk how to feel better, and i hope all of you are doing better than i am because this feeling sucks.",en
95,No matter how much i try ..this addiction never goes...I have no more control on myself....days are passing and im not doing anything...Depression is a real thing guys! So much energy i used to have 2-3 years back...ready to face any challenge in life but here i am just left with regrets and anxiety ..will i ever be able to achieve something in life or my story will go down as of the one who could do it but didn't ever used his full potential...God its getting real hard...Maybe someday things get better!,en
96,I'm so thankful for my friends. At least I'm not totally alone ,en
97,"To anyone who reads this:

YOU ARE BEAUTIFUL
It's ok to feel the way you feel.",en
98,When you’ve been through so much pain and tears and all you can do now is look down with a sad face :(,en
99,"The sun is waking up right now in my city  i'm still in bed and have to go for a running but not just now, i still have time and this playlist. 6:38 am ",en
100,I actually can't even cry earlier but when I click and hearing this playlist..for no reason I start to tears a bit...........I only tired.,en
101,"Hey, what’s up? Everything is all right? I just want you to listen, that i am fu#king Proud Of you for everything you do. Every small detail you do is perfect. I hope that everything will be all right. Good luck and dont give up, Goodnight<3",en
102,These are the songs I will listen to if i brake up with someone ,en
103,Thx for all these comments guys they are really helpful….,en
104,If you’re ever sad to the point where you don’t wanna live just know that their ARE people who love you and they’re ARE people who wanna see you happy they’re are people who love to see you smile they’re are people who wanna see you push yourself to we’re you have no limit who wanna see you follow your dreams and who wanna see you flourish into the amazing beautiful person that you are people mess up people make mistakes they say or do something they don’t mean sometimes it might feel and seem like no one loves you but trust me someone out there does and if you won’t live for yourself then live for the people who wanna see you do great things who love you as a partner sibling cousin niece nephew grand kid daughter and son best friend live for them and if not for them then me a person who doesn’t know what you’re going through but who cares about you live for me and the world god bless y’all have a great day and remember every time you wake up is a blessing not a curse some people who take their lives the people around them hate their selves cause they couldn’t stop them or do something about it that’s the worst kind of pain hating yourself cause you couldn’t save the people you love from taking their own lives look up keep your chin up,en
105,I got really sad last night because I realized I’m the youngest of my entire family including cousins and if I don’t die early I’ll have no family at my funeral.,en
106,"when i heard these songs, the first song first second i just started bawling my eyes out from 16 years of built up trauma and sadness and just emotions....when i cry, im afraid i will never stop.",en
107,These songs help me get my mind d out of my breakup,en
108,this makes my 4years after being told i am not good enough back to good,en
109,thank you so so much for this!!,en
110,"Believe in yourself then you will find this life easier, hope everyone reading this will always be happy and loved. ",en
111,"My mom always told me the reason I thought all my friends hated me was because I had a teenage mind and it’s just my anxiety acting up. Turns out she couldn’t have been more wrong and I just found out today that all my classmates hate me even the ones I thought I was close with.
I just miss when I had my little friend group before they both moved. They always helped me with daddy issues and now I don’t know what to do. I can’t talk to anyone about it not even my mom cuz I don’t want to see her cry again. Last time she started crying even though she tried not to. I know she thinks it’s her fault I feel like this and she really tries to help but she can’t.",en
112,Olá tem músicas no Spotify?,pt
113,i really like this song,en
