,comentario,liguagem
0,THE DAWN IS HERE !!!,en
1,The Weeknd is the true definition of a legend,en
2,The angelic vocals are unbelievable ,en
3,One of the best artist of the late 2010s and early 2020. The Weeknd will be remembered as a legend,en
4,"This came out a year ago and I still can’t get over the first 30 seconds. The sounds at the beginning the dark synth prepares you for what to come, and then the abrupt stop, for “ I saw the fire in your eyes” is just truly one of the greatest moments in music history to me. It sets the tone immediately and calls back to his older self but introducing you the new. Abel is a genius and an icon I’m so grateful to be alive during this time.",en
5,"I'm 40 I never thought i would become a Weeknd fan. I been a fan since ""can't feel my face"" and I just love how dark and 80s his music is, amazing.  I love how true he is to himself I hope he never changes. I love his CDs too all are dope from beginning to end.",en
6,What a wonderful blend of disco and 80s!,en
7,Abel’s music is so timeless. He never disappoints ,en
8,The day this video was released was the day my daughter was born. I’ll never forget it. Now we sing to it! This song and “Clover Cage - Colorblind With A Beautiful Mind” are the two songs that helped get rid of my depression. I just want to send love to everyone and I want everyone to know things will get better. We are in this together..I love you ,en
9,I can't belive it's been 1 year since this dropped and it still slaps ,en
10,"This man could be gone for months, years, decades even, and still come out with a bop",en
11,This whole album. The concept. The sound. Everything is just beautiful. So underrated and under appreciated.,en
12,"Listening to this album late at night, in bed, with good noise-cancelling headphones is an amazing experience. I especially love this song but the whole album is magnificent.",en
13,"I’m one of your biggest fans, I was in your top 0.1% of listeners on Spotify last year. Dawn FM is my most favourite music album of all time! It’d make my day if you replied to my comment. Keep up the good music! Can’t wait for the next release! ️",en
14,"This song is incredible, and only continues to get better with time.",en
15,This song never fails to TAKE OUR BREATH AWAY!!,en
16,"YEAH, YEAH, SI, SI,  ¡VAMOS A BAILAR! ",en
17,"As almost 40 year old ""boomer"" raised on 70s, 80s and some 90s I almost completely ignore most music since 2006 except few bands. As years are adding I ignore more and more bands. But this guy is like a restoration. He doesn't need too many beats, autotune, etc.. 80s feeling is amazing and his singing too.",en
18,This album gonna break the internet.,en
19,"I can't stop listening to this song, one of the best songs I've ever heard, keep it up and don't change, you make great music",en
20,Se vc voltou pra ouvir esse som Parabéns! Seu gosto e excelente!!! ,pt
21,"What a song ,what a vibe, just amazing",en
22,"The Weeknd has reached the point where he can do no wrong. He was NEVER bad, but ever since Blinding Lights dropped, it's like he's reached a new gear and high in everything he's doing",en
23,Every songs of his is addictive,en
24,I got a feeling that this man never makes a bad song,en
25,the weekend's songs really fit in alot with today's situationship,en
26,Music I'll never get tired of listening ♬,en
27,I like this. No auto tune and it's very danceable. More please!,en
28,Último dia do ano escutando ele  esse cara araza demais adoro sou muito fã dele,pt
29,as músicas do The Weeknd são alucinantes!,pt
30,"I'm impressed with his creativity, his constant innovation as an artist. KING.",en
31,He’s a legend always delivers,en
32,Talentos ele têm demais ,pt
33,"Weeknd music style is very distinctive and memorable, it reminds me of the golden era 60s-90s music!! He's a modern-day blast from the past type of caliber which makes him stand out above the rest!!",en
34,"Love it, one of my favorite songs. I’m addicted to this guy’s music ",en
35,"The Weeknd does not disappoint at all, this shows he cares about his music so much he puts his heart and soul into it always. I just love him man. I've been jamming out to him since I was 14 now I'm 21!!",en
36,"Every Weekend song is always a hit and new experience for me. This song already sounds like a classic. Please never stop with these 80s vibes. This is one of my personal favorites from you sir.

3:20 I can't stop rewatching",en
37,Incrível como esse cara n tem música ruimmm.. ,pt
38,This song is so peaceful to listen to i love it,en
39,The Weeknd is the definition of an artist aging and developing like fine wine over their career,en
40,"there is so much to love in this album  , still growing on me",en
41,Giving all to new heights and God said it was good  feel-good music of the decade ,en
42,This guy is king to me he can perform like a legend ,en
43,"The weeknd literally sounds like the past, present and future all combined into one unique musical category.",en
44,Artista monstro!,pt
45,Tire meu fôlego #theweeknd!,en
46,"O beat desta música pertence a uma banda de música pop dos anos 80 
Os X Ray Conection este beat é da música Get Ready.  O The weeknd realmente de faz lembrar os  Euro Disc 80s ",pt
47,Your talent knows NO bounds! ,en
48,Musicas top como sempre!,pt
49,I’ve been a fan of The Weeknd’s for like 8 years! It’s incredible to see his popularity rise and his evolution as an artist! Once again he knocked it out of the park,en
50,"One of my favorite songs of all time, a true masterpiece",en
51,"Love The Weekend. What a amazing artist, so much talent. Vibing to this in 2022.",en
52,Minha favorita ,pt
53,amo essa música 🇧🇷,pt
54,a fantastic and energizing song  !!,en
55,No one can beat the talent of The Weeknd .He is not like other rappers who are going viral by using A u t h e n t i c v i e w s to get the views up. Thumbs up who agreess,en
56,Fact: The Weeknd is making everyone's day so much better with his song,en
57,"What a great video! This song is so good, I can't wait to listen to it in 2025! I saved almost 90% on my flights using Mighty  Travels  Premium.",en
58,"[Verse 1]
I saw the fire in your eyes
I saw the fire when I look into your eyes
You tell me things you wanna try (Uh)",en
59,MELHOR CANTOR THE WEEKND AMO TODAS AS MUSICAS 1005555555555555,en
60,All of your songs are absolutely upbeat your such a amazing artist,en
61,Música ótima amei tô viciada ,pt
62,The Weeknd never disappoints. This is truly breathtaking. I can't stop listening it over and over,en
63,your music is a kind of magic,en
64,This song gives me something new in life. Nice music! ,en
65,homey got some moves and tunes! his dancing is unreal! lord have  mercy what talent.... and the voice is incredible!,en
66,The Weeknd's songs make my day go according to how I want to be so the Weeknd I hope u keep on the good work and I love ur music,en
67,"Everytime The Weeknd posts new music, it always feels weird first time listening to it. It's so different, but when I get used to it - I can't stop listening to it. You take my breath away, Abel.",en
68,Minha música preferida do TW.,pt
69,"This guy is a pure genius! I think, that noone from the long time made me so eager for listening music. Besides He has everything, that good artist should have - perfect voice, looks, mystery, something to say to the audience. Good luck and keep it going on! You are the star.",en
70,Wow this sounds just as 80s as blinding lights this is awesome never change Weeknd.,en
71,"The Weeknd is a once in a lifetime artist, I don't think we will ever see such an amazing and versatile artist for a long time",en
72,"I like this dude, his music is very good, especially this one and blinding lights, i don't really listen to music that plays on mainstream radio, but this one is fire",en
73,Love it,en
74,"Feel like im got back on vintage era. 
Love this song ️",en
75,How is it possible that every song this man creates is a MASTER PIECE ,en
76,"This is a wonderful video. People compare The Weeknd to Michael Jackson, but he honestly encapsulates that feeling of 80s music and talent in general to me. With the music of today, this is refreshing and thrilling.",en
77,I love this song!!,en
78,"Back to the 80's , back to my teenager , back to  Real music back to happiness",en
79,Omg this is a vibe. All his songs are ,en
80,Idk how anyone can't love this on first listen. This is one of the most infectious songs he's ever made,en
81,Adoro suas músicas... linnndo ,pt
82,I love when he does funky/neo-soul type of beats,en
83,"I’m so glad he’s still on his retro 80’s vibe, UNBELIEVABLE.",en
84,"This man just keeps having hit after hit, I love all of his music  ",en
85,I love this song I wish we could have more 80's inspired music and then maybe the music industry won't be in such a terrible rut,en
86,O homem é bom ...... Lança o rit e vira sucesso.... The weeknd parabéns,pt
87,"He has a point, he's an icon,he's a legend and he is the moment.",en
88,This guy is literally the angel In disguise. I love his songs!! He's soo good. In the future his songs will still be a hit!!!!,en
89,Im crying cos its so good️️️️️,en
90,The Weekend é muito artista MDS amooooo,en
91,This man is literally my obsession. Every song he makes never misses! His songs are cocaine!,en
92,When I wanna dance I come back to this!,en
93,The weeknd never disappoint,en
94,This magnificent song was the beginning of one of the most legendary and my personal favourite The Weeknd album Dawn FM.,en
95,"Lyric:

I saw the fire in your eyes
I saw the fire when I look into your eyes",en
96,My hands and head move automatically as soon this plays,en
97,"Abel is so talented man. All the way back from house of balloons, kiss land, and beauty behind the madness, to the dawn.  As his biggest Stan, it makes me so happy to see how far he’s come.",en
98,Love this song this morning and always will love it.,en
99,His music is always ,en
100,This song reminds me of his music before 2020 idk why. I miss those days ,en
101,This song and “Clover Cage - Falling For Free” are the two songs keeping me sane through these tough times. I just want to send love to everyone and I want everyone to know things will get better. We are in this together..I love you..,en
102,Abel thank u so much for keeping the 80’s alive u are fire  x,en
103,I need more 80s Weeknd songs. I’d been addicted since late 2019.,en
104,"How good does he look now.  Love his music, his dance moves, everything about him xx",en
105,Love this song this afternoon and always will love it.,en
106,The Weekend melhor cantor,en
107,Love this ur absolutely brilliant keep the music coming !,en
108,This is masterpiece..always listen this before my duty. Boosts my confidence ,en
109,It's hard to explain but this man is making waves with his unique sound and flow.,en
110,DIOS MIO EL TEMA MAS INFRAVALORADO DE THE WEEKND MERECE ESTAR EN N1 EN TODOS LOS PAISES,en
111,It's on repeat..... Everyday ,en
112,The Weeknd is the only artist who can bring back the retro sound and totally make it sound like he invented it.  He gets better with each single and each album.,en
113,One of the masterpieces,en
114,The weeknd is like a shaken bottle of carbonated 80’s exploding. So refreshing and satisfying.,en
115,This is a wonderful video.The Weeknd will be remembered as a legend,en
116,Sou muito fã de todas as canções,pt
117,Michael Jackson vibes. This song is amazing. My favorite The Weeknd song so far.,en
118,MÚSICA BOA DO CARAMBA,pt
119,this feels like a song thats exists for multiple years alr i dont know if this is a remix or whatever but its timeless damn,en
120,I love the disco sound he's got going on here ,en
121,"I love the way he teases upcoming drops at the end of his songs. Like Sacrifice  at the end of this song, or Starboy at the end of I Feel It Coming, and others. It makes them feel almost like movies. Pretty cool",en
122,I love it!!! Guapito ️ The weeknd,en
123,I like that he’s sticking with the 80’s and synth vibes ,en
124,Best song the Weekend has ever made. ,en
125,Listening to Weekend brings us to next level vibe you wanna lost in,en
126,Great track telling a story which songs nowadays is missing. Love it from Fiji,en
127,"""It's like a dream what she feels with me, she loves to be on the edge, her fantasy is okay with me then suddenly baby says Take my breath""️",en
128,"This dude is the man, just drops hit after hit, ive been a fan of his forever and he just gets better and better.",en
129,1 year has passed listening to this masterpiece ️,en
130,Love his music ,en
131,That epic entrance,en
132,Love this song tonight and always will love it.,en
133,Massa esse estilo anos 80,pt
134,He literally never disappoints??? Like- I cant handle how much of a genius this guy is its insane!!!,en
135,Novo gênio da música!!!,pt
136,Thanking this song for getting me through the long transit time to work 🩷,en
137,"those chords in the chorus give me goosebumps, man.",en
138,This song and “Clover Cage - Make a Difference” are the two songs keeping me sane through these tough times. I just want to send love to everyone and I want everyone to know things will get better. We are in this together..I love you ️,en
139,"The weekend is a different kind of artist that his songs feel like blend of past , present and future all at the same time .",en
140,Guy is killing it   1 and only legend,en
141,This song is crazy fire just learned some of the chords on my guitar,en
142,"I love the guitars in this song, very funky. ️️",en
143,"His voice will replace the word 'melodious' in the dictionary. 
Legend.",en
144,"As a person born in 80s, hearing this song makes me so happy, because it brings the vibes of those times. Simpler times. Thank you, Abel ️",en
145,1 year has completed but this song still recommend me in my playlist ,en
146,"103.5 dawn fm is no less than amazing!!
Any one of Abel's songs, should anyone be Able to relate? Of course! Magnificent. ",en
147,uma das melhores da The Weeknd,pt
148,What a Beat? What a Music? I Love the Vibe of Music and the Sounds of Beast Beats,en
149,The Weekend & Max Martin stay bringing the 80s pop sound back to life. Love seeing him stay at the peak of his career for years with no signs of slowing down. Keep making Toronto proud 🇨🇦,en
150,If one is called a Legend..That should be Weekend.. Absolutely ,en
151,1 year later. It's my favourite song anyway ,en
152,The way I’m obsessed with this song ,en
153,"Thanks for the epilepsy warning. Seriously. Thank you! Not many people are aware of the fact, that strobe lights will trigger an epileptic seizure…. but I stayed for the song, because it’s one of my favorites ",en
154,Man.  Shoutout to whoever writes these bangers.  They got The Weeknd locked in.,en
155,How many more hits does this dude need to make before we start putting him in as one of the greatest pop stars of all time. He makes it seem so easy. A true sign of greatness.,en
156,I love It ,en
157,Very talented,en
158,Abel is the best artist. When i get bored i listen to his songs.his song is best for travelling.🫰,en
159,The day this video was released was the day my daughter was born. I’ll never forget it. Now we sing to it! This song and “Clover Cage - Colorblind With A Beautiful Mind” are the two songs that helped get rid of my depression. I just want to send love to everyone and I want everyone to know things will get better. We are in this together..I love you ,en
160,The day this video was released was the day my daughter was born. I’ll never forget it. Now we sing to it! This song and “Clover Cage - Thought You Should Know” are the two songs keeping me sane through these tough times. I just want to send love to everyone and I want everyone to know things will get better. We are in this together..I love you ,en
161,The day this video was released was the day my daughter was born. I’ll never forget it. Now we sing to it! This song and “Clover Cage - Learning To Love Myself” are the two songs that helped get rid of my depression. I just want to send love to everyone and I want everyone to know things will get better. We are in this together..I love you,en
162,The day this video was released was the day my daughter was born. I’ll never forget it. Now we sing to it! This song and “Clover Cage - Learning To Love Myself”  the two songs keeping me sane through these tough times. I just want to send love to everyone and I want everyone to know things will get better. We are in this together..I love you ️,en
163,The day this video was released was the day my daughter was born. I’ll never forget it. Now we sing to it! This song and “Clover Cage - Frozen In Time” are the two songs keeping me sane through these tough times. I just want to send love to everyone and I want everyone to know things will get better. We are in this together..I love you ️,en
164,The day this video was released was the day my daughter was born. I’ll never forget it. Now we sing to it! This song and “Clover Cage - Learning To Love Myself” are the two songs keeping me sane through these tough times. I just want to send love to everyone and I want everyone to know things will get better. We are in this together..I love you ,en
165,The day this video was released was the day my daughter was born. I’ll never forget it. Now we sing to it! This song and “Clover Cage - Learning To Love Myself” are the two songs that helped get rid of my depression. I just want to send love to everyone and I want everyone to know things will get better. We are in this together..I love you ️,en
166,one year of this masterpiece ,en
167,This song is a whole vibe ,en
168,EU TE AMOOOOOO ️,pt
169,"He never disappoints us, he's literally like the greatest of all.",en
170,truly a bop,en
171,There isn't a song from this awesome guy that is NOT good!!! ,en
172,Parece as músicas dos anos 80,pt
173,"This is true masterpiece. Abel wanted to keep that magic of “blinding lights” beat, mixing with retrowave flavor. Amazing!",en
174,"Dear Abel, time passes and your genius does not dry up. Wow ! Sublime song !",en
175,I love this song ,en
176,That's what perfect dance music is all about     ,en
177,"This is a wonderful video. People compare The Weeknd to Michael Jackson, but he honestly encapsulates that feeling of 80s music and talent in general to me. With the music of today, this is refreshing and thrilling.",en
178,Beautiful song  with a lot of hidden meanings and insight to the “Life” ,en
179,This song and “Clover Cage - Falling For Free” are the two songs keeping me sane through these tough times. I just want to send love to everyone and I want everyone to know things will get better. We are in this together..I love you..,en
180,When i listen this song i sing  make me happy feel the vibes,en
181,This is the best song I will pop my head off its so good! ,en
182,"Please keep the 80’s vibes. It works for ya bro. I haven’t danced like this to music for awhile and I know I’m not even close to alone. It’s that good, and the world needs it in all the violence and chaos",en
183,"This song instantly puts me in a good mood, and the song “Clover Cage - Secret Song” took away my depression and changed my life. I am now working on loving myself and becoming the best version of me! Love you guys",en
184,"No way it’s been 11 months since this song was released, wow, time flys by",en
185,"Lyrics:

I saw the fire in your eyes

I saw the fire when I look into your eyes

You tell me things you want to try",en
186,This song is genius,en
187,essa musica passa aquela vibe dos anos 80 show!,pt
188,"I mean, nobody does it like him, the vocals and that perfect mixture of past and present sounds, creating a new refreshing one, ABEL IS ON ANOTHER LEVEL",en
189,This song and “Clover Cage - Falling For Free” are the two songs keeping me sane through these tough times. I just want to send love to everyone and I want everyone to know things will get better. We are in this together..I love you..,en
190,I love this song so much,en
191,This is amazing work and this song is great,en
192,This song make me feel like its perfect for the Grand Theft Auto 6 opening credits. Hope this comes true.,en
193,I can’t get enough of this retro style beats Weeknd is putting out since After Hours,en
194,Very talented with the spirit of the ancient artists,en
195,"You're my crush's favourite singer, so I am here to witness myself why she is so obsessed with your music",en
196,"I am single, but when i hear this type of songs, than i feel i am in love. This is power of music."" ...",en
197,Literally the best concert,en
198,"What makes him different from the rest is his ability to sing in sync with the sound/music or melody, similar to Indian/Pakistani singers, which is very different from the rest western singers.",en
199,"""The after hours are done and the dawn is coming""
The sun rising at the intro, this guys is pure genius. I'M READY FOR THIS NEW ALBUM ABEL!!!!",en
200,The best Weeknd all time song for sure!!,en
201,This song and “Clover Cage - Lost Then Found” are the two songs keeping me sane through these tough times. I just want to send love to everyone and I want everyone to know things will get better. We are in this together..I love you  ️,en
202,"I saw the fire in your eyes
I saw the fire when I look into your eyes
You tell me things you wanna try, uh
I know temptation is the devil in disguise",en
203,"It honestly scares me, how successful he is. It's always hit after hit.",en
204,"I saw the fire in your eyes
I saw the fire when I look into your eyes
You tell me things you wanna try, uh
I know temptation is the devil in disguise",en
205,I'm addicted to the beat,en
206,The weekend is goatee he keeps the modern day 80s alive Michael Jackson would be proud,en
207,Truly a legend forever,en
208,amo vc principalmente  suas músicas,pt
209,I'm obsessed with this song,en
210,She is dazzling,en
211,Some times i feel i live in 80s time period while hearing weeknd drugs️,en
212,"QUE GRANDE, CADA TEMA QUE SACA ES UN HIT MUNDIAL. THE WEEKND EL MEJOR",en
213,What a tune!,en
214,This song and “Clover Cage - Lost Then Found” are the two songs keeping me sane through these tough times. I just want to send love to everyone and I want everyone to know things will get better. We are in this together..I love you ️,en
215,I recently started listening to him and now I am sold.,en
216,The day this video was released was the day my daughter was born. I’ll never forget it. Now we sing to it! This song and “Clover Cage - Learning To Love Myself” are the two songs that helped get rid of my depression. I just want to send love to everyone and I want everyone to know things will get better. We are in this together..I love you ,en
217,"I imagine Daft Punk, listening to this somewhere, smiling and nodding in approval",en
218,Can’t sit still listening to The Weeknd,en
219,O the weekend i o Ed São os melhores cantores de sempre Elisabete Gonçalves,pt
220,"I saw the fire in your eyes

I saw the fire when I look into your eyes

You tell me things you want to try

I know temptation is the devil in disguise You risk it all to feel alive",en
221,Can’t think of many other artists who can carry a song like this man,en
222,The Weeknd is a certified hit maker. Insane vocals!,en
223,this guy is incredible reminds me of my life every song wow,en
224,LOVE <3 GIVE THIS MAN A GRAMMY!,en
225,I love the weekend it's the only thing I listen to I love All of the weekends songs it is so much better than any other song,en
226,His music is timeless. It's never a dull moment listening to his music.,en
227,All I can say is simply the best,en
228,"I saw the fire in your eyes

I saw the fire when I look into your eyes

You tell me things you wanna try, uh

I know temptation is the devil in disguise",en
229,"this song made me sleepless playing in my mind all night)),i told it to stop but it didnt ))),the first time i heard it it just got contagious))",en
230,great song,en
231,The weeknd never disappoint...,en
232,"""Can't feel my face"" ""The hills"" ""Starboy"" ""Blinding Lights"" ""Save your tears"" and now ""take my breath""! All amazing songs made by The Weeknd. He's just too good.",en
233,Love it,en
234,Essa música me dá um negócio!,pt
235,"This song and ""Lukaz - Did You Call Me” are the two songs keeping me sane through these tough times. I just want to send love to everyone and I want everyone to know things will get better. We are in this together. I love you ",en
236,Excellent thank you it was good singing,en
237,This guy never made a bad song in his career,en
238,Love this song I was born in 1977 i don't normally like new music but love this song,en
239,This is briljant,en
240,I'M JUST IN LOVE WITH THIS,en
241,"The weeknd really doesn't seem to take a break. So my ears are always pleasant. 
Every time his album is released, my heart becomes magnificent.",en
242,This is genius.,en
243,this song kinda remind everybody of the time when 80s vibes where created,en
244,The best of what the weekend sang,en
245,MARAVILLOSO JUNTO CON DAF PUNK,pt
246,"Lyrics:

I saw the fire in your eyes
I saw the fire when I look into your eyes",en
247,The weeknd is one most talented artists of this generation and every song he drops is a banger,en
248,The best modern 80s music producer,en
249,"1 year ago, its still takes my breath away....... literally",en
250,Whenever I listen to the intro to this song I walk like that,en
251,I don’t dislike a single one of his songs or albums it’s kind of baffling how much I enjoy his music.,en
252,I love your music Great song,en
253,"The Weeknd is the best current artist of this generation,He's saving and resurrecting good music. This song sounds so retro.",en
