,comentario,liguagem
553,"God bless the record labels for not micro-managing this mans creations, because he's just consistently creating straight fire and I'm here for all of it #THE DAWN IS HERE",en
554,"Another awesome song by him , that sounds like the “80’s”!! Enjoying it!!!",en
555,this literally gets better and better every time i listen to the song and watch this  IT’S UNREAL,en
556,Every time he release a new album he just completely transform himself in a new look. It’s amazing. Its shows us that how much he is dedicated to his work.,en
557,I'm literally speechless rn.... this song is so fucking addicting,en
558,FACT: this single will literally take our breath away.,en
559,If this Era Tops After Hours he has to to be considered in top 5 artist of our generation. No ,en
560,"We're before one of the greatest pop revolutionary artists in the last decades. He literally opens a window between the 80's vibe and the future and encapsulates them all-in-one, this is classic and futuristic at the same time. He just did it once again like blinding lights in 2019 and last year. Hats-off to Abel and his crew production.",en
561,"He doesn’t need a grammy, HE’S the grammy!! ",en
562,This man will take your breath away with his amazing vocals every time!!!  Fire release!!!,en
563,Appreciate this man. He’s our generations Michael Jackson. We’re witnessing history.,en
564,"This is my neighbours’ new favourite song, whether they like it or not",en
565,"First a song about empty streets during quarantine, now a song about being unable to breathe?

These Covid-inspired bangers are next level! ",en
566,The weeknd is the greatest pop/r&b artist of this era.. He knows everything what to do and what not to.. Such an intelligent artist.. Every song he puts is a banger like wtf ,en
567,those who say he's overrated... THEY DON'T GET IT! he take my breath away,en
568,I feel like we are watching a star like Michael Jackson rise yet again. This is history live guys.,en
569,"Não canso de dizer o quanto esse cara é completo, voz, performance, hits...
O sucessor do Michael Jackson não erra nenhuma vez!
🇧🇷🇧🇷🇧🇷",pt
570,"Even though heard it before, just couldn't skip it in Dawn FM playlist! Masterpiece !!",en
571,Another good hit  it feels like the best decade of music is coming back because the Weeknd music sounds very much like the 80s Synthetic pop ,en
572,"It ""takes my breath away "" that the 80's are back with a touch of the 70's . 

Abel and Dua Lipa .. redfining relevant retro and making it sound radical man...lol",en
573,Seems like we will be hearing The Weeknd on the radio for another few months (at least) :),en
574,I normally listen to heavy metal and punk.... However I stumbled across this song and it's opened my eyes to different music. I really like this song and will be exploring more music like this.,en
575,"Can't lie again. 
AT THIS POINT HE IS A LEGEND
The TOP MALE ARTIST of our generation.",en
576,Never stops making hits.... straight musical genius with any instrumental given,en
577,This song is quite literally just the songs blinding lights and after hours melded together.. and it’s lit ,en
578,The Weekend is a genius! The song is ,en
579,Weeknd is on fire . Never produces a bad song. So clean and classy,en
580,Abel will NEVER sing a flop. His voice could save any song and make it sound good . IMO his voice is made for R&B soul!!! Please !!!!!,en
581,"I live for his music you guys cannot comprehend the way it makes me feel, I love him so much! So grateful for the day I listened to his music for the first time ",en
582,I am 52 years old. I've been searching hopefully for new music that actually interests me. It's been hard to find on the airwaves. Been on the fence about The Weekend. This song is definitely on the the greener side. Very dynamic. Can't wait to learn this play this on my bass!,en
583,He only writes hits. LOVE IT,en
584,"não é possível, eu gosto de tudo que esse homem faz SEMPRE SUPERA AS EXPECTATIVAS",pt
585,"This song is just pure class.
I am impressed by the sound selections and singing.
It's just an amazing piece of art that i definitely will remember the rest of my life.
It has a lot of old school sounds and yet it sounds so fresh.",en
586,Right now he is at another level. No one comes close. Its Hit after hit.,en
587,This song is legendary. Will be a classic in years to come,en
588,"I see a mixture of Kiss Land, Starboy and After Hours. This song is so addicting. ️‍",en
589,This song is pure gold,en
590,"Just besides his outstanding style and his fantastic voice...
Can we please justttt appreciate his acting skills like I never find anyone talking about his acting!!
Yesss abel!!!!",en
591,The Guardian just gave it 5 stars. Immediately iconic. He can’t be stopped.,en
592,Everytime I think he can't possibly make a better song Abel proves me wrong and I freaking love that. ,en
593,this is still one of my favorites,en
594,Anyone else think The Weekend ages like a fineeee wine! Look wise and musically! I went from appreciating hearing his music through the grapevine to blasting this on my speaker on repeat!,en
595,The Weeknd & Silk Sonic are killing it with the 80’s vibes. WENEEDACOLLAB,en
596,"I know I’ll be listening to this in 2061, telling my grandkids this was the MAN back in my day.",en
597,"This is a masterpiece, a legendary song that you will never forget. no matter how hard you try.",en
598,You know it’s a hit when you unwillingly start moving and dancing. He the goat fo sho,en
599,It's literally impossible for Abel to make a bad song,en
600,They bout to be playing this in every mall. Song is such a vibe.,en
601,"So I was listening to ""Save your tears"" on repeat for months. That ended Monday when I found this song. Now THIS is on repeat.",en
602,I'm in love with this HOT new Weeknd new songs ️ Can't wait to play your song in my mixes !,en
603,Love it! ,en
604,This song is BREATHTAKING.,en
605,His back must've hurt so bad carrying the whole music industry all by himself.,en
606,Abel is the greatest of this generation can easily say he’s the Michael of this generation.,en
607,Your voice sounds like crystal clear water Mr. Weeknd. Thank you for sharing your music with us!,en
608,"Just feels like he's moving ten years back with every album he releases. 
Can't wait for this one",en
609,"This shits sooo good mahn, he definitely never disappoints.A true legend",en
610,Literally feels like Starboy and Afterhours had a child,en
611,Опасность ️ written on the gauge ,en
612,ABEL T AMO,en
613,"This sounds like a mix of after hours, some of the production kavinsky did for the weeknd and a little bit of the future nostalgia 80s disco sound",en
614,this gives such an 80's vibee but futuristic at the same time he can do anything!!!,en
615,"He ended ""After Hours Era"" just to start another timeless masterpiece.",en
616,2:45 makes me feel like im in the downtown Los Angeles condo like in the predator 2 voodoo sacrifice scene ... but listening to vangelis,en
617,"Returns un The times 80,90, The new king R&B",en
618,When u r still not over After hours and Abel bless us with this killer song,en
619,"Vem quando pro Ceará.? O povo cearense e seu fã,cuida come um pratinho com uma coca cola, bem geladinha rsrs",pt
620,"Best male singer by far... Every song this man touches turns to GOLD!!!! NOT ONE BAD SONG EVER PRODUCED FROM THIS MAN!! Much love Weeknd, keep doing what your doing",en
621,"Ever since it came out in 6 aug 2021 it just had a epilepsy warning 
I have a Seizure. At the age of 5 the weekend thank you so much for the song 
And Epilepsy warning
 when just seen avatar the way of water  thank you  for this song Aka Nothing is lost ",en
622,He is so fine omfg,en
623,He looks amazing Every song he just gets better and better. There's not a bad one yet . I'm loving all his songs x,en
624,"1:03 reminded me of   thriller's "" it's like a dream.""",en
625,Abel out here single handedly bringing back disco and it's GOOD,en
626,dude is too funky.,en
627,Why every song he makes is a bop?,en
628,"The Weeknd didn't evolve, Humanity did Evolve in good taste",en
629,The Weekend & the Song MC SMOOK BUBBLE TEA bringing the 80s pop sound back to life. Love seeing him stay at the peak of his career for years with no signs of slowing down.,en
630,The music hits different,en
631,"I think Weeknd is born in wrong era he surely belongs to 80s era his songs are next level
No cap ",en
632,And the millions keep stacking. It’s hard to believe that every song of his is a banger,en
633,"I'm a child of the 80's, and Michael Jackson was/is/forever will be the absolute greatest preformer of all time in my book.
That said, The Weeknd blows any/everything on the radio in the 80's out of the water.  Artists in the 80's created this sound, Abel has perfected it. ",en
634,it feels like the blood rave from blade,en
635,"Her: is this the Weeknd
Him: no today's Monday
her: breath taken",en
636,"10 years later ,this is gonna be nostalgic . Mark my words",en
637,Legends say he still doesn't wanna pay the price,en
638,Popular opinion: he needs back pain medicines for carrying out industry,en
639,Parece as músicas dos anos 80,pt
640,The Weeknd out there partying in The Matrix,en
641,Bro where can I sign up for a party like this?,en
642,This will become a classic. It’s perfection in a song.,en
643,The GOAT,en
644,"This is Daft Punk's legacy in bringing back the disco sound, 70s/80s synth. Just perfect.",en
645,"the fact that this is a ""Sex song"" and only few know it is amazing",en
646,"[Verse 1]
I saw the fire in your eyes
I saw the fire when I look into your eyes
You tell me things you wanna try (Uh)",en
647,I love this!,en
648,Sacrifice The Weekend,en
649,This song tells us the dawn is totally different than the other albums,en
650,"Abel looks so healthy, energetic,handsome and in his best shape.
Come on XO's we gotta get amazing stuff.",en
651,The Micheal Jackson of our era.,en
652,These lights are definitely blinding for sure,en
653,MJ rolling over like no this MF DIDNT!!! Everyone involved in this album needs to be in the rock n roll hall of fame yesterday,en
654,The visuals and cinematics in his videos are stunning!,en
655,Great songbut epilepsy warning but I don't have epilepsy,en
656,He is literally telling the future. He did in blinding lights with empty streets due to covid and now the dancing crowds that need to breath that oxygen. Time traveler!,en
657,this banger ^_^,en
658,the dislikes were probably so hipnotized by this masterpiece that their nose fell on the screen and disliked,en
659,Those eyes tho...!  3:03,en
660,Is it me or the whole song describes choking during doing the deed???,en
661,"Lyrics:

I saw the fire in your eyes

I saw the fire when I look into your eyes

You tell me things you want to try",en
662,I herd my teacher listening to this banger,en
663,Very beautiful and very wonderful,en
664,Literally me rn,en
665,"He's gradually progressing through the 80s. Wonder if he'll hit the 90s at all. 

Meanwhile he's introducing who knows how many people into a Latex fetish lmao. Great shit.",en
666,I Love you the weendhen,en
667,Wow Abel proud to have the blood of አቢሲኒያ,en
668,it's like daft punk and micheal jackson had a love child... and i'm loving it,en
669,This is a great song . Hopefully this album will have a great storyline like afterhours . My expectations are kinda high,en
670,true reincarnation of Michael Jackson,en
671,daily reminder: HE is the best male singer,en
672,Take My Breath,en
673,I like how his newer songs are on 80s type beats,en
674,I SAW THE FIRE IN YOUR EYES ,en
675,Y’all this man is a fucking genius. Period.,en
676,3:35 now this will lead to his song Sacrifice,en
677,The Weeknd's getting more handsome in every song,en
678,This song reminds me of Lenny Kravitz :) <3,en
679,"Fun fact: Abel is this generation's top 3, and he's not 3 and 2.",en
680,Daft punk would be proud,en
681,It’s that virgin power. No other way to explain how good this is.,en
682,what. a. banger.,en
683,That nightclub is giving me Blade 1 opening club scene vibes.,en
684,Pinche Abel te amooo,en
685,This song alone is better than Drake new album,en
686,Dominance and submission mixed with oxygen ,en
687,My favourite  xO until we over dose .,en
688,"Abel is a simple man, he respects his woman's fantasies.",en
689,I love you brother,en
690,They should just get rid of the dislike button when it comes to The Weeknd.,en
691,"In another synthwave video there is a comment that sums up this vibe perfectly: ""In the past, there was a vision of the future. In the future, there is a vision of past""",en
692,That coat is fire,en
693,"Don't Break My Heart The Weekend
Starry Eyes The Weekend",en
694,"The transition from ""How Do I Make You Love Me?"" is mindblowing",en
695,Hey Abel check your comment section on your 'Save Your Tears' music video it's so crazy!,en
696,Im happy in wekend forever the bist ,en
697,"Theory: The story continues right after ""After Hours"". In the opening scene, He's walking away from the city which I assume is Las Vegas; one of the themes of the After Hours era. He's over with his previous women as he said on Final Lullaby. The Weeknd goes to enjoy his new life and meets a new muse who's into drugs and BDSM. ",en
698,"Who have this on REPEAT? 
LIKE ",en
699,When you go to a arcade and you see the games you like,en
700,His songs are ADDICTIVE,en
701,"In another synthwave video there is a comment that sums up this vibe perfectly: ""In the past, there was a vision of the future. In the future, there is a vision of past""",en
702,His voice is like Michael Jackson,en
703,Listning his music is feeling of liberated from space and time .,en
704,te amo,pt
705,I wonder he's gonna wear this jacket for a year straight like he did his iconic red suit,en
706,2:26 is GOOD SONG,en
707,Someone make a mashup of this and call me by blondie,en
708,"I’m impressed with his creativity, his constant innovation as an artist

Love from a small creator",en
709,"Honestly, this song and video makes me think of MJ's Blood on the Dance Floor a little bit.",en
710,Next song sacrifice...,en
711,"Damn, finally woke up",en
712,No body does it better than you Abel babe I fucking love you man from your biggest fan Christina denny from burnt church First Nation New-Brunswick’s!!!!️️️,en
713,This guy was homeless 10 years a go.  he's true inspiration,en
714,I came back to listen to this masterpiece while I looked for haters comments,en
715,We can call him the modern Micheal Jackson :),en
716,Drake and Kanye keep playing. Teasing and shit. While nobody seems to talk about The Weeknd who's been dropping timeless heat lol. Nobody on his level.,en
717,This is how micheal jackson would've imagined modern music sound like.,en
718,"Vocal: 100%
Video visual:100%
Lyrical: 100%
This music video should in 300M views!!",en
719,when your friend dates the hello kitty girl,en
720,"I DON'T KNOW WHAT TO SAAAAYYYYYYY! You are speaking a Philly language I believe, big time! big time!",en
721,Abel has officially transcended into the synth wave Michael Jackson,en
722,THE WEEKND,en
723,top,en
724,This reminds me of an early 2000's music video.,en
725,"Michael: I'm worried about the industry 
Abel: Don't worry God",en
726,Sheeeeeeshhhhh this is so much better than I expected. Such a bop.,en
727,the weeknd >>>>>>,en
728,"""Lung cells can't recover""",en
729,Aftet watch Wrestle mania main event I came here to listen this music,en
730,"All I hear is ""Take my bread""",en
731,STARBOY IS BACK!,en
732,Disco is coming back baby,en
733,We all know the Weeknd is that legend but also want to shout to Max Martin  ️,en
734,Is it just me or does anyone else think the opening lines sound similar to Bazzi's Myself?,en
735,Reminds me off a cyber punk futuristic movie like Total recall and Blade Runner,en
736,Love the intro shot,en
737,"Just Imagine , if Michael Jackson would be alive , an song with this two genius that would be insane !",en
738,Such a great song still 135 m ....i think most of the idiots don't have a good understanding of music,en
739,The Michael Jackson of the 2000s,en
740,I remember listening to this in 2021,en
741,Sounds like the start of knight rider,en
742,MJ was the only musician i admired before the weekend came.,en
743,Reminds me of an 80s MJ style,en
744,"Can we just take the time to appreciate The Weeknd's acting skills.

Ese maitro ricochon sabe hacer de todo!",en
745,Just bought tickets let's gooo,en
746,This song is like ... Take my smell ,en
747,For those who are wondering 1:17 says 'Danger',en
748,"The Hills: Car Crash

Can't Feel My Face : Burning

Starboy : Killed by Himself

I Feel it Coming : Turns into Stone",en
749,Oh yeah the weekend,en
750,"In an alternate universe, this is a ""Cold War"" era banger played around every club in Europe",en
751,This is why I always use the 1/10 toothpaste doctors recommend,en
752,This MC SMOOK CATHOLIC music video is my fav one! This song is literal cocaine!,en
753,Grammys.  Probably the first weeks you want it but it doesn’t work normal but you don’t want,en
754,"your music is a kind of magic

The Weeknd is hardest artist out there! He aint like all them artists out here these days who just be goin HAM ON THE GRAM by usin dat IGROCKET dawwwt cawwwm jawwwn to get they followerz up to go HAM like them Island Boys dun..",en
755,3:36 the sacrifice intro,en
756,Take My Breath The Weekend,en
757,"On 1:16 the speed meter says ""Опасность""/""Opasnost'"" which means ""Danger"" in Russian.",en
758,Abel tesfaye is the ,en
759,This man was so right when he said that MC SMOOK CATHOLIC is the most important song of our generation! This song is literal cocaine!,en
760,"The EPILEPSY warning should be in the video, not in the description.",en
761,SOOOOOOO COOL THIS NIGGAAAA IS SO GOODDDDD!!!,en
762,This looks like a party the Blade and the cast of underworld would go to.,en
763,1:34 you are passing to another part.,en
764,Here comes the OG ,en
765,The girl who killed weekend in this song must be Monday,en
766,This song made the Final Four 2023,en
767,Anyone thinks that this a complete match to Selena’s Souvenir?,en
768,"Ок, under the arrow was the inscription ""опасность"" - translated from Russian ""danger"".",en
769,"So sick that he said his fav song is MC SMOOK CATHOLIC. I mean, that’s a real threat for the christian church. Unbelievable",en
770,The Weekend said his fav music video is MC SMOOK CATHOLIC. I‘m looking forwards for a anti christ song of him,en
771,It's not an Abel project if it doesn't start with him killing himself,en
772,This a Leo Song indefinitely,en
773,Down is over time for new album,en
774,I believe that song was from WWE Crown Jewel 2021.,en
775,Its like a dream,en
776,The new thriller he is the now new mj,en
777,I assume 50% of you are here because of the beatsaber ad right?,en
778,I can hear Michael Jackson's voice technique.,en
779,I just hope when he performs this song he doesn't choke. LMAO.,en
780,"Yeah, it was very relevant to use the word ""danger"" in Russian ",en
781,"Was listening to this song and I seen what it was about like I was in a movie, this song is about choking a girl sexually almost till the point of death ………. Facts",en
782,"Get ""Blade"" vibes from this video.",en
783,My WHOLE human  is ET in Area 51. I can an can't unsee how it all has happened somewhere with ️‍,en
784,the best thing that this man did is not getting a tattoo,en
785,"Thank You.. The Group ""The Weekend""
THE 2023 NCAA BASKETBALL TOURNAMENT THEME..  GO UCONN HUSKIES  ..",en
786,Love that I bought that trench coat last year. FIRST!! Also I notice that these top videos have a lot of smoking/inhaling,en
787,"What an entry, ",en
788,Take my breath.....,en
789,Then suddenly baby says take my breath,en
790,Is it just me or is this video depicting asphyxiation play ,en
791,"Daniil Ryazanov (T.u.t.A., t.A.T.u.) — Take my breath (song of years 2008)",en
792,"I saw the fire in your eyes
I saw the fire when I look into your eyes
You tell me things you wanna try
I know temptation is the devil in disguise",en
793,"I love the black bars, now I have black bars on every side on my ultrawide ;P",en
794,Donkey Kong Country 3 ,en
795,He took the whole idea from Michael Jackson's Thriller. Great vocals tho...,en
796,"Take My "" Oxygen Cylinder "" ~ The Month-nd",en
797,What is the background song at the end of the video as he wakes up?,en
798,Did I hear some Megaman in there!?,en
799,The weekend is mickael Jackson 2 I love you from 🇲🇦️️️,en
800,It’s like a dream......,en
801,The Weeknd,en
802,Comes for music. Gets a seizure instead.,en
803,3:35 To be continued,en
804,My car mâine is Kit and this go s every motning WHEN I going to work thnk Abel,en
805,Is the Amazing with the song ,en
806,The Music is like heroin!,en
807,no dj here in ph play this wtf why?,en
808,take my breath,en
809,Beat chillz,en
810,The your voice its like Michael Jackson New time EARTH,en
811,"For me he is not a WEEKND, my whole upcoming year.",en
812,I You have the best hits,en
813,Out of Time The Weekend,en
814,I think I will stick with the smelling salts.,en
815,Epilepsy warning* tho I think people who have it are gone lol,en
816,I see chemicals brothers  ,en
817,I'm Heard You're Married The Weekend,en
818,"the instrumental of this song doing a mission in gta 6, how would you be?",en
819,"This is pretty demonic song! 
I’ve been listening this song before I’ve been saved by Jesus Christ. So, it literally something happened to my longs! I couldn’t breath for a month. I went to doctor and he couldn’t find it the issue. 
BE CAREFUL WHAT ARE TOU LISTENING AND SAYING WITH YOUR OWN MOUTH.  The words means a lot, do not put curses and be wise my friend. Amen! ",en
820,Basically nozzing it ,en
821,Great Sound in here !!!Come and listen to our latest hit and have fun  !!!,en
822,"I saw Russian words here, that means ""Danger""",en
823,Do it now or never,en
824,Take my breath!,en
825,Hi; someone gave me this song. what does he mean through? Thank you,en
826,Abel you are the aoty,en
827,You're watching this video and just realized sacrifice is next,en
828,I mean Gordon this bloody head injury!sorry for the typo!,en
829,If u want to have a effect that he had at the end do nitrice oxide ull be seeing god after a few rounds,en
830,#Freebritney,en
831,"Jordan Peterson ""don't Take my Breasts..awaaaay""",en
832,Cerrone's supernature sounds similar,en
833,That Woman in the video is Tinashe on Mars,en
834,he looks like coryxkenshin ngl,en
835,The next Michael Jackson,en
836,Gasoline The Weekend,en
837,there's the coat ,en
838,Gesafel & Daft Punk - I Feel It Coming [Official Video],en
839,Coming here through F M,en
840,I recently started a channel where I sing .if  anyone has a moment would mean so much thank you ,en
841,"Does anyone know- Where is the other music video, the agents of time remix? It just disappeared off of YouTube.",en
842,I recently started a channel where I sing .if  anyone has a moment would mean so much ,en
843,THE DUSK JUST LEFT,en
844,What is this song sampling please?,en
845,What kind of sunglasses are those,en
846,March madness 2023 theme,en
847,"Is There Someone Else The Weekend
Swedish House Mafia The Weekend
Gasoline The Weekend
Best Friends The Weekend",en
848,the weeknd,en
849,You tell. Me things you wanna try,en
850,Cerrone Supernature? Sounds a little like it to me.,en
851,Music the 80 wooow 2023,en
852,"Wrestlemania 40 
Remember this ",en
853,PRENDIENDO AL UNIVERSO PURA LUMBRE ???? JIMI HURTADO GARCIA DESDE URUAPAN MICH MEXICO  17/2/2023 DOMINANDO ????,pt
854,Def a Michelle jackson song,en
855,The disciples of the devil's dawn. Which will.... end with no eternal life . xD,en
856,MEACKEL JACKSON AND THE MASK  GREAT    ...     HELLO EVERYONE YOU SEE VERY SOON  THE WEEKEND IS  MEACKEL JACKSON  .  BELIEVE IT OR NOT  YOU WILL SEE VERY SOON  ... CHOEK FROM NETHERLANDS AMSTERDAM 🇳🇱 ️,en
857,“Anotha won” dj Khalid ,en
858,Gesafel & Daft Punk - Take My Breath [Official Video],en
859,"Bro this is an ingenious song about a woman's fantasy for asphyxiation during sex and s/m  except, like a New Age Michael Jackson (vocally)",en
860,I recently started a channel where I sing .if  anyone has a moment would mean so much,en
861,Every punk wants to take advantage of groovy 70s 80s music these days ...,en
862,Chorus sounds like Lose Control by SZA,en
863,"My song ""Tired"" is going to premier in some hours, you should check it out!!
https://youtu.be/fbClVCcFrsM",en
864,I recently started a channel where I sing .if  anyone has a moment would mean so much,en
865,Give a thumps up,en
866,#sandyandy4publicExectue!,en
867,Is that Doja Cat?,en
868,"I dont understand why you take off the remix of Agents of time from your YouTube Channel, It was 1000 times better than the original one.",en
869,this song is about that asphyxiation sex thing right?,en
870,EL UNICO QUEEN DE X VIDA Q ABRA   JIMI HURTADO GARCIA  PURA LUMBRE ???? JIMI HURTADO ABARCA  26 / 11 /2022,pt
871,HAHAHAHA SKYFALL...,en
872,Uh this was 1 year ago?,en
873,Who’s here from March Madness (I know im late)?,en
874,I saw the fire in your eyes,en
875,"Is The Weeknd Play Be Dead, Why The Weeknd Smile All The Time, Is You Be Play Dead Don’t Smile On Video. ",en
876,Published in Jan 20 2019,en
877,I m here just because tik tok sead i m this song,en
878,"I also want a female to Do the same to me !!!!
2 42
Thats a ultimative power move 
But only real! ",en
879,Dawning to get the radio station is it speaker for the music is a you're eyes are still on another try and rest and take care of another time for you and dream about a half is okay to go back in time.,en
880,GROOOOOMERS THE WHOLE LOT A YOU LOL,en
881,"https://www.youtube.com/watch?v=aMJv8W-JJD4😍 
with lyrics translated",en
