,comentario,liguagem
254,Honestly my dreams come true when they did this song together they are two of my favorite artists I love them both,en
255,really cool song ,en
256,Take this masterpiece ,en
257,"Nobody is doing it like Abel, his quality is untouched",en
258,Lmfao you're a genius  when you knock on the door with the head I almost cried!!! Well done for this Abel ️,en
259,"that make me remember thriller, this man have the MJ vibes for real ",en
260,o homem!!! ,pt
261,This Piece Is CLASSIC.,en
262,Can't stop listening to this,en
263,Really good! ,en
264,"i love the characters clothing, whoever designed it good fking job. Simple and powerfull, no colors",en
265,"This is beyond epic, just what we needed: a retro/80's/synthwave vibe into a modern pop song. Sounds so nostalgic yet refreshing at the same time. I loved it",en
266,This song and “Clover Cage - Lost Then Found” are the two songs keeping me sane through these tough times. I just want to send love to everyone and I want everyone to know things will get better. We are in this together..I love you ,en
267,"Choker and chokee..
The Weeknd is gunna last the test of times...never fails to deliver.",en
268,"bro I remember the day this was posted, it was like ""premiered 1 hour ago"" now it's 1 year old!!!",en
269,Take my breath ,en
270,For those who see this in 2070...this man was the best of our generation. Respect #Legend ,en
271,"Lyrics:
I Saw The Fire In Your Eyes,
I Saw The Fire When I Look Into You Eyes,
You Tell Me Things You Wanna Try,",en
272,I'm addicted ,en
273,The greatest modern artist,en
274,"This is my neighbor’s fav song now, whether he likes it or not.",en
275,"What an amazing performance, love from Novi Sad!!!!",en
276,This mofo is so cool! Can't musically put a foot wrong either ,en
277,love the music,en
278,Sometimes you have to just go back and appreciate the brilliance that is The Weekend,en
279,The attraction I have to everything this man does is toxic!!! ️,en
280,If only this man knew how many people’s life’s he’s changed with his music ...,en
281,god no one knows how good of a song this is,en
282,Thanks world to give us The Weeknd nowadays,en
283,Gives me some stranger things theme music vibes but maybe that’s why it’s so damn catchy love it!!!,en
284,"I saw the fire in your eyes
I saw the fire when I look into your eyes
You tell me things you wanna try
I know temptation is the devil in disguise",en
285,"This man is the only artist who is bringing back that 80s nostalgia in his music. ️ this track will be on repeat for a good 2-3 months. Can’t wait for the new album! (just noticed the fangs he’s wearing and got underworld vibes, hell yes).",en
286,Love this guy,en
287,He is legend and he is ,en
288,Que grandee the weeknd casi 120 millones de vistas,en
289,I love the weeknd and he is legend because his songs is great,en
290,Abel is one of the most talented musician our time. His voice is brilliant and Songs is every different with 80s Touch but modern. A worthy successor of Michael Jackson,en
291,"I love the weekend, he's the modern day MJ,with his voice and music and his signature style of black leather and red eyewear",en
292,CRAZYYY WHAT A VIBE!!!,en
293,Love this song ,en
294,I love your voice it's Talented,en
295,The Intro Is Sick!,en
296,I can't believe how magical that experience was. I swear Abel makes us all feel alive. ♡,en
297,Love this song,en
298,Would love to see you and Timberlake do a collaboration ,en
299,Weeknd s songs are great take my breath after hours in your eyes blinding lights starboy save you tears the hills i feel it coming earned it and everything songs The Weeknd is legend,en
300,"He never disappoints
Weeknd go in soo hard on this! He aint like all them other artists who just be usin dat IGROCKET dawwwt cawwwm jawwwwn to go HAM ON THE GRAM smh seem like anyone can get mad followers on the gram like Island Boys dun did..",en
301,"The weeknd shines at night 
this one is for dawn 
day light is for sucking the whole sun energy up",en
302,"Dark, Mysterious, danceable, commercial, fun and uplifting all at the same time can fit on any playlist how is this possible? ️‍A genius of our generation sad we don't understand it till they are gone!!!",en
303,Love it.,en
304,How does this not have more views??,en
305,Não entendo porq so tem isso de viws esssa música é muito boa,pt
306,"This song and this video are so well produced. Abel is just on another level. Always telling a story, having a unique artistic angle and still making his music accessible for a big crowd, and danceable! This is incredibly difficult. There are very few artists around like him at this moment. Much respect",en
307,This is a weeknd classic.,en
308,Playing in PF all the time. ,en
309,this is so addicting,en
310,I just don’t understand How a song can only be out for a few hours and already be a classic??? Abel did it again! Long Live The Weeknd,en
311,This is so 80’s and so stranger things vibe!,en
312,adorei,pt
313,"That Grammy doesn't deserve to be in Abel's hands, he too good for it! ️",en
314,"Every Chapter he reinvents himself, new Style of Music and a New Charakter he creates…..simply an amazing Artist. Love you Abel ️",en
315,I searched to find a song for him that is not beautiful but failed ️‍️‍,en
316,Uauuu  muito  manero  esse vídeo ,pt
317,Super pesma.,pt
318,We're gonna make a song together one day. Mark my words.,en
319,"Lyrics 
I saw the fire in your eyes
I saw the fire when
I look into your eyes",en
320,Bro the transition from take my breath to sacrifice is absolutely phenomenal,en
321,This song makes me wanna drive normal on any of the GTA GAMES,en
322,He is simply the best,en
323,Dawn experienced through sound ,en
324,A whole classic,en
325,This is so good,en
326,He’s gonna go down as one of the greatest of all time. Shout out to Abel for holding it down for the last decade,en
327,Im enjoying by this music ,en
328,Great song ️️️️️️️,en
329,hearing this outside of the haunted house was amazing,en
330,Great visuals. Especially Shaina West. ,en
331,good lord this is so good,en
332,I love how Abel changes his look and personality with each release,en
333,This song and “Did You Call Me” by Lukaz are some of the only things getting me through tough times.I hope everyone is doing well. I love you! ️,en
334,this is why hes the king of pop ,en
335,"I saw the fire in your eyes
I saw the fire when I look into your eyes
You tell me things you wanna try, uh
I know temptation is the devil in disguise",en
336,"The Weeknd is the only new artist who’s going highs and lows to present a whole perfect package with each new song, from music to visuals to lyrics to basically everything!",en
337,i forgot i loved this one ,en
338,My favorite artist of the last decade.,en
339,The similarity between this beat n thriller song is crazy!!!!,en
340,Abel has come such a long way. I feel honored to have been there from close to the beginning to now. Legendary ,en
341,"I used to be a fan, but after hearing this masterpiece, I'm a whole air conditioner",en
342,"Oh boy oh boy oh boy, 80's vibe it just feels good ",en
343,I love you the weeknd!,en
344,2:44: This is my favorite part.,en
345,I'm always blown away to see what happens when an artist absolutely comes into their power. The vision keeps expanding the music keep getting better..thank you Abel,en
346,Happy 1 year anniversary Dawn fm,en
347,2:23 is from where my fav part begins,en
348,"His Voice reminds me every time on a true legend,...... Keep on with your great music,..... ;)",en
349,Is this The Weeknd or Michael Jackson?  Prince of pop? No. Just impressive,en
350,"When we are just losing our addiction to save your tears and blinding lights, he comes with another banger. Ngl he is going to rule the billboard for the next few months.",en
351,"When I saw the word ""опасность"" when the Weeknd took a deep breath, I was so proud because it was one word from my language 🇷🇺🇷🇺🇷🇺🇷🇺",en
352,The only other artist besides Pink Floyd that I currently own all of their music.,en
353,Ahhhh i know how i played one of my Favorite games from 2018 with this Music. For some Reason i find that a good Memory of 2021♡♡♡,en
354,Life was so different when this came out.. I wish that one day The Weeknd listens to my music and we make a hit song together. God bless everyone. Better days are coming.. ,en
355,So proud of his work he’s honestly unstoppable at this point,en
356,An Epic and Phenomenal  Artist,en
357,Made my mornings day this song on Europa FM Romania!,en
358,"Damn, this really did take my breath.",en
359,I like this song very much !!,en
360,I really am so besotted with this man.. his voice is so pure and unique  xx,en
361,"this man is simply brilliant, everything he does is good, his voice is beautiful, GENIUS",en
362,I love this song,en
363,Take my breath away ..  just like a souvenir,en
364,This song has a orignal vibe,en
365,How can this man make even better music than before ,en
366,This is badass,en
367,Amazing the beat the lirycs the melody..️️️,en
368,"Man, the lighting of the Video, is so great/beautiful/well-done intention",en
369,The weeknd + Max Martin = Music Magic ,en
370,I love how the weekend keeps coming back with the 80's and 90's throwbacks that's why we love him,en
371,I love him so much,en
372,It’s actually crazy when you realise this guy hasn’t missed 10 years in a row,en
373,Im excited to see his live concert thing at sofi stadium tomorrow on hbo max but im so confused on the whole storyline,en
374,"I've been listening to this song on repeat, The Weeknd never fail to amaze us-",en
375,This is the most Amazing song..,en
376,This song has the most bizarrely dark lyrics. I've never heard a scenario like this before in a song.,en
377,What a flipping brilliant video - That Black and Silver throughout ohh,en
378,Happy 1 Year Anniversary 'Take My Breath' ,en
379,"TE vuela la cabeza. Greetings ARGENTINA.
Blows your mind all album",en
380,He is continuing that retro/futuristic 80s vibe…. I like it.,en
381,"If every artist was like The Weeknd, this world would be perfect",en
382,80's hell yea ,en
383,Fantastic!   I would love to see a duet with Shakira in the near future,en
384,Que canción  the weeknd king ,en
385,That tech noir terminator vibe...,en
386,This deserve a billion views. Asap.,en
387,"I saw the fire in your eyes
I saw the fire when I look into your eyes
You tell me things you wanna try, uh
I know temptation is the devil in disguise",en
388,What a climax,en
389,Ele i o Ed São os melhores cantores de sempre Elisabete Gonçalves,pt
390,1 year ago this came out. Happy anniversary dawn fm,en
391,"He's a true artist. His voice, his creativity, his music are extraordinary and a bless for this generation. I admire him and respect him so much!",en
392,I lost my shit when he started performing this LIVE last Saturday.,en
393,This song is too touching..I could cry.!,en
394, Take my breath away ,en
395,I feel like this song will be the most listened in the album like blinding lights used to be but not the most appreciated by the fans. his underrated songs are always the best,en
396,Mirror gazing and seeing that fire just…just hits different man ,en
397,The mv of take my breath has now surpassed over 100 million of views ,en
398,"Take My Breath Is, My Favorite Song From The Weeknd.",en
399,When I was a kid my dad always idolized Michael Jackson and showed me his live performances and all his music vids on VHS. Some day I'll replicate the same with my kids. ,en
400,Ok this dude is incapable of making a bad song. Every song he makes is a bop.,en
401,My brother in law passed away a few months ago and everytime I hear this song I think of him! The lyrics have such a close meaning and always shed a tear! This song is just incredible,en
402,Lit ez always ...the  weekend iz always on,en
403,"This video is soo lit, I was laughing with the hair thing she did to him #awesome",en
404,"Take my breath away

And make it last forever babe Do it now or never babe Take my breath away Nobody does it better babe Bring me Close to ",en
405,Love the song,en
406,te amo Abel <3,pt
407,i could totally see this in a movie trailer.,en
408,"The Weeknd IS the definition of pure artistry. He never stops reinventing himself. He pores his heart and soul out to all of his fans on stage. I went to his concert back in 2018 in Abu Dhabi and let me tell you guys, he's something else. I cannot wait to see him perform live again in UK and Sweden next year. This is Abel Tesfaye, ladies and gentlemen !!!  ",en
409,If he made vaporwave with underground vaporwave artists just now becoming famous... like luxury elite and telepath ... it would be so epic... then he could do live Synthwave and TerrorWave Horror Wave performances in Los Angeles with strict 80s dress codes and pull up in custom 80s Lamborghinia etc,en
410,He's a handsome specimen,en
411,Daft punk and Weeknd coming together really created a monster. A really sexy monster,en
412,Awesome song thank you,en
413,The most creative artist of our generation. He's a genius.,en
414,"I fucking love this beat , it remind me of Kissland era ",en
415,The best song,en
416,I told my family to play this at my funeral,en
417,"I'm totally blown away by this song! I love how it has a late 70s/80s vibe, but with enough of the new sound to keep it currently. His voice is amazing, I just cant get over how wonderful he is!! I'd love to hear more songs with this type of vibe!!",en
418,you risk it all to feel alive ,en
419,"Michael Jackson is proud of you young man he sure would be very happy with you! I would love for him to be alive and for you to do a duet together, but who knows, technology won't allow us to do that in the future? anyway, congratulations Abel! the album is fuckin great.",en
420,"Take My Breath The Weekend
Save Your Tears The Weekend
Sacrifice The Weekend
Out Of Time The Weekend",en
421,"You might think that After Hours has set a very high bar. How is he gonna make songs that are better? 
And he freaking does it with so much ease. A beautiful reincarnation of the 80s music.",en
422,Bro this song is fire!,en
423,Great music. Great job I really like everything. I will continue to support you,en
424,you are a legend the weekend,en
425,Best song on the album IMO! This is my cat!,en
426,Fuckin gorgeous and hero of these era of music,en
427,Definitely the guy who bring the 80’s vibes to this modern era . Every song he takes out turns instantly into a Hit ,en
428,Weeknd is a god gift to a world music in ruin!,en
429,swear you guys are sleeping on this part 03:16 to 03:30  anyone knows any similar songs?,en
430,This song hits hard I hope I’m not the only one watching in 2023 lol,en
431,You have a good taste of music if you like this,en
432,His voice's so soothing.And even haters can't deny.,en
433,"As a Gen-Xer, there's not a lot of modern music that impresses me. That being said, if you ever catch me drunk at a karaoke bar, rest assured that I will be singing the Weeknd's entire catalog. This guy is phenomenal.",en
434,"Текст песниВидеоСлушать
I saw the fire in your eyes
I saw the fire when I look into your eyes
You tell me things you wanna try, uh",en
435,Am I too late to The Weeknd Party. Dawn FM finally got me there! This song is attracted me with its 80s vibe meeting Daft Punk.,en
436,Everyone needs to take note of his ability to reinvent himself it truly is inspiring,en
437,I'm definitely getting a jacket like this now xD,en
438,The leading lady is absolutely breath taking (pun intended),en
439,Love this one,en
440,Reminds me of 2000s movies lol,en
441,The Weeknd should go by the name of “The Year” since he’s been killing it this whole year with every new release and collaboration. Every new release is just as great as the previous one. ,en
442,I forgot how fkin good this song is ,en
443,looooove the weeknd,en
444,"My 13 month daughter literally loves The Weeknd. Ever since save your tears came out, she would quiet down and crawl towards any screen playing save your tears or literally any song made by The Weeknd.",en
445,This video is amazing  !!! I wanna see more black women in his videos omg they match his whole vibe,en
446,They played the song in Singapore gp ,en
447,"There is distinct quality in Weekend's songs, especially the music, that if you just listen to slightest part of intro or listen to his songs without any vocals, you can easily recognise whose song is this.
In other words, sheer quality!",en
448,Daft punk should definitely get their credit. But he definitely grasped that stardom n his singing deserves it.,en
449,Ugh I love this,en
450,My new favorite song,en
451,This is the vibe of MJ in voice of The weeknd,en
452,the weeknd is a genius bro. like i’m always blown away by his creativity. this song is ️‍,en
453,THE WEEKND songs are so amazing that my baby sister was dancing to the song,en
454,"Bro... tell me your a demon without saying it. The symbolism in this video is wild. Like, props to you for not hiding it.?!",en
455,Showed this to my 57 year old friend and he LOVES it,en
456,Certified bop! That’s all,en
457,"My ex introduced me to the weekend in 2013.
Funny how time flies",en
458,Holy SH!T she is BEAUTIFUL!!!! WOW!!!,en
459,I lobe weekend so much ,en
460,Most of his recent songs are making me feel like I’m living in the 1980’s and I love it.,en
461,I just figured it all out. I might be a little late to the party but thank you for the warning. I hope it's true the old saying that it's never too late....,en
462,Vamos lá pessoal a cordar ao som desta música para ir bolir vamos lá pessoal Elisabete gonsalves,pt
463,this guy is unreal,en
464,This man took everyone's breath away and used it to resuscitate that feeling of 80s music. True talent!,en
465,It’s this song and “Did You Call Me” by Lukaz are some of the only things getting me through tough times.  I hope everyone is doing well. I love you <33. ,en
466,So good… the Fleetwood Mac reference everything,en
467,The one and only you are the best singer exelent,en
468,Vamos lá pessoal a cordar ao som desta música para ir bolir vamos lá pessoal a cordar Elisabete Gonçalves,pt
469,"He is the moment, he is everything, he’s an ICON",en
470,The Weeknd is a fckin living legend,en
471,"The Weeknd go in soo hard on this right here, straight up BANGER! He aint like all them trappers and oppas who just be usin dat Authentic views   to get they hits up to go HAM... SMH seem like anyone can glow up these days... SMH",en
472,The Weeknd is the embodiment of the word ART. No words would ever be able to describe his music and its perfection. Seeing him go from his early projects like Trilogy and Kissland (My fav) to this is just so inspiring and his name will be written down in history. They compare him to the great MJ etc. but let's just agree that there is and will be only one WEEKND. I dont know if it's just me but this song gives me a lot of wanderlust vibes and I'm diggin it. Excited for the whole upcoming album. THE DAWN IS HEREE!!!,en
473,Every Angel is Terrifying The Weekend,en
474,Wao amazing song brother keep it up My beloved brother ️,en
475,the best song,en
476,you are one of the best singers in the world. freddie mercury michael jackson and THE WEEKND... my top three.,en
477,"this man never misses, literally has no bad songs.",en
478,This song has GTA written all over it!,en
479,OMG THE MELODY START MAKE ME ... CRAZY,en
480,he absolutely never disappoints. He's truly an artist!,en
481,Fuck!!! The production on this is dope.  Gives me mad masculine energy.,en
482,The king ️,en
483,Does he really know that he is great ,en
484,This guy will never fail cuz he’s constantly reinventing himself and bringing something new on the table .,en
485,That party looks like it's about to rain down blood from the sprinklers when Blade walks in.,en
486,My 7 year old is obsessed with this song.,en
487,Take my Breath,en
488,"Bro, he just doesn't make a bad song. I'm convinced it isn't possible.",en
489,almost 1 year. xo ,en
490,amazing this guy ,en
491,That hallway gives me harry potter vibes when that dark demon trys taking his breath away.,en
492,I LIVE FOR THISS,en
493,dope video ,pt
494,This is my 2nd favorite along with Blinding lights,en
495,This remake of Blade is different ,en
496,This whole song has a GTA 6 kinda vibe... And I like it,en
497,Damn I came back and can actually hear the sacrifice beat at the end..,en
498,Fun fact: Abel's music videos are miles better than modern hollywood movies,en
499,That afro too slick with itperfection,en
500,Não entendo a letra mas o som é bom,pt
501,Love from Kenya ,en
502,"The Weeknd's music is magical... No matter who listens to it, they're just addicted to his music. XOTWOD!!!",en
503,The walk is lite ,en
504,Good song,en
505,I appreciate your music the Weeknd plus what type of music do u sing,en
506,"Popular Opinion : Everyone Agrees That The Weeknd Vocals Are Not Jokes, They're Really Masterpiece",en
507,"But the best song for me is
The Weeknd Wicked games",en
508,Daft Punk has certainly had a remarkable impact on The Weeknd's career.,en
509, I really like when artists make it to their highest level. It’s extremely rare but The Weeknd is 1 of the few that has done it.,en
510,The extended version is so much better I'm bummed the music video is the radio edit tbh,en
511,been more than a year as a weeknd fan,en
512,"If this is what the revival of disco looks like, I'm in",en
513,Bro you don't need grammy grammy needs you,en
514,that was the greatest song,en
515,Is it even a real question as far as who is the best artist out right now?,en
516,This song just came out but already feels like a classic.,en
517,Zhu should remix this song since they seem to be in the same vibe ,en
518,"It is such a shame that his greatest hits album (""The Highlights"") was released, prior to the release of, ""FM Dawn"", as that means it doesn't include either this track, ""Take My Breath"", nor, ""Sacrifice"".",en
519,This guy brought back the synth wave from 80-90s and made it palatable to the new listeners,en
520,Daft Punk is strong with this one and I'm glad! <3,en
521,THE WEEKND TAKE MY BREATH THE WEEKND,en
522,if only he put take my breath and sacrifice together,en
523,Love it Xx I'm obsessed Xx sexy Xx emotions I'm feeling x abel I adore you x,en
524,The Weeknd keeps coming out with banger after banger!!! It is so good to see him stay at the top of his game for so many years!!! not many artists have the longevity that he has had!!!,en
525,Damn God is with us now and watching all of you sitting on the edge is better than ev4,en
526,The weekend makes better music when he is heatbroken lol,en
527,The concert was amazing...but bc place was to big and a great performance by the weekend...,en
528,Every weekend music video is just another boss for Abel for beat lmaooo  my dude got choked by a braid my g,en
529,"The future is being written, and Abel is increasingly placing himself in the hall of the best of our generation.",en
530,I love how this man always dies or almost dies in his music videos,en
531,If Pedro ever runs for office again I think Napoleon can dance to this one next time.,en
532,I could see MJ making a cameo if he was still here,en
533,Fast the past 5 days am listening to this song only. Repeat mode.,en
534,It's only been a year since after hours and a whole new album is coming. Bring on the dawn ,en
535,"After Hours was about to bring back to life 80's, The Dawn is going to bring back 70's. It seems there's something of Cerrone's synths in this track.",en
536,The best one,en
537,"I never thought The Weeknd could top Blinding Lights but he's done it.  Bravo Abel, Bravo!!",en
538,"Love this guy, he remind me a Michael Jackson, he sing the pop style for this modern days look much better",en
539,"DANG. I wasn't sure if he was gonna stick with synthwave when the After Hours era ended, but DANG, THIS is the most synthwave thing he's made, and I'm freakin here for it!!",en
540,80s post disco at its finest. Abel blessing us with another throwback vibe hit.,en
541,"¿CÓMO HACE ESTE HOMBRE PARA SIEMPRE ROMPERLA CON SU MÚSICA?
DIOS, ESTÁ INCREÍBLE ",en
542,"And he does it again!
I feel like this song has potential to be the song of the year just like Blinding Lights was 2020's.",en
543,"As músicas do Abel são sempre estranhas da primeira vez que ouço, mas depois de ouvi-la outra e outra vez, passo a não só gostar mas a viciar nela. E só há uma palavra para isto TALENTO. ️‍",pt
544,"It was like a prophecy that he was going to be a huge icon in music industry. Discovered his work like seven years ago and in that particular moment I could feel there was no doubt he was going to blow up the entire world for years to come. Each time he comes up with a new era and new songs, my mind goes back to that day I clicked on a song called Wicked Games.",en
545,Make a new award for this guy. He deserves something more than a Grammy.,en
546,THIS ladies and gentlemen is what a grammy SHOULD sound like !!,en
547,I don't mind if we get abel's new music every damn year. He's literally king of music. ️️,en
548,He's riding high on 80's tune and have managed to better it everytime....good stuff,en
549,Man if this dawn era tops After Hours i'm convinced he's a literal music overlord.,en
550,"The Weeknd como sempre perfeito, amei a melodia retrô dançante e a letra também é incrível. 
The Weeknd as always perfect, I loved the retro dance melody and the lyrics are amazing too.",en
551,"Personally, I respect this man, the way I respect Michael Jackson and Prince's musical prowess....",en
552,"Lyrics:

I saw the fire in your eyes
I saw the fire when I looked into your eyes",en
