,comentario,liguagem
0,Muito bom essa musica,pt
1,Essa música tem uma energia incrível.,pt
2,SIMPLESMENTE O MELHOR SOM DOS ANOS 90!! FABULOSO.. ADOOORO,pt
3,This song will forever be one of the 90s icons.,en
4,"What a song !
Unforgettable !!!!
I dance on it 
I loved the song ",en
5,"Oh my days, every time I hear this track I just want smash the volume up to full and dance the night away. Such a cracking track.. one love haddaway",en
6,"Simplesmente inesquecível,  maravilhosa , perfeita, música que ficará sempre na minha lembrança!!!!!",pt
7,Aaaaa isso que é música ,pt
8,"Quanto mais escuto essa música, mais vontade fico de escutar novamente, tempos bons",pt
9,A melhor música para a melhor infância,pt
10,"Lembro de quando foi lançada em 1992, hit instantâneo. E hoje se tornou um dos principais clássicos do Eurodance.",pt
11,"It will be here and on our hearts for ever, this is a LEGEND song️️",en
12,FUE COMO TOMAR UNA MAQUINA DEL TIEMPO Y VIAJAR AL PASADO. QUE MARAVILLA DE MUSICA.,en
13,"Aos 47 anos ainda amando essa música, saudades dessa época ",pt
14,Classics don't die..they become legend,en
15,"Essa música e imortal 
De geração em geração nunca será esquecida ",pt
16,"Vem tantas lembranças quando escuto essa música,saudades, a se o tempo voltasse. Essa música é maravilhosa ",pt
17,Maravilhoso ,pt
18,Essa sim é uma música nostálgica,pt
19,CLÁSSICA! NÃO TEM Como não dançar!! TOPP!! Ainda mais essa versão extendida!!!!,pt
20,Amo essa música ,pt
21,What a masterpiece ,en
22,essa música fez parte de minha juventude no Maranhão eu curti muito. adoro essa música.,pt
23,This song will always b a classic and great song for generations to come this song is awesome ,en
24,Essa música é perfeita!! Amo de verdade!! ️,pt
25,Essa música é incrível passa uma energia boa de mais. Show!,pt
26,I really love this guy. His music is genuine.,en
27,"Música top irada , verdadeiramente sensacional.",pt
28,Musicas como essa jamais serão  esquecidas....,pt
29,Essa musica nunca envelhecer.......muito maneiro...!!!!!,pt
30,Amo essa música ♡ todos os dia venho ver esse música com o fone,pt
31,Amo essa menina ,pt
32,a melhor música de 2015 ️,pt
33,Eu amo essa música!!!!!!!!,pt
34,Músicas que não envelhecem nunca 🇧🇷,pt
35,Eu ouvi essa música quando eu tinha 3 anos muito tempo atrás! até hoje lembro como era antes >:),pt
36,"Amo essa musica desde pequena, apesar que ela ja existia antes do meu nascimento rsrsr",pt
37,"Tempo bom que não volta mais, dancei muito essa música bom de mais ",pt
38,"I'll always love this song, no matter what.",en
39,Adoro essas músicas anos 90,pt
40,Loving this song!!!️️️️️️️️️️,en
41,Que épocas... Recordar es volver a vivir!!!,pt
42,"Esse hits sempre faz sucesso, é muito bom",pt
43,Adoro esta música boas lembranças  ,pt
44,Impossível não dançar!! ,pt
45,Está música é eterna,pt
46,This song takes me to the 94 taking the train every weekend beautiful memories ,en
47,Música nastalgica maravilhosa amooo,pt
48,In my opinion this is the best version of this absolute classic-perfection,en
49,Escutando essa aqui so me vem o tom na cabeça,pt
50,Deste que me entendo como gente eu amo esse música ️ Aí essas batidas ️️,pt
51,Boas recordações!,pt
52,One of the greatest songs of all time!!,en
53,Omg one of my favorite love songs ever awesome!!,en
54,"Essa música me trás muita nostalgia mano, tempos que não voltam ",pt
55,Essa música mim lenbra a minha infância ,pt
56,Amo essa música tempo mais gostoso,pt
57,A mais bela música já inventada,pt
58,Apaixonada por esse hit,pt
59,"Letras

What is love?

Oh baby, don't hurt me

Don't hurt me",en
60,Essa música me traz ânimo,pt
61,I still can't listen to this song without thinking about Ricky Vasquez dancing to it in My So-Called Life. That scene was epic!,en
62,Aumento no último volume do som pra ouvir essa lindeza de música ️,pt
63,"essa música é tipo... Precisa existir tlg, faz parte da realidade já de tão classica",pt
64,Essa música é outras da época faz voltar ao passado éramos felizes e não sabíamos,pt
65,"Abril de 2023, essa música é muito envolvente, top de mais!",pt
66,"LA MEJOR REPRESENTACION DE LOS 90, ME FASINA EL TECHNO.",en
67,"já dancei muito esta música, dance muito  bom .",pt
68,"Bons tempos, cresci ouvindo essa música que nostálgia .
Maio 2023",pt
69,Ó melhor cantor de todos os tempos 🇧🇷,pt
70,Eu amo.,pt
71,2023 escutando esse clássico ,pt
72,Issoooo q é música ,pt
73,já escutei essa musica meu filho gosta dessa musica ! melhor tempo antigo voltar de novo e escutar todas as musicas boas!,pt
74,Essa música não é do meu tempo mas eu acho top  la ele,pt
75,Is it just me or does this song almost fill you with a nostalgia that's both incredibly happy and sad at the same time for an era you weren't a part of and a reality that never happened,en
76,Melhor versão do single Disparada!!!!!,pt
77,Brings back so many memories ,en
78,Amo essa música,pt
79,esse som tocava dia e noite na academia que eu treinava,pt
80,"Sucesso forever, parabéns pelo seu trabalho  Eziquiel Costa Junior  Cantor e compositor gospel  Sucesso.",pt
81,I remember hearing this on the radio and  also my mum used to play this at parties and to this day it’s still nostalgic,en
82,True love is forever and so is this beat brings me back to life when Im feeling down....always!!!! ....dance everybody!!!,en
83,Cara guando era um jovem minha família adoravam essa música...  quando eu escuto vem  pensamendo.    ( Show ),pt
84,This song is absolutely beautiful.,en
85,Muito boa ,pt
86,The new beat in 3:54 gets me every time,en
87,"What is love?
Oh baby, don't hurt me
Don't hurt me
No more",en
88,31 de dezembro de 2022 e essa musica tem que tocar não pode faltar ,pt
89,Música show!!,en
90,Segunda semana da quarentena e continuamos com bom gosto musical ,pt
91,This song  2023 still hit me ,en
92,Esse música começa a tocar e você só lembra do tom ....,pt
93,NO IMPORTA EN QUE FECHA LO ESCUCHES O EN QUE AÑO LO QUE IMPORTA ES QUE TE DIVIERTAS CON ESTA CANCION,pt
94,"Saudades, me faz lembrar quando eu era jovem.",pt
95,Sempre toca  nas rádios do GTA ! Top,pt
96,Best times in the 90’s it’s sad that we can’t relive it anymore,en
97,Music That Never die ,en
98,A TOP 1 das músicas Dance de todos os tempos!,pt
99,Mês de Abril de 2023 ouvindo as antigas adorooo,pt
100,Love this song!!,en
101,Amo muito tudo isso,pt
102,That break where the elements are reconstructed and layered in various combos is amazing!,en
103,"Minha coroa se amarra nessa, passei a gostar por causa dela. ",pt
104,"What is love?
Oh baby, don't hurt me
Don't hurt me
No more",en
105,ES UNA HERMOSA CANCION ME ENCANTA,en
106,Isso sim é uma musica.,pt
107,Eterno!!!!,pt
108,"One of, if not "" The Best"" song of its decade.Man the memories it brings back....Party on",en
109,It was a hot summer day in the 90s. This song was playing on a old portable radio and my parents are there chillin outside on the patio. My father has this big moustache and i'm listening this song for the first time. I'm 6 or 7 years old. What a memory,en
110,Still loving it!️,en
111,"O cara que remixou essa música trocou umas paradinhas de lugar e ainda deixou ela combinando... Tá show de bola.
Deve ter uns 30 anos que ouço essa.musica. e não enjoa, até meu filho curte ela.",pt
112,"Me fez lembrar minha infância, ainda quando a vida não tinha preocupações , dor de cabeça , nada .... Era só estudar e brincar ..",pt
113,"Brasil 🇧🇷🇧🇷🇧🇷 Quarentena , curtindo essa música que Amo",pt
114,essa musica é ser eternamente jovem !,pt
115,Love It ️,en
116,O som da minha vida,pt
117,Its 2023 i still love this song ️,en
118,I love this song ️️,en
119,"Wow this song is like a mix of emotions: the lyrics are dark, but its got a cheery beat",en
120,Em tempos difícies nada melhor do quer ouvir belas cançãos,pt
121,linda tenho 10 anos mas adoro ouvir essas musicas dos anos noventa e oitenta,pt
122,"Eu em 2023 ouvindo,  curtindo, dançando e comemorando por ter vivido os anos 90!!!!",pt
123,"I love dancing with this song
Great workout!",en
124,Oh saudade meu Deus!,pt
125,"Caramba,essa música me trás uma nostalgia do krl,adoro esse tipo de música (Anos 80 90.)",pt
126,Eu Wilson amo essa música!,pt
127,essa é boa demais fi slc,pt
128,Amo muito essa música e outras do passadooo,pt
129,"What is love?

Oh baby, don't hurt me

Don't hurt me

No more",en
130,Uma das melhores músicas de todos os tempos  alguém em 2023?,pt
131,"Eu amo essas músicas, é olha q nem vivi essa época só tenho 21 aninhos haha",pt
132,LE DOY GRACIAS A MIS PADRES POR CRIARME CON MUSICA DE  LOS 90S PARA ABAJO,en
133,QUANDO TOCA NINGUEM FICA PARADO,en
134,Show de bola brother.....!!!,en
135,Melhor memória de todas.Ahh 1992. ,pt
136,Amazingly perfect ,en
137,O house está voltando às graças do povo aqui no Brasil.,pt
138,2023 and still in love with this song,en
139,não entendo porque hoje em dia não existe mais esses estilos de músicas ,pt
140,Top esse tempo foi massa,pt
141,"""What is Love ""...one of my favorites while I'm working out at the gym",en
142,Music that actually turns water into wine ,en
143,"A melhor 2020 de sempre, pra sempre 
Isso sim musica  faz vc viaja no tempo",pt
144,"Tema da novela Sonho meu exibida no horário das 18:00 horas ,de 1993/1994.",pt
145,Eu não me canso de ouvir essa música ,pt
146,Essa musica nao sai da minha mente,pt
147,"Época boa da minha vida que eu fazia tudo errado, e a luz Divina estava sempre,(está) comigo me defendendo de tudo ruim obrigado meu Deus pelo seu amor a tua graça me basta ",pt
148,Steel one of the best sounds of all time,en
149,Reminds me of my late aunt Thandi...RIP Queen ️️,en
150,Wow!! Que nostalgia!! Tempos bons...,pt
151,Sem dúvida alguma a melhor música eletrônica dos anos 90!!!!,pt
152,Essa é toppppp,pt
153,Great song ,en
154,Aqui do Brasil do Nordeste escutando. Amo essa música. a melhor,pt
155,"mto boa essa msc, e alem disso me lemba mto o tom",pt
156,very good 90s song something of those who are in this era will not know only if we listen to them how they will be,en
157,Ótimas lembranças mistura com saudades foi top️️️,pt
158,"clean, pure mix, must be fresh.",en
159,Will always be a banger,en
160,Vim do futuro dizendo que essa música ta fazendo sucesso em 2070,pt
161,The magic song BRASIL 90' 🇧🇷,en
162,Amo essa versão,pt
163,Quem tá escutando em 2023?!! clássico demais!!!!,pt
164,"Tenho 28 anos, não sou da época dessa música, mas sim ela passa de geração em gerarão,  minha mãe sempre escuta, e agora eu escuto e sim tenho saudade de uma época que nem vivi !!!!",pt
165,eu sou evangélico mas gosto de ouvir está bela canção limpando a casa,pt
166,Que bela recordação em 2020.... Dancei muito em boates na década de 70/80...,pt
167,Eu amo essa música ela é muito viciante,pt
168,Dancei muito na minha juventude íamos pro meio da pista arrasava nós ,pt
169,Não gosto de dizer nunca mais essas musicas nunca perderão sua essência.....,pt
170,Amo ️,pt
171,Pure early 90s. Enjoy it as such.,en
172, this is a forever song  ,en
173,"Abril2023 Brazil
Saudades do meu tempooo",pt
174,2020. Still love this song.,en
175,"20 years back we used to celebrate new year eve with this song 

90st hits",en
176,Sempre  o dence  ou saudades  da minha  infância até hoje eu curto o está musical,pt
177,"My uncle is mentally disabled and this has always been his absolute FAVORITE song! Every time we have a family event, I always make sure to request this song to get him up on the dance floor so he can dance his heart out. He gets so into it and we always love seeing him so happy. It's the best feeling. :)",en
178,this still rocks on 2023 !,en
179,Essa música me faz lembrar do filme os estragos de sábado a noite kkkkkk,pt
180,I love the song ,en
181,"I love this song ️
My wife listen this song .
I love it because my wife like it",en
182,10 years old and thought I was the coolest person screaming what is love,en
183,The best song while driving,en
184,Abril de 2023. Essa é a música dos passinhos ,pt
185,"This music takes to me at the past...️️️ Times when i played play station 2 with my cousin, great times.",en
186,Wow ..just wow...what a song ,en
187,Cadê os brs escutando essa obra prima?,pt
188,"What is love?
Oh baby, don't hurt me
Don't hurt me
No more",en
189,You don’t know what love is until you’ve been hurt,en
190,"mama I made it 

LYRICS -",pt
191,"This man wakes me up every day...
When I go to work...I feel like he makes me feel alive..and very in love whit energy also my exercise routine for the day....I love this song forever.",en
192,Eu amo essa música,pt
193,Cancionon!!!! Uffff!!! ,en
194,"Linda demais e bem aproveitável nas horas triste,para dançar,ouvir e pular e esqueceu o mau.obrigada.",pt
195,4:52 this part,en
196,Quem está escutando essa música! 2020. Músicas como essa nunca irão sair da moda! São intemporais! Batem em todos os tempos e épocas,pt
197,I love love love love this song,en
198,Bass line got this tune!!!.. and the organ!!!,en
199,QUIEN NO HA BAILADO ESTO POR DIOS,pt
200,One of the best ever!!,en
201,May 2023..still dancing with this song,en
202,So nostalgic ,pt
203,Lembro da minha adolescência.  Estou ficando velha mas o gosto das músicas dos anos 80 não mudaram. Só tem musicao,pt
204,Felix speaking Italian makes me laugh so hard even when his pronunciation is on point,en
205,90s hit when i was a teenager. Good days gone forever in the Uk  now i am 41.,en
206,"To this day it's difficult to ask the honest question ""What is love?"" without having some joker answer ""Baby don't hurt me.""  That may make this song immortal.",en
207,"Thath ,magiaa ",en
208,Man this was good in the day and still is. 57 and still grooven.  Hug's love and happiness everyone ,en
209,End of 2027 still loving it ,en
210,My favourite song 🇿🇦,en
211,Grow up listening to it.the night clubs played. Lots of energy beautiful girls in palm beach.  ️️️🇺🇸️,en
212,"""Dobre e passe para o próximo""",pt
213,22 years ago my father (deceased) took my and my brother to the move Night at the Roxbury and it just has a special place in our hearts due to this song. My older brother is getting married this year. I am in Roc NY and he's in Miami FL and I am going to show up unannounced with a boombox playing this song. Should be before the kiss I suspect.,en
214,i fucking love this song ,en
215,"Melhor dance  de todos tempos, ouvindo na atualidade, janeiro  de 2023, alguém por aqui da um joinha por favor kakakaa",pt
216,"It reminded me of my uncle's wedding. I was ten, wow stil undefeated wow.",en
217,....The point is what is love....after a age looks different but is the same.,en
218,Mas Mas Mas que música que voz que remix estamos em 2020 isto é música ️🇵🇹,pt
219,"Year 2035, still vibing on this masterpiece",en
220,Curti aqui quem tá ouvindo essa pancada em 2023 ️.,pt
221,Still the best ,en
222,AMO HADDAWAY!!! FORTALEZA-CEARA BRASIL,pt
223,"Alguém 2020 curtinho esse clássico curte aí, músicas como essa é igual vinho, quanto mais velha melhor.",pt
224,Oi Aki e o Carlos adoro essa música ,pt
225,"Melhor  década 80 90 filmes, músicas tudo era bom demais! Hoje em dia tá complicado !",pt
226,"some people call it cheesy, I call it ""good vibes"" and today's music just a ""product""",en
227,"May of 2023, having my 11 year old listen to the best roller skating rink song of the early 90s.",en
228,Top,en
229,Fazia tempo que não ouvia aí qual voltei agora não paro mais,pt
230,Escuto essa música direto no GTA 5. ,pt
231,My favourite song!thanks!!,en
232,Great song,en
233,I really love this music ever,en
234,this mix is even better than the radio edit!!!! I love it!,en
235,"Curtindo esse clássico imortal em 2023,  se você leu, feliz 2023!!!!!!!",pt
236,Great song,en
237,boa dms,pt
238,¡¡QUE RECUERDO HERMOSO!!! ---¡¡¡TEMAZOOO!!! GRACIAS!!! BESOS,pt
239,"Imagina se a primeira edit dos kaulitz não fosse com essa música kkkk vocês estariam pensando neles com outro som, mas algum gênio resolveu colocar essa na edit do Tom tocando na cabeça da guitarra",pt
240,Eu amo essa música porque é uma música q marcou minhas memórias com meu vô ele adorava e hj eu amo essa música,pt
241,NAO DEIXEM O MEME MORRER,pt
242,5/22/2023 still jamming to this,en
243,Quem Está Ouvindo Em 2020 Está Aqui Sucesso Total Show,pt
244,I’m 50 yrs love ️ this music  90 baby ,en
245,Esse música é linda demais eu já dançei muito ela,pt
246,QUESTA CANZONE E LA REGINA DEL MIO CUORE ...IN PIU SE PENSO BENE ERA IL PERIODO CHE SONO STATA IN CIPRO BELLEZZA ASSOLUTA VACANZA IN MERITO COME SEMPRE ,pt
247,Eu amo bastante essa música,pt
248,Perfect song To Ride or Die with  ️️️️️,en
249,This song is forever,en
250,"Boa música, curti muito recordar, obrigada por estes momentos...",pt
251,Love is the Family Role Model For The World ,en
252,No DVD pirata do filme da múmia com todos os filmes,pt
253,Dong still has the rhythm that makes everyone wanna just dance,en
254,"Man,I Remember going to night clubs and them playing this song.. those were the good ole days..",en
255,Omg this is soo good,en
256,biggest 90s dance anthem,en
257,"Superb  remember my childhood listening after more than 16 years 

Beauty ",en
258,Mi época de secundaria. Y mis primeros antros,pt
259,Amo a vida,pt
260,Che bei tempi,en
261,So relaxing,en
262,"Não acredito que a música que eu escutava nas lojas de roupa e pelas rádios do Bar era tão antiga assim— EU SOU DE 2000 GENTE, TÔ ME SENTINDO UMA IDOSA!!!",pt
263,Música muito boa,pt
264,The Best!!!,en
265,TR SÜPER FANTASIC MÜZIK ,en
266,"Obrigado youtube pela grande seleção de musicais. Preciso disso, Vivo disso. Vamos indo 2020...",pt
267,90's Kid and this is my shit!,en
268,"Remember this song  when I was 18 and gave birth to my first baby a beautiful baby girl so  cute and as she grew she was very quick at the age of 2 could count upto 100 , my dad who I miss so much taught her,  she would love to sit listen and learn me and my dad and mum taught her she knew colours      etc to love her  so much my beautiful girl love from mum xxxxxx",en
269,"It's Monday, June 15 and this song is still as amazing !!!!",en
270,Abril de 2023 e ainda nessa música,pt
271,May 2023! This song goes beyond the time,en
272,"Still dancing .
It touch your hole body..",en
273,Last 30 years hit songs,en
274,"Meu sobrinho de 4 anos se sacode todo, quando escuta essa música ",pt
275,"Essa música lembra meu avô Roberval, na calada da noite ele pegou seu opala diplomata, tomou um tadala, colocou 50 gramas nariz a dentro e contratou o serviço de duas GP uma delas era H, quem pegou foi uma viatura que dobrou a rua e viu só a rabeta do opala balançando, meu avô ficou conhecido como PRÉ SAL, de tanto cavocar aquela noite, tocava essa música enquanto rolava o ato de amor, eterno vô Roberval, te amarei pra sempre.",pt
276,This song will always remind me of Jim Carrey.,en
277,E das galáxias  chou de bola ,pt
278,Brasil 🇧🇷🇧🇷,pt
279,The best!,en
280,It's April 2020 and I still love dancing to this song.  Go Nestor Haddaway.    I am a young 60 year old adolescent Lol,en
281,Brasileiros cadê vocês?🇧🇷🇧🇷🇧🇷🇧🇷🇧🇷🇧🇷,pt
282,Vim por causa dos edits do Tom ,pt
283,Alguém além de mim escutando essa obra em 2023?,pt
284,I like this version of the song,en
285,"Caixa: Senhor, deu R$18,00
Eu: obrigado, vc também",pt
286,Me faz lembrar do filmes dois estranhos no sábado a noite.,pt
287,Pelé idêntico 🇧🇷🇧🇷,pt
288,the party master ,en
289,"Essa música só me lembra o filme ""Parazin e maranhão 2 o troco""",pt
290,Obgd mamae por deixa eu conhecer essa musica @catiaoliveira#,pt
291,thanks to my dad ti made me grow with this songs and not trap,en
292,Whenever i heard this song play in gta i would just let it play,en
293,Quando escuto me lembro do tom kaulitz,pt
294,Só quem acha a música linda decha o lik,pt
295,the best song ,en
296,aí sim era música,pt
297,"""Obrigado, dobre e passe para proxima pessoa""",pt
298,perfection,en
299,The dance scene in A night at the Roxbury ,en
300,Love this music 🇵🇪,en
301,Still 2023 and also still here!!!!,en
302,39 seconds onwards tune ,en
303,I always travel back to 80’s and 90’s music whenever I get time and what better during the quarantine time...stay safe world..love from 🇮🇳,en
304,Me lembro da banda Tokio hotel,pt
305,The best !!!!@,en
306,"Credo, 6 milhões de pessoas no carnaval de BH nesse calor, tô fora rs ! ",pt
307,So eu que to escutando essa relic em 2023,pt
308,"Cashier: The total is $10.20 | Me: Here, take $10 and keep the change",en
309,End of 2022 and still love and listen to this beautiful song.,en
310,Playing GTA 5 while listening to this song was great 8 years ago.,en
311,"""O que é o amor? Amor, não me faças sofrer, sofrer, nunca mais!""",pt
312,Música pra ouvir no último volume,pt
313,love how all the comments are in Spanish lmao. me encanta tambien,en
314,"QUE HERMOSO TEMA ES TEMA QUE TENGO EN TONO DE MI CECULAR Y LA VERDAD NO M CANSO TAMPOCO DE ESCUCHAR.-
SALUDOS DESDE ARGENTINA .-",en
315,Aqui desde paraiba mordeste Brasil em plena quarentena música linda !!,pt
316,"2020... still the same question. 
What.Is.Love? 
♡Love the sound of the 90s ♡",en
317,"Love my 80 's This song's take me way back in High school...My Lord please help us go this COVID-19 I want to say Thank you to our Nurse""s,Doctor's and everyone that stay up all night helping kill this Virus....My Lord please help us Stay together no  more hate we are all Brothers and Sister's Father forgive us Amen ",en
318,Love Haddaway.. what is love ,en
319,I Listen to the 90s and 80s music more than these days...love the old day,en
320,"Born in 1975 Sept, lived these nice songs while in high school 90's.. feeling lucky to live that days in Real..",en
321,2020 still a great song  2030 still a great song  2040 still a great song 2050 still a great song...............,en
322,Ahh. I love this song. ,en
323,"April 13th 2020, still a banger, it's almost 27 years",en
324,80's...90's... never comes again like that pretty days ,en
325,AQUI ESCUCHANDO ESTA BUENA MUSICA MIENTRAS PASO LA CUARENTENA Y APOYO A MI HIJO A HACER LA TAREA. ANIMO...BENDICIONES,pt
326,"We are in this Together,.. finally someone who has Compassion and Humanity no matter what happens, God be with and Bless you, ALWAYS. ",en
327,"Esses mid beckrs me fazem, voltar há um passado de muitas alegrias.",pt
328,The best music forever,en
329,"Algum sobrevivente da Saudosa Década de 90 ouvindo essa Obra Prima em 2020?!
Deixa Like!!!",pt
330,Estava eu e um colega de nome Fábio apelido Fabim no Conjunto Nacional em Brasília.  Fomos apenas passear no shopping.. tinha mais ou menos 13/4 anos s fomos a pé da quadra em que morávamos 105N. Quando estávamos prestes a ir embora Fabim joelho disse que seu cunhado ia nos buscar no shopping. Ao chegar seu cunhado de nome Júnior chegou com um Kadett GSi zerado e tinha acabado de instalar 4 triaxiais Pioneer. E advinha a música???? What's is Love.  Viemos do Conjunto Nacional até a 105N ouvindo essa música. Kkkkkkkk,pt
331,2020 lockdown......jamming out to this still!! Makes me happy. Lol Shout out from the rez ( navajo nation) #childhoodmemories,en
332,2020 em plena pandemia escutando as relíquias... quem mais está escutando l...,pt
333,One is the best music ever ,en
334,"When I listen just one time a day:
My brain whole the day : Babyyy don't hurt me, don't hurt me noMOOOO !",en
335,August 2020 still listening this amazing tune ,en
336,"I miss watching them gym classes where older folks gets to ""boogie"" to this song = )",en
337,I’m 16 I wasn’t even born when this song came out ️ ( I love it ),en
338,Tempo de qui a gente podia ter a ilusão qui td ia ficar bem!!! Pelo menos escutando a gente volta ao passado por uns instantes melhores momentos i nao sabiamos,pt
339,October 2020 ? This song will never die ,en
340,Who's still stuck in the 80s and 90s ,en
341,What is Love in 2020 ? That is The Thought ️ of This Year .* Washing your Hands & Staying Healthy,en
342,Lembro o meu querido e eterno papai,pt
343,Real hearts beat from inside of the moon,en
344,"We are  in 2020  :  (   To remember is to live again!!! Back then good times!!, good music!! Now virus !! does anybody Have a  time machine ?? ",en
345,My favorite music :D,en
346,"reminds me of my life every day, baby don't hurt me know more",en
347,quarintine got me listening to throoow backsssss,en
348,"Unbelievable, cool",en
349,I don't understand why people don't like it,en
350,Estamos ativos geração 90,pt
351,Lembro da minha mocidade,pt
352,Essa música lembra o tom Kaulitz,pt
353,Does anybody else think of the movie Night at the Roxbury when they hear this song?,en
354,Eu tenho quase 50 anos amo vcs,pt
355,quem mais ta arrochando os carro de ceasa nas madrugada fazendo horario escutando?,pt
356,2023...top music 90s ..remember...the happiness of SNL,en
357,This song is so speciel for me me and my dad listen to This song evry Day like 5 years ago and The intro on This song give me felling and my dad didnt live in that country living in now i go to him 3 Times in 1 months i love my dad so mutch,en
358,"Show demais
Alguém mais em 03 Maio 2020? Curte ae....",pt
359,Che tempi!,en
360,Essa até o Vladimir Putin esculta e dança ,pt
361,Love from Romania ,en
362,I remember playing saint row and hearing this,en
363,"They should know  after  me . What is Love
 one words..
Don't love  fake people 
R u with me ",en
364,"What is love, where is love anyway, couse everything is go to hell.
No true Love anywhere, all around is fake.

So ...WHAT IS LOVE, in 10.04.2020.",en
365,Me lembra o tom,pt
